tweet,dates
"I've been inspired by Ronald Reagan my whole life, and I think of these words often. In honor of his birthday today, let's celebrate the life and legacy of The Gipper, our 40th President, by remembering his message about our freedom. https://t.co/tspTCfWDDk",2020-02-06 19:24:10
"Tonight, I'm optimistic about what we can accomplish when we put differences aside &amp; focus on bettering the lives of the people we serve. It's time we remember how great America truly is and how lucky we are to call this country our home. 🇺🇸 #SOTU https://t.co/bF1n0m2raK",2020-02-05 04:40:31
"“Though he was unable to vote while on Air Guard duty this week, @RepKinzinger has been consistent on the need to give the President, regardless of political party, the power to protect America. His record of support on #AUMF is clear: https://t.co/oqglVh63zj"" - @Maura_Gillespie https://t.co/GXPzW7JBee",2020-01-30 23:09:19
https://t.co/IrQ6aI9lLx,2020-01-29 22:00:46
"""In an op-ed published by @pjstar, @RepKinzinger calls on Springfield to take action &amp; save nuclear generating stations across the state. Why is nuclear energy so important to the future of Illinois? Read the op-ed to find out: https://t.co/AR3Lt83hfm"" - @Maura_Gillespie",2020-01-28 22:08:18
"“Today, @RepKinzinger @GerryConnolly @RepEliotEngel &amp; @RepMcCaul sent a letter to the Georgian PM with grave concerns over political targeting &amp; a declining economic trend that spells trouble for Georgia’s path towards democratic reform &amp; Western integration.” – @Maura_Gillespie",2020-01-21 18:28:27
https://t.co/I8kxk5skBJ,2020-01-21 17:33:44
From the guy who shuts down the internet to his own country to hide the murder of his people.  How many people did you kill so far @khamenei_ir ?  Clown https://t.co/RY0W8V4Vnx,2020-01-18 03:48:38
"‼️ Yesterday, the #USMCA passed the Senate &amp; now heads to @POTUS for signature. Enacting this trade agreement is long overdue, but I'm glad to know that we’ll soon bring much needed certainty &amp; opportunity to America’s workers &amp; our economy. https://t.co/FSv7LjoNHi https://t.co/n7ibaYnC3h",2020-01-17 21:31:57
"Amidst deadly attacks and utter chaos, 'The Cave' shows a story of hope and humanity, and the jarring reality of what Syrians face under the brutality of Bashar al Assad &amp; his backers. Congrats to @FerasFayyad @NatGeo &amp; all involved for this much-deserved nomination. https://t.co/GrUKiNGYcL",2020-01-16 02:33:59
The Iranian people are united--they're united against the corrupt Iranian regime that violates their human rights &amp; funds terrorism around the world. I'm proud to cosponsor this resolution in support of the #IranProtests &amp; to stand with all who seek freedom. https://t.co/VgbzM8We9F,2020-01-14 22:42:01
"#ICYMI: @AjitPaiFCC has great news for rural broadband! The new #RDOF rules = $16 billion for totally unserved areas with a 2nd phase that will include an additional $4.4 billion for partially served areas, while targeting still-unserved households. https://t.co/jnSj3W1mmQ",2020-01-13 16:09:00
