tweet,dates
"Republicans tucked in a $170 billion tax break for 43,000 people making over $1 million into coronavirus relief.

That's more than all aid for states and cities.

@RepLloydDoggett and @SenWhitehouse are right: We have got to repeal this obscene giveaway. https://t.co/g2xvoMHzVa",2020-04-23 17:15:43
"Maybe—just maybe—the most essential people in our economy are not hedge fund managers.

Could it be that they are doctors, nurses, EMTs, grocery store workers, workers in drug stores, farm workers, and truck drivers?

Let us begin to rethink some of our priorities.",2020-04-23 12:36:46
"More Black and Latino people are dying from coronavirus because air pollution is worse in their communities. That is unconscionable.

It is not a radical idea that clean air and water should be the right of all Americans regardless of income and skin color.https://t.co/zG2KIvn96Z",2020-04-22 19:20:24
"Trump's Earth Day plans? Ignore science, exploit a pandemic to roll back environmental protections, and hand out favors to the fossil fuel industry.

Let us celebrate the 50th #EarthDay by standing together and tackling these crises head on. https://t.co/iVRrZQy1Hx",2020-04-22 15:17:33
"To prevent further economic collapse, Congress must make sure every worker in America keeps receiving his or her paycheck and benefits during this crisis. https://t.co/DN3QBl49fc",2020-04-22 13:47:24
"This pandemic is devastating the Navajo Nation, which already struggled with poverty, lack of running water and inadequate medical care.

Indigenous communities like the Navajo Nation cannot be neglected any longer. Congress must provide full federal support to make them whole. https://t.co/u3w7pUwVxn",2020-04-21 22:08:43
We have trillions in funding for endless wars. We can damn well find the money to make sure our people are able to feed their families and pay their bills. https://t.co/MaxCezFYoq,2020-04-21 20:30:29
"I got involved in politics because I never again want to see humanity descend into the barbarity of the Holocaust.

On Holocaust Remembrance Day, let us recommit to the struggle we're all involved in to create a world where people love and care for each other. https://t.co/Ekh3vr9bYh",2020-04-21 17:21:38
"President Trump has failed to listen to science and we have all suffered because of it.

Let's be serious and prioritize our health over the bank accounts of billionaires and large corporations. https://t.co/5sbBXTCvb8",2020-04-21 12:01:00
"Big Oil has proven that it cannot operate without causing health, environmental, and economic crises. 

Our job: Ensure that oil workers have health care, pay, and pensions as we rapidly transition away from fossil fuels. https://t.co/Kq4LYtIqr9",2020-04-20 20:49:52
"When tens of millions of Americans are losing their jobs while the rich get even even richer, it is outrageous that the Republicans slipped a $170 billion tax giveaway to the top 1% in the last emergency relief bill. This tax loophole must be repealed. https://t.co/CgfUs3inKI",2020-04-20 18:56:43
"It makes no sense for young people to be denied jobs because they were arrested for smoking marijuana. It is time to legalize marijuana, expunge past marijuana convictions and end the failed war on drugs. https://t.co/KimMYKoLAn",2020-04-20 16:03:01
"A furloughed German worker retains 90-100% of his salary, while his American counterpart is struggling to obtain unemployment benefits.

Unacceptable. Congress must cover the paychecks of every U.S. worker. https://t.co/PCMY0tgmw0",2020-04-20 12:48:35
"Tens of millions are being laid off. Over half our workers rely on their jobs for health care.

How does this make any damn sense?

Whether you're working or not, young or old, rich or poor, health care must be a human right—not a privilege or job benefit. https://t.co/o6owj7Wfgi",2020-04-19 17:16:03
"American taxpayers put tens of millions of dollars into developing remdesivir. Any coronavirus treatment or vaccine must be made free for everybody.

We will not tolerate profiteering by Gilead or any other pharmaceutical corporation right now. Human life comes first. https://t.co/3lvDKZUKMA",2020-04-19 15:00:04
"We spend $11,000 for every man, woman and child on health care—twice that of other rich countries.

Yet 30 million are uninsured, thousands of health workers are losing jobs, and we lack basic medical equipment.

It is time for a rational, single-payer, Medicare for All system.",2020-04-18 23:39:14
"Justice for frontline workers means childcare, safe conditions and $500 a week in hazard pay to:

🛒Grocery workers
👷🏼‍♀️Transit workers and truck drivers
📦Warehouse, delivery and postal workers
👩🏽‍⚕️Paramedics, nurses, pharmacy employees
🧺Domestic workers
👨🏼‍🌾Farm laborers
🧼Janitors",2020-04-18 19:16:25
"The American people deserve and require leadership from Washington that acts aggressively, puts working people first, and provides peace of mind to the most vulnerable people in our country.

We must act with love, compassion and urgency. https://t.co/fSKgsyFz6a",2020-04-18 14:47:58
"We are the only wealthy country where millions are losing their jobs and health care at precisely the moment when they need them the most.

@MarkWarner, @SenDougJones, @SenBlumenthal and I have a plan to restore the wages and benefits of every rank-and-file worker in America: https://t.co/BKyJmJEFd5",2020-04-17 22:16:11
"Call me crazy, but I believe the richest country in the world has no business sacrificing the health of our essential workers. We need vigorous workplace safety enforcement, paid sick leave, free health care, and monthly $2,000 payments during this crisis.https://t.co/a0TNkubdFu",2020-04-17 20:12:17
"These ideas are not radical:

🏥Universal health care
🛌Paid sick leave for all
👷🏽‍♀️$15 minimum wage and a union
🌏A livable planet for our kids
👩🏽‍🎓Free preschool-to-graduate school education

We have got to open up people's imagination as to the kind of world they can be living in.",2020-04-17 14:54:56
"One year ago today, Donald Trump vetoed our bipartisan legislation to end U.S. involvement in Saudi Arabia's brutal war in Yemen.

Now, as a pandemic threatens millions of Yemenis, the U.S. must finally say: Stop the bombings. Lift the blockade. Let food and medicine into Yemen. https://t.co/WxsvRExuqb",2020-04-16 20:49:47
"How to fix a shortage of medical masks during a crisis:

✅ Utilize the Defense Production Act to make, buy and distribute masks

❌ Give $55 million to a bankrupt company that doesn’t actually make masks

Trump's corruption and incompetence are costing lives. https://t.co/OxtUrbqS2h",2020-04-16 18:53:15
Cancel all student debt. https://t.co/2wKzTuiQdJ,2020-04-16 16:53:30
"Trump’s decision to cut funding to the World Health Organization—in the middle of a pandemic—endangers American lives. And his own officials know it.

This is a global crisis. We have got to strongly support multilateral institutions like the WHO to confront it. https://t.co/027gbIMRd2",2020-04-16 15:36:09
"We are the only major country where millions of people are losing their jobs and health insurance during this pandemic. In my view, the solution is straightforward:

✔️ Keep workers on payroll and provide 100% of their wages
✔️ Treat health care as a right—not an employee benefit https://t.co/RSnOzDXYjF",2020-04-16 14:11:13
"People are spending most of their stimulus checks on food, medicine and other necessities. We have got to do a lot more.

Congress must now immediately authorize monthly payments of $2,000 to every person in America until this crisis is over. https://t.co/TPvA7AcrCL",2020-04-15 19:49:12
"The Postal Service is:

🌎Our only universal delivery network
👩‍💼Employer of 640,000 Americans
📦Deliverer of 1.2 billion packages of medicine a year
🎖Largest provider of jobs for veterans
🇺🇸Enshrined in the Constitution

We must save the Postal Service and protect its workers.",2020-04-15 18:32:30
"Social distancing can be impossible for our homeless, who are among the most vulnerable during this pandemic.

We cannot talk about the necessity of staying at home if we are not committed to making housing a human right. https://t.co/iZMughbpmg",2020-04-15 16:30:38
"$33.4 billion. That's how much the wealth of Jeff Bezos and six other billionaires increased last week while millions of Americans were filing for unemployment.

Our society cannot sustain itself when so few have so much, while so many have so little. https://t.co/XwlhIXTMzS",2020-04-15 13:21:17
"Let me congratulate Sara Nelson and the flight attendants on their historic victory to ensure that 2 million airline workers receive their paychecks and benefits during this crisis.

Congress must now extend these protections to every worker in America. https://t.co/5OkxRvw4pY",2020-04-15 00:52:09
"Chris Smalls organized Amazon warehouse workers to demand protective gear, paid sick leave, and workplace safety.

Rather than change its policies, Amazon fired him.

I say to Jeff Bezos: Enough! We will not tolerate CEOs who intimidate workers fighting for their human rights. https://t.co/5UKMl9b38w",2020-04-14 21:42:19
"Billionaire bankers just love socialism for the rich.

Greedy hedge fund managers are now calling themselves ""small businesses"" to apply for government handouts. That is wrong.

This aid is desperately needed to help Main Street, not Wall Street. https://t.co/x73kh9TaSB",2020-04-14 19:40:20
"Instead of firing employees who want justice, maybe Jeff Bezos—the richest man in the world—can focus on providing his workers with paid sick leave, a safe workplace, and a livable planet. https://t.co/EdabC2tW3U",2020-04-14 17:18:48
"We are looking today at doctors and nurses who can't acquire the masks they need as they put their lives on the line.

Yet we are the wealthiest country in the history of the world.

How does that happen?",2020-04-14 12:35:07
"Trump knows mail-in ballots mean a larger voter turnout, which he does not want to see.

That is pretty pathetic.

My colleagues and I are working as hard as we can to pass legislation so that as many people as possible can safely participate in our democracy. https://t.co/fZaJDTn7BO",2020-04-13 18:51:14
"Leilani Jordan said she wasn't given gloves or hand sanitizer.
 
Now this grocery worker is dead at 27 over a $20.64 paycheck.
 
Is this what America is about? Or will we fight for protective gear, hazard pay, and paid sick leave for all frontline workers?https://t.co/rpkOV0z69B",2020-04-13 17:05:53
"Even before this pandemic, a majority of our workers lived paycheck to paycheck.

1 in 7 children didn’t get enough to eat.

40% couldn’t afford a $400 emergency.

Let us learn from this crisis. Let us finally eradicate hunger and poverty in the richest country in human history. https://t.co/dzy3dzbQSo",2020-04-13 14:16:00
"It is beyond insane that corporate hospital administrators gave nurses protective gear only after they were tested positive for coronavirus.

We need emergency labor standards and swift enforcement to protect our frontline medical workers NOW. https://t.co/WSG4eYpheQ",2020-04-12 20:53:55
"We cannot allow Donald Trump to use this horrific pandemic as an opportunity to bankrupt and privatize the Postal Service. Now, more than ever, we need a strong and vibrant postal system to deliver mail 6-days a week. Congress must act now to save it. https://t.co/W0YSGHm3AH",2020-04-12 14:16:31
"The idea that we treat health care as an employee benefit is totally absurd.

As millions are losing their jobs, my bill with @RepJayapal says: We will take a burden off your shoulders. In this crisis, you will get all the health care you need for free. https://t.co/jTmzx60DLm",2020-04-11 19:39:04
"Governors across America have pleaded with the White House to get equipment, chemicals, and supplies to test and protect people during this pandemic.

Trump’s ridiculous response has done so much harm and will cost the lives of many thousands of Americans. https://t.co/Nt6CTV5TkR",2020-04-11 15:00:00
"It is absolutely outrageous that Donald Trump and Steve Mnuchin have still not approved grants included in the CARES Act to fully fund the paychecks and benefits of 2 million airline workers.

@stevenmnuchin1: Stop delaying these grants. Pay the airline workers now. https://t.co/fihyj5dGYn",2020-04-10 23:30:00
"We are only as safe as the least-insured among us.

Today, I am introducing emergency legislation with @RepJayapal to:

✔️ Empower Medicare to cover treatment for the uninsured
✔️ Cover all out-of-pocket costs for those with insurance during this pandemic https://t.co/wAfyEIPLkW",2020-04-10 22:24:54
"My friend Rep. Tlaib is right. At a time when hand-washing is saving lives, no one should be denied water—period. https://t.co/h4JsYlGq39",2020-04-10 20:02:33
"If today we had the same level of inequality we had forty years ago, the bottom 90% of American households would be earning $12,000 more every year.

$120,000 per decade.

Do not tell me we cannot afford to cover the paychecks of every worker during this horrific pandemic.",2020-04-10 18:00:42
"It is outrageous that in the richest country in the history of the world, people are going hungry. Congress must radically increase food assistance programs and offer grocery delivery options to ensure all people are able to eat safely during this crisis. https://t.co/zkvsGFdHOA",2020-04-10 14:05:50
"LIVE: Please join my town hall on the coronavirus pandemic with @SenatorLeahy, @PeterWelch, and @GovPhilScott.

We are answering Vermonters' questions by phone and providing information on federal and state efforts to address this crisis: https://t.co/B8YInobqzX",2020-04-09 21:10:16
"How the hell are you supposed to wash your hands during a pandemic when your water has been shut off?

We must require utility companies to restore services to all who have been disconnected, and prohibit all new shutoffs until this crisis is over. https://t.co/bfY5eRO2hk",2020-04-09 18:34:13
"To support the American people during this pandemic, Congress must:

💵 Guarantee 100% of all workers' paychecks
💊 Empower Medicare to pay all out-of-pocket costs
🏦 Provide $2,000 a month for all
🤒 Give paid sick leave to all workers
🏡 Suspend rent and mortgage payments",2020-04-09 12:09:43
"This crisis makes clear what we have known for decades.

If we are sincere about the needs of ordinary Americans, we must pass a single-payer national program to guarantee health care for all Americans. https://t.co/0T5WCvUqy6",2020-04-08 19:30:47
"The president is acting out of political self-interest during a pandemic.

I believe Congress must provide leadership instead. Here is how: https://t.co/fSKgsyFz6a",2020-04-08 13:08:19
"It is unacceptable that African Americans are getting sick and dying from the coronavirus at such disproportionately high rates.
 
We must solve the horrific racial disparities in health that we have in this country. https://t.co/dtrCYwCqfT",2020-04-07 19:57:51
"Amazon workers have tested positive for coronavirus—which may live for up to 24 hours on cardboard—at 50 warehouses.

In my view, failures by Amazon to keep workers safe are not only putting their employees at risk. They place the entire country at risk. https://t.co/rBsFOC9Hca",2020-04-07 17:52:02
"At a time when millions of people are losing their jobs and their health insurance, the United States government must guarantee that you will have all of the health care you need. https://t.co/RiN5F2meZo",2020-04-07 14:57:21
"During this pandemic, know your rights!

For most renters, you cannot be evicted or charged penalties for not paying rent.

For most homeowners, you can request a forbearance on your mortgage. https://t.co/Qc96viEqNG",2020-04-06 20:41:52
"We have got to do everything we can to make sure that right now, our people are safe, get the paychecks that they need, receive medical care for free, and have a roof over their heads.

All American workers must be made whole. https://t.co/aM54KvrsfT",2020-04-06 17:21:05
"Jason Hargrove’s death is an outrage—it should've never happened. Blue-collar workers are risking their lives to keep this country running. They deserve better.

The federal government must require that all frontline workers get protective gear NOW. https://t.co/mqMriBGs54",2020-04-06 14:12:58
"This is an economic meltdown. Millions of Americans have no food in the pantry to feed their kids. No money for rent. Can't pay their mortgage, student debt, or medical bills.

We cannot say, ""Let's wait and see."" We need to get help to our people now and protect their wellbeing.",2020-04-05 19:58:00
"It is insane that our nurses are being forced to care for the sick without masks and respirators. The Department of Labor must immediately issue emergency workplace standards to protect our health workers, their families, and their patients. https://t.co/Z8dWqtxz5X",2020-04-05 18:43:02
"It is incomprehensible that we have governors continuing to do business as usual rather than issue stay-at-home orders.

If they're not able to do it, the federal government should. https://t.co/EowV1ebbST",2020-04-05 16:47:00
"During this emergency, the government should cover all of the health care you need—that means no out-of-pocket expenses. https://t.co/pFFbhOMJ59",2020-04-05 13:02:00
"While millions of Americans were waiting on unemployment benefits they were promised, Trump made time to meet with those suffering the most: Exxon and Chevron CEOs.

If you’re an oil executive who desperately needs a handout, don’t worry! The president is here to help. https://t.co/y3ifK16bh7",2020-04-04 17:52:19
"If our farmworkers fall ill, we go hungry. Our health and wellbeing are all interconnected.

We must put an end to their cramped, impoverished conditions, and provide free health care, paid sick leave, and good wages—regardless of immigration status.
https://t.co/VqDuJaIANN",2020-04-04 15:16:06
"The sailors cheering for Captain Crozier are right.

The Navy appears to be retaliating against him for acting out of concern for his sailors' health. His position should be restored immediately.

Amidst this horrible pandemic, we must speak the truth and protect each other. https://t.co/ShYe10Lghr",2020-04-03 21:10:04
"10 million have already filed for unemployment.

3.5 million have already lost their health insurance.

Good-quality health care should not be tied to your job.

At a minimum, the government must ensure health care for all, without cost, for the duration of this crisis. https://t.co/CEhwRTMdBX",2020-04-03 19:54:08
"If workers are considered essential enough to show up on the job during a pandemic, I'm pretty damn sure they're essential enough to have a $15-an-hour living wage, paid sick leave, protective equipment, and health care as a right. https://t.co/RffohjDDJG",2020-04-03 17:43:25
"The coronavirus has infected nearly a quarter million Americans—more than in any other country on Earth.

It is absurd to keep 87 million people uninsured or underinsured during this pandemic.

Let us learn from this crisis. Let us make health care a human right in America.",2020-04-03 14:15:20
"I support the flight attendants. The Trump Administration must stop putting up road blocks to this aid.

The airline grants must be immediately released to fully fund the paychecks and benefits of 2 million workers. Workers need help and they need it now. https://t.co/xBVZqJdR9K",2020-04-02 21:30:00
"The White House wanted to give Indian Country $0 to deal with the coronavirus. Democrats fought for and got $10 billion, but Native American communities need far more. The next coronavirus package must prioritize tribal health care and economic support. https://t.co/cylzxDSQma",2020-04-02 21:01:44
"Congress passed the largest unemployment benefits expansion in history, but families like the Rodriguezes are going hungry waiting for help to arrive.

The federal government must assist every state and territory in America to get support out right away. https://t.co/E6JzrG4kAQ",2020-04-02 20:09:52
"What good is an order to shelter in place if you're homeless? This pandemic shows us that housing is in fact health care.

As a matter of public health and justice, we must end homelessness and provide shelter to 500,000 Americans sleeping on the street. https://t.co/dolktrA738",2020-04-02 18:54:28
"Last week, 6.6 million applied for unemployment. Millions more will lose their jobs in the coming weeks. In the midst of this horrific crisis, Congress must pass a new, unprecedented emergency bill that guarantees income and health care for all Americans. Working on details now.",2020-04-02 15:32:47
"The Labor Department's job now is to make sure millions of people get unemployment benefits immediately.

We must also join the UK, France and other countries to directly fund workers' wages and stop more layoffs.

We have got to tell our working families: You will be made whole. https://t.co/3fKlliSxp9",2020-04-02 14:13:48
"Number of people who have no health insurance:
 
🇰🇷South Korea: 0
🇨🇦Canada: 0
🇹🇼Taiwan: 0
🇯🇵Japan: 0
🇩🇪Germany: 0
🇸🇬Singapore: 0
🇺🇸United States: 30,000,000
 
Now, more than ever, we need a universal, Medicare for All, single-payer health care system.",2020-04-02 13:09:00
"Half of our seniors survive on $25,000 a year or less.

Outrageously, Trump tried to make them jump through hoops during a pandemic to get their $1,200 emergency relief payment.

Thanks to strong pressure, Trump reversed this policy. Seniors will get the help they need right now. https://t.co/l1jTCbOMAk",2020-04-02 00:53:02
"Amazon's warehouse workers protested because people are getting sick on the job.

Their demands were not radical: a safer workplace, protective gear and paid sick leave.

Amazon’s response? Retaliate by firing a worker who helped organize the walk-out. That is absolutely immoral. https://t.co/qBfGrDx53l",2020-04-01 21:43:41
"Today is #CensusDay, and I urge every person living in the United States to fill it out.

It is more important than ever that we participate in the Census and make sure funding for things like health care and nutrition support go to everybody who needs it: https://t.co/lj64IKkQ2z",2020-04-01 18:39:50
"Millions are losing their jobs and need urgent help to feed their families. They cannot afford delays.

Congress passed the largest unemployment expansion in history.

Now the Labor Department must do everything in its power to ensure people have their benefits within two weeks. https://t.co/FpyQvcFtPf",2020-04-01 17:19:13
"Millions are losing their jobs and health care at a rate never before seen in American history.

@realDonaldTrump’s response? Block https://t.co/ArVjlUxRZn from enrolling people who desperately need insurance during a pandemic.

That is insane. https://t.co/psXteIQGCU",2020-04-01 15:06:24
"How can it be that we spend 18% of our GDP on health care—more than any other major country on Earth—but still lack the beds, masks, ventilators, gowns, gloves and test kits we need to adequately respond to this crisis?

We must transform our dysfunctional health care system.",2020-04-01 14:24:52
"Our postal workers already had one of the most important jobs in America.

Now they are putting themselves at risk to deliver everything our country needs.

I am asking the Postal Service to do much, much more to protect their safety and wellbeing right now. https://t.co/L4Gj9iF4p2",2020-03-31 22:25:18
"This is an unprecedented moment in American history.

Our job is to mobilize this country to produce all the protective equipment our health workers need, ventilators for our sick, and free medical treatment for everybody. https://t.co/9T86cE302v",2020-03-31 21:04:55
"Coronavirus has killed 2,600 in Iran, but U.S. sanctions are obstructing medicine and aid from getting in.

@SecPompeo and @stevenmnuchin1: Pandemics know no borders. Let us put aside our countries' disputes and lift sanctions to reduce human suffering. https://t.co/fRFndKSP39",2020-03-31 19:15:33
