tweet,dates
"Over 234,000 jobs in MO depend on trade with Canada &amp; Mexico, and thanks to #USMCA, U.S. ag and food exports will increase by at least $2 billion each year. This milestone trade deal is a major victory for Missouri farmers, manufacturers and small biz. https://t.co/zSYP1d6DyV",2019-12-19 22:36:21
"House Democrats have achieved nothing more than a massive political divide in America and long-lasting damage to our democracy.
https://t.co/ftoZ3dacOT",2019-12-19 02:02:55
This has been a 2.5 year process with the sole mission of overturning @realDonaldTrump's election. What a shame. What a sham. https://t.co/PrepFISmsn,2019-12-18 19:32:55
"In recent years, deaths related to fentanyl have seen a 1,000% increase. Like so many other states, Missouri has seen the devastating effects of our nation’s opioid crisis firsthand. Last week, I introduced a bill to combat illicit fentanyl trafficking. https://t.co/LpsPNngivp",2019-12-16 22:23:26
Today’s announcement by GM is a testament to the quality of MO03’s workforce &amp; our state's business environment.  Looking forward to many more years of success in Wentzville as auto manufacturing in the U.S. continues to strengthen. https://t.co/qM9r4MBHCz,2019-12-13 19:50:06
A must-read account from someone actually involved with United States-Ukraine relations. https://t.co/K29dwoURK1,2019-12-10 20:18:20
Read my full statement on the articles of impeachment here: https://t.co/hVOHJvKbqO https://t.co/U7MnjPvASV,2019-12-10 18:36:41
Thank you @MOFarmBureau! Honored to receive this award from an organization I’ve been a proud member of for nearly 20 years and so firmly believe in. #MOFB19 https://t.co/aulQJxTS7U,2019-12-10 13:51:34
Speaker Pelosi said it herself: Democrats started the impeachment of @realDonaldTrump 2.5 years ago. https://t.co/s8a4ak9k57,2019-12-09 20:20:05
"The USMCA will increase U.S. ag &amp; food exports by at least $2 billion a year. 33,049 manufacturing jobs in MO depend on trade with Canada and Mexico. This bill is a no-brainer – Speaker Pelosi needs to stop delaying and bring USMCA to the House floor. https://t.co/lgCRACJtnU",2019-12-09 18:22:56
"America’s economy is red hot! Employers added an incredible 266,000 jobs in November, unemployment -- at just 3.5% -- is at a 50-year low, and workers’ wages have gone up 3.1%. https://t.co/sbj9TPnr5N",2019-12-06 14:39:38
"Seeing as Democrats have been trying to impeach @realDonaldTrump since the day he was sworn in, Speaker Pelosi's announcement that the House will proceed with articles of impeachment is not news, just another political stunt in their unconstitutional impeachment “investigation.”",2019-12-05 18:08:36
House Democrats begin the next phase of their impeachment sham in the Judiciary Committee today. Hope Chairman Nadler remembers his own statement from President Clinton’s impeachment in 1998. https://t.co/GkuMuyZubE,2019-12-04 15:45:38
Blaine's Bulletin: Thanksgiving https://t.co/17yAjiUgXI https://t.co/Hr5b1zcx6d,2019-11-29 18:11:16
"Far too often, my constituents face challenges when accessing quality health care in rural Missouri. I will continue to advocate for all Missourians’ access to health care regardless of zip code. #NationalRuralHealthDay",2019-11-21 21:08:13
"House Dems keep changing the narrative hoping to make even an ounce of progress on their impeachment quest. 

First they accused @POTUS @realDonaldTrump of ""quid pro quo.""
Next, “extortion.”
Now, it’s “bribery.” 

Their investigation is unraveling. It’s time for the sham to end.",2019-11-20 14:42:09
Missouri’s Third District is Deer Country – Franklin and Callaway Counties were ranked #1 and #3 in the state for total deer harvested this past weekend! https://t.co/XerBGrhncS,2019-11-19 15:26:53
Reminder: Join me for a tele-town hall TONIGHT at 5:35pm CST! Please sign up by noon to ensure your number is added to our call list: https://t.co/sitK7fQQig,2019-11-19 14:19:29
TOMORROW: Please join me at 5:35pm CST tomorrow evening for a tele-town hall! I look forward to hearing from you -- sign up to participate here: https://t.co/sitK7fQQig,2019-11-18 20:58:04
Great news for Callaway County – the Route D Bridge over I-70 will be completely replaced. The fight to keep Missourians safer on our roads continues! https://t.co/F9j2Nzittr,2019-11-15 20:46:42
What we’ve learned from week one of the Democrats’ public impeachment circus: https://t.co/Zr9kubfvvZ,2019-11-15 16:57:43
"Today, I introduced legislation to improve the recovery process of endangered species in our country and reduce the misuse of the endangered species list. https://t.co/iKx54FVXK9 https://t.co/y8yTJ2cobf",2019-11-14 21:30:52
"Once Republicans were actually given a chance to speak, Adam Schiff promptly interrupted the questioning and advised the witness on how to answer. The sham continues. https://t.co/vgafJhJtnp",2019-11-13 18:35:36
We’re now over two hours into the so-called “open hearing” and not a single Republican has been allowed to ask a question.,2019-11-13 17:22:09
"House Democrats’ tainted impeachment charade drags on today and continues to prevent Congress from legislating. Republicans are ready to pass #USMCA, give our troops a pay raise, and fund the government. Let’s get back to work for the American people.",2019-11-13 16:46:32
Happy 100th Birthday to the @FarmBureau! The state of Missouri is made up of two-thirds farmland and home to a longstanding agricultural tradition. A great reminder that it’s time pass the #USMCA for our nation's farmers.,2019-11-12 19:11:26
"Missouri is home to over 438,000 veterans – today and every day, we thank you. https://t.co/2tmRylmMk5",2019-11-11 16:22:27
"The Berlin Wall fell 30 years ago today, reinforcing that individual freedom and democracy always overcomes communism. I’m proud a piece of this important moment in history stands today in Fulton, MO. https://t.co/WVur2HwbHr",2019-11-08 20:15:37
"Today I sent a letter to Speaker Pelosi and Chairman Schiff demanding the release of all transcripts from their secret impeachment depositions. Despite promising increased transparency, this investigation continues to happen behind closed doors and completely on Democrats’ terms. https://t.co/vTvxvXrddi",2019-11-07 21:36:36
"Countless communities in rural MO are still in need of dependable broadband. The MO Broadband Grant Program provides state resources that help providers, communities &amp; regions invest in broadband infrastructure in underserved areas of MO. Application info: https://t.co/WfHwwsaQZj",2019-11-05 19:51:04
"Congrats the Helias Lady Crusaders – Class 3 State Softball Champions!
https://t.co/jm1MFmy2xk",2019-11-04 22:00:48
#USMCA is a great deal for Missouri and America.  It’s time to pass it! https://t.co/SwthH2amMb,2019-11-01 21:05:54
"Democrats are relentlessly pursuing impeachment of @realDonaldTrump, who they've been trying to undermine since his 1st day in office. Today’s vote &amp; this investigation are simply political stunts from Democrats who are still aching from the 2016 election https://t.co/OVaXD196EV",2019-10-31 19:04:55
"Witnesses at a hearing with MDIs recently discussed the harmful effects CECL will have on low-to-moderate income consumers. Unfortunately, Chairwoman Waters has yet again blocked any attempt to address this potentially disastrous accounting standard. https://t.co/xDzhwIUjRP",2019-10-31 15:29:39
"A great day with @the_USO service project on Capitol Hill! 2,000 care packages are on their way to our brave men and women defending our freedom abroad. https://t.co/jrlCcYbtmz",2019-10-30 18:02:49
Wentzville’s finest answering the call to serve in every way! https://t.co/uU3O1n4uLj,2019-10-30 13:47:54
"The #USMCA will benefit farmers, manufacturers and businesses across the country. House Republicans are ready to pass it, but Democrats continue to use this so-called “impeachment inquiry” as a stall tactic.",2019-10-29 21:11:00
Happy #NationalFirstRespondersDay! Thank you to all the heroes who risk their lives for Missouri and our nation each &amp; every day. https://t.co/UFUWKKkwbP,2019-10-28 21:12:08
"As the leader of ISIS, al-Baghdadi was one of the most ruthless, evil people on the planet. His death is a victory for the entire world. Thanks to the leadership of @realDonaldTrump &amp; the bravery of our military, we now live in a safer place. https://t.co/CD44YhMapF",2019-10-27 15:41:55
"The dollar is the world’s reserve currency because it is the most trusted and stable. With new technologies and rapid innovation, we must make sure we keep it that way. Thank you Mark Zuckerberg for testifying today. https://t.co/rmXRwQIB2z",2019-10-23 19:13:42
CECL is a direct threat to small banks and the communities they serve. It’s past time for House Financial Services Committee to act.  https://t.co/CWcJTahU0h,2019-10-22 21:24:22
"Today I sent letters to House Leadership requesting access to all records, documents, transcripts, and materials related to or obtained in the course of the ongoing joint impeachment investigation. The manner in which this investigation is being conducted is unconstitutional. https://t.co/FjtvpTZuXS",2019-10-21 22:23:23
I sent a letter to Treasury Secretary @StevenMnuchin1 urging FSOC to require OFR to conduct a study on the CECL accounting standard. Read it here: https://t.co/VCI4heW0Zp,2019-10-21 21:20:16
I was proud to co-lead a letter with @RepMattGaetz and nearly 70 other Members thanking @SecAzar for his work to end taxpayer-funded research using aborted fetal tissue. https://t.co/fhMfRUMlbO,2019-10-21 19:28:45
"Today on #NationalMammographyDay, I introduced a bill that would allow mobile mammography units, or ""MammoVans"" to better reach rural, underserved areas in Missouri. https://t.co/ivxus1N1tn",2019-10-18 18:39:48
"My sincere condolences to the Cummings family. I had the opportunity to serve with @RepCummings on the House Oversight Committee as a freshman, and always admired how he guided his life through staunch principles.",2019-10-17 16:13:43
Wishing all my fellow Missourians a very Happy Missouri Day! Proud today and every day to represent #MO03. https://t.co/9k5Cww4rmi,2019-10-16 18:19:59
Today is Missouri day – the perfect occasion to celebrate @StLouisBlues Stanley Cup win on Capitol Hill! https://t.co/mOEGPHv51X,2019-10-16 14:55:26
"UPDATE -- Center for Responsible Lending: “As proposed, CECL creates a significant disincentive for lenders to originate loans to low- and moderate-income families and communities of color” @FAFNorwalk https://t.co/ruCjgSedRQ",2019-10-15 21:15:59
"Calling all space lovers – @NASA has invited K-12th grade students to name the Mars 2020 Rover! The contest closes November 1st, so be sure to send in your names and short essays soon. https://t.co/jBFWDqE0LV",2019-10-15 18:29:14
"With 7,600 auto care industry employees in #MO03, I’m glad to be a part of the Auto Care Caucus. https://t.co/2KxxvCCQSW",2019-10-15 15:02:10
Excited to see the restoration of this 1870 cottage in the Historic City of Jefferson. A joint effort from the federal government and the VA to create a place for veterans to use. Read more here: https://t.co/loSAaxljPD,2019-10-11 20:07:12
Let's go Cardinals! Excited for game 5! #TimeToFly #RedOctober https://t.co/R1h0QRUWN9,2019-10-09 20:35:01
I am proud to cosponsor @RepAndyBiggsAZ’s resolution to condemn and censure Rep. Adam Schiff. He should be held accountable for his reckless pursuit of impeachment and for continuously misleading the American people.,2019-10-09 18:54:39
"Once again, my colleagues across the aisle are grasping at straws in an attempt to defend their agenda of impeachment. https://t.co/28ZWOyNwVl",2019-09-25 15:35:34
"Today, I announced upcoming constituent service days to be held across #MO03. Staff from my office will be available to assist, one-on-one, with anything from veterans’ benefits to Medicare issues to general questions regarding federal agencies. https://t.co/oV9TXXCaPs https://t.co/0Gg7qRlsX0",2019-09-24 20:30:31
"On #ConstitutionDay, WE THE PEOPLE celebrate the framework for our great nation.

For over 200 years, the words of our founding fathers have been a beacon of democratic ideals. We must remain vigilant in protecting the rights and freedoms guaranteed by this revered document. https://t.co/fgIyy6kroz",2019-09-17 19:57:00
"We would do anything to protect our children and that means ensuring they have a properly installed car seat that is right for their AGE, HEIGHT, and WEIGHT.

Do you have #TheRightSeat to keep your child safe? https://t.co/HGEFlkebfq",2019-09-16 19:11:17
"This week I had the pleasure of meeting with leaders from my alma mater, Lincoln University. As a proud graduate of @LUBlueTigers, I’m happy to see @POTUS taking action and prioritizing HBCUs across the nation. https://t.co/iEZtCz9kWI",2019-09-11 21:55:34
"At this moment 18 years ago today, our nation was forever changed. Today we remember and honor those who lost their lives. 

We will never forget. https://t.co/nmTJQowBZ9",2019-09-11 12:48:02
"Thanks to @usda, rural communities affected by natural disasters will get the resources they need! https://t.co/JuAWbmPWVZ",2019-09-10 18:30:32
"77% of voters agree: Babies #BornAlive during an abortion must be protected.

80 times, Representatives have requested a vote.

80 times, Pelosi has blocked a vote to #EndInfanticide

Why is it so hard for @SpeakerPelosi and House Democrats to pass the commonsense #BornAliveAct? https://t.co/zgGLJjpAd3",2019-09-10 15:52:32
