tweet,dates
Good to chat with students from Kenosha Christian Life School today! It’s great to see young people interested in government. https://t.co/4HxELlGqqZ,2020-05-08 19:04:25
Awesome! The Wisconsin Wing of the Commemorative Air Force will conduct a flyover today to salute our veterans and celebrate the 75th Anniversary of our victory in Europe during World War II. Here is the flight path: https://t.co/TgAB1bE8GC,2020-05-08 14:50:42
"On this day 75 years ago, our troops achieved #VictoryInEurope. Known as #VEDay, today marks the 75th anniversary of the Nazi surrender resulting in an Allied forces victory and the liberation of Europe. https://t.co/nUspHZporT",2020-05-08 13:51:52
"May 7th is #NationalDayOfPrayer. Today, let us pray for those affected by coronavirus, for families who’ve lost loved ones, for those who have lost their job, for the protection of our health care workers, and for our nation. https://t.co/LX8qt42GkY",2020-05-07 22:25:43
"Scammers are trying to take advantage of the coronavirus pandemic. I held a Telephone Town Hall with experts to help inform folks about how to avoid scams. Read more, here: 

https://t.co/PW76Qh6Yuf",2020-05-07 21:40:19
More testing coming to Racine County https://t.co/KwPbxMkieg,2020-05-06 23:20:43
"Thanks for supporting our community, @Jockey! https://t.co/7XwKvX6dWw",2020-05-06 22:48:32
"Thank you nurses! Nurses are on the frontlines battling the coronavirus and caring for patients. Thank you to all the nurses working hard to save lives throughout our country. 

#NurseAppreciationDay https://t.co/BWW2q4ULsj",2020-05-06 19:16:57
"Did you miss today’s telephone town hall on how to avoid scams related to #coronavirus? No worries! You can listen to it here. Be sure to visit https://t.co/szQxrz8lUP for helpful resources to prevent and report scams. 

https://t.co/sow61dKi8p",2020-05-06 17:44:12
REMINDER: I will be holding a Coronavirus Scam Prevention Telephone Town Hall at 10am. More information below: https://t.co/qpks2GYlOy,2020-05-06 14:04:49
REMINDER: I will be holding a Coronavirus Scam Prevention Telephone Town Hall tomorrow at 10am. More information below: https://t.co/a9k8cMAium,2020-05-06 00:20:15
"The House should be in session now, getting answers for the American public:

How do we bring the medical supply chain back to the US?

What did China know and when did they know it?",2020-05-05 21:36:47
"To reopen safely we need to improve our testing utilization in Wisconsin. I support prioritizing nursing homes and long term care facilities. We need to increase utilization. We hit a new high of 3,500 tests yesterday, but testing capacity is over 11,000!  Let’s get going.",2020-05-05 20:42:03
"Thank you teachers! It’s #TeacherAppreciationDay. Impacts of coronavirus have led to school closures and forced our teachers to educate students in new ways. To all the teachers out there, I want to say thank you!

#TeacherAppreciationWeek2020 https://t.co/XHoJA5bZ1x",2020-05-05 16:43:32
"Naval aviator Alan Shepard became the first American in space on this day in 1961. 10 years later, he would step foot on the moon. 

From @DAVHQ https://t.co/tKIrbh492T",2020-05-05 13:54:01
Great to join the @uwwWSG meeting tonight. It was good to hear from @UWWhitewater students and give an update of my work in Congress. Go Warhawks! https://t.co/o0SBKCoFSZ,2020-05-05 00:30:16
I joined many colleagues in urging Secretary of State Mike Pompeo to support efforts to extend the UN arms embargo on #Iran &amp; impose travel restrictions on dangerous individuals within the Iranian regime. We must keep our eye on Iran. We can’t allow Iran to buy &amp; sell weapons. https://t.co/NQQU7osZkn,2020-05-04 23:28:27
"Thank you firefighters! 

#InternationalFirefightersDay https://t.co/EzpjVoFYQ6",2020-05-04 22:10:55
Great to join students from Val Croft’s AP history class at Milton High School this morning for some Q&amp;A! https://t.co/aFFqr0LZS4,2020-05-04 21:05:54
"I will be holding a Coronavirus Scam Prevention Telephone Town Hall on Wednesday, May 6, 2020 at 10am. More information below: https://t.co/ykcNm14qzY",2020-05-04 15:56:02
Joining Tim Bremel on @wclo1230 at 9:15. Tune in! https://t.co/MymckCJArY,2020-05-04 14:08:19
"Great to see local businesses stepping up to help our community. 

https://t.co/AeWk8ax9uw",2020-05-03 20:25:33
"New Navy ships will be built in Wisconsin 🇺🇸 ⚓️ 

https://t.co/wnnPQxfpPW",2020-05-01 18:12:32
"May is National Mental Health Awareness Month. We must fight the stigma associated with mental health &amp; support those on the front lines fighting this crisis, family, friends, and neighbors struggling during this difficult time. 

#MentalHealthAwarenessMonth https://t.co/XT5UjljIJ5",2020-05-01 16:29:16
"Happy Birthday, Gladys! 100 years young! https://t.co/puNejIc7kC",2020-04-30 21:36:10
"Targeted &amp; innovative actions must be taken to ease the burden on families during #COVID19, especially when it comes to at-home &amp; online schooling. Read about my effort to allow parents to use 529 funds to cover students' education expenses in @thehill: 

https://t.co/iYRRNRwfKa",2020-04-30 15:03:23
"I will be holding a Coronavirus Scam Prevention Telephone Town Hall on Wednesday, May 6, 2020 at 10am. More information below: https://t.co/hMR7bmecuE",2020-04-29 19:22:56
Great to join AP government students from Janesville Parker HS. We were scheduled to meet in March to discuss their Washington Seminar research papers. But did it virtually yesterday. A great discussion and good questions! https://t.co/b52xqRor85,2020-04-29 16:21:24
I’m joining Wake Up Kenosha on @am1050wlip at 6:50am. Tune in!,2020-04-29 11:39:48
Good news! https://t.co/5rKmkgMOJe,2020-04-28 16:34:10
Thanks @SeanSpicer for highlighting this issue. I’ve talked with Wisconsin dairy farmers who have dumped milk. It’s heartbreaking. They need our support. I’m focused on working w/ @realDonaldTrump &amp; Dept. of Ag to connect farmers directly with those in need of milk and food. https://t.co/7ySGXC24GA,2020-04-28 15:01:22
Thank you for your support! https://t.co/VtYOrJ87bj,2020-04-28 14:21:00
WATCH: I joined @seanspicer on @Newsmax to discuss the need to support Wisconsin dairy farmers &amp; our efforts to hold Iran accountable during #COVID19 pandemic. https://t.co/fYjdqbe6gl,2020-04-28 00:51:25
I’m joining @seanspicer on @newsmax to discuss the need to support Wisconsin dairy farmers &amp; our efforts to hold Iran accountable during #COVID19 pandemic. Tune in  tonight at 5:35pmCT! https://t.co/sJu2BCibEW,2020-04-27 22:01:40
Congress should act to allow 529 education savings plans to cover expenses related to learning from home. See my full letter to Congressional leadership. 1/9 https://t.co/q7McoDf7Ab,2020-04-27 20:01:03
On now with @wclo1230! Tune in! https://t.co/ERPxG279Yz,2020-04-27 14:18:41
"Welcome home! 

https://t.co/mzhmNOTIAQ",2020-04-25 00:38:28
"Testing can help us reopen sooner &amp; safer. Wisconsin DHS reports we have capacity to test 10k per day.  Legislation I supported, signed by the President today, provides funding for testing expansion. View the data at: https://t.co/VqD2p4X73K",2020-04-24 21:52:13
"All jobs are essential to the families they support. As a result of the continued coronavirus shutdown, it is clear we need to continue providing for workers. Today, I voted for additional funding to support jobs, help doctors and nurses on the frontlines, and increase testing. https://t.co/MHr2Pu0RPa",2020-04-23 22:46:13
"We cannot take our eyes off Iran. Iran is using the coronavirus pandemic to work to avoid our sanctions. I have a plan to stop that if we act now.

https://t.co/Ta1taypP6R",2020-04-23 16:21:22
Headed to Italian House for takeout tonight. Ate lots of meals here freshman year! It’s in Janesville next to Craig HS. Support our local businesses and workers! https://t.co/N4fMVBEW67,2020-04-22 00:33:24
"Welcome @Mike_Pence to Wisconsin. Thanks for highlighting the work being done in Wisconsin to fight to coronavirus! 

https://t.co/Wc1rroWIoW",2020-04-21 16:26:35
Wisconsin’s govt closures haven’t struck the right balance. One size fits all rules allow some car washes to open while others are forced to close. We can protect our health while allowing people to work. We need flexibility. All jobs are essential to the families they support. https://t.co/MkEd1nQ9z6,2020-04-20 23:13:58
Important FAQ’s regarding Economic Impact Payments: https://t.co/JhEreHmbnW,2020-04-17 18:59:23
Thank you truck drivers! https://t.co/OnYUHCjF37,2020-04-16 19:32:46
"Students and families are adjusting to online and distance learning. To ease the financial burden on many families, funds in 529 plans should be expanded to help students obtain the needed curriculum material or online educational material. More: https://t.co/qN2x3Ulw9r",2020-04-16 17:56:42
"The @USTreasury announced millions of Americans have already received an Economic Impact Payment. @IRSnews has launched a new tool to track where your payment is in the process. For info on eligibility, payment status &amp; other resources, visit: https://t.co/l0JufZEyn5.",2020-04-16 16:17:56
🚨REMINDER: Both Federal and Wisconsin tax filing deadlines have moved to July 15! https://t.co/NCxMr7Xj6N,2020-04-15 18:09:36
"Good news! The new F-35 fighter jets are coming to Wisconsin’s Truax Field in Madison. 

https://t.co/GLfuQGSFvZ",2020-04-15 16:59:18
This unprecedented economic situation requires quick action so we can help the areas that need it most &amp; prepare for the future. Opportunity Zones encourage investment and promote job creation. This bill extends the opportunity zone program for 10 years. https://t.co/OMfh95YQj1,2020-04-15 15:42:38
I’m joining Wake Up Kenosha on @am1050wlip at 6:50am to discuss the latest on #coronavirus. Tune in!,2020-04-15 11:41:06
Important information regarding Economic Impact Payments! Make sure you watch out for scams. https://t.co/DTaOffHHZ8,2020-04-14 18:13:25
"I agree @realDonaldTrump! Coronavirus funding bills should be focused on fighting coronavirus, not extraneous spending like the Kennedy Center! It should be used to battle coronavirus &amp; help workers! We need policies that focus on the problem not for pet projects. https://t.co/zKV3MbABD3",2020-04-14 16:01:11
"Thank you dispatchers and first responders! 

Graphic from @nbc15_madison https://t.co/rXbdOAXrPh",2020-04-14 14:40:33
"Keep dancing, Chuck! Chuck Franzke is a World War II Vet from Waukesha who went viral on social media for dancing to Justin Timberlake in front of his home on his 97th birthday! 

https://t.co/Xh23v2ueXR",2020-04-13 18:21:52
Joined Tim Bremel on @wclo1230 this morning to discuss the latest on #coronavirus. You can listen here at the link below. I join Tim around 7 minutes into the show. https://t.co/97WceKIukR https://t.co/KOchrSsw7J,2020-04-13 18:01:10
I’m joining Tim Bremel on @wclo1230 at 9:15am to discuss the latest on #coronavirus. Tune in!,2020-04-13 14:03:31
Happy Easter to you and your family. Today we remember that there is hope even during difficult times. https://t.co/T6YAWB4cXo,2020-04-12 17:06:42
Stopped by Sandee’s Thai in Janesville tonight for some Penang curry takeout. A great night to support small businesses. (And much better Thai than I would cook on my own.) https://t.co/1e05o8ZJPd,2020-04-12 00:34:03
Social distancing for Badgers https://t.co/zoU4OjWx5r,2020-04-11 20:41:53
"I want to ensure every high schooler in Southeast Wisconsin has the opportunity to showcase their talents despite the current situation. Good luck to all and I look forward to seeing your submissions.

https://t.co/w9vsgeeIZo",2020-04-11 16:13:36
Happy to join @kentwainscott and @WISN12NEWS tonight to talk about how Jockey in Kenosha and Charter NEX in Milton are now making protective gear for our health care workers. Glad I could help! https://t.co/2Q4T3NRmKN,2020-04-11 00:33:30
"For folks who do not normally file tax returns, the @IRSnews has a new tool so you can securely submit your personal information and receive your Economic Impact Payment fast! Use the tool here: https://t.co/TcRKQsGdO2 https://t.co/QMr2mZIPAQ",2020-04-10 22:16:49
"Thank you to @HomeDepot for donating masks to our paramedics and firefighters in @City_Janesville! 

https://t.co/3XXck9y7WC",2020-04-10 18:03:43
"Charter NEX, a plastics manufacturer based in Milton, is helping to produce PPE for frontline health care workers. Glad I could help! https://t.co/Cd1J7KBY1O",2020-04-10 15:22:17
Warm tea on a cold day outside. https://t.co/5lq699TnIE,2020-04-09 23:56:51
Millions of Americans have stepped up and put extraordinary examples of patriotism on display to help combat coronavirus. Check out stories from Wisconsin and around the country here: https://t.co/BJqXSjkDEV #AmericaWorksTogether https://t.co/kFbBPi69wW,2020-04-09 21:07:32
"UPDATE: This year my office will be holding our Artistic Discovery Contest virtually! The coronavirus pandemic may prevent high school students from being in their classrooms, but it does not stop their ability to draw, paint, and create. For more info: https://t.co/vA1P4XIxr3 https://t.co/79kH5qpWP6",2020-04-09 18:26:18
Local companies are stepping up to keep our health care workers and first responders safe. Glad I could help! https://t.co/qqqPp9e7On,2020-04-09 15:58:04
Wishing everyone a happy and healthy Passover! https://t.co/zV1z5BJ1CB,2020-04-08 23:42:15
"Great job, @gatewaytech! https://t.co/KCWhk5868Y",2020-04-08 22:13:16
"I agree @NikkiHaley. That $25 million should be used for fighting coronavirus, not a DC theater. That’s why I introduced the bill to take back the $25 million. https://t.co/RG7ye8CrNL",2020-04-08 17:06:43
I joined @MikeCurkov this morning on @CBS58 to discuss the federal response to #coronavirus. Thanks for having me on! https://t.co/IiwigRBw5d,2020-04-08 15:44:03
Don’t get scammed! Stay vigilant. Criminals are trying to take advantage of the coronavirus crisis. https://t.co/mu7dfSGo9J,2020-04-07 23:34:24
"Today is #WorldHealthDay. Thank to you to all of our health care workers in Wisconsin, the United States, and across the world who are on the frontlines battling the #coronavirus! https://t.co/1AcefA3YaY",2020-04-07 21:07:55
Thanks for having me! @WiscBuilders https://t.co/WjYsCDmHBE,2020-04-07 20:52:38
"President @realDonaldTrump has approved Wisconsin’s request for a major disaster declaration. This allows Wisconsin to receive the federal resources and assistance we need to combat #coronavirus.

https://t.co/Dod6dfilOf",2020-04-07 16:10:38
Yesterday I held a teleconference to discuss the economic impact of coronavirus on local Wisconsin convenience stores and their workers. Thank you for remaining open to serve our communities!,2020-04-07 13:48:57
Glad to see SBA address my concerns. Religious nonprofit &amp; religious organization workers are suffering from the economic fallout of coronavirus. Great that these workers can receive a paycheck &amp; these groups can have fed aid to keep their doors open. https://t.co/NnE4AkDEIc,2020-04-06 16:35:36
For official coronavirus resources visit my website: https://t.co/TtCMFX6X8o https://t.co/64dTILYDoh,2020-04-06 15:58:43
"Got a few things at Farm and Fleet in Janesville this weekend. Online order, drive through pickup. Great to see local businesses being creative on how to operate safely during challenging times. https://t.co/3V6exu0NFQ",2020-04-05 16:48:11
"“Steil raised the flag up through our company about how fast we had to respond,” said Doug Latreille.

“Immediately after that, we martialed our resources together,” said Charter NEX CEO Kathy Bolhous.

https://t.co/GlUjsQW1HU",2020-04-04 21:01:27
Radio stations across Wisconsin will be playing Jump Around at 3PM! Get on your badger gear and get outside and jump around at 3! Find a station near you: https://t.co/4q3TXodWHy https://t.co/aQaNNj4xVM,2020-04-04 17:53:23
"“In 2018, the center had 232 employees earning annual salaries of $100,000 or more”. 

And they have a $100M endowment. Pretty sure they do not need $25 million of additional taxpayer funds!

https://t.co/U76QJ5GMwZ",2020-04-04 01:22:51
I spoke w/ @AlysonBruner from @SpectrumNews1WI about working w/ @Jockey to ensure they can produce critical PPE for health care workers &amp; first responders. We also discussed my work w/ the @StateDept to help bring a Janesville woman home who was stuck in Peru. Full interview: https://t.co/ZneNmQUHoh,2020-04-04 00:39:00
"I wrote a letter &amp; urged Administrator of the US Small Business Administration (SBA), Jovita Carranza, to ensure religious organizations &amp; religious nonprofits are eligible for SBA loans to pay workers, rent, &amp; utilities. 39 of my colleagues joined me in support. Full statement: https://t.co/SvHrFwDL8j",2020-04-03 19:22:50
The Paycheck Protection Program began this morning. I was happy to support this program which helps keep workers on payroll during the coronavirus pandemic. Over $875 million in loans have already been approved. Check out @SBAgov’s website for more info: https://t.co/aNK47NjeW8 https://t.co/8bB0uNp5xT,2020-04-03 17:04:36
Great to join Spicer &amp; Co. on @newsmax to talk about my new bill that would rescind the $25 million for the Kennedy Center. Thanks for having me on @seanspicer! https://t.co/S96IEtTb8A,2020-04-03 14:16:49
I’ll be joining @RaymondArroyo on @worldoverdc tonight to talk about my bill to rescind $25 million to the Kennedy Center &amp; more! It starts at 7PM CT. Tune in!,2020-04-02 23:59:27
"Great to join @AlysonBruner on @SpectrumNewsWI to talk about how I worked with  @Jockey, who is now making PPE for our medical workers and first responders on the frontlines battling #coronavirus. 

https://t.co/JxFF7HYBDE",2020-04-02 23:36:17
I’ll be on with @HowieCarrShow at 5:05PM CT. We will be talking about my new bill that would rescind the $25 million given to the Kennedy Center. Tune in! https://t.co/MC3kRQGLB3,2020-04-02 21:49:12
I’ll be joining @WPR at 3:45 to talk about the federal government’s response to coronavirus. Tune in! https://t.co/xsy2z7Cuxu,2020-04-02 20:30:56
I worked with the Wisconsin delegation to urge President @realDonaldTrump to approve the State of Wisconsin’s request for a major disaster declaration. This will allow Wisconsin to get the federal resources and assistance we need to combat #coronavirus. https://t.co/Aql7USqfzb,2020-04-02 20:19:29
Our community is awesome. Glad to work with the State Department to get Maddie back home to Janesville and out of Peru. https://t.co/106M7utsC3,2020-04-02 19:06:17
"“She said the government had banned drinking, and one thing she wanted when she got home was a Spotted Cow, a popular New Glarus Brewing product that is not sold outside Wisconsin.

Scott said they found two Spotted Cow six-packs on the porch.”

https://t.co/ffUbJ9il1t",2020-04-02 19:05:51
I held a teleconference w/ dairy farmers across Southeast Wisconsin to hear firsthand about the impact of coronavirus. Our farmers are struggling. The CARES Act included $23.5 billion to support farmers. I will continue to ensure that we help our farmers. https://t.co/9aIGIRgqCA,2020-04-02 15:04:23
Social Distancing - Wisconsin Style https://t.co/t1IJLdhdlU,2020-04-02 14:44:41
WATCH: I joined @JackPosobiec on @OANN to talk about my new bill that would rescind the $25 million to the Kennedy Center. Thanks for having me on! https://t.co/22c0Fk0kAQ,2020-04-02 01:00:09
I am excited to announce that Maddie has returned safely home to Janesville! She arrived home today. https://t.co/0WMEyFMpvx,2020-04-01 20:59:41
#Breaking: Great News! Maddie is now back safely home in Janesville. I worked with the State Department to get Maddie out of Peru and back home to Janesville. https://t.co/ZKI7ivD2me,2020-04-01 20:49:15
"Happy to join @WisconsinMC this morning for their business coalition webinar. I talked about the federal government’s response to coronavirus and how we need to support workers, families, and jobs. https://t.co/l6GrCuOCkM",2020-04-01 20:20:44
"This money should be going to workers and families, not a DC theater. Read more from @nypost: 

https://t.co/JvvXpujJ7g",2020-04-01 17:51:50
"Huge thank you to @Jockey who has stepped up to help our community &amp; country. They will be donating: 

250,000 gowns nationally &amp; 10,000 scrubs to NYC for health care workers

10,000 surgical masks &amp; 10,000 N95 masks to first responders in Kenosha 

Glad I could help with this! https://t.co/lD37O6lIhv",2020-04-01 16:11:00
Joining Tim Bremel on @wclo1230 to discuss the latest on the #coronavirus pandemic. Tune in around 9:07am!,2020-04-01 13:56:21
"Some in Washington felt it was important to spend $25 million of taxpayer dollars on the Kennedy Center when there are obviously bigger needs right now. 

My bill rescinds the $25 million. That money should go to fighting coronavirus or to taxpayers.

https://t.co/tINJDslZPA",2020-04-01 13:10:57
"Good morning, Kenosha! I’m joining Wake Up Kenosha on @am1050wlip at 6:50. Tune in!",2020-04-01 11:41:00
"$25 million for the Kennedy Center should never have been included in the CARES Act, but it is appalling that they’re now laying off their workers. https://t.co/4VfDT3BxXt",2020-03-31 19:55:12
"Interviewed with @WTMJSteve this morning. We talked about coronavirus, my new bill, and how I worked with Jockey that will now produce 30-50k gowns per week for our health care workers. https://t.co/gUvIX6Yh1i",2020-03-31 19:05:32
Great to talk with @henryrodgersdc about my new bill that would take back the $25 million from DC's Kennedy Center. https://t.co/0gVXWWV9UM,2020-03-31 18:33:58
"My new bill takes back the $25 million from DC’s Kennedy Center. 

This money should be spent fighting the virus or in taxpayers’ pockets! 

https://t.co/0g0JDOQMTV https://t.co/1DhNBgWjcI",2020-03-31 18:23:58
"My new bill takes back the $25 million from DC’s Kennedy Center. 

This money should be spent fighting the virus or in taxpayers’ pockets! 

https://t.co/0g0JDOQMTV https://t.co/RXmykvOxb7",2020-03-31 18:21:26
I’m joining @WTMJSteve at 11:35AM to talk about coronavirus and how I worked with @Jockey that will now produce 30-50k gowns per week for our health care workers. https://t.co/Ei68aKP0eI,2020-03-31 16:29:07
This money should be spent fighting the virus or in taxpayers’ pockets! https://t.co/Wtb0Mr2q4Z,2020-03-31 15:58:48
Thanks @SteveScalise for supporting my bill that takes back the $25 million from DC’s Kennedy Center. This money should be spent fighting the virus or in taxpayers’ pockets! WATCH on @seanhannity here: https://t.co/HgmYGEdvE5,2020-03-31 13:35:41
"Great news! Proud to help. @Jockey, headquartered in Kenosha, just announced at the @WhiteHouse w/ @realDonaldTrump that they’ll produce 30-50k gowns for health care workers per week &amp; will donate 10,000 scrubs. Thank you for supporting doctors &amp; nurses on the frontlines. WATCH: https://t.co/SzC5sqvLAn",2020-03-30 22:41:22
We must protect our first responders &amp; health care workers. I joined the Wisconsin congressional delegation to urge FEMA to provide personal protection equipment (PPE) for our health care workers and testing supplies to effectively respond to coronavirus. https://t.co/7PuxPcBg92,2020-03-30 19:01:20
Today is #NationalDoctorsDay. Thank you to the doctors in Wisconsin and across the country who are fighting on the frontlines against coronavirus. Doctors are saving lives. Thank you!  🩺 https://t.co/Qj08AiNcvS,2020-03-30 15:30:43
"Today we honor the service and sacrifice of our Vietnam veterans. We are thankful for your service to our nation. We will always remember our heroes who never made it home. 

#VietnamWarVeteransDay https://t.co/jIjbcoDCD1",2020-03-30 01:11:08
"For good info on how to donate, volunteer, or contribute medical equipment, check out this @Fema page. https://t.co/GlIBDihUrp",2020-03-29 14:40:57
"While the CARES Act is far from perfect, it provides relief. This bill provides free coronavirus testing for Americans and ensures those on the front lines—our doctors, nurses, and health professionals—have the supplies they need. 

https://t.co/aDMgufQVua",2020-03-28 15:48:13
An example of American ingenuity supporting our fight against #coronavirus. Improved testing is a big part of beating the virus. Thank you to all the researchers who are committed to the fight. https://t.co/eYimej053f,2020-03-28 15:10:57
"The CARES Act just passed the House &amp; provides needed relief to families, workers, hospitals, and communities in Southeast Wisconsin impacted by #coronavirus. Read more here: https://t.co/qJoFObUWsn https://t.co/DtsxK31W7S",2020-03-27 18:04:45
"Americans’ health and American jobs are being attacked by an invisible virus. And this House is called upon to respond today. Americans need our help. While far from perfect, the CARES Act provides needed relief. We cannot let the perfect be the enemy of the good. https://t.co/J5Zqv5GW39",2020-03-27 14:50:29
Just pulled in. About to speak on needed coronavirus relief bill on the House floor. https://t.co/1d4j7mpOFK,2020-03-27 13:53:39
Leaving Janesville to head to DC to continue work on much need aid package. https://t.co/9jDxu0DesU,2020-03-26 20:17:14
For official coronavirus resources visit my website https://t.co/KduGHVPpsQ https://t.co/RDWnhSV0LN,2020-03-26 16:02:53
It’s National #MedalofHonorDay. This is our nation’s highest award for valor. Thank you to our heroes! https://t.co/i6BoQzckNT,2020-03-26 00:58:12
Important information from the @StateDept https://t.co/WO5UaSBtAb,2020-03-25 17:03:35
Both Federal and Wisconsin tax filing deadlines have moved to July 15! https://t.co/MxyNYc8mq2,2020-03-25 16:34:28
Support our local businesses! https://t.co/5S1asJLk9N,2020-03-25 14:54:08
