tweet,dates
"House Democrats don't have a budget. They haven't done the work. They're not in the arena saying what they would do. Yet they continue to sit on the sidelines, criticizing the efforts of the President's budget. https://t.co/9v8Igcymok",2020-02-12 22:32:35
"This news is encouraging to hear, but we have so much further to go. I am proud of Utah's leadership on suicide prevention.

In D.C. I am working to give first responders the tools they need to save lives &amp; designate 9-8-8 as the National Suicide Hotline.

https://t.co/2lJl3v72jV",2020-02-11 22:45:21
"With my @housebudgetGOP colleagues at the White House to hear about President Trump's budget proposal.

One of our nation's biggest challenges is controlling our debt and our spending. The President's efforts to balance the budget should inspire Congress to do the same. https://t.co/Fi5PHbWSqF",2020-02-11 21:22:45
"This week I was able to meet with many of you, especially some of our youth from Southern Utah, who are working hard to combat youth vaping among their peers. 

Other highlights included: The #SOTU, moving on from impeachment, and meeting @DanReynolds. https://t.co/6fl8qKENRq",2020-02-07 19:18:56
"Utah has always been a leader in finding innovative ways to provide high-quality healthcare to its citizens that are most vulnerable. Healthcare needs are dynamic and constantly changing, so it’s encouraging to see the federal government recognizing the need for flexibility. https://t.co/AfG00JIAy9",2020-02-06 23:25:18
Great to chat with @DanReynolds about how we can work together to protect the worth &amp; dignity of all Americans. Thank you for the work you do on behalf of LGBTQ youth &amp; families. https://t.co/UJKthT7WnT,2020-02-06 20:53:04
"I'm glad that this charade has finally ended. Now Americans can focus on enjoying our booming economy, the lowest unemployment rate in 50 years, and our strongest military in a decade. 

It's time for Congress to get back to work on behalf of the American people.",2020-02-05 21:56:47
I know Mitt well and have great respect for him. He has been a leader in the Republican party for decades and has accomplished many great things. But he was wrong to vote to convict the President.,2020-02-05 20:47:59
#SOTU2020 https://t.co/csJ26m5kad,2020-02-05 04:14:21
America is thriving. We have so much to be thankful for. https://t.co/grBn8xLacz,2020-02-05 03:29:24
"So much energy here tonight because President @realDonaldTrump has it right. 

✔️Strongest economy in 50 years ✔️School choice
✔️Lower price of prescription drugs ✔️Protect our borders
✔️Destroy ISIS
✔️Keep America strong!

#SOTU2020 https://t.co/uLZvwIfDRO",2020-02-05 03:22:15
