tweet,dates
"I echo @AjitPaiFCC and the @FCC in calling on broadband providers to step up and ensure Americans don't lose their #broadband connectivity as our communities turn to teleworking, remote learning and telehealth during the #COVID19 outbreak. https://t.co/hWpEdGew35",2020-03-13 21:44:14
Thank you @realDonaldTrump for declaring the #coronavirus outbreak a national emergency. This is an unprecedented time for our country and for the state of #Ohio. Our response must continue to be swift and aggressive.,2020-03-13 20:04:47
"As the Buckeye State continues to respond to this unprecedented #CoronavirusPandemic, know that @OHdeptofhealth has a call center dedicated to answering your questions and providing accurate information on #COVIDー19 7 days a week, 9AM-8PM https://t.co/MNqvrUalNK",2020-03-13 15:06:14
"Due to #coronavirus concerns, @WhiteHouse and Capitol tours have been canceled through April 1st. My office is working to contact all constituents who had a tour before that date. If you have any questions about your tour, please reach out to my DC office at 202-225-5731.",2020-03-12 17:40:46
#BREAKING - @CDCgov just announced that it is providing #Ohio with $15.6 MILLION to support our state and local health depts/personnel on the frontlines of the Buckeye response to the #COVID19 outbreak. https://t.co/N7ofxE6MgR,2020-03-11 18:33:29
"This morning, I had the chance to address some serious issues w/ @SecBernhardt, including @Interior's Operation Lady Justice, a joint task force b/t @USIndianAffairs @HHSGov @TheJusticeDept to combat the epidemic of missing and murdered indigenous people. Watch his answer here ⬇ https://t.co/FJXcjgxx1v",2020-03-11 16:12:19
"Great article by @WEWS highlighting the impressive work of the Jefferson Police Dept this past wknd. Not only did officers bust six meth labs, they also found several signs of drug trafficking. Northeast #Ohio is safer today because of them. #BackTheBlue  https://t.co/ihgcaBhnC0",2020-03-10 14:20:30
"Today, @OHdeptofhealth confirmed 3 cases of #COVID2019 in Cuyahoga Co. I applaud @GovMikeDeWine for declaring a state of emergency in #Ohio to help our public health officials. I assure you that the federal govt is working closely w state/local partners to respond to this virus.",2020-03-09 22:36:03
"Thank you to the @Mentor_Chamber for inviting me to speak with them at their first Coffee &amp; Conversation event of 2020. From career and technical education, to college loans to health updates on #COVID19, we had a very productive conversation. https://t.co/vNylPeEO5m",2020-03-09 16:05:15
"Thank you @GovMikeDeWine for signing this bill into law. Officer Mazany served the @MentorPolice for 14 yrs before he was killed in the line of duty. While his life was tragically cut short, his legacy of bravery &amp; dedication to his community will live on forever. #BackTheBlue https://t.co/rfR2J6evr6",2020-03-06 14:35:44
Great to hear from @EPAAWheeler this morning on @realDonaldTrump’s FY2021 budget request and how @EPA will continue to work with Congress to protect the #GreatLakes https://t.co/UMGcxsTZXu,2020-03-04 17:32:14
Great meeting this afternoon with @AIPAC. I always look forward to speaking with all of the young constituents who travel from #NortheastOhio to discuss the needs of our Jewish communities back home in #OH14. https://t.co/nPIJDLGaY6,2020-03-03 20:23:00
"A nice reminder that a simple act of kindness, like fixing a fallen flag, can go a long way. God bless 🇺🇸 https://t.co/HlynbHUhZ6",2020-03-03 15:06:54
"Creating accurate #broadband maps is one of the first steps we need to take to expand broadband access in #Ohio, especially in our rural communities. https://t.co/gSUk0EBaYh",2020-03-02 18:09:46
"#ICYMI: the #GreatLakes made @TravelLeisure’s top 50 best places to #travel this year! 🌊

As someone who was born and raised on the shores of #LakeErie, I know the Great Lakes are a national treasure and am proud to see them recognized as must-visit vacation destination. https://t.co/vULzYUWYWV",2020-03-02 15:05:46
"OH-IO! Happy birthday to the Buckeye State. On this day in 1803, Ohio became our nation's 17th state. https://t.co/FwK1fzKjHT",2020-03-01 16:19:18
"As a cosponsor of @RepJimmyPanetta’s bill to help provide legal services to homeless #veterans &amp; veterans at risk of homelessness, I’m proud to say it passed the House unanimously this week.

Helping those who have so selflessly served our nation is the ultimate bipartisan cause. https://t.co/yizpXtDg94",2020-02-28 19:00:03
"With nearly 3,000 coronavirus deaths worldwide, combatting this epidemic must be a priority for everyone. I applaud @GovMikeDeWine @OHdeptofhealth for implementing proactive, effective steps to prevent an outbreak in the Buckeye State. 
https://t.co/p1e8l4Hv12",2020-02-28 16:30:25
"In between a @HouseAppropsGOP hearing w/ @forestservice Chief Vicki Christiansen and votes, I got to speak to a great group of students from @KentState’s Washington Program in National Issues. I know it won’t be long until some of them are working here in our nation’s capital! https://t.co/IDktfiNTT2",2020-02-27 20:22:25
