tweet,dates
"The @USWNT inspires young women and unites our country every time they take the field. Yet, they still fight for #EqualPay. We must all band together to demand no less than what they deserve – equal pay for equal work. https://t.co/KdBgiZyLx2",2020-02-12 23:35:49
"Today, I’m proud to take part in @EnergyCommerce’s first legislative hearing to protect abortion access in more than 20 years! We must #ActForWomen, pass #WHPA and ensure women’s access to abortion care. https://t.co/Bg8xkVm5FM",2020-02-12 18:30:22
The #TrumpBudget is filled with deep cuts to critical programs that will hurt American families. It is the latest example of this President’s empty promises. https://t.co/Uiruu3D4cJ,2020-02-10 23:00:08
"This week, the @USDOT approved the first ever exemption for an autonomous vehicle. Congrats to @nurobots for advancing the future of mobility. We are proud to have companies doing innovative work right here in Sacramento. https://t.co/eTloPRHvPL",2020-02-07 21:05:00
"Today, I’m proud to stand with Democrats fighting back against the Trump Administration’s Medicaid block grant scheme, which threatens to increase drug and health care costs for millions of Americans. #ProtectOurCare https://t.co/inqPPMfynd",2020-02-06 19:38:20
"The updated Travel Ban continues the policy of separating families. We can't let these discriminatory rules continue under the guise of safety. That is why I am a co-sponsor of the No Ban Act, which would rescind all versions of @POTUS’ hateful Muslim Ban. https://t.co/Pov7dOCPTL",2020-02-06 00:30:00
"No child in the world’s wealthiest nation should go to bed hungry or be without a safe, affordable place to call home. Yet, the President is gutting SNAP and dismantling fair housing. This is harming American families. We must fight to #ProtectKids.",2020-02-05 18:07:54
"On today's #SOTU I am wearing a climate pin to ensure that this critical issue receives the attention it warrants, regardless of whether @POTUS mentions the #climatecrisis tonight. We need bold action now to protect our planet for generations to come. https://t.co/XHMgSgjvQb",2020-02-04 23:15:00
"The #StateOfHealthCare is: Democrats fighting to finally lower prescription drug costs and expand care, while Pres. Trump and Republicans try to rip care away. #SOTU https://t.co/omRK9VZdzh",2020-02-04 22:00:00
I am proud that the House Democratic women will continue to work to strengthen the State of our Union by empowering women and fighting discrimination across our country. Today I am happy to be with one of Sacramento's strong woman leaders. #StateOfTheWoman,2020-02-04 21:45:00
"I am proud to welcome Dr. Donna Yee from Sacramento to join me at #SOTU &amp; shine a light on our fight to improve the #StateOfHealthCare. Dr. Yee has spent her career advocating for Sacramento’s seniors &amp; has a longtime track record of service, advocacy &amp; care within our community. https://t.co/hw7mKcsHW8",2020-02-04 21:16:33
"This National Gun Violence Survivors Week, we remember all of the American families &amp; communities that have suffered from the gun violence epidemic in this country. We need wholesale change to protect our families. We need to confront this crisis. #MomentsThatSurvive https://t.co/OVnjsathHf",2020-02-03 22:24:25
"Every American deserves to breathe clean air and live in a community with green space. Last week, I introduced the TREES Act which will work to empower communities to increase green space, reduce energy costs, and fight climate change. https://t.co/q1K8slSWTO",2020-01-31 21:14:07
"Capping funding for Medicaid is not flexibility – it’s taking away people’s coverage and access to care. The Trump Administration's new Medicaid plan is a targeted attack on the health care of millions of Americans, plain and simple. https://t.co/ZXfAmM1NM9",2020-01-30 19:44:03
Every 3 seconds a food allergy reaction sends someone to the ER. By passing the FASTER Act (H.R. 2117) we can help improve the safety and lives of 32 million Americans living with food allergies. https://t.co/gqZN0khgkf,2020-01-29 20:10:51
"Because of Trump’s #RemainInMexico, just .01% of asylum seekers are reaching safety. Before this dehumanizing process, 20% were granted asylum here in the US.
This policy is not normal – it is intentional cruelty and a systematic denial of human rights.
https://t.co/uo8rsojNf7",2020-01-29 19:19:20
"At today’s E&amp;C hearing, I spoke about how climate change is driving an increase in frequency &amp; intensity of wildfires – devastating the state of California in recent years. We must act &amp; explore thoughtful solutions to protect public safety &amp; air quality for all Americans. https://t.co/kwmiy3M10x",2020-01-28 20:51:17
"On #HolocaustRemembranceDay, #WeRemember the genocide of over six million Jews by the Nazi regime. We must never stop fighting against hate, bigotry &amp; other-ing in our society. Antisemitism, racism and all forms of prejudice must be defeated. #NeverAgain https://t.co/EpRzTuTJVX",2020-01-27 23:00:07
"The Sacramento region will be counted thanks to our amazing community leaders. This week, I heard all of the important work that is happening throughout our region. We are fighting misinformation, fear, and mistrust, but @Norcalcensus is leading the way. #2020Census https://t.co/w2L82Z2LN6",2020-01-24 21:50:33
"Three years ago today, the Trump administration reinstated the Global Gag Rule, forcing NGOs to choose between providing vital reproductive health services or accessing US assistance. https://t.co/tQUrrpHHrQ",2020-01-23 23:52:37
"On the 47th anniversary of Roe v. Wade, we must renew our commitment to protecting women’s reproductive rights. Now more than ever, these rights are under attack. I will stand shoulder to shoulder you in this fight – we can’t and won’t go back. #RoevWade https://t.co/Ep89bgnDGK",2020-01-23 00:50:00
"Today, we celebrated a milestone in our long battle to protect the Sacramento region from flood risk. The Folsom Dam Raise project will raise the height of the dam by an additional 3.5 feet and is another crucial step towards ensuring the safety of our future generations. https://t.co/4sKrST6GJy",2020-01-22 00:00:00
"Dr. Martin Luther King, Jr.'s work uplifted millions. He shared his vision for a country that valued all people, regardless of race, religion, age, or ability. He recognized that our country's diversity is a means to bring us together, not tear us apart. Happy birthday Dr. King! https://t.co/6RN1Jyk3vl",2020-01-20 19:58:29
"Today, I proudly voted to pass H.R. 535, the PFAS Action Now Act. This is a monumental step forward to protect the public from dangerous, health-harming PFAS chemicals found in our air and water. https://t.co/Aa82MLDCRb",2020-01-10 17:33:35
"Exciting news for Sacramento with the new @RideSacRT Route 142 bus service to the airport! Reliable, convenient, and affordable transportation to our airport is vital to drive growth and economic development throughout our region. https://t.co/r23uxjdnel",2020-01-06 20:14:00
"In David Stern, the city of Sacramento had an ally and friend. I commend all he did to grow the @NBA and help keep the @SacramentoKings here in our community. I am grateful for his leadership, and he will be truly missed. https://t.co/GyrTKSGCE0",2020-01-02 18:08:00
John Lewis is a tireless fighter for justice and equality. He always speaks truth to power and never backs down from a fight. I know this will be no different. We’re all wishing him a speedy recovery. https://t.co/zGjpqe8nTG,2019-12-30 20:00:58
Wishing everyone a #MerryChristmas! https://t.co/RnYEOm5vIz,2019-12-25 19:49:15
Happy Hanukkah! Wishing everyone who is celebrating eight days and nights of peace and joy. https://t.co/ezQWbSw2v6,2019-12-23 02:15:19
Please read my statement on why I voted in favor of articles of impeachment below. https://t.co/S3RQSKKBV3,2019-12-19 02:06:37
The facts are clear. Trump violated his oath by withholding taxpayer funds in exchange for dirt on a political rival. He continues to invite foreign powers to violate our sovereignty. These are impeachable acts and a clear danger to our nation. We must act to #DefendOurDemocracy. https://t.co/jR6WIJ4eAx,2019-12-18 22:12:20
"It’s not too late to get you and your family health coverage for the coming year. Plans may be cheaper than you think, and good news – the @CoveredCA deadline has been extended until December 20. So, don't delay! Click below to enroll now! 👇👇👇 https://t.co/lHFhEaq7RA",2019-12-17 17:37:08
"For nearly a decade, prices for brand name prescription drugs widely used by older adults increased faster than inflation. The soaring costs of prescription drugs are price gouging our seniors. The #LowerDrugCosts Act will stop unjustified price hikes. Let’s make this a reality! https://t.co/gO3aiQaFiP",2019-12-12 16:32:10
"Today, @HouseDemocrats are taking bold, transformative action to #LowerDrugCosts #ForThePeople. The Lower Drugs Costs Now Act leverages the power of the people to negotiate lower drug costs for Medicare recipients and offer those lower prices to families with private insurance. https://t.co/GcvGlqUFK9",2019-12-12 16:24:31
"Prescription drug companies are charging Americans prices that are three, four or even ten times higher than what they charge for the same drugs in other countries. This week, @HouseDemocratrs are acting #ForThePeople to #LowerDrugCosts. https://t.co/6Eput7FbBv",2019-12-11 17:06:12
Don't forget to compare @CoveredCA health insurance options for 2020 and make sure you have the best plan for you and your family. The deadline for January 1 coverage is fast approaching! https://t.co/qAbPvr1b33,2019-12-10 22:15:24
"•Without #NetNeutrality, your Internet Service Provider can 

🚫Block
🚫Throttle
🚫Charge Extra

for internet access. Our fight to #SaveTheNet isn’t over, and I’m proud to join @SenateDems in calling for a vote on the Senate Floor. https://t.co/8bwAEKXjvC",2019-12-10 16:35:00
Today we honored @SacFirePIO firefighter Tamara Thacher for her sacrifice and dedication to the people of Sacramento. Tamara and her family are in our hearts and prayers. #RememberingTami https://t.co/xZnnrO1FqH,2019-12-09 21:30:00
"The heroic legacy of the civil rights movement is under attack as states pass strict voter ID laws, gerrymander &amp; purge voter rolls. I’m proud to vote for #HR4, critical legislation that will help stop the most egregious voter suppression tactics. #RestoreTheVote https://t.co/QMtn5e5GKT",2019-12-06 18:00:55
"In CA, we know firsthand that wildfires are increasing in frequency and intensity. When disaster strikes, we all need wireless cell service. That's why I pressed the @FCC to advance a wireless resiliency plan that includes specific guidance for wildfires affecting Californians. https://t.co/o1o6IgHjoh",2019-12-05 18:42:46
"Sacramento has truly lost a remarkable woman with the passing of my dear friend Lina Fat. Lina was a master of building bridges within our community, and her restaurants and legacy represent exactly that convergence of culture, ideas, and people that make our region great.",2019-11-26 06:14:55
"On this International Day for the Elimination of Violence against Women, I am proud to join @JanSchakowsky, @HouseDemWomen, and over 100 colleagues in reintroducing the International Violence Against Women Act. It’s time to #EndViolence against women. #IVAWA #GenerationEquality https://t.co/V5VuousDGa",2019-11-25 19:09:06
"What a beautiful November Friday in Sacramento. While things in Washington can get hectic, there is nothing I love more than spending time experiencing everything our region has to offer. https://t.co/PFn8OCY6X2",2019-11-23 05:44:11
"It’s outrageous that today, 11 months and 20 days into the year, is the day Latinas’ average pay catches up to what white, non-Hispanic men made LAST YEAR. We need #EqualPayForEqualWork! #LatinaEqualPayDay https://t.co/QeoOXzxo7e",2019-11-20 19:07:00
"To me, equality means freedom from hate, violence, and bigotry. On Transgender Day of Remembrance, I’m thinking of all the transgender American lives we’ve lost –– together, let’s commit to loving our neighbors, regardless of their gender identity. Let’s be better. https://t.co/mAQUzFbLYD",2019-11-20 18:15:48
"What a week! I applaud @AjitPaiFCC for announcing a plan to make the 5.9GHz band available (on top of a public auction for the C-Band!). I have long called for action on the 5.9GHz and mid-band spectrums. Now, we are even closer to unleashing innovation and the #5G economy.",2019-11-20 17:41:18
"Insulin has been used to treat diabetes for nearly a century. Yet prices for this lifesaving medication continue to climb higher. First step to getting costs under control? Pass H.R. 3, the #LowerDrugCosts Now Act. #WorldDiabetesDay https://t.co/X7AdWot2kr",2019-11-14 19:10:00
"It's always great to see Sacramento faces in Washington! Yesterday, @AsmKevinMcCarty stopped by my office to discuss how we can work together to move our region forward. I look forward to our continued partnership! https://t.co/4obtDlMzXR",2019-11-14 15:44:57
"This morning, it was an honor to congratulate @SmithsonianSec Lonnie Bunch with @SpeakerPelosi on becoming the Institution's 14th Secretary. As a @Smithsonian Regent, I look forward to continue working with Sec. Bunch to connect all Americans to history, art, and science. https://t.co/LRM7sJgbFp",2019-11-13 16:53:20
"We need the ERA so that our nation can achieve its economic and social potential. We need the ERA so we can lead the world, not fall behind. That's why today @HouseJudiciary is marking up legislation to help ratify the ERA. We're one step closer to achieving equality for all! https://t.co/iL9GyRYsGJ",2019-11-13 15:19:00
"It was a pleasure to welcome @SpeakerPelosi to #Sac for a conversation with @JenSiebelNewsom celebrating the centennial of the 19th Amendment’s ratification in CA. It is inspiring to be around so many women who are standing up, speaking out, and being the change they want to see. https://t.co/4xDq3KwYHy",2019-11-13 00:30:00
"Today, the #SCOTUS brought forward Trump's unlawful case against #DACA recipients. We cannot let hate, xenophobia, and fear dictate how we treat human beings. Dreamers are vital parts of our communities, and I will stand shoulder to shoulder you in this fight. #HomeIsHere https://t.co/5aUmQR0O2T",2019-11-12 18:28:50
"I had a great meeting and tour with SMF Airport Director Cynthia Nichol. Moving people in and out of our region drives growth and economic development, and Cynthia is doing great work to build on SMF’s role in that process – helping to cement #Sac as a great American city. https://t.co/BoL8hxA8PS",2019-11-08 22:30:00
"Threats of a nationwide license to discriminate are becoming real. I want to live in a world where LGBTQ parents and youth can be proud of who they are, not ashamed. If you agree, join me: https://t.co/LBnGDbua8E
#EveryChildDeservesAFamily #NationalAdoptionMonth @family_equality",2019-11-07 16:46:00
"""We would like to get rid of it."" 

30 years ago, the Sacramento region sent a message: Let's get nuclear fuel out of our communities. Learn how I'm working to remove spent nuclear fuel from Rancho Seco and decommissioned plants across the country. 👇👇👇

https://t.co/QDkuy8hQz0",2019-11-06 17:02:00
Climate change is our planet's greatest threat. That's why Trump pulling out of the Paris Climate Agreement will be remembered as a failure of American leadership. This catastrophic decision will have consequences for our planet and generations to come. https://t.co/GCyYCPxjrf,2019-11-04 22:25:49
We are at an important milestone in this process and need your feedback!  I am excited for what is ahead of us. https://t.co/LfUIzBXiPg https://t.co/sPLpLFq5U3,2019-10-31 17:30:00
