tweet,dates
"Thanks to US special forces &amp; @realDonaldTrump, the world's most wanted terrorist &amp; leader of ISIS is dead. 

While @washingtonpost mourns the loss of an ""austere religious leader,"" the rest of the world celebrates the removal of this evil man from the earth. https://t.co/rodtx5Skmn",2019-10-28 16:41:07
"PG&amp;E is monitoring another potentially widespread severe wind event that may cause further planned power outages in Northern California beginning Tuesday, October 29.

#CA01 counties impacted: Butte, Glenn, Nevada, Placer, Plumas, Shasta, Sierra, &amp; Tehama. https://t.co/YvksBWZbJB",2019-10-28 13:54:23
The death of ISIS leader Abu Bakr al-Baghdadi is a great victory for the war on terror &amp; for freedom-loving people everywhere. I congratulate our military’s special operations forces &amp; @realDonaldTrump for executing this successful raid. (1/2),2019-10-27 15:54:44
"El Dorado County sheriff’s Deputy Brian Ishmael was tragically shot &amp; killed on Wednesday when 2 Mexican citizens opened fire at a marijuana grow in Somerset.

My prayers are with his family, his colleagues, &amp; his entire community. (1/3)
https://t.co/P2JQt6Szdi",2019-10-25 19:56:52
"National Prescription Drug #TakeBackDay is tomorrow, October 26th. If you have unused or expired prescription medications lying around in your medicine cabinet, find a collection site near you at https://t.co/OUYBAF6j07 &amp; help combat the #opioidcrisis in America. @DEAHQ https://t.co/yaJVr1el7c",2019-10-25 17:56:11
"Thank you @LindseyGrahamSC for introducing a Senate resolution to condemn my House Dem colleagues' handling of this impeachment process.

▪️The House must vote to initiate an inquiry
▪️There must be due process
▪️Republicans must have the same ability to participate FULLY https://t.co/mQIjuJ8M0y",2019-10-25 15:30:58
It’s very encouraging to see revenue produced from increased energy development is directly &amp; tangibly benefiting the areas that produce it. I thank @POTUS &amp; @SecBernhardt for implementing policies that support our communities &amp; build upon the foundation of America’s economy. https://t.co/IIpP4JbO3B,2019-10-24 21:21:05
"Democrats have been attempting to undermine @POTUS &amp; remove him from office since the day he was elected. These closed-door impeachment proceedings are no different.

When 75% of the House - &amp; by extension 75% of Americans - have no say in the matter, that's a major problem. https://t.co/P8dKewW42W",2019-10-24 20:53:03
"Democrats: Searching for any possible reason to impeach @realDonaldTrump &amp; undo the results of the 2016 election - &amp; doing so behind closed-doors.

@POTUS: Overseeing an economic BOOM for working Americans and rejuvenating the U.S. economy.

https://t.co/O14XtgT7SE",2019-10-24 20:05:57
"Some of my @HouseGOP colleagues &amp; I quietly &amp; orderly gained access to the #SCIF today. When we entered the room, @RepAdamSchiff immediately ended the hearing &amp; left the room, bringing the witness along with him.",2019-10-23 18:21:25
"Dems continue to deny Republican Members of Congress access to their closed-door proceedings in the basement of the U.S. Capitol.

Never before has an impeachment investigation been totally hidden from the American public.

It's wrong &amp; we'll continue fighting for transparency. https://t.co/XvySIYdnCL",2019-10-23 17:48:08
"For 2.5 years, Dems have tried to damage President @realDonaldTrump, &amp; it’s all behind closed-doors while the public is left in the dark.

I'm in the SCIF right now w/@HouseGOP while Adam Schiff hides with the witness. We demand transparency &amp; we're prepared to stay here all day.",2019-10-23 17:41:45
"Moments ago, I joined many of my @HouseGOP colleagues in demanding more transparency in Democrats’ secretive impeachment investigation.

Why are Adam Schiff &amp; Speaker Pelosi conducting this process behind closed doors? 

The American public deserves access. https://t.co/kf2hlA3iEN",2019-10-23 15:11:44
"Be advised: another planned power outage my affect customers in Butte, Nevada, Placer, Plumas, and Sierra counties. https://t.co/tx50UohFck",2019-10-23 13:28:44
"Democrats clearly haven't run a fair &amp; transparent impeachment process. I know it, my @HouseGOP colleagues know it, &amp;, most importantly, the American people know it.

@SteveScalise's rule change would allow all Members to participate in this #ParodyImpeachment. #StoptheSchiffShow https://t.co/FoSHVo3Imr",2019-10-22 22:10:34
Millions of Americans have been left behind by the #ACA. That's why I'm working with my colleagues in the @RepublicanStudy Committee to protect people with pre-existing conditions and empower patients to choose the healthcare option that best suits their family. https://t.co/0PsMfOLrvz,2019-10-22 21:09:45
"WATCH: Today, @TransportGOP held a hearing on federal recovery efforts from recent disasters. I asked @fema reps about long-term solutions &amp; improvements for temporary housing &amp; debris removal programs, especially in relation to the #CarrFire &amp; #CampFire.
https://t.co/K6z7JIipml",2019-10-22 20:17:02
"After being denied access to last week's closed-door &amp; secretive hearings, I sent letters to @RepAdamSchiff, @RepEliotEngel, &amp; @RepMaloney requesting access to all impeachment-related documents &amp; records from their respective committees.

The American people deserve transparency. https://t.co/Tu1Ab2p2dN",2019-10-22 18:05:15
Tune in soon to watch our hearing with @HouseAgGOP on conservation benefits of precision agriculture! https://t.co/jSOD13FVsi,2019-10-22 17:14:22
"Tonight, I joined @SteveScalise, @RepAndyBiggsAZ, &amp; @HouseGOP in voting to censure Rep. Adam Schiff. 

Of course, Democrats blocked the measure in the House. Chairman Schiff’s dishonesty &amp; lack of transparency with the American people will likely continue. https://t.co/vuGKEm2DLj",2019-10-21 23:31:09
"Discussing the impeachment of a sitting President is one of the most important &amp; impactful conversations we can have in this nation. It should be handled with care &amp; in a fair, open, &amp; transparent manner. Adam Schiff has failed on all accounts.",2019-10-21 22:35:33
"Chairman Schiff has been nothing but misleading &amp; dishonest from the start of this investigation, and he needs to be held accountable.

Tonight, I'll be joining 170+ of my @HouseGOP colleagues in condemning his actions &amp; calling for his censure in the House of Representatives. https://t.co/RwYaV6IUaL",2019-10-21 21:55:28
I applaud President @realDonaldTrump's nomination of current @EnergyDepSec Dan Brouillette to be the next Secretary of @ENERGY. Dan is someone who has sacrificed to serve his country in the @USArmy &amp; has been a leader in establishing America’s energy dominance while at DOE. https://t.co/eJmFBxjlyT,2019-10-21 21:28:09
#ICYMI: The unemployment rate in California reached a record-low last month at 4.0%. That's further evidence that the pro-growth policies of this Administration are having a positive impact on hard working Northern California families! https://t.co/sUaGYqCADg,2019-10-21 13:59:43
"Considering I was asked to leave a closed-door impeachment hearing earlier this week and prevented from viewing testimony transcripts, I'd say this is a needed rule change.

Thank you, @SteveScalise - the American people deserve transparency throughout this process. https://t.co/YOLrOxNhsm",2019-10-18 20:52:48
"What have we accomplished during the last year under Dem leadership?

❌Ratify the #USMCA
❌Pass bipartisan prescription drug pricing legislation
❌Reauthorize the Debbie Smith Act
❌Address the crisis at our southern border
❌Fix our outdated infrastructure
✅None of the above https://t.co/rXq0JjCOrD",2019-10-18 20:19:45
"Today, I attempted to attend Democrats’ closed-door impeachment hearing, but was promptly “asked” to leave. 

This is what a secretive, partisan, &amp; unfair process looks like. They’ve broken all precedent &amp; violated due process. 

The American people deserve transparency. https://t.co/v4aWJYLvrW",2019-10-17 15:57:19
"I, like many Americans, am deeply troubled by the lack of transparency in the Dems' impeachment process. Adam Schiff has repeatedly &amp; intentionally misled the American people.

I join @GOPLeader, @RepAndyBiggsAZ, &amp; many of my colleagues in calling for his censure in the House. https://t.co/hMjIPdtNG4",2019-10-16 17:26:56
"On the same day @SpeakerPelosi decided not to let the House vote on the impeachment inquiry, Dems literally attempted to silence @SteveScalise by cutting his mic on the House floor.

You just can't make this stuff up - Dems don't want Americans to have a voice in this process. https://t.co/XSGbtbMdjY",2019-10-16 15:50:19
"While @KingJames, @SteveKerr, &amp; seemingly the entire @NBA shamefully refuse to stand up to Chinese authoritarianism for fear of it affecting their future business investments, Congress is not sitting idly by. 

We voted last night to stand with the protestors in Hong Kong. https://t.co/M3mT6mPWzV",2019-10-16 14:51:21
"Median household income has risen by $5,003 in just 3 years under @realDonaldTrump's Admin - the highest ever.

For comparison, median income increased by $1,444 during the last 16 years.

There's no question pro-growth policies benefit working Americans.
https://t.co/AjAWUKqs11",2019-10-15 22:26:38
"Today marks 72 yrs since my friend, Brigadier General Chuck Yeager, became the 1st person to travel faster than the speed of sound. A resident of #CA01, Chuck left his imprint on history on October 14, 1947. Watch the moment that changed our world forever. https://t.co/Ea4JnG5zLv",2019-10-14 18:44:15
"Republicans in Congress have been urging Speaker Pelosi to let us vote to approve #USMCA for months. Now, the President of Mexico is joining the chorus of voices who know this agreement will benefit all 3 countries. 

Enough dragging our feet - it's time to ratify the #USMCAnow https://t.co/9scGy0XtxD",2019-10-11 16:28:20
"As of late Thursday night, PG&amp;E reports more than half of the customers impacted by the power shutoff have had their power restored. Roughly 312,000 customers remain without power. More information on the status of power restoration can be found below. https://t.co/CoxA4Vk7A9",2019-10-11 15:18:37
"As power outages continue across NorCal, improving weather conditions mean some areas might see restoration efforts begin by mid-day. See below for reliable real-time info on power restoration updates, the nearest community resource centers, &amp; more. https://t.co/X3KXvGfmv7",2019-10-10 17:41:53
"During the ongoing #PSPS, @PGE4Me has opened community resource centers to provide some services like restrooms, chargers, and bottled water. 

Find the closest center to you below. 

More info: https://t.co/ljY8KmgWyC https://t.co/0HhZgCu8A6",2019-10-09 22:04:34
"As thousands of NorCal residents are w/o power, it further highlights our need to properly manage our forests.

Recently, @forestservice moved forward w/implementation of a rule I authored to streamline the removal of dead/dying trees in danger of falling on power lines. https://t.co/5DoQfBf97h",2019-10-09 20:20:48
"NorCal may have fewer people than more densely-populated parts of the US, but a disproportionate amount of hwy fatalities occur along rural roads.

That's why @USDOT @SecElaineChao announced the ROUTES initiative to help address our infrastructure needs.

https://t.co/wnYghHKqXq",2019-10-09 19:05:57
