tweet,dates
"#VEDay75 serves as a reminder that no challenge to our freedom is stronger than the forces that defend it. To the Americans who served in our Armed Forces during World War II, we are forever grateful for your contribution to eliminating fascism and liberating Europe and the world https://t.co/1IG1HYcn1i",2020-05-08 20:24:21
"Wildfire season is approaching. With many of us working or sheltering at home, now is great time to use @CAL_FIRE’s resources and maintain your defensible space, keeping your home and property safe from wildfire. https://t.co/B0Q0CsduGt #WildfirePreparednessWeek https://t.co/YR9aUdR0FN",2020-05-05 18:30:43
"FEMA, HHS, and the private sector combined have delivered 

✅76.5 million N95 respirators 

✅107.2 million surgical masks

✅811.9 million gloves

✅Nearly 11,000 ventilators.

The numbers don’t lie. @POTUS is dedicated to providing supplies and stopping the spread of COVID-19.",2020-04-29 15:39:50
"The #PaycheckProtectionProgram is just one of the many ways small businesses can get help from the effects of #COVID19. This video from @GOPLeader helps breakdown what other programs are in place to get small businesses and employees back on their feet.
https://t.co/FvYGix7yHX",2020-04-27 17:54:38
"The #PaycheckProtectionProgram has officially resumed.

Visit your lender to submit a loan application so that funds can be disbursed as timely as possible. For more information, visit the SBA's website 🔽
https://t.co/HPM3PMau7s",2020-04-27 14:53:39
"As we face the #COVID19 pandemic, we are reminded of just how critical workers are to our supply chain infrastructure. Thank you #ToThoseWhoKeepUsMoving for all of your hard work during this unprecedented crisis. https://t.co/ODcZPUUVLK",2020-04-21 17:01:39
"The #WHO was dishonest about the coronavirus — echoing and praising the lies disseminating from China. 

@realDonaldTrump was right to hold #WHO accountable. The American taxpayers should not prop-up an organization that shows dangerous bias towards the Chinese government.",2020-04-15 15:16:26
"On this National Doctors Day, I want to thank not only doctors, but all health care workers who are serving on the frontlines during the #coronavirus pandemic. Your unwavering commitment to helping others is heroic. https://t.co/vTLQc0Zv3O",2020-03-30 15:47:47
"Several constituents have asked to see the full bill text of the #CARESAct. You can find that and info on all other bills introduced in the House or Senate at the link below.

https://t.co/Ldh4qPddWv",2020-03-28 14:56:52
"Elbow bumps are the new handshake. Good to see you this morning, Pastor Cummins! https://t.co/q6dpsZfYHh",2020-03-27 17:25:54
"Speaker Pelosi, Americans need solutions related to COVID-19, not 

❌A $15 minimum wage
❌ Same day voter registration
❌Corporate “diversity &amp; inclusion” budgets.

These unrelated, partisan demands are a waste of time while Americans suffer. They need help now.",2020-03-23 19:57:24
"Even at a time like this, scammers prey on people in need. If you or someone you know are receiving calls or solicitations, DO NOT RESPOND, especially with personal info.

Contact the @FTC to report it. 

https://t.co/iQezT6zEKO https://t.co/vcLbgGg0v1",2020-03-19 17:58:15
"Thanks, @SteveScalise, for the King Cake! 

Happy Mardi Gras to all those in #CA01 that may be celebrating today! https://t.co/Dwd8ZkcFp9",2020-02-25 17:27:00
"As a strong supporter of #2A, I’m a proud cosponsor the Lawful Interstate Transportation of Firearms Act, a new bill sponsored by @RepMoBrooks that expands protections for Americans traveling w/ firearms.",2020-02-21 16:57:45
"Protecting our water resources is good for our farmers, our families, and our food supply. California water is limited, and we shouldn’t waste it by dumping it into the ocean. 

Thank you @GOPLeader and @realDonaldTrump for bringing this issue to America’s attention. https://t.co/pvTmpLxuxk",2020-02-18 19:54:17
California has 9️⃣ days left to comply with the #WeldonAmendment and offer abortion free health insurance. It’s time to buck the status quo that takes human life for granted. I encourage Gov. Newsom to recognize the rights of #prolife Americans.,2020-02-14 17:01:12
"#NEPA &amp; #ESA are big government at its best.

Congress should be in the business of addressing inefficiency in government &amp; holding the bureaucracy more accountable. https://t.co/c30YY2OLZ5",2020-02-11 20:52:18
"After 4 months of political gamesmanship, the outcome is as we expected — @realDonaldTrump is #ACQUITTED!

Democrats must once-and-for-all face the music; the results of the 2016 election can't be changed. 

Now it's time to get back to work.",2020-02-05 21:54:06
".@realDonaldTrump: “The United States should be a sanctuary for law abiding citizens, not illegal aliens.” 

Thank you, Mr. President. Sanctuary cities violate our laws and have no place in our society. 🇺🇸",2020-02-05 03:06:54
America will never be a socialist country! #SOTU2020,2020-02-05 02:59:50
"Looking forward to #SOTU2020.

Here are my thoughts: https://t.co/vHj2DPnYoz",2020-02-05 01:19:58
"I recently introduced the Clearing Lines along Electrical At-Risk Zones (CLEAR Zones) Act for owners and operators of power lines to more easily clear trees or parts of trees near power lines that may ignite and cause fires.

Read my full statement here: https://t.co/EFevm60yrL https://t.co/BFQFSUzidN",2020-02-04 16:45:21
"Signed, sealed, delivered: The #USMCA is now law. This is a great deal for the American people and our economy.

While the Democrats focus on impeachment, @realDonaldTrump is working hard for us. https://t.co/hpfnjAAYUn",2020-01-29 17:09:29
"The #USMCA is a win for farmers, businesses, workers, and families. Thank you @realDonaldTrump for inviting me to the White House for the signing of this historic trade deal! #PromisesMadePromisesKept https://t.co/ODN5Zyzk2i",2020-01-29 16:02:09
Thank you @POTUS and @EPAAWheeler for rewriting #WOTUS. This is a common-sense change that gives landowners the flexibility to maintain their own land without overreaching federal input. https://t.co/xEvR0bt1M3,2020-01-23 21:15:49
"In the 47 years since #RoeVWade, more than 60 million unborn childrens’ lives have ended too soon.

I was honored to receive an A rating from @SBAList for my pro-life record. I will never stop fighting for unborn children to have the most basic human right – the right to live. https://t.co/WGGk42B2jK",2020-01-22 17:14:27
"Today, @RepJimmyPanetta and I introduced a resolution recognizing the 200 American firefighters in Australia fighting bushfires. Australia and the U.S. should continue to work together to prevent future wildfires in both of our homes.",2020-01-16 22:26:08
"What moves slower than a missile crawler transporter, a three-toed sloth, and a banana slug?

Speaker Pelosi during this #ShamImpeachment.

See my speech here: https://t.co/CjANcWseMN https://t.co/FVAmCOZVrr",2020-01-16 15:09:30
"It's been 28 days since Democrats jammed Articles of Impeachment through the House

Since then, @POTUS has:
✅Signed phase 1 of a trade deal with China
✅Killed an Iranian terrorist
✅Modernized NEPA

It's clear who is really working for Americans.",2020-01-15 18:07:23
"House Democrats just blocked @GOPLeader's resolution to stand behind Iranian protesters who are protesting a regime that chants 'Death to America.'

These people are fighting for freedom and risking their lives in the process. They need our support.",2020-01-14 21:14:00
"This resolution puts the Democrats' agenda ahead of U.S. national security by undermining @realDonaldTrump's  Article II powers. 

This is another example of the political games Democrats continue to play, &amp; that's why Americans will continue to trust Trump with our military.",2020-01-09 23:15:10
"We all have a lot to be thankful for in this country, and today is about recognizing how important it is not to take that for granted. From my family to yours, God bless you and Happy Thanksgiving! https://t.co/tIZh11Gosk",2019-11-28 16:00:01
"Remember: it took less than 20 minutes into the Trump Presidency for Dems to decide @realDonaldTrump should be impeached.

3 years later, they're still at it - &amp; their quest to remove @POTUS from office at any cost won't stop. https://t.co/Ay7CthL3ct",2019-11-25 16:23:36
"It sure seems @SpeakerPelosi's ""path to yes"" on the #USMCA has been a long and winding one.

Enough stalling - it's time to hold a vote on the House floor so that we can ratify the #USMCAnow https://t.co/CUoQ43755N",2019-11-22 19:44:55
"It appears the bipartisan #USMCA is the latest victim of @SpeakerPelosi &amp; @RepAdamSchiff's impeachment obsession.

Not much productivity left for Congress in 2019 - only more theatrics &amp; hysteria from Dems. It's a shame. We should pass the #USMCAnow.

https://t.co/xrIQ3l29gs",2019-11-21 21:09:01
The Farm Workforce Modernization Act is a great example of members of Congress from both parties coming together to produce a piece of legislation that is greatly needed. I look forward to voting for it on the House floor soon. #FutureFarmWorkforce https://t.co/K7GQTGAyCp,2019-11-21 14:45:41
I'm happy to report that the House passed the Shark Fin Sales Elimination Act tonight! This bill will end the barbaric shark fin trade in the United States and I was glad to support it. #FinBanNow https://t.co/rZzeu1mG7a,2019-11-20 23:07:54
"Today, my colleagues &amp; I were happy to join with the Senate in passing the Hong Kong Human Rights &amp; Democracy Act to show that the U.S. unequivocally stands with our friends in #HongKong &amp; will hold Beijing accountable.

Next stop---&gt;@POTUS's desk. https://t.co/g1gYHl5ftK",2019-11-20 22:29:27
"No quid pro quo. No ""bribery."" Nothing.

The reaction of @RepAdamSchiff in this clip says it all - Democrats' entire fabricated #impeachment narrative is collapsing all around them. https://t.co/kUjBV3mlaJ",2019-11-20 21:01:45
"While the House focuses its undivided attention on #impeachment, I spoke on the House floor to highlight 1 very important item Congress could be working on instead: the #USMCA. This bipartisan trade deal would boost America's economy &amp; create jobs, &amp; we should pass the #USMCAnow. https://t.co/7WudrKpMTC",2019-11-20 17:07:03
"While this CR avoids a govt shutdown for a few weeks, Dems have merely punted from Thanksgiving to Christmas. We need a long-term solution that provides our nation with stability, namely for our military &amp; border security, &amp; this measure falls well short.

https://t.co/FD55mIdnBu https://t.co/3DojCLvD4N",2019-11-19 21:03:14
"So, let me get this straight. Democrats did some focus testing and decided that ""bribery"" was a better buzzword than ""quid pro quo,"" regardless of whether or not it actually applies (it doesn't). Now they're sticking with it because it better fits their narrative?

Got it. https://t.co/tm58I0bV4k",2019-11-19 19:39:50
"Meanwhile, outside of the beltway &amp; away from the #impeachment hysteria, Americans can see that our economy is doing quite well! 

Last month, unemployment in California reached a record low for October! 

Americans are getting back to work. https://t.co/MnGPWyG71F",2019-11-19 17:33:28
"There is seemingly no end to the dishonesty &amp; misdirection from @RepAdamSchiff. 

He continues to intentionally mislead the American people &amp; has completely failed to conduct a fair &amp; open process. 

Welcome to the world of Schiff's #ParodyImpeachment of @realDonaldTrump https://t.co/wVPYEU23SY",2019-11-19 16:57:12
"Following this week, there are only 2 remaining weeks Congress is scheduled to be in session this year.

While @SpeakerPelosi &amp; @RepAdamSchiff focus on their #ImpeachmentScam, we're unable to get anything real accomplished, like the bipartisan #USMCA. Americans deserve better.",2019-11-19 15:40:47
"Quid pro quo, extortion, bribery...while Dems are busy focus testing which buzzword makes their false accusations sound the best, Americans can see right through this political smear campaign on @realDonaldTrump.

But Dems never let the facts get in the way of a good narrative. https://t.co/KoFhfU2xy4",2019-11-19 15:20:49
"As I've said many times before - this bogus #Impeachment scam is all about politics and nothing else.

Democrats can't change the results of the last election, but that won't stop them from attempting to rig the next one. https://t.co/Ne62a61eZd",2019-11-18 15:33:49
"The 1st public #impeachment hearings took over the cable airwaves this week, &amp; I spoke on the House floor to offer my thoughts on this whole process. Nothing has changed - this is an ugly, partisan witch hunt against @POTUS that is dividing our country &amp; holding up real progress. https://t.co/jVys3pz0pu",2019-11-15 18:50:23
Just passing this along for some of my Democrat colleagues that seem a bit confused: https://t.co/6zDQb3yMKv,2019-11-15 16:59:49
"Those were the days, indeed. 

""There are a number of events you are investigating, to which I cannot bring any firsthand knowledge"" - former Ambassador Yovanovitch

Yet another ""star"" witness that didn't actually witness anything at all. https://t.co/FPaZavA38I",2019-11-15 16:44:18
"Nearly 40% of the Dems who've been tasked with overseeing the impeachment investigation are already compromised.

They have such a strong vendetta against @POTUS that they voted to impeach @realDonaldTrump long before the call in question even took place.

It's a partisan sham. https://t.co/xMGi5or7MG",2019-11-15 15:02:09
"Yesterday on impeachment, @RepAOC: ""This is about preventing a potentially disastrous outcome from occurring next year.""

@RepAlGreen in May: ""I'm concerned if we don’t impeach this president, he will get re-elected.""

It's clear Dems' main focus/fear is @realDonaldTrump in 2020. https://t.co/VofMkTvESa",2019-11-14 17:38:20
"As if we couldn't figure it out for ourselves, Democrats are actually saying it out loud - the sole purpose of this entire impeachment charade is to prevent President @realDonaldTrump from being re-elected. 

This is an incredible and dangerous abuse of power. https://t.co/cNxHRuLUSp",2019-11-14 15:16:29
".@RepAdamSchiff &amp; House Dems finally allowed their weeks-long, closed-door impeachment proceedings to take place in the public eye. Nothing has changed – the cameras don’t suddenly legitimize this bogus process. We do not impeach @POTUS based on hearsay.
https://t.co/d2TohUDYR0 https://t.co/gloHzhR4uY",2019-11-13 22:51:14
"Thank you, @RepRatcliffe, for quickly unmasking these impeachment proceedings for what they are - political theatre.

Isn't this whole thing supposed to be about the President's alleged impeachable offenses? Yet neither of the star witnesses can point to anything as impeachable? https://t.co/IdLgTTl9Yp",2019-11-13 19:35:44
".@DevinNunes is right: Speaker Pelosi pledged not to move to impeach @realDonaldTrump w/o bipartisan support.

-ZERO Republicans supported impeachment resolution.
-2 Dems even opposed it.

@SpeakerPelosi received bipartisan OPPOSITION, but has moved forward anyways. Partisanship. https://t.co/BnNzQ1MBs4",2019-11-13 17:53:52
"Dems have brought their #impeachment charade out of the basement &amp; into the spotlight today, but it's still all smoke &amp; mirrors to distract Americans from the facts.

While Dems attempt to justify their vendetta against @realDonaldTrump, keep in mind these key facts: https://t.co/5w9ReaQL9W",2019-11-13 16:34:37
"Today, the national spotlight is on @RepAdamSchiff &amp; his sham #ImpeachmentHearings, but it should be on what we aren't doing, like passing #USMCANow.

It's a shame. Congress could be working on things that'd actually benefit our country &amp; create jobs, but simply chooses not to. https://t.co/ofnt92v3yt",2019-11-13 16:11:13
"The Ponderosa West Grass Valley Defense Zone project would help slow the spread of a dangerous wildfire threatening Grass Valley &amp; give firefighters time to act. This is a perfect example of the mitigation strategies we need to protect our communities.
https://t.co/NpQrPM5LZA",2019-11-12 20:44:32
"While Dems' partisan impeachment crusade goes public this week, nothing has changed: @HouseGOP are relying on facts. Dems are not.

They've been unable to present any actual evidence of an impeachable offense by @realDonaldTrump, &amp; you don't impeach the @POTUS based on hearsay.",2019-11-12 19:13:47
"America is, without question, the greatest nation in the world. This #VeteransDay, we honor those who have served their country in order to protect our way of life. Thank you to all of the veterans &amp; active duty service members in Northern California &amp; across the United States! https://t.co/bnWThocRp8",2019-11-11 17:01:00
"BREAKING: @USDA announced a $148,300 grant to the Town of Paradise to support the community’s recovery efforts from the #CampFire. This grant will help expedite the recovery process, &amp; I thank @usdaRD for their continued support of Northern California.
https://t.co/AyTH6s3acf",2019-11-08 20:41:26
"One year ago today, the landscape of Northern California changed dramatically. When the Camp Fire ignited on November 8, 2018, we had no way of knowing that Concow, Magalia, Yankee Hill, and of course Paradise, would never be the same again. (1/5)
https://t.co/NwX4jk8Jnc",2019-11-08 17:20:53
"In case you missed it, I joined @J_GallagherAD3, @CASenatorJim, &amp; San Diego Mayor @Kevin_Faulconer on Monday to discuss the impacts of homelessness in Northern California &amp; work together on solutions with local, state &amp; federal officials. https://t.co/PFSzGB0hu7",2019-11-07 22:00:25
"It turns out even the whistleblower's lawyer has acknowledged this coup against President @realDonaldTrump, even going as far as to say ""We will get rid of him.""

His open animosity against @POTUS reeks of partisanship &amp; a coordinated effort to impeach the President at all costs. https://t.co/0Xbd0bx1NM",2019-11-07 17:02:52
"Water supply reliability is a big challenge for many areas throughout the Western U.S. – especially in CA. I applaud the efforts by this Administration (@EPA &amp; @usbr) to streamline the federal processes for improving our nation’s water infrastructure.
https://t.co/I4lKrrmGkq",2019-11-06 21:51:40
"Over the weekend, I attended the 100th anniversary celebration for American Legion Frank Gallino Post 130 in Nevada County. It was a privilege to present congressional certificates to honor WWII veterans and thank them for their sacrifices for this country! https://t.co/arZe5aoXtc",2019-11-05 22:09:07
"I spoke on the House floor recently to honor the life of one of my constituents &amp; friends, John McArthur.

They don't make em' like John anymore - let's hope his legacy helps to inspire the next generation.

https://t.co/isqjdYCk7h",2019-11-05 20:26:00
"Thanks to @J_GallagherAD3, @CASenatorJim, &amp; @Kevin_Faulconer for putting on a great forum to discuss how we can solve homelessness issues in Northern California! I was glad to participate. https://t.co/AffBwbGOMV",2019-11-05 17:14:34
My colleagues @JimPressOffice &amp; @RepSteveChabot hit the nail on the head. @RepAdamSchiff &amp; House Democrats are so determined to impeach President @realDonaldTrump that they are willing to throw precedent &amp; due process out the window. That is unfair to @POTUS &amp; unfair to America. https://t.co/L1aJgaHeMv,2019-11-04 21:01:35
"Must read: The Paradise High School Bobcats are in the midst of an inspiring undefeated season that continues to unite their community. Nearly a year after the #CampFire burned many of the players' homes to the ground, this team has given people hope. 

https://t.co/WFCW2CQ4JK…",2019-11-04 20:34:11
"Yesterday, #DomesticViolenceAwarenessMonth came to a close. I joined with many of my colleagues this week - Republican &amp; Democrat - in wearing purple ribbons to raise awareness for domestic violence &amp; to show our support to the victims whose lives have been impacted. https://t.co/ZxaIjZhEwZ",2019-11-01 20:47:35
"Jobs increased by 128,000 in October while unemployment held strong at a near 5-decade low.

While Dems continue their never-ending quest to undo the results of the 2016 election, our economy continues to hum under the pro-growth policies of President @realDonaldTrump. https://t.co/i76iAcgNU0",2019-11-01 17:36:03
"#ICYMI: Read my joint op-ed with @RepZoeLofgren, @RepNewhouse, @CongMikeSimpson, @RepJimmyPanetta, &amp; @MarioDB outlining the path forward for America's farms under our new bipartisan bill, the Farm Workforce Modernization Act.
https://t.co/IBF7RxjzRn",2019-11-01 16:46:30
"The US added 128,000 jobs in Oct - smashing expectations.

Don't forget - in 2016, CBO predicted an avg. of 25,000 new jobs per month. Under @POTUS, we've averaged 167,000!

President @realDonaldTrump's economic agenda continues to boost jobs &amp; paychecks.
https://t.co/7TOTe0LiwN",2019-11-01 16:32:53
"👻TRICK: In January, Dems promised to get things done for the American people w/their new majority, only to focus 110% of their energy on impeaching @realDonaldTrump.

🎃TREAT: Our economy is booming, people have more $$ in their pockets, &amp; the terrorist leader of ISIS is dead.",2019-10-31 19:45:25
"Looks like Speaker Pelosi &amp; House Dems got a bipartisan impeachment vote - just not the one they wanted. 

It seems even some members of the Democratic caucus recognize this scheme to impeach President @realDonaldTrump for what it is - a sham. https://t.co/7yfDMVsRfP",2019-10-31 16:53:51
"Today, Dems passed a resolution to continue their sham impeachment inquiry into President @realDonaldTrump. It has been conducted in secrecy &amp; behind-closed-doors for five weeks – &amp; now they want us to legitimize it? I don’t think so.

My full statement: https://t.co/JEHX82opFJ https://t.co/nvBxNm2F9b",2019-10-31 16:14:22
"This is a #Halloween witch hunt against President @realDonaldTrump.

Despite Dems' closed-door theatrics, most people know these so-called ""impeachable offenses"" rattling around the basement of the Capitol are no more real than the goblins that will show up at their door tonight. https://t.co/cUqcSFwnTN",2019-10-31 14:57:28
"Isn't it ironic that Dems picked #Halloween to attempt to legitimize their spooky basement impeachment process on @realDonaldTrump?

Congress is not intended to be a house of horrors. Halloween or not, it's scary to everyday Americans the way Dems have abused this process.",2019-10-31 14:37:30
"Proud to introduce the Farm Workforce Modernization Act today w/a bipartisan group of my House colleagues. This is a common-sense compromise that is fair to farmers, farmworkers, &amp; US citizens who appreciate the rule of law. It will provide stability for our #FutureFarmWorkforce. https://t.co/onrxTg9m9K",2019-10-30 21:17:20
"Today, I introduced the bipartisan Farm Workforce Modernization Act, along with my colleagues @RepZoeLofgren, @RepNewhouse, @RepJimmyPanetta, @CongMikeSimpson, &amp; @MarioDB.

This bill will provide needed certainty for farmers &amp; farmworkers.

My statement---&gt;https://t.co/yMuymDZgeA https://t.co/zaEkfPj8gx",2019-10-30 20:27:50
"#ICYMI, Border patrol announced 74 miles of border wall completed, 159 miles under construction. Where the wall is complete, traffic has dropped.

""The proof is in the pudding, walls work.""
-Brandon Judd, President of the National Border Patrol Council
https://t.co/epHSNvH4gw",2019-10-30 15:00:02
Take a look - House Democrats' radical agenda and obsession with impeachment should scare Americans more than any #Halloween costume ever could. https://t.co/IAGdjdVy62,2019-10-29 21:14:10
"Years of ridiculous regulations from Sacramento have prevented even a hint of proper forest management.

President @realDonaldTrump had it right last summer: “There is no reason for these massive, deadly &amp; costly forest fires in CA except that forest management is so poor.” https://t.co/DA4n178243",2019-10-29 20:20:04
"1 in 8 women in the U.S. will develop breast cancer in her lifetime. As #BreastCancerAwarenessMonth comes to a close, I'm joining my colleagues from both sides of the aisle to raise awareness of the estimated 41,760 women that will die from breast cancer this year in the U.S. https://t.co/N51gYES8f2",2019-10-29 20:03:40
"Never during my time in elected office have I witnessed a scene quite like the darkened towns and neighborhoods I saw last weekend while driving through Northern California. I do not accept these frequent power outages as the new normal. (1/6)
https://t.co/4X0E6BKxum",2019-10-29 19:52:51
"Let me get this straight, after running a closed-door process for weeks &amp; selectively leaking info that fits their impeach-at-all-costs narrative, now Dems expect us to vote to legitimize their #ParodyImpeachment? Give me a break.

There's no salvaging this tainted process. https://t.co/R2OgKSZuod",2019-10-29 15:02:27
"While Dems focus all of their waking hours on impeaching President @realDonaldTrump, we could be passing the #USMCA to provide support for manufacturers &amp; small businesses across the country. 

Congress should drop the hyper-partisanship &amp; pass the #USMCANow https://t.co/80whoN6mVm",2019-10-28 20:57:13
"This American K-9 hero helped hunt down &amp; kill the most wanted terrorist in the world &amp; leader of ISIS, Abu Bakr al-Baghdadi.

The world is unquestionably a better place now that this evil man no longer inhabits it.

Thank you for your service! https://t.co/kFu8NSsldx",2019-10-28 20:32:44
