tweet,dates
.@CraigheadCoop Thank you all for getting out and getting power back to folks across Jonesboro. https://t.co/jnyjOs1tqi,2020-03-29 13:10:05
Couldn’t agree more. Many lives saved because of their diligence and attention to the developing situation. #JonesboroStrong https://t.co/x72jBnQIRi,2020-03-29 13:05:28
". @AsaHutchinson proclaimed today a day of prayer and I am not only praying for everyone involved in the #COVIDー19 response, but a prayer of thanksgiving that no lives were lost yesterday in the tornado. Also a prayer of thanks for all the first responders who rushed to help...",2020-03-29 12:18:09
".@ryanvaughan, @BryanAMcCormick, and your entire weather team saved a lot of lives tonight. We all are thankful for you keeping watch as this storm developed. #JonesboroStrong",2020-03-29 02:57:36
#JonesboroStrong https://t.co/DsGWRaR9IT,2020-03-29 02:19:47
