tweet,dates
"Proud of this stAte Redwolf NFL All-Pro Linebacker - and not just for his football. #ManOfGod 

https://t.co/IUK3AtYpgN",2020-05-09 14:07:49
".@MZHemingway outlines the days and players leading up to the inauguration of the President who were “successful” in launching the Russia Hoax. The coordination in the media with some of the (former) top brass at the FBI shows how deep it went. Sickening!
https://t.co/LQd8a29DFl",2020-05-09 12:13:44
"It’s #MilitarySpouseAppreciationDay. Here’s a pic of my favorite military spouse - my Mom. She kept the home fires burning throughout my Dad’s 24-year career through multiple overseas deployments and three kids. When he retired, SHE received a letter of commendation from the USAF https://t.co/8vuapc0nuB",2020-05-08 22:37:22
"This is welcome news for US farmers! However, we are not out of the woods and we should continue to ensure that China upholds their end of the trade deal. #Trade #China https://t.co/dZo5pHCg1w",2020-05-08 18:17:07
AG Barr is to be commended for his pursuit of impartiality and truth in all of the events that have engulfed our country over the last several years. Today’s decision regarding General Flynn should serve as an example that justice is for the innocent as much as it is the guilty.,2020-05-08 01:04:07
https://t.co/BLrQnJChuQ,2020-05-07 18:37:26
I hope you’ll take time today for the #NationalDayOfPrayer and ask for Gods protection on all of those fighting against #COVID19 here in AR and across the world. I hope you’ll also pray for our communities as we work to build our country back in the coming weeks.,2020-05-07 16:10:53
"Today, @AsaHutchinson announced a commitment by @CDCgov to provide 90k testing kits and swabs to further increase our awareness of #COVID19 and where it is in AR. America continues to scale up testing so we can fight this invisible enemy. Thank you to @VP and @realDonaldTrump!",2020-05-06 18:48:29
Those who are self-employed or independent contractors will be able to apply for Pandemic Unemployment Assistance starting tomorrow in Arkansas. Apply online every day 6am-6pm at https://t.co/FvSbzwvpQg or by phone at 1-844-908-2178 between 6am-4pm.,2020-05-04 23:21:39
". @phillyrich1 has put together a timeline of #COVIDー19 that everyone should take a look at. China was buying *so much* PPE, they actually had a trade deficit. For those who choose to run their propaganda about what has taken place, history is watching:

https://t.co/cophw5fdaX https://t.co/ghxqGu8zgz",2020-05-04 23:11:12
". @GOPLeader has put forward a workable, fully reasonable plan along with @RodneyDavis and @TomColeOK04 to open up the People’s House in order to function and work in this #COVIDー19 environment. 
https://t.co/1vvPxJN81E",2020-05-04 20:39:16
Thank you @USDA for not just helping feed Americans during these uncertain times but for assisting our nation’s farmers in their mission to get food on the tables of folks across the country. #InItTogether https://t.co/LCAmJetKao,2020-05-04 20:15:09
". @ArkansasDWS is testing the new unemployment application for self-employed and other 1099 workers waiting for Pandemic Unemployment Assistance, and they’ve opened up the application this weekend from 6am-6pm. Click here to apply: https://t.co/MhPHY4r0m1 #PUA",2020-05-01 20:45:29
"The @IRSnews team has updated their tool where you can track your economic impact payment and learn why you haven’t received it or what may be missing so you can get it. Learn more by going here:
https://t.co/BwplUjVpVp",2020-04-29 14:22:39
. @USDA and @SecretarySonny will ensure we have a secure food supply with this very important decision by the President. A nation who isn’t food secure is compromising their national security. We must always ensure we are food secure. #ag #nationalsecurity https://t.co/EL1yB1CxUU,2020-04-29 14:02:26
"Free speech was intended to prevent a government from being able to alter the marketplace of ideas in a free society. When an entity can put it’s finger on the scales of free speech, we must vigilantly defend that freedom. Here is one of those times:
https://t.co/rKzv7nj8Je",2020-04-29 12:52:54
"The Presidents actions to ensure our nations food supply is strong comes at an important time in our fight against #COVID19. By deploying these important resources, he is working to mitigate any further disruptions for producers and the American people. #agriculture",2020-04-28 21:43:48
". @ConawayTX11, @AustinScottGA08, @RodneyDavis, @RepTomEmmer, @GOPLeader, @SteveScalise, @RepLizCheney, and I sent a letter to the President requesting #COVID19 relief for Ag-producers to be adequate for the losses they will be facing. Read more here:
https://t.co/bXrA9ejF4y",2020-04-28 15:33:05
". @GOPLeader outlines what has become painfully clear over the last several weeks by Communist leaders in China. Their motives have been clear and so must our resolve be as equally determined. Our collective safety and national security depend on it!
https://t.co/1EEzNndzrf",2020-04-28 00:24:13
"We have 2 more Red, White, and Blood Drive events coming up. If you’re in Cherokee Village or Jonesboro. Please consider making an appointment at https://t.co/zsDbtqT2le! #GiveBlood https://t.co/edz0GdYx30",2020-04-27 21:56:29
"As Arkansas gets closer to phase one of reopening, I wanted to get out and see what is going on across the First District. We are pretty Ag heavy, so ride along with me and Will as we head south today in Arkansas. https://t.co/aUzPHV3v3T",2020-04-27 16:11:44
"For years, misguided people, groups, and even some nations, have actively advocated for and participated in the boycott, divest, and sanction - BDS - of Israel. Their motives are punitive and based largely on their own anti-semitism. China, on the other hand... (1/x)",2020-04-26 15:44:42
"It’s great to see my friend @RepTrentKelly launch @corps_farm in Mississippi! At a time where Ag-producers are beginning their crop year, this is another tool for them to weather the storm #Covid_19 has made. 
https://t.co/8yFgxaIOhK",2020-04-25 17:49:18
It’s great to see Alabama Farmers Federation working to find ways to support our producers and those who have been laid off. #FARMCorps  https://t.co/KrUAOLbTN6,2020-04-22 18:32:23
"Red, White, and Blood Drive is in Wynne tomorrow! If you’re in the area, please visit https://t.co/9eDItJz8xq to schedule an appointment. #GiveBlood https://t.co/fHKGgLCK6v",2020-04-22 17:42:28
The President and @stevenmnuchin1 are exactly right about asking for money back from big companies and entities like Harvard University who have significant means of funding that small businesses do not. Taking advantage of a program isn’t good form - leave it to the small ones.,2020-04-22 12:19:02
"Infrastructure workers help ensure our shelves are stocked, medical teams have supplies, and much more. We are incredibly grateful for their long hours and sacrifices during this difficult time filled with many new challenges. #ToThoseWhoKeepUsMoving https://t.co/LdAan604FA",2020-04-21 20:45:07
"I appreciate the President putting America’s workforce first at a time when unemployment is higher than ever. Due to the misleading actions by the Chinese government, we must realize this time calls for a different approach. Let’s help our fellow Americans get back to work! https://t.co/K3uLi0DB87",2020-04-21 02:46:59
One of my fellow House members shared this earlier today. What she doesn’t know is that AR1 has companies who make pipe and tubes for the oil and gas industry. What’s going on isn’t something thats cheered or loved. Maybe she realized how hurtful her “love” was. https://t.co/b5TqVuOaQw,2020-04-21 00:12:09
".@pmarca has an excellent essay about what we can start to think about and work towards as a country in a time of significant disruption. Building a “new” America can work for rural and urban populations. Let’s find ways to make it better than before!
https://t.co/KjOUs5lUZv",2020-04-19 16:57:55
". @SecretarySonny and the folks at @USDA are working to find ways to get the products of America’s ag-producers to our food banks and out to those in need. It’s a reminder that we produce the most abundant, nutritious, and safe food than anywhere...",2020-04-18 15:38:55
I am also glad to hear that they are going to quickly send out direct support for our farmers and ranchers. The challenges we have faced in this environment have reminded us it is critical we have the ability to feed ourselves. Food security is national security! #Agriculture,2020-04-17 22:33:11
The news that @SecretarySonny shared tonight with the President is both assuring for our ag-producers but also to the American people. National security means being able to feed and clothe ourselves. This will ensure we support our producers as well as our fellow Americans.,2020-04-17 22:31:29
".@RepFrenchHill is as good as it comes with respect to banking and financial institutions. He will be an asset for all of America, not just Arkansas as he ensures this program is implimented with integrity and accountability. https://t.co/Z3qh7o7qiE",2020-04-17 20:25:08
"As of yesterday, over 21,000 business owners were approved for over $2.7 billion dollars in the #PPPloans program in Arkansas. 

How many have there been today?  

Zero for zero dollars.",2020-04-17 19:36:04
"I have heard from one bank this morning that at the very least, forty business owners were not able to get #PPPloans to stay open and keep people employed. In rural Arkansas, that is a lot of payroll, a lot of economic impact. Hope the ice cream is tasting good, @SpeakerPelosi.",2020-04-17 14:48:44
"The President’s approach to reopening America is central to what our country is about - the ability for decisions to be made closer to the people and those impacted most. It’s important we all understand this invisible enemy remains, but we are stronger and will win in the end!",2020-04-16 23:20:04
"Just over six months ago, I gave an interview about China and challenges I brought up about the integrity of our supply chain. I also mentioned the challenges posed by Chinese nationals who had infiltrated higher learning institutions...",2020-04-16 22:53:13
"I guess the Speaker and Chuck Schumer will be okay with this and playing an active role in denying funds to business owners everywhere. And, for what? Political points they think they can score? Ruining someone’s livelihood must be “acceptable” to them. https://t.co/FfWZNuhrpQ",2020-04-16 21:37:45
"Tomorrow and Tuesday Red, White, and Blood Drive will be in Blytheville. If you’re in the area be sure to go to https://t.co/9eDItJz8xq to make an appointment. #GiveBlood https://t.co/cxnhj3mWHs",2020-04-16 20:46:02
"This week, the Economic Impact Payments provided by the CARES Act started arriving. While this is good news for many, I also understand there might be issues for some receiving the payment. If so, please contact our office at https://t.co/eBfL9RtAZy. We will be happy to asisst.",2020-04-16 15:53:50
"America, here is your split screen as we fight the affects of #Covid_19 with political elites who are happier with a freezer full of ice cream than they are with business owners staying afloat. https://t.co/Xv88v9PTrc",2020-04-16 15:30:26
"The Paycheck Protection Program is out of funds and Senate Dems, along with the Speaker, only want to enjoy their ice cream while businesses languish in uncertainty. If you haven’t been able to apply for one of the loans, we want to hear your story: https://t.co/TK4zlTsYXm",2020-04-16 15:19:14
".@RepJimBanks has introduced legislation to stop this from happening, but it likely will need action from the President to stop this from happening. It’s unconscionable we would be investing in Chinese companies with all we know. This must stop!
https://t.co/NXGj55L8kl",2020-04-16 14:46:34
"Chairman Xi is exacting his control over critical, life saving PPE supplies at a time when we need them most. The political class in Washington and other places must enact policies so these companies can bring production home to America. We cannot delay!
https://t.co/iHWj7hHl4A",2020-04-16 13:08:00
"Lies, deceit, coverups, and people dying inexplicably in what’s been one of the worst global pandemics in our history. Every part of our reliance on China must be rexamined and decoupled immediately.  Thank you, @SenTomCotton for sounding the alarm early.
https://t.co/Yssm8wenVQ",2020-04-16 01:10:53
"Over 14k loans totaling over $2billion dollars have been approved via the #PPPloan program in Arkansas. As many of our community banks are still trying to process applications, Schumer and company are holding things up, again. Obstruction is the name of the game, I guess.",2020-04-15 16:37:34
The President is making the right call to halt funding to @WHO in light of misleading information they pushed out and the enabling of the Chinese government they have done to cover up the origins and nature of the #COVID19 virus.,2020-04-14 22:23:48
"Under the CARES act, independent contractors, self-employed, ag workers, and more are eligible for unemployment assistance. While @ArkansasDWS is still creating the system in which they process claims, you can sign up for updates on their progress here: https://t.co/qDwxIK39M8",2020-04-14 19:44:47
"Tomorrow Red, White, and Blood Drive starts! If you’re near Walnut Ridge I encourage you to visit https://t.co/Tg3p3iiAyE to sign-up. @ArkRedCross #GiveBlood https://t.co/1bO7i6lLSn",2020-04-14 17:20:27
There is no known end date in this fight against COVID-19 and @RedCross needs the help of blood and platelet donors. I encourage folks to visit https://t.co/VPr6ZxpAjY to make an appointment. #GiveBlood https://t.co/BFNJROLa6T,2020-04-13 20:31:53
"“And he said to them, ""Do not be amazed; you are looking for Jesus the Nazarene, who has been crucified. He has risen; He is not here; behold, here is the place where they laid Him.” Happy #Easter! He is risen!",2020-04-12 11:22:11
"Part of the CARES Act was an Economic Impact Payment. Some don’t have to file tax returns and there’s been some confusion on how they would get it. Good news - @IRSnews has launched this site 👇🏼 where you can learn what to do so you can get the payment:
https://t.co/zAi4leXJad",2020-04-10 16:20:15
Great news and more great work coming out of the Natural State! #AmericansWorkingTogether https://t.co/ZLNGFUsDB2,2020-04-10 16:12:26
"On this #GoodFriday, our hearts and minds are heavy with what our friends, communities, and nation is dealing with on a daily basis during this pandemic. I am comforted by the words of Jesus Christ when he said, “I am with you always, even to the end of the age.” #EasterWeekend",2020-04-10 13:17:46
It’s way too easy to get caught in all the negative during this time. I encourage folks to visit the new site @HouseGOP launched which includes a map of positive stories around the nation of Americans stepping up to help. #AmericaWorksTogether https://t.co/0Nn347lpIw,2020-04-09 18:59:41
Thanks for the support! 🇺🇸 #AmericaWorksTogether https://t.co/moJUFApCmB,2020-04-09 16:40:09
"Yet again, Senate Democrats are holding up important funds for small business owners across America. I know that several hundred applications are trying to be filed in AR1 and yet they want to stall. Shameful and disgusting. Leave it for another day, @SenSchumer.",2020-04-09 15:41:32
Talking more @corps_farm at 8:35 am CT with 105.5 The Duck. Be sure to listen in! #FARMCorps,2020-04-09 13:27:13
Excited to be talking to @1049TheFox today about @corps_farm. Be sure to tune in at 8:15 am CT! #FARMCorps,2020-04-09 13:13:39
My prayers are with the families in Poinsett County who have experienced damage and disruption due to this evenings tornado. There are many in Craighead County and in NEA ready to help you.,2020-04-09 02:41:24
".@CBSNews let me tell you about an initiative we’re starting in Arkansas - learn more here:

https://t.co/xzyoBSvmmn https://t.co/QYWMdVtuhq",2020-04-09 01:08:14
https://t.co/Rpkizv1Ab2 https://t.co/QYWMdVtuhq,2020-04-09 01:06:03
"For small business owners, the PPP application is now on their website, should you need or someone you know needs this to apply for these funds:

https://t.co/lsh3UA0zoI",2020-04-08 14:21:41
#AmericaWorksTogether https://t.co/x2aQVa5n8N,2020-04-08 13:21:14
There is no better day for us all to thank and cheer for our healthcare professionals than #WorldHealthDay. It’s been such a challenge for them all as this pandemic spreads. I’m thankful for all our healthcare professionals today and every day! 👏🏼 👩🏻‍⚕️👨🏻‍⚕️,2020-04-08 01:28:14
".@ArFB, @ARDeptofAgricul, @AginArk, AR National Guard, and AR Dept of Veterans Services are all coming together to show how #AmericaWorksTogether when it matters most. It’s only the start of helping Ag-producers in Arkansas! https://t.co/jBogLHho77",2020-04-08 00:58:38
This is great news - they (WHO) have been duplicitous in #COVID19 being a global pandemic and economic calamity. https://t.co/sem6Q7HyFC,2020-04-07 23:40:01
".@SBAgov and @USTreasury have put out more information about the Paycheck Protection Program that you can find down below. I appreciate @stevenmnuchin1 seeking more funds so that more banks and business owners have the ability to participate!
https://t.co/aRlDqzJRgz",2020-04-07 21:53:44
Today I’m proud to announce my initiative to pair Arkansas Ag-producers and furloughed/unemployed Guard and Reservists - FARM Corps. The Farm And Ranch Mission Corps will serve as a way to bridge the labor gap that #COVID19 has created across the state (1/x),2020-04-07 15:18:30
"Today, many of us gathered at the @CityofJonesboro Regional airport to help clean up from the recent tornado. We kept our distance from one another as we cleaned up the remnants left by the storm. #InItTogether #JonesboroStrong https://t.co/CLbpWHZsqz",2020-04-05 20:19:04
Couldn’t agree more! It’s a critical time for our producers as we start another year. https://t.co/qZjmu7hzoS,2020-04-05 00:48:33
Here is some additional perspective about what Senator Cotton has said about this and how the media refused at every chance to ignore and discredit him. https://t.co/jEPg7MWtFK,2020-04-04 00:14:35
". @SenTomCotton was admonished and ridiculed for what has (sadly) come true with #Covid_19. I agreed with him that news coming out of China was suspect and should not be trusted, at all. Now, more evidence he wasn’t peddling “conspiracy theories”
https://t.co/NPHqmvuiil",2020-04-04 00:12:03
Today I heard from several community banks who had a hard time accessing the PPP program via @SBAgov and @USTreasury. We will be sure and get their info submitted so they can help those around AR-1. Community banks are the backbone of commerce - thank you for what you do!,2020-04-03 20:37:19
". @GOPLeader thoughtfully discuss COVID-19 oversight, I highly recommend you watching (1/5) : https://t.co/a7TDKPAwjZ",2020-04-03 19:24:25
"What does paid sick leave mean for you? @USDOL recently updated it’s FAQ page which answers this and many other questions folks might have. #COVIDー19 

https://t.co/0T65ctaMyE",2020-04-03 19:08:35
"If the Speaker cares one bit about our country and the raging #COVIDー19 pandemic, she will pause her so-called select commission on the President (political games/theater) and instead focus on the real threat to our country/world - the Chinese Government:
https://t.co/hNggddAk3r",2020-04-03 13:47:30
"In any next phase of relief or policies for America’s economy, we are going to have to find some ways to ensure our Ag-producers are supported in every way possible. I am working on Ag-labor issues currently with many stakeholders. Critical to our national security! https://t.co/Dq6gNAZv65",2020-04-03 13:12:11
Today marks the first day those who meet this criteria can apply for funds to help them keep going and stay in business. Head to https://t.co/sEMbc66HJB and apply 👇🏼👇🏼👇🏼 https://t.co/HEmCEOFrsg,2020-04-03 12:07:52
"Part of the CARES Act was relief payments to individuals and eligible children. As they begin to implement the bill, the @IRSnews has pushed out some information on this important program. Read more and let me know if you have any questions:

https://t.co/V39kXB0udw",2020-04-02 18:57:55
"In one word, the South. https://t.co/oVqN2ZOcAg",2020-04-02 17:23:32
"The Speaker is failing yet again at leading the People’s House at a time of crisis. Instead of a partisan commission to oversee the Exec Branch/Agencies (House Committees already do this function), she instead needs to focus solely on our main threat and that of the world...",2020-04-02 16:34:19
Jonesboro residents please look 👇🏼 https://t.co/Ex3rRYWJ2z,2020-04-02 15:59:09
"Today’s jobless claims reminds us that the veracity and economic lethality that #COVIDー19 has unleashed knows no boundaries or demographics it will not damage. We must all pull together in this fight so our communities, families, and friends have a better future.#InItTogether",2020-04-02 13:39:21
. @WHO you failed the entire world when you peddled these lies. You’ve continued to be a propaganda arm for China at a time when countless people are dying all over the world. Never again will your words matter for the safety and protection of mankind. https://t.co/fqJZrRnVJy,2020-04-02 11:53:21
Thank you to corporate entities like these who are stepping up in ways that are awesome and supportive at a time when there is uncertainty and fear. This is the America that is resilient and supportive! #InItTogether https://t.co/OQWtQNCMov,2020-04-01 17:01:46
"It’s time we fully investigate the extent by which China has lied, covered up, and allowed the spread of the #COVIDー19 virus to ravage the world.

I want to establish a Select Commission on China so we can fully expose the threat they pose to America and the world. https://t.co/pfOZgoliRh",2020-04-01 16:15:35
"What are your options if you’re laid off because of COVID-19?

Individuals can take up to 39 weeks of Unemployment Insurance, and the minimum weekly pay is increased to $600. This includes self-employed individuals, independent contractors (gig workers), and sole proprietors.",2020-04-01 14:06:05
We have thirty days ahead that we have to do all we can as individuals to slow the spread of #COVIDー19. We all need to consider this guidance and internalize it for the good of those around us. #InItTogether https://t.co/lkkhChULNH,2020-04-01 13:03:21
"Assistance for small businesses is available to folks all across the First District. There is a lot of information and my office is here to help. Call (870-203-0540) or text (870-292-6747) with any questions and we will try and help:

https://t.co/dgfMpuur9d",2020-04-01 12:32:37
"After the storm, there is always someone who may take advantage of you. With so many cars having been damaged, here is a resource in case you need some assistance:

https://t.co/nsDFrGFgQV",2020-03-31 23:42:48
Thanks @cvpayne for having me on your show to discuss how COVID-19 is affecting American agriculture. #COVIDー19 https://t.co/P8br00qeGL,2020-03-31 19:41:31
"The dependence we have on China and others for critical supplies - including labor for our Ag-producers - has to change. We must recognize that when we are over dependent, we will be over reliant in times of crisis, like now. Time for changes is now:
https://t.co/UYcV0b6P0l",2020-03-31 16:19:01
The news this afternoon of American companies rising to the call of important PPE shows how quickly the private sector can find ways to alter production to meet critical needs. We’re all working hard to beat this invisible virus and I’m thankful for their hard work! #InItTogether,2020-03-30 23:55:08
Our doctors are on the front lines everyday but currently they are leading the nation through a large pandemic. I’m grateful to have them serving our community especially during this difficult battle. I think the best way we can thank our doctors is to stay home. #DoctorsDay,2020-03-30 20:43:02
"Don’t forget hand sanitizer, too. Industrial ethyl alcohol (main ingredient) is mostly made from corn ethanol. Our corn producers are helping keep us all safe during this #Covid_19 pandemic. #ThankAFarmer https://t.co/NRJvBBufoO",2020-03-30 12:26:31
".@AsaHutchinson is doing a great job with two disasters on his hands, as are local and regional leaders in NE Arkansas. I encourage us all to look ahead and see the common goal of a total community and economic recovery from what has been thrown at us so far in 2020...",2020-03-30 00:35:02
"The community of Jonesboro and people all across the region are rising up at an incredibly hard time in our area and our country. The outpouring of help, money, and time shows us all how much we are #InItTogether today, tomorrow, and the long haul. #JonesboroStrong #Hope",2020-03-29 17:21:02
First District coming together in a time of need. Great to see! #JonesboroStrong https://t.co/ucDQbGaYOs,2020-03-29 16:04:55
Local authorities are highly discouraging onlooking. Please stay home for the importance of #Covid_19 and for those who are a part of the cleanup can do so safely and quickly. Monetary donations are best for @ArkRedCross and can be reached at 870-932-3212,2020-03-29 14:33:23
The number of those who want to help is overwhelming and authorities want to be sure you call ahead. Appropriate protective items are critical. We have to remember that we are still fighting #COVIDー19 and safety of everyone is paramount!,2020-03-29 14:28:00
"Sadly, there are already unscrupulous individuals who are trying to take advantage of those who have had damage to homes/structures. There is no such thing as “FEMA Approved” and anyone who contends this should be reported. (1/3)",2020-03-29 14:20:51
