tweet,dates
"Right out of Orwell’s 1984. Iran is spinning centrifuges again and stockpiling uranium. Silver lining: this tweet, as mendacious as it is, is going to make it harder for Mike to get back to trying to get us into a war with Iran. https://t.co/7Dgacs5drT",2020-05-09 20:55:48
"Steps away is the cemetery, and now monument, where Lincoln delivered his Gettysburg Address. Some believe he was inspired by Pericles’ Funeral Oration in which Pericles says, “ ""If we look to the laws, they afford equal justice to all” https://t.co/2yKOtiakmG",2020-05-09 15:47:34
"Driving back from DC last week I stopped at Gettysburg to breathe the air and find strength and direction.

The 14th Regiment of Connecticut volunteers helped repel Pickett’s charge here, and helped preserve our union.

22 of them are buried nearby, unnamed. https://t.co/zwXoDJZIsi",2020-05-09 15:41:23
"I love my country deeply. It’s why I do what I do.

But the DOJ just destroyed itself to exonerate a powerful white man who admitted his crimes.

But it takes two months to arrest the men who hunted and killed an innocent black man. On video.

We got work to do.
#AhmaudArbery",2020-05-09 15:07:43
"Self-employed individuals and gig workers can now apply for unemployment benefits in Connecticut by visiting https://t.co/M49YCzIpl0. Look for the red button, and be sure to enroll in direct deposit to receive your benefits sooner.",2020-05-07 22:52:28
"Want to hear from a Himes who has charisma, skills and facts for a change?!?!

Join me 4pm this afternoon for a Facebook Live chat with my sister, Dr. Katherine Himes, who will give us a look inside her hospital in Pittsburgh and drop some knowledge.

https://t.co/qT5HUOyxM3",2020-05-07 16:10:50
"Criminy. Read the room, man. https://t.co/U17wc4MTKH",2020-05-07 15:47:58
"Seventeen words that perfectly summarize a presidency:

 “‘Now, the one thing that the pandemic has taught us is that I was right,’ Trump said. @post #CV19",2020-05-05 12:42:05
https://t.co/6hQnPqGjl4 https://t.co/1OO2SHHGhF,2020-05-04 16:00:58
"Thank you @StamfordPolice @SFDPIO   @StamfordEMS for collecting food for the shut-in and the hungry! Thousands of pounds collected.

If you can contribute, come on down to @StamfordPolice HQ, 725 Bedford St. https://t.co/zwwfeUBsiq",2020-05-02 17:00:57
"We crossed the 2,000 #COVID19 fatalities mark in Connecticut today. It’s impossible to imagine the pain that has been visited on so many of our friends and neighbors.",2020-04-28 00:51:54
I’ll be answering your questions on Reddit today at 3pm. Check out https://t.co/gBmBCjZrgo to tune in or ask a question. https://t.co/HteKttyAnT,2020-04-27 18:17:06
Agrees??? Is there any dispute? https://t.co/fVQ4FWr8xC,2020-04-23 22:04:20
"Hand sanitizer, gloves, masks and voting cards outside the House Chamber as we prepare to pass the aid bill. https://t.co/V59eHcUKT6",2020-04-23 18:37:03
On the House Floor right now to support the expansion of PPP and $ for our hospitals/testing.  Very eerie. Everyone in masks. People spread 10 feet apart. https://t.co/DxJFB6FjDH,2020-04-23 18:33:14
"On the 50th anniversary of  #EarthDay, consider visiting one of Connecticut's State Parks. Safely!Here's a full list: https://t.co/x3gDxd4oko",2020-04-22 18:03:01
Questions about your economic impact payment? Join the IRS Commissioner tomorrow at 2 PM for a discussion. https://t.co/UJtD3wsuF6,2020-04-22 17:26:01
The girls have been cooped up by two days of cold weather. So Sunday is not a day of rest in the hives. https://t.co/vLJoE9ybzZ,2020-04-19 14:55:02
The Rolling Stones!!!,2020-04-19 00:58:26
How about we don’t take epidemiological advice from folks who don’t believe in climate change and evolution. https://t.co/h8sr5giqAA,2020-04-17 12:16:42
"Really feeling the loss of Jack Bryant. NAACP leader, Board of Ed member, calm and humble leader of great integrity. Defined servant leadership. And he was my friend.  https://t.co/DhNUfam5rl",2020-04-16 22:15:37
"Delivered food, coffee and deep gratitude (safely) to these firefighters in #Bridgeport and #Norwalk. Some people can’t work from home to keep you safe. @norwalkctfire @BridgeportFire 

Do the right thing so that they can stay safe and healthy. https://t.co/jRg4lmV39F",2020-04-15 13:56:11
Nothing says leadership like veiled threats against those who are actually performing well and abiding by our Constitution. https://t.co/CKohJP72pw,2020-04-14 16:22:40
"If President Obama had said this, Republicans would have lit themselves on fire on Pennsylvania Avenue. And rightly so. 

Now...crickets. https://t.co/eDIAnNMvSw",2020-04-14 00:12:07
"Michael Sandel: “Mobilizing to confront the pandemic and, eventually, to reconstruct the shattered economy, requires not only medical and economic expertise but moral and political renewal.” https://t.co/Hzxyni4LBQ",2020-04-13 21:29:47
"Truly amazing Easter. Joined a virtual Easter service at Faith Tabernacle Church in Stamford, then volunteered at the Bridgeport Islamic Community Center food pantry. They were giving out #Census2020 info with a week’s worth of food!

Happy Easter! https://t.co/qnESMWjxPJ",2020-04-13 01:48:13
Not numbers. Not statistics. People. Neighbors. Family. https://t.co/T4DiudAcIZ,2020-04-13 01:40:29
"At some point this weekend, the United States will become the country with the most #coronavirus deaths in the world.

Time to double down on keeping away from each other, washing our hands, and looking out for the vulnerable. #COVIDー19",2020-04-11 13:28:13
"This is true, but not quite how they mean it. 🤫😜 https://t.co/hoTdcam3hQ",2020-04-10 22:53:45
"Here it is folks! This is how you get your $1200 as fast as possible. 

If you haven’t filed a 2018 and/or 2019 tax return, you can convey the critical info to the Treasury here:

https://t.co/82egljG3ga",2020-04-10 18:47:23
Smart message. Smart model. https://t.co/li8AP4WeOQ,2020-04-10 18:20:16
"Ok. Apparently I just did my official Facebook Live on Coronavirus out of my personal Facebook page. Did not imagine I would spend Easter weekend being mercilessly attacked by my college roommates, but here we go....",2020-04-10 17:50:43
Maybe one or both of the two Corinthians could clue him in about this? https://t.co/qKG8AbDGXF,2020-04-10 17:24:12
I’m kind of shocked that #pleasemuteyourphones has yet to trend.,2020-04-10 17:20:34
"You can support @realDonaldTrump. Many do.

Or you can support the notion that we are a democratic republic with reasonable checks and balances.

But you can’t do both. https://t.co/KvHt4L5Khr",2020-04-08 01:00:06
"There are very few institutions I respect as much as the @USNavy 

The leadership I have witnessed aboard several ships has been incomparable. 

@SECNAV calling Captain Crozier “stupid” to the crew that loved him is the opposite of leadership. Appalling. https://t.co/BKyRhxX3kr",2020-04-06 22:49:07
https://t.co/o8LCQWpndF,2020-04-05 17:08:54
In politics this is known as not reading the room. https://t.co/6cBMP0okET,2020-04-04 22:53:14
"My little sis is a doc in Pittsburgh, tough as nails. She just reached out: “I have always handled crises in hospital, but this is hard.”

We don’t ask for help in the Himes family. I know, not recommending that.

Don’t close today w/out supporting a bunch of people. #COVID2019",2020-04-04 16:57:32
"For the rest of our lives, each of us will carry around the question: when my people were dying, did I do enough?

Be like Mario. 

#COVID19 #coronavirus  https://t.co/pp5YL8jK8y",2020-04-04 14:22:45
"Captain Crozier and Inspector General Atkinson. Decent patriotic men of service doing their jobs with honor. And of course @realDonaldTrump can’t abide that. 

Both fired in one week.

There is no bottom to this administration.",2020-04-04 02:52:17
"L’etat, c’est moi. https://t.co/t5IDQsUPsD",2020-04-03 17:18:22
"From the Staying Sane Behind Closed Doors File: made a lasagna for dinner last night. My first. 

Being a chef is not part of Plan B. https://t.co/Lbdzqbobes",2020-04-03 12:43:12
"Are there 8,500 Vermonters? https://t.co/e4dukkh6gl",2020-04-03 00:21:31
"There aren’t a lot of chuckles out there right now but the Cuomo on Cuomo show running on CNN is definitely one of them. Now they’re talking porgies and striped bass. 

@NYGovCuomo @ChrisCuomo",2020-04-02 16:06:32
Good advice on staying sane in self-isolation from people who would know about that.  https://t.co/bk7Pxn4fsV,2020-04-02 14:41:58
"Me trying to figure out Webex, zoom, google hangout, Facebook live, twitter live for #WFH 
#coronavirus #COVID19 https://t.co/DPnwhvwZpY",2020-04-02 14:23:48
Good morning. Be like Sandra. https://t.co/4DHkMaNhUS,2020-04-02 12:33:00
Decameron Series #2. Suggestions on how to stay sane behind closed doors. Lots of conference calls. Never ending conference calls. Why not multi-task? Split firewood while listening to conference calls. https://t.co/4imiu0SeHi,2020-04-02 02:03:51
Thank goodness. This was a terrible idea. https://t.co/WSFmDvkayT,2020-04-02 01:22:13
Ugh. Just came across this ⁦@BostonGlobe⁩ headline and photo. Don’t be like Himes. Seriously. https://t.co/8xVWvDJnUi,2020-04-02 01:14:10
"I’m embarrassed to admit it, ⁦@CoryBooker⁩, but my first time was in New Jersey. ⁦@jammallemy⁩ #vote #marchforourlives  https://t.co/oNvzTmCo8S",2020-04-01 23:57:29
https://t.co/uVJxW6VcEJ,2020-04-01 16:33:14
The President is nosing around for credit over the fact that we may not have 2.2 million dead Americans. It’s really not supposed to be this way.,2020-03-31 23:20:53
"So today we start the Decameron Series, occasional suggestions to keep sane behind closed doors when not working through SBA and IRS regs. Limited bourbon appearances.

Decameron #1: planted tomatoes, sunflowers, peppers, kale 2 weeks ago. Behold. https://t.co/TTR7LPphBj",2020-03-31 23:10:21
Sign me up. https://t.co/PrzEJEcKvc,2020-03-31 18:31:14
Home studio. The rickety nature of the apparatus is partly offset by the soothing vision of ⁦@LitchfieldDist⁩ bourbon acting as camera support. #COVID19 #coronavirus https://t.co/2siuhvvcT6,2020-03-31 16:45:40
Heroes. Help keep them safe. https://t.co/2SbOyjidVC,2020-03-30 20:34:54
"As this #COVID19 crisis intensifies in southwestern Connecticut, stories of heroism, kindness and creative connection are everywhere. Reply to this tweet with your story.",2020-03-30 18:17:12
"On @JohnLarsonCT teletown hall meeting just now, @GovNedLamont says that a thousand nurses have come out of retirement in CT to help with the #COVID19 crisis. Heroes all!",2020-03-29 19:29:44
"I’m not sure I agreed with Senator Tom Coburn on much of anything. But he was a good, principled, ethical man. I’m going to miss him. https://t.co/NMX2hnL0X0",2020-03-29 17:28:20
"This is important for CT and for Fairfield County, which is still wildly disproportionately hit with the #coronavirus https://t.co/B8kFCdQ1NH",2020-03-29 14:32:48
"As I said yesterday, we’re learning a lot about leadership in this pandemic. Today, @realDonaldTrump thinking out loud, scared thousands of my constituents for half a day. Surprise! It was a bad idea. Thanks for nothing, Mr. President. 
#coronovarius https://t.co/dL708yoNPC",2020-03-29 00:54:52
"Drove down to DC yesterday to be sure the economic rescue plan passed. Ordinarily I would I gnaw my own arm off before I drove out of DC on Friday rush hour. No traffic today.

So time for a rare junk food stop. https://t.co/a7XUqUamGP",2020-03-27 22:04:26
#Massie prowling behind Kevin Brady’s microphone as Kevin closes. About to get interesting.,2020-03-27 17:22:40
"This would be a good time for @realDonaldTrump to force production via the Defense Production Act.

Actually 3 weeks ago would be a good time to do it. https://t.co/Rfc13hvzEs",2020-03-27 17:14:48
"As debate ends, I count 80 members in the gallery and maybe 120 on Floor. Getting close to a quorum. And a little too close for comfort. #coronavirus 

This bill is getting done. Now on to making sure the $ gets out to the unemployed and the devastated.",2020-03-27 17:11:14
"Speaker Pelosi on the Floor for final speech. Urges members to the floor to stop any shenanigans and pass the economic rescue bill. “The sooner you come, the shorter my speech”. Some applause from @GOP side 😜",2020-03-27 17:03:36
"We’re learning a lot about leadership in the face of the #coronavirus crisis. This, for example, is the opposite of leadership. https://t.co/1DqM765BNM",2020-03-27 16:53:42
"Probably 80 members on the floor, another 20 in the gallery. I’m in gallery not cause I think it’s safer, but because I forgot my tie. I’m guessing they’ll forgive me being out of uniform.",2020-03-27 16:38:48
"I’m in House as debate winds down on our Economic Rescue Bill. Expecting shenanigans despite strong bipartisan support. I see about 100 members here, all with their 6 feet radiuses.
#CoronaLockdown",2020-03-27 16:35:02
The normally packed Longworth House Office building cafeteria. The eagle eyed will recognize ⁦@JoeNeguse⁩ @repcheri and ⁦@janschakowsky⁩ standing at a distance. #coronavirus https://t.co/0WNat4W5BK,2020-03-27 15:32:02
"And remember, the people who keep us safe don’t get to work from home. Police, fire, EMS and healthcare workers are heroes ordinarily. Today they are superheroes. Happy to join ⁦Mayor @HWRilling⁩ today to say thanks. At a safe distance. #coronavirus #Norwalk https://t.co/6jDD43U9HK",2020-03-25 21:02:11
"The folks at @SoNo1420 have converted their operation to making hand sanitizer. Get some in SoNo if you’re low. 

And their other products, used responsibly, will help ease this crisis. Cant lie, I did my part to support this small biz! 🥃 
#Norwalk #coronavirus https://t.co/Q1AcJZ36u6",2020-03-25 20:55:45
"There is meaningful relief for individuals, businesses and states and municipalities in the coronavirus bill we are finalizing. Join my teletown hall tomorrow for specifics on how it will help you and yours. #coronavirus https://t.co/NgqPy8rieR",2020-03-25 16:57:44
"There’s a lot in this rescue bill, and it ain’t done yet, but am very glad that independent contractors, the self-employed and gig workers will qualify for expanded unemployment insurance.

Recognition that we work differently than we did a generation ago. #coronavirus",2020-03-25 16:49:53
"Very pleased that we have reached agreement on a historically broad economic rescue package to combat the devastation of #coronavirus. Votes have to happen, so no counting 🐔. But I will be getting info out about the package in the coming hours and days.",2020-03-25 12:44:48
Saw a whole lot of my constituents this way today. Brave new world. https://t.co/SD5tI2kpH0,2020-03-25 01:24:59
"As we watch our @GOP friends get outraged over Pelosi’s people-centric counteroffer to McConnell’s $500 billion corporate slush fund, remember 10 years ago when Obama’s economic rescue plan ($787bn total) got ZERO @GOP votes in the House and almost ZERO @GOP votes in the Senate.",2020-03-24 13:31:20
"“If civilization is to survive, we must cultivate the science of human relationships - the ability of all peoples, of all kinds, to live together, in the same world at peace.”
—Franklin Delano Roosevelt",2020-03-24 12:33:54
"Drinking a glass of maple sap. Natural water with 2%ish maple sugar and lots of minerals and such. Got it from my own trees. You can too. Cheap and easy, and will keep the young ‘uns entertained for a while. See how:

https://t.co/wX0mK6YdsJ https://t.co/bPgieWx7zL",2020-03-24 01:13:10
"With these curves, it’s not clear to me why the President would raise expectations about a return to normal in “15 days”. I hope he’s right, but it’s a heck of a risk.

I’m guessing he misses touting “his” stock market. Which is now lower than the day he took office. https://t.co/QIgnwoJRsO",2020-03-23 23:37:37
"Si su empresa pequeña se ha visto afectada, estamos listos para ayudar. https://t.co/E0ew0ln91f",2020-03-23 21:31:21
"Actually, right now, we need N95 masks, visors, protective gowns, ventilators and probably more ICU capacity. Any chance you might help us with that? Even a little? https://t.co/3WY2fF5R1V",2020-03-23 18:32:14
The shortage of personal protective equipment in our health care facilities is a crisis. Want to help from closed (appropriately) doors? https://t.co/oisVRciBpB,2020-03-23 16:39:35
"Whatever you thought of @realDonaldTrump’s “tax reform” (I opposed it: regressive, SALT), it handed corporations HUGE amounts of $.  Which they largely used for repurchases and dividends not for investment. 

No way they get taxpayer $ that isn’t for workers and survival.",2020-03-23 15:37:36
"Glad to see the Fed take action this morning to help the economy. Time for Congress to step up with a bill that is PEOPLE, STATE and SMALL BUSINESS focused.

This bill CANNOT be the vehicle for either side to get its long-desired policies implemented. #COVID19",2020-03-23 13:36:13
