tweet,dates
"In the face of government abuse, political weaponization, &amp; obsessive opposition, @realDonaldTrump has kept every campaign promise &amp; our country is all the better for it.  

Listen: https://t.co/wOktP0p7sI",2020-05-10 15:44:01
"In celebration of #NursesWeek, it was my privilege to visit w/ Chief Nursing Officer Tammy Williams, &amp; her team, presenting them w/ a flag flown over the US Capitol in honor of the countless sacrifices they make for West Texans. 

A small way to say, ‘thank you’ for all they do. https://t.co/R5jfnFuss5",2020-05-08 20:35:37
"Essential workers are still at the Capitol, Members of Congress should be too - the American people deserve it.

I’m thankful for Kevin, who is responsible for my office’s mail, &amp; all of the Capitol staff who keep our chambers running safely &amp; smoothly. 

Let’s get back to work. https://t.co/7Pzsvrb10c",2020-05-08 14:22:18
"TUNE IN: This morning, at 8:05 CT, I’ll be joining the Wade Wilkes Show on @am580radio. Listen here - https://t.co/OuIh9YpeK7 https://t.co/6ll6CX3ruH",2020-05-08 12:26:23
"“If a sparrow cannot fall from the sky w/o God’s notice, it’s improbable an empire can rise w/o His aid.” -Ben Franklin

This #NationalDayOfPrayer I was honored to join @LubbockChamber in prayer via Zoom asking for God’s “aid” as we rise (&amp; recover) from the fallout of COVID19. https://t.co/Tf48VXWOZD",2020-05-07 23:52:28
"W/ school trips to DC canceled due to #COVID19, I wanted to give WTX students a virtual tour of our nation’s capital: https://t.co/HKB7u6aD5m

Educators shape our children’s lives everyday &amp; make it look easy! I hope my bloopers serve as a reminder that it’s harder than it looks! https://t.co/up8D846hHX",2020-05-06 20:45:28
"More residual stench coming from @Comey’s FBI. 

Being critical of @POTUS is one thing, but political weaponization of the FBI is the height of injustice, an affront to the agency, &amp; a threat to every citizen’s freedom. https://t.co/vvMNgqwVzS",2020-05-03 19:24:32
"Proud to have colleagues from across the country join @RepMikeJohnson &amp; I in urging @SBAgov to maintain the integrity of the Paycheck Protection Program by ensuring none of these taxpayer funds go to Planned Parenthood &amp; their affiliates.

Full letter: https://t.co/5s39UJ8jFZ https://t.co/48tG1N9Sjp",2020-05-01 21:52:32
"Texas @GovAbbott is doing the right thing, it's time to reopen for business. 

We will manage the risks, safely &amp; responsibly, and Texas will lead the way for our nation's recovery!

My full interview w/ @TeamCavuto: https://t.co/jDwFdJ9fLU https://t.co/ZO4928XtK9",2020-04-30 17:34:26
"I’m pleased @GovAbbott has begun reopening Texas. It’s time we responsibly get biz back online, ppl back to work, &amp; communities back to some semblance of normal.

W/ the Lone Star State’s resources, resolve &amp; risk-taking ethos, I fully expect TX to lead in the nation’s recovery. https://t.co/vijrykv3ZU",2020-04-27 20:23:40
"Given reports of the communist regime’s coverup &amp; mishandling of this virus, I’m proud to have signed this letter authored by @SenMcSallyAZ &amp; @RepMattGaetz to guarantee taxpayer money is not funding Chinese state-run labs. https://t.co/gkvMliLZeh",2020-04-27 19:01:52
"Military spouses sacrifice so much for our nation &amp; are now going beyond the call of duty to keep their communities safe. 

The Big Country is blessed to host the airmen at Dyess &amp; their equally courageous families! 

#InItTogether  https://t.co/sOWm7W75Jp",2020-04-26 22:19:06
"There is no telling the amount of human lives &amp; costs that would have been saved if not for #China &amp; the @WHO Director General working in coordination to cover this up.

Their lack of transparency has hurt the entire world.

My interview w/ @SteveScully: https://t.co/joDx6AA1Mg https://t.co/lcwQXtbnt8",2020-04-26 18:24:15
"Tina Siemens from Seminole, TX &amp; her friends have sewn almost 2,000 cotton masks for folks in the surrounding area including the Heart Hospital &amp; a few drive-thru screening centers in Lubbock. She sent my family some, too.  

Thank you, Tina!

Small towns, big hearts. Go WTX!! https://t.co/N68fkItYmk",2020-04-25 19:15:01
"Americans will manage risks &amp; reopen responsibly, and free enterprise will lead the way to recovery!

✅ Relieve families
✅ Recapitalize businesses
✅ Reopen the economy 

...and we will RESTORE America! 🇺🇸 https://t.co/PM5OqhHVhA",2020-04-24 20:36:29
"This is a huge win for rural America! 

I’m very pleased with today’s decision by the Trump Administration that not only protects our working families in rural America, but also our food and fuel supply for all Americans.

Thank you, @realDonaldTrump!

https://t.co/iFNXzmjD00",2020-04-24 19:31:41
"These folks are the heartbeat of America, they are the lifeblood of our economy and they – NOT the government – will lead one of the greatest American comebacks in our history.

Let's get America back to work.

My full speech here: https://t.co/2brCYDNFKT",2020-04-23 21:34:22
"Our small businesses are the lifeblood of West Texas and the heartbeat of America.

The #PaycheckProtectionProgram has helped these West Texans get back on their feet and keep their employees on the payroll &amp; off unemployment. https://t.co/xaKTOOX4Yk",2020-04-23 12:23:00
"Proud to introduce this bill w/ my colleagues, @RepAdrianSmith &amp; @RepTerriSewell.

Ensuring continuity of care across our prairies &amp; plains during these uncertain times will not only protect our working families in rural America, but also our food &amp; fuel supply for all Americans. https://t.co/iykl7EP6XH",2020-04-22 18:54:01
"I fully support President @realDonaldTrump’s decision to suspend immigration to the United States. 

Given the risks &amp; priorities associated with our relief &amp; recovery efforts, it’s a responsible, common sense approach to putting Americans’ safety &amp; success first. https://t.co/VqW8xLzgUJ",2020-04-22 15:54:55
"The Saudi’s production scheme is destroying American energy!  

Now they want to dump more on US market &amp; take what’s left of our storage capacity?!  

⁦@POTUS⁩, we need a big barrel of #AmericaFirst action! https://t.co/SEtRi69AXy",2020-04-22 15:06:56
"The #PaycheckProtectionProgram has been a lifeline to 1.6 mil small businesses, saving 30 mil jobs for working families in WTX &amp; beyond. That’s 30 mil less on unemployment!

Texas two-step to recovery: RECAPITALIZE PPP &amp; responsibly RETURN to work! https://t.co/rsPnXGwOp1",2020-04-21 20:29:57
"Though schools across TX-19 have closed, the Congressional Art Competition remains open for 8-12th graders to submit their work.

I encourage students to use this time at home to showcase their creativity &amp; artistic ability. The winner's piece will be hung in the U.S. Capitol! https://t.co/zQHypxen2m",2020-04-21 18:35:14
"I don’t “love to see” oil &amp; gas workers &amp; their rural communities suffering as a result of this devastating price collapse, @AOC. 

Places like West Texas &amp; hard-working men &amp; women in the oil patch power the bright lights of NYC... including the hospitals! https://t.co/ITEJ6RLk2s",2020-04-20 22:01:08
"‘These abandoned healthcare refuges only add to the many miles between life and death situations for the families who feed and fuel the rest of our country.’

Read more in my latest @dcexaminer op-ed: https://t.co/KbIfyW3Jm5",2020-04-17 13:10:47
"Join me in discussing the federal response to COVID-19, ongoing relief efforts, &amp; how we can strategically begin to reopen. https://t.co/2uYbdP7c3I",2020-04-16 18:41:11
"TODAY: join me on Facebook for a live Q&amp;A session to discuss the federal response to #COVID19, strategy for safely reopening our economy, &amp; any concerns you may have. https://t.co/c0wzuabCW6",2020-04-16 16:54:35
"Gov ⁦@GavinNewsom⁩’s plan to provide cash assistance to illegal immigrants is ill-advised &amp; irresponsible.  

There’s a difference between being compassionate &amp; careless with taxpayer money. https://t.co/hJTprKBnPf",2020-04-15 23:23:22
".@WHO... you’re fired!

The @UN must:
❌ Remove the Director-General 
🔎 Investigate full extent of failures 
💸 Make China pay restitution https://t.co/Cq3dg0J1Ga",2020-04-15 01:41:52
"Thankful for the Chapman family from Sweetwater. During these times of anxiety &amp; uncertainty, acts of compassion are needed more than ever. 

#InItTogether

 https://t.co/wAYFUkMNlX #FoxNews",2020-04-14 19:46:30
"I agree with my colleague in the Senate, @LindseyGrahamSC. 

China must be held accountable for the deaths &amp; infections caused by their systemic deception &amp; intentional disinformation campaign &amp; the WHO, being soft on China, exacerbated the problem.

Read: https://t.co/vyWl6TmdHG",2020-04-14 18:36:34
"Add the Russia-Saudi Arabia price war to a host of critical deals brokered by our Negotiator in Chief!  

On behalf of independent producers in West Texas, the largest energy basin in America - thank you, Mr. President! https://t.co/isnQD4odAa",2020-04-13 22:23:07
"From our family to yours - Happy Easter, West Texas!  

He is risen... He is good... and He is worthy to be praised.

Have a great day! #Easter2020 https://t.co/FNvKrokhlc",2020-04-12 18:27:18
"Thank you, Mr. President! 

America will recover... but we’ve got to eat in the meantime! https://t.co/jaqzA9JKSw",2020-04-10 01:17:04
"The heartbeat of our nation is rural America, &amp; the health care providers who service these communities are critical to protecting small town USA &amp; the #FoodFuelFiber they provide. 

Today, 85 members joined @RepAdrianSmith &amp; I in urging #PPP inclusion for rural hospitals.

READ: https://t.co/ON507JdzPR",2020-04-09 22:40:40
"Our number one priority is ensuring the public health &amp; safety of our nation. 

But, if we don’t engage economic viability in a thoughtful, strategic, &amp; responsible way, we could be faced with economic depression-type conditions. https://t.co/h1I6CwFDQ8",2020-04-09 19:29:35
"Right now, our focus has to be response &amp; relief, but as we recover, we must hold China &amp; the complicit @WHO accountable for their #COVIDCoverUp.

This is expected from the communist regime, but not organizations for which we fund &amp; carry the water.

More w/ @mattmartinradio: https://t.co/MPpASpaEsr",2020-04-09 16:36:07
"TUNE IN: at 9:35 CT I’m joining @KFYO &amp; @ChadHastyRadio to discuss #COVID19.

Listen here live: https://t.co/knQH7MQz1y https://t.co/2kTrTir2nA",2020-04-09 14:25:55
"1 yr ago, my son &amp; I were making a special memory w/@TexasTechMBB at the @NCAA championship.
 
While many have had #MarchSadness w/ fewer events bringing us together, I’m grateful for the sacrifices Americans are making to keep our most vulnerable safe &amp; help our country recover. https://t.co/pML89vnHZV",2020-04-09 01:29:35
"Today, I spoke with @VP &amp; @stevenmnuchin1 about the relief our rural healthcare providers desperately need.

Rural hospitals provide critical access to health care for many of our communities, as well as our ag &amp; energy producers. https://t.co/LXuzCVMUHS",2020-04-08 23:38:26
"Thank you to @GOPLeader &amp; @HouseGOP Chair @RepLizCheney &amp; others for joining my letter to @realDonaldTrump about steps to ensure the viability of one of our nation’s most critical industries.

America is safer &amp; stronger when we’re energy independent! https://t.co/n5A7cIv3cO https://t.co/CQpugi676C",2020-04-04 15:31:34
"For more information on how to #SlowTheSpread &amp; the latest updates on #COVID19, please visit the @WhiteHouse &amp; @CDCgov website: https://t.co/P9SZfRV34Y https://t.co/STvqkSsHKV",2020-04-03 14:04:53
"Proud to have @SteveScalise &amp; 41 of my colleagues join me in sharing our thoughts w/@realDonaldTrump about helping our energy industry through these trying times.

As we recover from #COVID19, we must prioritize American oil &amp; gas producers &amp; maintain our energy independence. https://t.co/lpmo3D9APR",2020-04-03 00:02:39
"Thank you, President Trump, for fighting for independent producers in the largest oil patch in the world - West Texas!!

Keep the pressure on the Saudis &amp; Putin! Energy security = national security! 

#GoWTX https://t.co/1G2xOpwYru",2020-04-02 16:31:41
Thanks to @RepJimBanks for his leadership - we must get to the bottom of this! https://t.co/u5FscMiS3E,2020-04-01 18:36:34
"Every year, my office works to resolve over 700 constituent casework requests for West Texans.  

McKenzie in my Lubbock office is a tireless advocate for TX-19 &amp; recently played a critical role in the safe return of 16 missionaries from Honduras.

Watch: https://t.co/jQWwViofYn https://t.co/8IfOZVlmor",2020-04-01 16:43:28
"Repping the @TexasTech Double T during my interview w/@BryanMuddKAMC tonight.

Like many Americans, “business casual” has taken on a whole new meaning in my office.

Stay healthy y’all! Go West Texas! https://t.co/p6lxnI0IfM",2020-03-31 23:18:07
"Stay home. Wash your hands. 

#KeepLubbockFlat https://t.co/WaCF6Bgk6i",2020-03-31 14:11:14
"On #NationalDoctorsDay I want to say thank you to the doctors who are selflessly fighting this virus &amp; all of our healthcare workers on the frontlines of the #COVID19 battle.
 
Words will never be able to express how grateful we are of the sacrifices you make &amp; lives you save. https://t.co/O1KLKAVS8f",2020-03-30 22:44:35
"COMING UP: I’ll be joining @KFYO at 7:30 CT to discuss the federal response to #COVID19 &amp; updated guidelines from the @WhiteHouse &amp; @CDCgov.

Listen live: https://t.co/knQH7MQz1y",2020-03-30 12:22:21
"Thanks for having me on, @seanspicer!

My full @newsmax interview here: https://t.co/o8Oir6s0m7 https://t.co/vNhVRyKrvb",2020-03-27 22:31:52
"Thank you to @realDonaldTrump, @GOPLeader, &amp; all my colleagues for working together to respond to this unprecedented crisis.
 
The #CARES Act provides temporary &amp; targeted disaster relief to our working families, small biz, &amp; frontline healthcare pros in their hour of need. https://t.co/4eBRUjvi6T",2020-03-27 20:30:04
"This is uncharted territory &amp; an unprecedented crisis – extraordinary circumstances call for extraordinary measures. 

We must move quickly to provide temporary relief for our working families, small businesses, &amp; frontline health care professionals. #COVID19 #Coronavirus

Watch: https://t.co/NQkzuAgW81",2020-03-27 14:48:37
"“While I have serious concerns about some provisions in the bill, as well as the overall price tag, I am more concerned about delaying support for millions of hurting Americans &amp; the prospect of an even costlier recession...” 

My statement on #CARES Act: https://t.co/mBGG2t1O20",2020-03-27 02:32:17
"Our energy producers are resilient, but market manipulation by Saudi Arabia &amp; Russia are devastating our oil &amp; gas industry &amp; jeopardizing our energy independence.  

We came to the SA’s defense against Iranian attacks &amp; this is how they pay us back?! We must put a stop to this! https://t.co/DS9LXodgH3",2020-03-27 00:32:22
"ICYMI: If you were unable to join last night's telephone town hall, you can listen to the entire discussion here. 

#COVID19 #coronavirus 

Link: https://t.co/8m6JgryR0F",2020-03-26 17:39:26
"Thank you to the constituents who called into our teletown hall to discuss the federal response to #COVID19.

I also want to thank the local &amp; state officials, healthcare workers, ag &amp; energy producers, small biz owners &amp; more who joined me on conference calls the past two weeks. https://t.co/HYz7yNf1Ov",2020-03-26 14:50:11
"COMING UP: Tune into the live stream of my Telephone Town Hall happening at 6:20 CT to hear my discussion with TX-19 constituents on the federal response to #COVID19.

LISTEN BELOW -
https://t.co/kioDfuB8Kc",2020-03-25 23:03:10
"A great story out of Tye, Texas showing how the American spirit of solidarity shines brightest in our darkest hours.

That’s West Texas &amp; the power of community! #InItTogether #ThinBlueLine 

Read: https://t.co/UEURzu9hcq",2020-03-25 17:43:15
"TONIGHT: I’ll be holding a telephone town hall to discuss the federal response to COVID-19 &amp; answer any questions TX-19 constituents may have. 

I encourage you to call in or follow along online by dialing (855)-962-1203 or streaming at https://t.co/gbzkdmyuoj tonight at 6:20 CT. https://t.co/JY8DfTxVy0",2020-03-25 16:34:41
"Farmers &amp; ranchers aren’t backing down. They are rising early, rolling up their sleeves, and providing our nation with the safest, most affordable food, fuel &amp; fiber supply in the world. 

God bless our men &amp; women in Ag. 

Happy #NationalAgDay! -JA https://t.co/cNuK46GwiW",2020-03-24 16:55:39
"Apparently, @SpeakerPelosi thinks it’s appropriate &amp; relevant to include this in a disaster relief package:

💸 Bailout of all USPS debt
💸 $15 minimum wage
💸 Greenhouse gas statistics for individual flights

I strongly disagree &amp; want to hear from you⬇️

https://t.co/PrcwOcB10f",2020-03-23 23:19:42
"We can’t afford to have this bogged down w/ non-germane policies, like union pension bailouts, that are irrelevant to disaster relief leg.

This move is irresponsible &amp; will prolong the process, hurting our nation’s families &amp; small businesses.

More w/@JohnFBachman on @newsmax: https://t.co/RFCFeBmoOp",2020-03-23 17:01:06
"This move by @realDonaldTrump lifts a burden off of families &amp; small businesses who may need more time to file their taxes.

I encourage all of my constituents who are expecting a refund to file at your earliest convenience &amp; get your hard-eared 💵💸💰 back. https://t.co/TLoTTaxEic",2020-03-20 17:10:49
"REMINDER: I will be hosting a Facebook Live Q&amp;A today at 1 pm CT to discuss the latest updates on COVID-19 &amp; it’s impact on our community. 

Hearing directly from constituents helps me best serve TX-19, I hope you can tune in! https://t.co/jKOmbGfqdm",2020-03-19 16:51:49
"If we practice the @CDCgov &amp; @WhiteHouse #SlowtheSpread guidelines for the next two weeks, we will get through this with our nation &amp; communities stronger than ever before.

My latest #CoronaVirusUpdate: https://t.co/mGPDO34vGH",2020-03-18 22:21:29
TOMORROW: I’ll be hosting a @Facebook Live Q&amp;A on confronting and controlling #Covid_19. https://t.co/qemvPWajQj,2020-03-18 19:59:48
"RIGHT NOW: I’m on @KFYO w/ @mattmartinradio to talk about #coronavirus in Lubbock &amp; what each of us can do to prevent, prepare, &amp; #SlowtheSpread. 

Listen live: https://t.co/Q2PaOWO3Pq",2020-03-18 12:09:20
"For prevention and preparation resources, as well as the most recent updates on #Covid_19, follow -

❗️@WhiteHouse 
❗️@CDCgov 
❗️@TexasHHSC 

My statement on Lubbock’s first confirmed #coronavirus cases: https://t.co/6Zj81rzkj5",2020-03-18 02:54:26
"‘The deferrals would occur on an interest-free and penalty-free basis, Mnuchin said.’

Thank you @stevenmnuchin1 &amp; @realDonaldTrump for doing the right thing to ease financial burdens on American families &amp; small business during these trying times.

Read: https://t.co/I9SCfyw4BS",2020-03-17 18:01:48
"Stay vigilant, but remain connected. Even within the walls of our own homes, modern technology allows us to connect with loved ones across the street or across the globe.

@WhiteHouse &amp; @CDCgov #StopTheSpread guidelines: https://t.co/eSjucyfGCk

My latest statement on #Covid_19: https://t.co/R5Ih9lbhAL",2020-03-17 01:10:20
"My latest update on #COVID19:

For information on prevention and preparedness, please visit the @CDCgov #Coronavirus resources website - https://t.co/PsJ1meEYoL https://t.co/wLR6XxlZz5",2020-03-13 22:28:29
"#COVID19 should be taken seriously, but we must keep things in perspective &amp; not panic or overreact. 

Prevention &amp; containment efforts must be aggressive; any economic assistance must be targeted &amp; temporary.

My interview w/ @newsmax: https://t.co/KHcpiAc8Oo",2020-03-12 18:58:33
"Today, I toured the @HHSGov #COVID2019 command center w/ @WaysandMeansGOP. 

While the current outbreak is something to take seriously, we shouldn’t panic. This admin, led by @POTUS, @VP &amp; top health officials, has a good, comprehensive plan to contain &amp; mitigate this threat. https://t.co/A6f8IZpTCp",2020-03-10 17:41:47
"Thank you to my team for their thoughtful surprise!  My mom made strawberry cake for me on my birthday every year &amp; my colleagues kept the tradition alive today.

It may not be mom or @ShopMarketSt, but @WholeFoods did a pretty good job.

Y’all are the best! https://t.co/6VmAN64FzN https://t.co/xF9askVC41",2020-03-09 21:50:51
"West Texas is home to food, fuel, fiber... &amp; freedom fighters.

Congratulations to the next @AF_Academy Cadet, Anthony Paone.

Watch Anthony's reaction to his @usairforce Academy appointment: https://t.co/g8UO8CB381",2020-03-09 18:59:20
"Under @realDonaldTrump’s leadership, our economy is booming:

⬆️ 273,000 jobs added in February 
⬇️ The unemployment rate fell to 3.5%, a 50 year low
⬆️ Wages rose 3% over the past 12 months

Read more: https://t.co/jrwbX4LwV1",2020-03-06 14:07:11
#BehindTheScenes: A ‘virtual tour’ of Washington for a TX-19 elementary school 📚✏️ https://t.co/jFQfHbWxPe,2020-03-04 18:04:18
"Washington politicians may be skewed, but here’s what the American people, the most important to @POTUS &amp; me, think:

✅ 63% approve of Trump's handling of economy
✅ 60% feel better off than a year ago
✅ 90% satisfied with economy

Thank you @stevenmnuchin1 for joining today. https://t.co/F3Q3PYZowl",2020-03-03 16:58:47
"My 5th great uncle fought in the siege of Béxar, my other uncle fought at San Jacinto. 

My 6th great grandfather gave supplies to Texian troops during the Revolution &amp; likely ancestor William Willis Arrington was one of the “Immortal 18” who fought at Gonzalez. 

#TexasForever https://t.co/KkssaThl7n",2020-03-03 03:25:35
"Maintaining the safety of Americans is the most important job of the federal govt &amp; I look forward to working w/ @POTUS &amp; @VP to quickly &amp; effectively contain &amp; mitigate this threat.

For updates on the #CoronaOutbreak, follow @CDCgov.

My full statement: https://t.co/LnsHnXaMje",2020-03-02 22:06:42
"Congratulations to @TexasTech alum General Charles Q. Brown, the next Chief of Staff for the @usairforce! If confirmed, he’ll be the first African American to ever serve in this capacity. 

Read: https://t.co/OnP64rmxDo",2020-03-02 19:42:52
"Frontier Texas in Abilene has the world’s largest copy of the Texas Declaration of Independence.  

Go by, sign it, &amp; feel the pride of our founding fathers who gave us a free, sovereign, &amp; independent Texas!  

The world has never been the same!

Happy #TexasIndependenceDay! https://t.co/6wS6OIROPG",2020-03-02 18:05:34
"Thank you to @SecAzar for coming to today’s @WaysandMeansGOP hearing on the proposed FY2021 budget.

We must put petty politics aside to ensure rural Americans have access to basic care. I look forward to working with my fellow Rural Healthcare Task Force Co-Chairs on this issue. https://t.co/o3j66GHuSl",2020-02-27 17:45:11
"This national #FFAWeek, I’m proud to highlight our office’s agriculture legislative assistant, Kaley. 

A former FFA officer &amp; Haskell native, Kaley’s knowledge of the industry, learned in part from @NationalFFA, &amp; passion for helping the producers of West Texas is invaluable. https://t.co/QoHXA4hEk3",2020-02-27 15:46:10
"A great discussion with the @TexasTech student government leaders who came by my office for @Big12Conference on the Hill day! 

#WreckEm https://t.co/bLxUbkqPua",2020-02-27 00:19:10
"China has been taking us for a ride for years, but thanks to the #PhaseOne China trade agreement, farmers in West Texas can finally see greener pastures ahead.

God bless @realDonaldTrump for having the political will to stand up to China &amp; ensure our farmers are treated fairly. https://t.co/hA0nzBUXuG",2020-02-26 19:35:50
"Thank you to my dear friend &amp; colleague @SteveScalise for the @Manny_Randazzo King Cake!

Wishing a Happy #MardiGras to the good people of West Texas &amp; Lousina’s first district. https://t.co/ihnXQkudX0",2020-02-25 16:34:21
"Democratic Socialist proposals will double down on big government polices we saw fail in the previous Administration.

The @HouseGOP &amp; @realDonaldTrump are restoring freedom from high regulations &amp; a burdensome tax code, letting people keep more of their hard-earned money. https://t.co/2KQJkwAklv",2020-02-25 15:53:41
"✅ Millions of jobs created

✅ Higher wages.

✅ Historically low unemployment.

More about the @realDonaldTrump economy &amp; border security on my @KFYO interview w/ @mattmartinradio &amp; Dave King: https://t.co/Rb0GOk44wX https://t.co/nk99rjQq2Q",2020-02-21 16:00:41
"I applaud @POTUS @realDonaldTrump for his steadfast support of life &amp; liberty.  

#TraditionalAmericanValues https://t.co/Mzh62AaGTm",2020-02-21 01:13:24
"I’m proud to have cosponsored @MarshaBlackburn’s House companion bill, led by my friend &amp; colleague, @RepKenBuck. 

The senselessness of sanctuary city policies encourages illegal immigration, undermines our sovereignty &amp; compromises public safety. https://t.co/Fb4O3U3Rzi",2020-02-20 15:38:27
"“... remember that the hollow promises of a $34 trillion government-run proposal would disproportionally affect the families who work every single day to feed and clothe you and your family.

#MedicareForAll would be mediocre-for-all... at best.”

More in my latest op-ed: https://t.co/q5njzI2FeV",2020-02-20 02:23:40
