tweet,dates
"Small businesses are the core of our nation’s economy. 

It was a privilege to visit James McCoy’s Drug Store in Abilene. Operating for 20+ years, Dr. McCoy personifies the values of hard work &amp; service to community that are fundamental to small businesses all across West Texas. https://t.co/m2S3M3WwFu",2020-02-19 18:56:40
"At last night’s Hargrove Insurance Customer Appreciate dinner, I enjoyed visiting with #TX19 constituents in the Big Country.

My favorite part was meeting a patriotic young man who I was honored to give a flag lapel pin. It’s important we teach &amp; cherish our future WTX leaders. https://t.co/ajEyGhxwQ9",2020-02-19 16:28:12
"Yesterday, I had the pleasure of speaking at the Rolling Plains Cotton Growers annual meeting in Abilene.

We discussed how the #USMCA &amp; #PhaseOne China deal are empowering the hardworking producers that, quite literally, put clothes on our back. https://t.co/iFZzj3THTU",2020-02-19 15:12:19
"It’s one thing to be out-of-touch when it comes to modern agriculture, but to demean farmers who provide our nation’s food security is inexcusable.

If politicians don’t have the “grey matter” to respect working people, they aren’t fit to lead. https://t.co/n9NYiKayYx",2020-02-17 20:48:05
"Anne &amp; Jane -

Republicans are red, Democrats are blue; there’s no one I admire more than you.

Unending love to both my sweets; like the steady stream of @realDonaldTrump’s tweets.

Nobody can measure, no money can buy; my heart for you like a West Texas sky.

-JA #ValentinesDay https://t.co/CnaW6xJ1Q6",2020-02-14 19:51:49
"Mandy is a dandy! 

She has been a trusted counsel to many lawmakers, including myself, who believe it is actually possible to balance science-based, environmental stewardship with economic growth &amp; opportunity.  

@realDonaldTrump &amp; the American people will be well served. https://t.co/R7GtVdGqsv",2020-02-14 18:22:57
"‘Mediocre-For-All: Rural Healthcare’s Road Trip to Ruin’

You don’t need to be a doctor to understand that Medicare-For-All would mean access to quality healthcare for none.

More in my latest op-ed: https://t.co/0JwY43tbut",2020-02-13 17:23:32
"Freedom &amp; boundless opportunity are the core of American ideals.

Socialism is a failed ideology that will rob our citizens of their freedom &amp; destroy our country.

We must condemn socialism in every form lest we consign the next generation of Americans as wards of the state. https://t.co/gyof11sORk",2020-02-12 13:10:47
