tweet,dates
"Encouraged that Bedford, Blair, Cambria, Fulton, Somerset, &amp; Westmoreland Counties will proceed to the yellow phase of re-opening on May 15. Each of us has made costly sacrifices to safeguard our community, and our hard work has paid off. https://t.co/2vWGtJAsKa",2020-05-08 22:16:30
"Today we mark the 75th anniversary of #VEDay75, the end of WWII in Europe. As we remember the many who were lost in this war, we also honor the men &amp; women who have served our nation. Our WWII veterans in PA &amp; across the U.S. are true national treasures. We are indebted to them. https://t.co/eWqc4DdbRl",2020-05-08 18:00:53
"As the only doctor serving on the China Task Force, I look forward to delving into opportunities to strengthen &amp; protect our supply chain for medicine and medical equipment, including PPE. Americans cannot be beholden to the Chinese Communist Party for our health care supplies. https://t.co/o8r8ktGppK",2020-05-07 20:32:04
"It's an honor to join the China Task Force as we seek to strengthen and protect our supply chain for medicine &amp; other health care equipment, and to hold the Chinese Communist Party accountable for its actions. I'm grateful to @GOPLeader McCarthy for the opportunity to serve.",2020-05-07 14:24:13
"As we kick off #NursesWeek, I am grateful for the tireless dedication of the nurses in Pennsylvania and across the country - not just during this coronavirus outbreak, but every day. Thank you for your hard work to serve American patients! https://t.co/EpadlGtUhS",2020-05-06 18:03:52
"This is important news for Pennsylvania's farms. Today @SBAgov announced that it is accepting new Economic Injury Disaster Loan (EIDL) and EIDL Advance applications on a limited basis only to provide relief to U.S. farms and agricultural businesses.

Farms should apply ASAP! https://t.co/Ee9dwgNyIk",2020-05-04 22:44:32
"After weeks of costly sacrifices to protect our neighbors, Pennsylvanians have done our part to stop the spread of #coronavirus and to save lives. It’s time for @GovernorTomWolf to let us get back to work. https://t.co/V7c6LpRVZv",2020-05-03 20:08:35
"As @GovernorTomWolf announces his plan to re-open PA, I urge him to be transparent about the metrics that each county must meet. Pennsylvanians have made costly sacrifices to protect our neighbors &amp; slow the spread. We must know the strategy behind the Wolf Admin's mandates.",2020-05-01 17:11:42
"Yesterday I participated in a productive discussion with @HHSGov Sec. Azar about health care access in rural communities. Alongside @POTUS @realDonaldTrump, I’m  working to ensure that rural Pennsylvanians can access quality &amp; affordable health care. https://t.co/DzWw7gBpSc",2020-04-30 20:28:08
Important info for small businesses in PA-13! Apply for the #PaycheckProtectionProgram ASAP. https://t.co/NiaX718GAe,2020-04-29 17:34:50
"The Small Business Administration will resume accepting applications for the #PaycheckProtectionProgram from approved lenders on behalf of any eligible borrower tomorrow at 10:30am. 

Small businesses &amp; farms wanting to participate should apply ASAP. More: https://t.co/6m4oTrs9Wf https://t.co/W5TcMVk0kV",2020-04-26 23:11:40
"During this unprecedented coronavirus crisis, @POTUS @realDonaldTrump is working tirelessly to protect Americans and get our economy back on the right track. 

Thank you for your leadership, Mr. President.",2020-04-24 14:45:43
"In Pennsylvania, our small businesses and farms are not only the backbone of our economy - they are the heart of our community. 

The additional #PaycheckProtectionProgram funding that the House passed today will help these hardworking Pennsylvanians weather this storm. https://t.co/79cqvQgqbW",2020-04-23 22:40:32
This is important information for Social Security recipients in PA-13. ⬇️ https://t.co/vh79i7ffxR,2020-04-21 22:03:23
"For weeks, the WHO allowed the Communist Party of China to lie to the world about #coronavirus. We must hold this organization accountable for its role in the coronavirus health and economic crisis. https://t.co/D0UEEkYlYS",2020-04-21 00:31:05
Looking for ways to give back to our community during the #coronavirus crisis? Yesterday I sent a note outlining opportunities for Pennsylvanians to help their neighbors. Read more: https://t.co/JzQmMCVMQ5 #InItTogether https://t.co/IwIsf27oNs,2020-04-18 20:42:05
"Nearly 70,000 small businesses in PA have been approved for #PaycheckProtectionProgram loans - keeping hardworking Americans paid, supporting PA families, &amp; protecting our small businesses.

Democrats must stop blocking PPP funding. Workers &amp; small businesses are counting on us. https://t.co/AAhkO2v7kc",2020-04-17 21:34:32
"The #PaycheckProtectionProgram already has helped 36,600+ of Pennsylvania’s small businesses - supporting hardworking families and safeguarding our economy. 

Democrats must stop playing games with Americans’ paychecks. https://t.co/HanGHLoYna",2020-04-16 15:11:20
"36,600+ small businesses in PA have been approved for forgivable #PaycheckProtectionProgram loans.

It's despicable that Dems are blocking additional PPP funding, and I urge Speaker Pelosi &amp; Leader Schumer to stop playing games with Americans’ paychecks. https://t.co/TIZBsAbsHx https://t.co/iZExDUU4mB",2020-04-15 21:30:36
".@POTUS @realDonaldTrump is 100% right to hold @WHO accountable for its gross mishandling of the #coronavirus outbreak. While the WHO propagated lies from the Chinese Communist Party, we lost valuable time &amp; opportunity to save lives. https://t.co/cdkysRPjnz",2020-04-14 22:57:40
It’s time for Congress to work together to deliver relief for American workers + small businesses. We simply can’t afford to waste time on Democrats’ political games. #InItTogether https://t.co/nXaX8fr2nM,2020-04-14 15:20:56
"Happy Easter! 

Even in the midst of the coronavirus crisis, #Easter reminds us that this is a season of hope. These are hard days, but we know there is a better path ahead. 

Today and every day, Alice and I pray that you find peace, rest, and hope.   

#HappyEaster #HeIsRisen https://t.co/gqX6TNtNze",2020-04-12 13:32:30
"On #GoodFriday, we remember Christ’s sinless life and His victory over death. Even in the darkness, there is hope. https://t.co/rrED5QCtFM",2020-04-10 17:02:08
"It’s despicable that Democrats blocked funding to expand the #PaycheckProtectionProgram &amp; help our small businesses get the help they need to pay hardworking Americans. 

This is not the time for politics - it's time for us to work together to help our nation weather this storm.",2020-04-09 20:16:49
"Just wrapped up a telephone town hall with a number of constituents about the coronavirus outbreak &amp; our nation’s response to this crisis. If we missed you this time, I hope to talk to you soon. As always, you can contact me at https://t.co/8p2ZbEdT7M or by calling my offices. https://t.co/o4jSPlWmy8",2020-04-09 16:25:06
"Unfortunately, bad actors are taking advantage of Americans during the coronavirus outbreak with scams related to economic injury payments, fake treatment/vaccine offers, and more. 

Discern fact from fiction &amp; keep your loved ones safe with these tips: https://t.co/oPDNL5PQul",2020-04-08 01:33:31
"All of us can do our part to slow the spread of coronavirus, protect our loved ones, and serve our neighbors. It's important for all of us to follow President Trump's Coronavirus Guidelines for the American People and to practice responsible social distancing. https://t.co/CQVf1djHd6",2020-04-06 20:17:29
We’re #InItTogether. https://t.co/IRyheTValL,2020-04-06 00:31:50
"This afternoon, I held a call with more than 250 constituents in the small business community to discuss the relief programs &amp; assistance available during this coronavirus outbreak, including the #PaycheckProtectionProgram. Find more info at https://t.co/h6mput8f10. https://t.co/cvt12F6Ia9",2020-04-03 23:34:54
"Starting tomorrow, the #PaycheckProtectionProgram will allow small businesses to apply for forgivable loans to cover payroll &amp; other key expenses so that they can keep their workers paid - protecting our workforce &amp; helping hardworking Americans. More: https://t.co/6m4oTrJKNN. https://t.co/bw9zix5eJ8",2020-04-02 22:26:52
"Thank you to the grocery store workers, truck drivers, farmers, USPS and delivery workers, teachers, firstresponders, bankers, sanitation workers, frontline health care teams, and the many others who are serving our PA-13 community during the #coronavirus outbreak. #InItTogether https://t.co/mZhUnvJbGo",2020-03-31 18:02:02
"As Americans combat #coronavirus, we are grateful to the doctors, nurses, and other health care workers on the frontlines of this fight. Thank you to all the health care heroes working tirelessly to care for patients in PA and beyond. #NationalDoctorsDay https://t.co/D16opLY1F8",2020-03-30 17:20:29
"Mr. President, we are proud that you are our @POTUS. 

Thank you, President @realDonaldTrump. https://t.co/CFgi8Mro3z",2020-03-29 23:33:50
"We cannot allow #coronavirus to shut down the American Dream. 

The CARES Act will deliver compassionate, targeted relief to those who need it most - families, workers, small businesses &amp; frontline health care workers - and safeguard our economy. https://t.co/OBuvVnqi6m",2020-03-27 19:45:46
The Chinese government must be held accountable for its role in the #coronavirus pandemic. Proud to join with @RepJimBanks and bipartisan Members of Congress to condemn China for its gross mishandling of this crisis. https://t.co/73FD1ATuzq,2020-03-26 19:12:26
"Unfortunately, bad actors are taking advantage of the #coronavirus outbreak and targeting Americans with scams online and over the phone. Get the latest tips from the @FTC to guard against these malicious scams. https://t.co/INniP6anXJ",2020-03-24 23:13:29
".@Sheetz, thank you for being vigilant and protecting our community. We're #InItTogether. https://t.co/1vr3fFqtsp",2020-03-24 01:31:25
The second failed vote in the Senate on a coronavirus relief package is more proof that Speaker Pelosi &amp; Senator Schumer put politics before the American people. This legislation is needed now to help millions of families &amp; small businesses impacted by the coronavirus outbreak.,2020-03-23 22:23:06
"It's unconscionable that Speaker Pelosi would play politics &amp; walk away from bipartisan talks with the Senate on coronavirus aid. Pennsylvanians need results to help families &amp; small businesses navigate this challenge.

Americans are counting on Congress to get this done.",2020-03-23 12:38:46
Grateful for the dedicated men and women of @USPS who are serving PA-13 during this challenging time. https://t.co/V21hO55f2g,2020-03-21 22:26:11
"During this public health crisis, we must combat misinformation. Follow @CDCgov for the latest coronavirus updates and guidance. #Covid_19 #InItTogether https://t.co/PBz0IeF676",2020-03-20 21:44:43
All of us can do our part to #SlowTheSpread. We’re #InItTogether. https://t.co/RfDWoctu34,2020-03-20 01:43:56
"Today I was saddened to learn that we have lost a fellow Pennsylvanian to coronavirus. This highly-contagious illness is continuing to spread, and it's up to all of us to do our part to protect our neighbors. https://t.co/v66WPm2I21",2020-03-18 23:07:19
"The American people are resilient. We’re in this together, and we’re going to get through this together. https://t.co/PiWdjRUHhR",2020-03-18 15:35:17
"There is no country more capable to manage a health crisis than the United States of America. 

We are going to defeat coronavirus together. https://t.co/KQphmppd9z",2020-03-18 11:59:18
All of us can do our part to #StopTheSpread of coronavirus and protect Americans in PA-13 and across the country. https://t.co/g8CuEaoOWM,2020-03-16 20:18:05
"On this #NationalDayOfPrayer, Alice and I ask you to join us in praying for PA &amp; our country as we combat coronavirus. As we ask God for guidance, we also pray for those who have been affected by this illness &amp; for those who are on the front lines of this fight. https://t.co/9MpuVfeO1E",2020-03-15 14:08:03
"Today, I updated the PA State Senators and PA State Representstives who serve the people of PA-13 on the U.S. response to coronavirus. It’s important that we work together to protect our constituents in southcentral PA. https://t.co/8av4zcJ9li",2020-03-13 19:35:42
"While you may have heard that the Capitol has been closed to visitors, I am here working for the people of PA-13. My offices in Washington and across the district are open, and my team and I are available to serve to you. https://t.co/Vey84Tqnsv",2020-03-13 18:29:17
"Earlier this week, I had a productive meeting with Joe Sheetz about protecting local businesses from potential cyber risks. It's a privilege to share a hometown with @sheetz! https://t.co/rHy87fUDoL",2020-03-12 22:56:04
"As @POTUS @realDonaldTrump said in his address to the nation this evening, smart action today will prevent the spread of coronavirus tomorrow. Each of us has a role to play in defeating this virus. 

All of us can take simple preventative measures to protect our community. https://t.co/uXqApwo3Rz",2020-03-12 01:45:05
"All of us can do our part to prevent the spread of coronavirus and protect our neighbors. Know the symptoms - fever, cough, and shortness of breath - and take commonsense measures to stay healthy. #COVID2019 https://t.co/uwivJPZT6G",2020-03-09 20:55:04
"Thanks to the leadership of @POTUS @realDonaldTrump, the U.S. economy is delivering results for hardworking American families. https://t.co/ncJp93mmHP",2020-03-06 16:18:12
"Great to join Franklin County Area Development Corporation for its annual State of the Economy breakfast in Chambersburg. During today's meeting, I provided a trade update on the USMCA and our ongoing negotiations with China - as well as the U.S. response to coronavirus. https://t.co/GVinh7HYUp",2020-03-05 22:40:15
"Every day, the brave men and women of @ICEgov, @CBP &amp; @USCIS go to work to defend the U.S. from dangerous threats - illicit drugs, human trafficking &amp; gang violence. As I discussed with Acting Sec. @DHS_Wolf, @DHSgov must have the resources needed to secure the southern border. https://t.co/ZbTzLQJsH5",2020-03-03 21:22:43
"It is critical for school administrators, law enforcement, and parents to be well-equipped to secure their K-12 schools. https://t.co/beCw0nfUdh is a great tool for PA-13 schools, law enforcement, and parents as we help students succeed. https://t.co/Jqau12lDyC",2020-03-03 18:35:08
"By working together and taking simple precautions, all of us can help to protect our community from COVID-19. https://t.co/4jXSY7kZLG",2020-03-02 22:55:46
Saddened to learn that a PA State Trooper was shot in the line of duty last night in Franklin Co. I am thankful that the officer is in stable condition. Our law enforcement officers are a critical part of our community &amp; I am grateful for their service. https://t.co/9lZQ6j6EzO,2020-02-29 16:29:44
"Disappointed that @HouseDemocrats once again blocked the #BornAlive Abortion Survivors Protection Act. Ending infanticide shouldn't be a political issue - it shouldn't even be a question. 

We won't stop fighting to protect the lives of children who are born alive. https://t.co/4L0I4ebv7Z",2020-02-28 18:50:23
Today I voted to condemn Sen. Bernie Sanders' disgraceful comments praising Fidel Castro and his communist regime in Cuba. Our nation is facing a stark choice between freedom and oppression. The American people should know where we stand  – with freedom or with Senator Sanders. https://t.co/kIdnacjnAg,2020-02-27 20:44:17
"A ""one-size-fits-all,"" government-run health care system would eliminate patients' choices and rob families of innovative cures. America simply can't afford House Democrats' radical, socialist agenda. https://t.co/rVCi5bKQXj",2020-02-26 17:39:37
"It is shameful that 41 Democratic Senators voted against this commonsense legislation to protect children who are #BornAlive - and the Speaker continues to shut down @HouseGOP requests for a vote in the House. 

All human life is worthy of dignity and our protection. https://t.co/JzryYdImNk",2020-02-26 15:51:38
"Our public health system exists to protect Americans from #COVIDー19 &amp; other threats. As we prepare for potential ramifications, make a plan for any disruptions that could occur. Thanks to those at @HHSGov, @PHEgov, @US_FDA, &amp; @NIH working to keep us safe. https://t.co/MEIYF82WL9",2020-02-25 22:47:04
Thank you to Whip @SteveScalise for sharing a delicious King Cake with us Pennsylvanians. Laissez les bons temps rouler! #MardiGras #FatTuesday https://t.co/0RS1YZT3WK,2020-02-25 22:03:06
"From the $93 trillion Green New Deal to ""one-size-fits-all"" Medicare-for-None, the Left is peddling a radical agenda that Pennsylvanians don't want and can't afford. 

This is just the beginning of their socialist agenda. https://t.co/ccc28Gnckc",2020-02-25 13:42:46
"Local libraries are an important part of our PA-13 community. Last week, it was a pleasure to visit the Everett Free Library and drop off books donated by the Library of Congress. Read more in the Bedford Gazette: https://t.co/Pwmew0dUFb https://t.co/qzK5sjouif",2020-02-24 19:32:23
"Seventy-five years ago, six Marines - including PA-13's own Sgt. Michael Strank - raised the American flag over Iwo Jima. Recently, I visited Sgt. Michael Strank Memorial Park in Franklin Borough to honor his legacy of service and sacrifice. https://t.co/b1Y1FJW3uO",2020-02-23 18:52:39
Thank you to the hardworking team at Augustine Die &amp; Mold in Somerset for a great tour. PA-13’s skilled workforce is an incredible asset for our community and has made our region a national leader in manufacturing. It’s my privilege to support this critical work. https://t.co/DDMwU4DjfB,2020-02-21 19:38:29
"It was my privilege to honor WWII veteran Richard Boyer for his service to our nation. Our veterans have made America strong, and we are indebted to them. https://t.co/Qw2MNTx5S8",2020-02-20 13:49:21
"Earlier today, I had a great visit to Small Tube Products (STP) in Duncansville. This PA-13 company is a metal tube mill that specializes in incredible product design and fabrication for a number of industries. https://t.co/JTmrOg21ZD",2020-02-20 01:11:29
"Today in Franklin County, it was my honor to present WWII veteran Richard Boyer with several medals that he earned during his service in the Navy. Thank you for your service to our nation and to our community, Mr. Boyer. https://t.co/UFfqOJEg9H",2020-02-19 01:11:22
Today we honor the leaders whose service has shaped America - from President George Washington to @POTUS @realDonaldTrump. https://t.co/o1XVfGhypj,2020-02-18 02:13:10
"This week, I had a great meeting with athletes and advocates from @SpecialOlympiPA. These young Pennsylvanians are incredible members of our community, and it’s a privilege to support their work in PA-13. https://t.co/vvhpUxymrt",2020-02-13 15:43:55
"Thank you to @POTUS and @ARCgov for investing in Somerset County. This grant will allow Twin Lakes Center to expand its capacity to care for those in recovery, and to continue offering hope and support to our community. https://t.co/dkfHzMNfLD",2020-02-13 01:55:28
"From higher wages to lower unemployment and more jobs, the economy is working for American families. Our pro-growth, pro-worker agenda is delivering results, and we need to keep moving in the right direction. https://t.co/4WydID5Vj8",2020-02-11 01:57:38
Grateful to hear from @FirstLadyND about her ongoing efforts to combat our nation's drug crisis. It's an honor to work with colleagues on both sides of the aisle to collaborate on innovative solutions to end drug abuse and addiction. https://t.co/nk8wZLugCW,2020-02-09 23:51:12
Ripping up the President’s #SOTU address was beneath the dignity of the U.S. House of Representatives and common human decency. Today I voted to censure Speaker Pelosi for her shameful actions.,2020-02-06 19:16:02
"Today marks the end of the long and shameful path of House Democrats' #ImpeachmentSham. After months of investigations conducted at a steep cost to the American people, President @realDonaldTrump has been acquitted for life. 

It's time to move forward. https://t.co/am7wiH9sZA",2020-02-05 22:18:34
"Thank you for your service, General McGee. Our WWII veterans are truly national treasures, and we are indebted to them. #SOTU https://t.co/NDtJDzhW9h",2020-02-05 18:13:22
The state of the union is strong! Grateful to be with our @POTUS @realDonaldTrump on an historic night as he outlined an optimistic path forward for our nation. #PromisesMadePromisesKept #SOTU2020 https://t.co/inTzXdAUVh,2020-02-05 17:37:35
"From securing our southern border &amp; rebuilding the military to strengthening the U.S. economy &amp; making quality health care more affordable for American patients, our nation is moving in the right direction. It's an honor to serve alongside @POTUS.

#PromisesMadePromisesKept #SOTU https://t.co/CKlYLnlBZV",2020-02-05 04:24:56
".@POTUS: ""We are Americans. We are pioneers. We are the pathfinders. We settled the new world, we built the modern world, and we changed history forever by embracing the eternal truth that everyone is made equal by the hand of Almighty God."" #SOTU 🇺🇸",2020-02-05 03:23:38
"From day one of his Administration, President Trump has committed to achieving #PeaceThroughStrength. As our Commander-in-Chief, he is seeking justice and eliminating dangerous threats to Americans both at home and abroad. #SOTU",2020-02-05 03:20:04
"In the 21st century, access to reliable broadband is key for success. 

It’s time to narrow the gap in broadband access and ensure that all Americans - especially those in rural communities - have every opportunity to reach their potential. #SOTU",2020-02-05 03:03:55
"""One-size-fits-all"" health care is one-size-fits-NONE. A radical, socialist health care agenda that stifles lifesaving innovation is the WRONG path for our nation. #SOTU #MedicareForNONE",2020-02-05 02:46:55
"Thank you, Mr. President! https://t.co/EJdg1JSssc",2020-02-05 02:33:12
"Thanks to our incredible skilled workforce, PA-13 is one of the nation's leaders in heavy equipment manufacturing. As we have experienced firsthand, @POTUS continues to deliver on his promises to hardworking Americans in Pennsylvania and around the country. #BlueCollarBoom #SOTU https://t.co/11mOxbq8BS",2020-02-05 02:28:02
"Under @POTUS @realDonaldTrump’s leadership, Americans in PA and across the country are benefitting from a #BlueCollarBoom and an economy that delivers results for hardworking families. #SOTU https://t.co/FrcP9MiR3j",2020-02-05 00:38:06
"Lowering Rx prices is a critical priority. Alongside @POTUS, @HouseGOP &amp; @HouseCommerce have a solution to make health care more affordable. Congress should pass HR 19, which already has widespread support, so that we can deliver real results for American patients now. #SOTU https://t.co/b9m4q9HIIV",2020-02-04 18:11:14
"The #USMCA is a win for our dedicated farmers, workers, and industry in PA-13. #PromisesMadePromisesKept https://t.co/AW7KsxLjeo",2020-02-03 13:16:37
Today it was my privilege to join @ONDCP Director Jim Carroll for the launch of the Rural Community Action Guide. This is a huge step forward as we work together to combat the drug crisis and save lives. https://t.co/gwJCiMkiFq,2020-01-31 22:50:48
"Under @POTUS @realDonaldTrump’s leadership, we are combatting our nation's drug crisis and saving lives in every community across America. This is encouraging news for PA-13 and our nation. https://t.co/QW4GyYLGf5",2020-01-31 02:57:21
"The #USMCA is a win for PA-13 and for our nation. It will deliver fairer trade opportunities, create jobs, and strengthen our economy. Under @POTUS’ leadership, we are bringing our trade policy into the 21st century. #PromisesMadePromisesKept https://t.co/Cx9bxs7Nbc",2020-01-30 01:29:28
"It was my privilege to recognize Specialist Joseph Raymond of East Berlin, PA for his outstanding achievement during the Solider of the Year board for the 1st Battalion, 108th Field Artillery. https://t.co/vuuyjui8IZ",2020-01-29 02:47:21
"This week, it was great to tour Pete and Gerry's Organic Eggs in Greencastle. We had a productive discussion about issues that are important to our agriculture community including the #USMCA, which soon will reach President Trump’s desk. https://t.co/phi4A93XLz",2020-01-26 22:27:03
"Here’s the bottom line: Rather than pursue the truth, Democrats have been obsessed with impeaching President @realDonaldTrump because they do not like him and do not respect the legitimate votes of those who elected him. The American people rightfully see through this sham. https://t.co/Jta8Gw0iBM",2020-01-25 21:41:10
"It was great to talk with so many dedicated #ProLife constituents from PA-13 in Washington on this historic day. Together, we’re working to safeguard human life and ensure that every person has the opportunity to thrive. #WhyWeMarch https://t.co/TPDKztj4em",2020-01-24 22:07:30
"Recently, I went down to the House Floor to discuss my commitment to life. As a #ProLife doctor, I took an oath to protect ALL human life. It's my privilege - and my responsibility - to continue this fight alongside @POTUS @realDonaldTrump &amp; fellow pro-life Americans. #WhyWeMarch https://t.co/woLbXSNaa3",2020-01-24 15:48:31
"Just spoke with the Tribune Democrat about the life and legacy of Sgt. Michael Strank, a Johnstown native and American hero. Looking forward to reading @Dave_Sutor’s forthcoming story on Sgt. Strank and Iwo Jima. https://t.co/aCX23hyeji",2020-01-23 20:28:53
