tweet,dates
Make no mistake: Today’s executive order fails to address or end this moral crisis. It merely replaces the unacceptable evil of family separation with the unacceptable evil of child detention. https://t.co/eNPDcNhokM,2018-06-20 21:32:47
"Senator Robert F. Kennedy died fifty years ago today. When he passed, it was as if something died in all of us.  https://t.co/O3zYDMIRxu",2018-06-06 18:27:42
"Thank you, @ABCNetwork. You did the right thing. There is not any room in our society for racism or bigotry.",2018-05-29 18:14:07
"Separating children from their parents is cruel, it is inhumane, and it is not in keeping with the moral values of our nation. It is simply un-American. I will fight this action with every fiber of my being. https://t.co/jyrwTPOxHO",2018-05-10 14:37:20
It is a sad and dark hour for our nation and the global family.  This administration’s decision to withdraw the United States from the Joint Comprehensive Plan of Action (JCPOA) is a major blow to all those working to bring peace to the world community.,2018-05-08 21:31:18
"I believe we have a right to know what is in the water we drink, the food we eat, and the air we breathe. On this #EarthDay, we must resolve to do all that we can to leave this planet we call Earth a little cleaner and a little greener for generations yet unborn. #goodtrouble",2018-04-22 16:01:40
"To the young people speaking up and speaking out today, my heart is with you. Keep walking and keep marching all the way to the polls in November. You will change America. #NationalSchoolWalkout",2018-04-20 16:26:16
"I was saddened by the passing of Rev. F.D. Reese. I first met Rev. Reese in 1963 on my first trip to Selma. He helped create the climate for the Voting Rights Act. I’m terribly sorry for his loss, not just for Selma or the state of Alabama, but the nation. https://t.co/xk0FNRh6HV",2018-04-10 14:54:50
"50 years ago today, I learned the painful news that my friend, my mentor, Dr. Martin Luther King, Jr. had been assassinated in Memphis, TN. He was my brother, my leader--that day it felt like something died in all of us. https://t.co/WkjkxJvXTC",2018-04-04 14:59:44
"Sometimes you have to get in trouble--good trouble, necessary trouble--to make a way out of no way.",2018-03-14 14:29:12
"53 years ago today, we were beaten, tear gassed, trampled by horses, and left bloody on the bridge in Selma. On this anniversary, we cannot rest. We must honor those who gave their lives for the right to vote. We must continue to find a way to get in the way. #goodtrouble https://t.co/pryA7cFSM8",2018-03-08 01:45:22
I stand with @Delta,2018-03-01 21:56:17
"58 years ago today, I was arrested for the first time as a participant in the sit-ins at lunch counters in downtown Nashville. Walking out to the paddy wagons, I tried to walk with a sense of pride &amp; dignity. I felt free, I felt liberated. I felt like I crossed over. #goodtrouble https://t.co/NSwsxarnva",2018-02-27 21:26:04
Never has there been a more important time to guarantee that each voice can freely speak up and speak out. We cannot allow a few powerful companies to control what you see and do on the Internet. We must save #NetNeutrality to guarantee a free &amp; open internet for all #goodtrouble,2018-02-27 17:07:33
".@SpeakerRyan Mr. Speaker, the time for action is now. We know the facts. There are too many guns. How many more children must die? How many more students? How many more teachers? People who are not willing to lead should get out of the way.",2018-02-16 14:24:02
"It is unbelievable, it is unreal that we consider a bill that turns the clock backwards and strikes a devastating blow in the fight for civil rights. https://t.co/3YMCscPero",2018-02-15 15:23:32
We are shocked and numb. How many more must die? Our conscience must move us to action. It is time for the American people to demand action from their elected leaders.,2018-02-15 04:26:06
"This budget seeks to dismantle the social safety net. That is not right, it is not fair, and it is not just. Every person watching should understand that this budget is dangerous and unrealistic. https://t.co/oVqQJDzTES",2018-02-14 16:43:43
If it hadn’t been for the march from Selma to Montgomery there would probably be no Barack Obama as President. I hope this conversation inspires young people to participate in the democratic process and understand that you too can make a contribution. We all have a role to play. https://t.co/BASjM7mMhi,2018-02-04 19:08:14
"It is painful to witness firsthand this attack on the remaining pillars of nonpartisan, governance, rules, and procedures, but it is unfathomable and unconscionable to attack our country’s national security personnel and apparatus for political cover and gain.",2018-02-02 20:05:23
"The frantic, desperate release of this memo leads us down a dangerous path of political spin and accusations instead of thoughtful, responsible, congressional oversight.",2018-02-02 20:05:00
"I never thought that I would witness the dismantling of the checks and balances of our country, and I never imagined that Republicans would cast aside the national security interests of our nation.",2018-02-02 20:04:39
This is a dark hour and a sad day in the history of our nation.  Congress has a constitutional responsibility to protect the goodwill of the United States and to serve as an inspiration to the global community for whom the dream of democracy is a beacon of hope and light.,2018-02-02 20:04:12
The movement lost another precious and devoted leader. Wyatt Tee Walker made a major contribution to the liberation and freeing of our nation. https://t.co/pmHdzDpqyX,2018-01-26 14:59:19
There is no sound more powerful than the marching feet of a determined people. #goodtrouble,2018-01-20 22:40:38
Information about Government Shutdown https://t.co/SCDUE6dwTx,2018-01-20 18:53:16
"It was good to be with you, Sen Booker. Thank you for all of your work. https://t.co/CIET2X3VyS",2018-01-15 16:22:27
"As Dr. King used to say, you have to love the hell out of them. #goodtrouble",2018-01-15 16:03:22
"Today, Dr. King’s legacy is a guiding light. As we push and pull for a more just and more equal society, Dr King’s campaigns against war, against poverty, against racism show us that love is the universal value of a society at peace with itself. #goodtrouble",2018-01-15 16:02:00
He gave his life for us https://t.co/HF3qOMSXFk,2018-01-15 16:00:45
He went to jail for us. #goodtrouble https://t.co/5kZT2OzXOb,2018-01-15 16:00:20
He marched for us. #goodtrouble https://t.co/lvC8drCSEb,2018-01-15 15:59:49
"Dr. King was my friend, my brother, my leader. He was the moral compass of our nation and he taught us to recognize the dignity and worth of every human being. #goodtrouble https://t.co/2OdUL5clIa",2018-01-15 15:59:10
"The Martin Luther King, Jr. holiday is a day on, not a day off. It is a day of service to our communities, to our brothers and sisters, and to generations yet unborn so that we all may continue Dr. King’s work of building the beloved community. #goodtrouble https://t.co/9xB7sRB6AF",2018-01-15 15:57:31
"If Dr. Martin Luther King Jr. was preaching today, he would be speaking the idea that we are one people, one family, one house—the American house and the world house—that we must learn to live together as brothers and sisters, if not we will perish as fools.",2018-01-14 20:05:47
"I am so proud that we were able to work in a bipartisan, bicameral manner to establish Georgia’s first National Historical Park in Dr. King’s name and legacy before what would be his 89th birthday and the 50th anniversary of his tragic assassination. https://t.co/dTRpRvoDYc",2018-01-09 16:21:01
"Congratulations to @FootballUGA on a hard-won victory. You never gave up, gave in, or gave out. You kept the faith and you kept your eyes on the prize.",2018-01-02 14:09:14
"Wishing everyone a happy New Year. May we all resolve to live each day with purpose and hope, never forgetting that the way of peace and the way of love is the better way. #goodtrouble",2018-01-01 15:38:14
Wishing everyone a happy and safe Christmas holiday.,2017-12-25 13:55:48
