tweet,dates
The House just passed legislation providing emergency funding to combat the #Coronavirus outbreak. This funding will give state &amp; local governments the resources needed to fight against the virus. I remain committed to keeping my constituents informed &amp; up to date on this issue.,2020-03-04 22:06:14
It was great to sit down &amp; discuss important topics today w/ Alabama Humanities Foundation. Thanks for your time &amp; thoughtful conversation @AHF! https://t.co/U6fDEDayGi,2020-03-04 21:47:31
Please make sure to monitor your local weather updates &amp; alerts as severe weather is expected to move through the state today &amp; tomorrow. https://t.co/XNsECDLZAz,2020-03-04 15:58:09
"This morning, @AIPAC members from Alabama came by my office to discuss several different issues. I assured them that I remain committed to our country’s friendship with Israel. Thank you for meeting w/ me! https://t.co/ftLvrFcYI2",2020-03-03 20:39:53
"I am grateful for 17 years of public service. I am not on the ballot today, but I still have a responsibility to remind people to vote. 🇺🇸",2020-03-03 11:37:30
"As we celebrate #ReadAcrossAmericaDay, it's important we recognize the valuable skills our children exercise &amp; develop when reading is incorporated into their daily lives &amp; their education. Let's continue to motivate our youth &amp; share w/ them the joys of reading! https://t.co/73AVyboVbY",2020-03-02 20:47:49
"REMINDER: The deadline to apply for a summer internship in my Washington office &amp; district offices is this Friday, March 6! If you know anyone who may be interested, please share this information w/ them, or visit my website to learn more: https://t.co/rrjgLi9Xkm https://t.co/V654EiSqvt",2020-03-02 14:21:24
"Our state has a deep history &amp; important place in the American Civil Rights Movement. The images from “Bloody Sunday” are never easy to see - but 55 years later, we are able to pass on a new legacy of hope, faith, &amp; justice for all. https://t.co/FItN7p9kd9",2020-03-02 00:56:59
"What a productive day in Washington! I enjoyed discussing several important legislative topics &amp; priorities specific to Alabama w/ these groups yesterday, &amp; I appreciated each of you taking the time to stop by my office. https://t.co/rculnfJT4T",2020-02-27 14:34:52
"Throughout the month of February, state &amp; local leaders are celebrating Career &amp; Technical Education Month, recognizing the value of CTE &amp; the accomplishments of the many programs across our state &amp; nation. Read more about the impact of CTE from my Weekly Column via @yhn: https://t.co/PkuxUhJUWZ",2020-02-24 14:44:16
