tweet,dates
"Women Empowerment, minority Latino-American peoples, and the forgotten peoples of Territories.

Ageless positivity and classic Latino subtlety hidden behind unrelenting energy and expression. 

This is the embodiment of a diverse America. 

So damn proud. https://t.co/mILaQOW17s",2020-02-05 08:11:36
"Territories are under the plenary power of Congress. The House represents the People, the Senate represents the Republic. 

Territories have Delegates in the House; the role of Territories as a part of the Republic, should also Senate representation.

https://t.co/XUen9XCdDC",2019-12-22 04:21:48
The unanimous passage of H.R. 1365 is a testament of the full support Guam has in both parties to bring closure to our Greatest Generation. (link: https://t.co/Ygm4ceo8FW) https://t.co/F6y3TiU1Vg… #Guam #GBG,2019-07-25 04:56:08
"Speaker Pelosi attends Guam Liberation Gala, confirms HR 1365 will be voted on next week with strong bi-partisan support. https://t.co/Hk4Z8zxCk8",2019-07-18 13:14:59
https://t.co/zbPRKhmf0e,2019-07-18 12:28:58
https://t.co/gl3ay5ZbFq,2019-07-18 12:28:13
"A powerful tribute to a powerful history shared, and the ultimate respect paid. https://t.co/tPLH9XzbPv",2019-07-17 13:10:57
I am proud to announce that I am an original cosponsor of HR 3631. This bill will increase federal funding to Guam's Medicaid program and prevent a lapse in Medicaid coverage on Guam. https://t.co/QH9CnmGA3t,2019-07-10 15:46:44
"Guam's liberation gala will be held this year after a multi-year hiatus on July 17th in Washington D.C. The Honorable Nancy Pelosi, @SpeakerPelosi has already confirmed her attendance as the guest of honor, for the gala. https://t.co/BxAH6ZE4rN",2019-07-09 15:53:23
Happy 4th of July from Guam!,2019-07-04 15:30:32
"Great meeting with Secretary of the Navy Mr. Richard Spencer.
We had discussions ensuring that Guam builds goodwill between the community and the military. Our offices will be working on legislation to help build high paying, sustainable multi-million dollar industries Guam. https://t.co/9BCfjwPX0h",2019-07-02 18:28:41
"U.S. Department of the Interior endorses passage of H.R. 1365. As H.R. 1365 advances from the Natural Resources Committee, Congressman San Nicolas continues to secure support for its passage. I am deeply grateful for the plain urgency and clear support from the DOI. https://t.co/VIW1ZzAyvX",2019-06-26 21:27:30
"Payment of Guam's World War II reparations moves closer to reality, after the HNR committee cleared Con. San Nicolas bill H.R. 1365 for a full U.S. House of Representatives vote. https://t.co/OIWpfLKzcG",2019-06-20 13:02:22
"Success comes with sacrifice. The Simon Sanchez graduates know this all too well, and earned their place on stage. Congratulations to the 2019 graduating class of Simon Sanchez! https://t.co/2G4xh4NKfA",2019-06-14 19:51:36
"The Tiyan Titans are unafraid of challenges, and welcome the opportunity to ""become"" that is a part of change.
Congratulations to the Tiyan High School class of 2019! https://t.co/Q0O6tFK1i4",2019-06-14 19:49:37
"To know where we are going, we must remember where we have come from.
Congratulations to the John F. Kennedy High School Class of 2019! https://t.co/TGJUdoMBcS",2019-06-14 19:48:22
"As a graduate of Southern High School it is always so special to reconnect with my alma mater and the community that makes us so strong.
Congratulations to the Southern High School class of 2019! https://t.co/9o5qk0eMJ2",2019-06-14 19:46:21
"The ""million dollar speech.""
Congratulations to the Okkodo High School Class of 2019! https://t.co/bBDOIciA7X",2019-06-14 19:41:16
"Guam War Claims moves forward with a Mark-Up Hearing on H.R. 1365 scheduled for June 19th, 2019.
https://t.co/eGhas9bsna
@PostGuam",2019-06-14 15:43:43
"Relevant agencies informed us they are unaware of the details of Adelup’s plans. We need to stay on our current course in the Congress if we to make sure no one with an approved claim is left out.
https://t.co/M9IrzY7pl7
#Guam",2019-06-14 12:34:36
"As a co-sponsor of HR 1354, the Territorial Health Equity Act of 2019 Congressman San Nicolas joins his House colleagues in securing full Medicaid parity for Guam with States. 
https://t.co/f8QrThVMVE #Guam #Medicaid",2019-06-12 12:17:06
"Over $400 million in buildup projects in 2019 National Defense Authorization Act.
https://t.co/RhhBykfbAf @PostGuam",2019-06-11 15:17:51
Guam Republicans express support for San Nicolas’ war claims bill. https://t.co/mjYxEfeUuM @PNCGuam,2019-06-11 12:34:48
"On June 6, 1944, more than 150,000 Allied troops stormed Normandy’s fiercely defended beaches. This battle proved to be a critical turning point for WWII. A month later, Guam was liberated from Japanese forces. Today, we honor their sacrifices. #DDay75thAnniversary #Guam https://t.co/lhCOy1RK3j",2019-06-06 12:26:24
"In March, I introduced H.R. 1365 to correct the Guam World War II Loyalty Recognition Act to allow the release of funds to World War II survivors. https://t.co/VHFvak7REy",2019-06-02 13:31:38
"Guam PDN: Puerto Rico backs Guam's SSI program bill.

https://t.co/2n2ThYmGZe",2019-05-31 15:41:11
"Congratulations to the George Washington High School (GWHS) graduating class of 2019! This year on the 75th Anniversary of the Liberation of Guam, I have requisitioned official American Flags flown over our Nation's Capitol in Washington D.C. @GuamPDN #Guam https://t.co/yPWKcMQ1Z6",2019-05-31 14:03:16
"An honor to facilitate and join our Armed Forces Committee of the Guam Chamber of Commerce in meetings on Capitol Hill.

Walking the Longworth House Office Building are from L-R: John Thomas Brown, Joe Arnett, Gerry Perez, @Kilili_Sablan , Jim Adkins, Jeff Jones, myself. https://t.co/iNyRGJoxAj",2019-05-24 13:45:49
"Kaselehlie, Yokwe, Alii, and Hafa Adai!

Reconnected with my friend newly elected President David Panuelo of the Federated States of Micronesia my new friend Hilda Heine of the Republic of the Marshall Islands  and my second President Tommy Remengesau of the Republic of Palau. https://t.co/QQuYoMWJDS",2019-05-24 13:33:04
"I am grateful that the Close Up Foundation honored myself and my colleague @RepAmata. When I was in the 8th grade I had an opportunity to visit Washington, D.C. This foundation helped myself and many Guam students to learn and become interested in our democracy. @CloseUp_DC #Guam https://t.co/1u8lguOGtr",2019-05-23 14:04:43
"Today I served as the Vice Chair of the Financial Services Committee. Our hearing took testimony from Treasury Secretary Steven Mnuchin to understand the efforts to reform the International Monetary Fund. @FSCDems @IMFNews #GUAM

https://t.co/MM579GUWeK",2019-05-22 14:51:39
This weekend I had the privilege of meeting the Guam Dragonauts at the FIRST LEGO League Razorback Invitational. I enjoyed spending time with talented young students representing Guam. @firstlegoleague #Guam #STEM https://t.co/JjwwAwTgmP,2019-05-20 17:30:06
"Guam is a strategic location for the the United States military. Over 13,000 armed services personnel and their families are stationed on Guam. Today we thank and honor all of our men and women who serve in the armed forces. @HASCDemocrats #ArmedForcesDay #Guam",2019-05-18 21:51:36
"I am deeply honored that @RepMaxineWaters appointed me as vice chair of the Financial Service Committee. I earnestly look forward to the work ahead to uplift the financial prospects of the communities we serve. @FSCDems 
https://t.co/zJrxvtePMb https://t.co/S81fxmCJAV",2019-05-16 18:54:06
I am introducing H.R. 1713 with Congressman Gus Bilirakis and Congresswoman Radewagen bi-partisan bill. The Lonnie Kilpatrick Central Pacific Relief Act honors a Navy Veteran stationed on Guam who died due to herbicide exposure. #Guam #MakeItCount,2019-05-16 17:59:39
"In a Natural Resources budget hearing I highlighted how migrants are not factored into the Compact Impact cost per migrant towards Guam. The Interior Secretary affirmed that the disparity may have been a Federal Government error.
#Guam @NRDems 
https://t.co/AhE23vA87w",2019-05-16 13:33:46
Police officers nationwide are serving our communities. This week we honor #PoliceWeek2019 to thank them for their service. We must honor all officers who gave their lives while performing their duties.,2019-05-16 13:26:17
I want to wish all of the moms a Happy Mother's Day! I am thankful for all the moms in our lives who are a role model for myself and many others! https://t.co/8Yd7W4Prt2,2019-05-13 13:19:38
"27% of the country has two or fewer banks. Rural Americans and those living in Guam need banks to keep interests rates low in rural areas. We can lower debt of rural Americans and create more jobs in these rural areas. #Guam #Financial #Jobs
https://t.co/SiB6u9KoK2",2019-05-01 16:08:25
There is an affordable housing crisis in this country. Let's get every American in a high quality and low cost home. #Guam #FinancialCommittee #HousingCrisis https://t.co/45AriDenET,2019-05-01 16:01:15
Guam gets a nice shoutout from Congresswoman Katie Porter at the 2min mark in the clip below - she gave me two high fives right in the middle of the hearing. https://t.co/dtxZEiHzCc,2019-05-01 13:19:19
I am proud to introduce H.R. 1141. This bill will appropriate funds authorized for war claims. We are working concurrently with the Natural Resources Committee and House Leadership to channel this measure as expeditiously as possible. #Guam #HR1141 #Veterans,2019-05-01 13:07:03
Border Wall will diverting over $749 million of current Guam buildup funding to the $3.6 billion border wall. Diversion of these funds will certainly setback the military buildup on Guam. #Guam #borderwall #DOD,2019-05-01 13:04:24
"Guam is now Real ID Compliant. The Office of Congressman San Nicolas announces that the U.S. Department of Homeland Security (DHS) has approved Guam’s certification of compliance in meeting the requirements of the REAL ID Act of 2005. #Guam#RealID

https://t.co/jn5WgPsOY8",2019-05-01 13:00:09
#NewProfilePic https://t.co/jpV8Fi3BUg,2017-11-06 01:23:51
