tweet,dates
"I'm pleased to cosponsor the Lower Costs, More Cures Act to help bring relief from high drug costs. There are many proposals focused on lowering prescription drugs costs, but our legislation focuses on solutions with the strongest bipartisan support. https://t.co/URA1crS6Ft",2019-12-19 22:31:11
"I’m disappointed the Senate passed a spending deal today that will add to the already massive debt burden being placed on future generations. It provides Christmas presents for everyone – all put on the federal credit card, which is overspent already. https://t.co/DJ8enmKeJd",2019-12-19 21:12:40
It’s important for students and families to have the most accurate information before choosing a college that best fits their needs.,2019-12-19 16:45:24
"Our nation is on an unsustainable fiscal course. We simply cannot continue down this path. While the NDAA is well-intentioned with many proposals I support, it ignores our overspending problem &amp; furthers the practice of passing legislation while ignoring the rules of the Senate. https://t.co/jokYrqOo02",2019-12-17 22:28:02
The GREAT Act would help simplify the grant reporting process and keep better track of taxpayer dollars. I’m pleased the House passed this important legislation and look forward to the president signing it into law soon. https://t.co/VUGl8atIrn,2019-12-17 19:45:35
"Diana and I were grateful to help lay wreaths on graves of the 3,000 veterans in Casper’s Oregon Trail Veterans Cemetery on Saturday. One of the names we saw was @RepLizCheney’s grandfather. Our fallen service members will always be our heroes. May we never forget to honor them. https://t.co/ifIngIJv9v",2019-12-16 22:28:55
Emerging cell-culture technologies may reshape the food industry in the coming years. Existing food safety laws were drafted long before these technologies were contemplated.,2019-12-16 21:14:23
Every year I have the honor of nominating outstanding Wyoming students to our service academies. The academies not only offer a quality education but provide a unique set of skills that graduates will carry with them throughout their lives. Learn more: https://t.co/ZMFUes3Nuu https://t.co/V9cdmW6k38,2019-12-12 16:52:24
It was great to catch up with the @WY_StockGrowers today and answer questions about what’s going on in Washington! https://t.co/xZ1vziFzRZ,2019-12-11 22:25:31
"Our economy is thriving, thanks in part to the #TaxCutsandJobsAct. After almost 2 years, it's brought more jobs and kept hard-earned money in workers’ pockets. That’s nearly 7 million more jobs and 2.4% growth in economy for 2019 according to the Treasury Dept. https://t.co/jOmHxUmpPC",2019-12-11 21:37:08
"If you love Wyoming and trivia, follow me on Instagram and test your Wyoming knowledge on my stories! This week it’s about women’s suffrage. https://t.co/th4EWvfY8E",2019-12-11 19:41:13
Government shutdowns do not benefit anyone and actually end up costing taxpayers more money. I cosponsored legislation that would prevent future government shutdowns. It is time to end unnecessary shutdowns for good. https://t.co/Mlpp7SoAWB,2019-12-11 15:24:46
"We are celebrating an incredible landmark today – 150 years ago, Wyoming led the way by granting women the right to vote and hold office. The Equality State is proud to have taken this important step 50 years before the enactment of the 19th Amendment. https://t.co/q2ohLvhEk5",2019-12-10 14:30:46
"Tomorrow is Wyoming Women's Suffrage Day, a testament to the contributions women have made – and continue to make – to Wyoming and the values that make our state stand out as an example for the rest of the country. https://t.co/AvTNcXZp26",2019-12-09 22:16:38
Every year my wife Diana and I host a cookie party to say thank you to those who keep the Capitol running – everyone from cafeteria workers and photographers to electricians and Capitol police officers stop by to enjoy some homemade treats. We couldn’t do what we do without them! https://t.co/ijZe41eBgX,2019-12-05 21:48:59
"I’m saddened that my colleague and friend @SenatorIsakson will be leaving the Senate at the end of the year. It’s been a privilege for me to work with Johnny on a number of legislative efforts. His experience, knowledge and friendship will be missed. https://t.co/vT6V7mdvns",2019-12-03 21:49:58
Wyoming is proud to be home to many family-owned businesses. This #SmallBusinessSaturday remember to stop by your local shops – as some of the best gifts come from local artists and retailers. What’s your favorite Wyoming small business? https://t.co/pxZONbYJYn,2019-11-30 14:03:00
Happy Thanksgiving from my family to yours! Diana and I send our best wishes and hope everyone has a safe and happy holiday. https://t.co/AKHeeVGtg6,2019-11-28 13:47:00
"Pleased the Senate unanimously passed my resolution with @SenJohnBarrasso to recognize Dec. 10, 2019, as Wyoming Women’s Suffrage Day. The 150th anniversary of Wyoming granting women the right to vote is a monumental milestone, and I’m excited to celebrate it.",2019-11-20 19:23:05
"While America is experiencing record-low unemployment, this puts a strain on seasonal and tourist businesses due to the low number of available temporary workers. By increasing temporary work visas, seasonal employers will be able to overcome the burden of being understaffed.",2019-11-19 22:23:23
"Today marks the 40th anniversary of the Congressional Award! Every year, Wyoming is proud to be one of the states with the most gold medal recipients. Encourage an outstanding student you know to learn more about the opportunities of @theaward program: https://t.co/1DXRgEdj32 https://t.co/9sYfItntnQ",2019-11-16 14:06:00
The right approach to tobacco policy is to get people to stop smoking or – better yet – to never start. We need to know how the Tobacco Control Act is working and be responsive to new technologies and potential threats to our children and the public health.,2019-11-13 22:06:50
This past weekend Diana and I met with several Wyoming cadets at @WestPoint_USMA. It was exciting to see how far these hardworking cadets have come since they were nominated to the academy. Wyoming is proud of you! https://t.co/l60TqUfYHh,2019-11-13 17:10:55
"I'm proud to introduce a resolution with @SenJohnBarrasso to designate Dec. 10, 2019 as Wyoming Women's Suffrage Day to celebrate the 150th anniversary of Wyoming granting women the right to vote. https://t.co/g9zqG8OaB4 https://t.co/Cip91olbxD",2019-11-12 20:53:26
Today we take time to thank and appreciate our country’s veterans for their service and sacrifice. Wyoming is proud to be home to thousands of veterans and Diana and I send them our best wishes. https://t.co/q15slixcCc,2019-11-11 14:08:00
I’m pleased the government affairs committee passed @RandPaul's Bonuses for Cost-Cutters Act. This bill incentivizes employees to find and eliminate waste in the government’s spending rather than promoting the status quo “use it or lose it” mentality. https://t.co/PI7XMNYksY,2019-11-06 23:49:00
"I'm excited the Budget Committee passed my bipartisan bill with @SenWhitehouse, which will make the budget process more orderly, deliberative &amp; focused on long-term planning. We need to fix our country’s fiscal problems so future generations are not faced with disaster. https://t.co/iGrRnrUbaF",2019-11-06 22:22:45
Shifting the budget resolution to a two-year cycle is an important first step toward fixing America’s #brokenbudget process. https://t.co/ScdsZtvuFC,2019-11-06 19:55:46
Americans deserve fiscal transparency when it comes to government spending. We need this bipartisan budget reform bill more than ever. #brokenbudget https://t.co/XMGPgMsaJq,2019-11-06 19:31:35
