tweet,dates
"The USMCA is a huge win for all of Utah, especially the more than 120,000 Utahns whose jobs depend on trade with Mexico and Canada.
https://t.co/ru7gHYFxH9 https://t.co/yFTlY4sTAl",2020-01-29 21:58:00
The House Managers have argued aggressively that the president’s actions contravened U.S. foreign policy. Isn’t it the president’s place – certainly more than the place of career civil servants – to conduct foreign policy? https://t.co/U1Iu0ITTKi,2020-01-29 19:46:50
"It was an honor to share the stage with @realDonaldTrump Friday when he became the first president to speak at the #MarchForLife
https://t.co/3GgjZIUP4W",2020-01-27 22:58:30
Today the Utah State Legislature began its annual session. Members of my staff will be at the Capitol every day during the session from 10am - Noon to answer your questions or concerns. #utpol https://t.co/TmXpmY9be0,2020-01-27 21:43:28
"I celebrated the joy of life today with @realDonaldTrump and tens of thousands of others at the #MarchForLife rally. Then I had a unique commute as I marched, biked, and scootered to the Capitol for day 4 of the impeachment trial. https://t.co/IgzoC67AqQ",2020-01-24 21:46:59
"Huge win for #ReligiousLiberty on this #MarchForLife day. HHS Office for Civil Rights has issued a notice of violation to California for their 2014 rule banning over 28,000 insurance policies that did not cover abortion. Californians deserve this freedom.
https://t.co/aI0gfKM4gV",2020-01-24 17:06:49
Fantastic news for the state of Utah and more proof the #TrumpEconomy is working. https://t.co/6J2uRXiVvq,2020-01-24 16:56:26
"Today, thousands of Americans are marching across Washington, across Utah, and across the country for the most important cause there is: the right to life. I stand with you, and encourage you to keep up this good fight. #MarchForLife https://t.co/iM0WPy76h8",2020-01-24 16:31:35
"Today is a great day for every American that is concerned about the high costs of housing and infrastructure in the United States. This revised Waters of the United States rule will bring common sense certainty to farm, business, and home owners. https://t.co/Jxm7eHZJnY",2020-01-23 21:50:08
"After 33 days of delay managers argued this was urgent. After hearing from 17 witnesses managers said they need more. After hours of speeches managers insulted the President, his counsel, and the Senate itself. I am taking notes and am unimpressed. https://t.co/AdHRXkPJB0",2020-01-22 19:07:44
"""Yes, it is love that will save our world and our civilization, love even for enemies.""
https://t.co/tvcJES3lwe",2020-01-20 17:22:22
Thankful for Sandy Police Chief William O’Neil and his over 20 years of service to the community of Sandy. I hope his family finds peace during this difficult time.https://t.co/NctXpr3NI0,2020-01-18 15:16:08
". @northropgrumman the state’s largest private sector employer in aerospace/defense, has announced an expansion in Weber County that will create up to 2,250 jobs! This is a big win for our state and will add more high paying jobs to our strong economy.https://t.co/CHPkmWgPEV",2020-01-17 18:06:56
"Great job @RepChipRoy, couldn't agree more! https://t.co/yY0FgAYe30",2020-01-16 22:38:22
It is not an accident that religious freedom is protected in the First Amendment. Religious liberty is one of the founding principles of our nation. So thank you President Trump for doing all you can to protect Religious Freedom on Religious Freedom Day. https://t.co/yLcggVWc8h,2020-01-16 21:08:44
It was great to meet with and welcome @SenatorLoeffler to the Senate today. I look forward to working with her on conservative priorities. https://t.co/o3m8PPQiba,2020-01-16 19:11:46
We need to include the full cost of every new spending program and that includes the cost of servicing new debt. https://t.co/8kMFroWkNP,2020-01-16 16:08:02
