tweet,dates
"The United States is a republic, Mr. President. Not a monarchy. https://t.co/xqnZfo7uUW",2020-04-16 00:37:03
"The IRS announced today that recipients of Supplemental Security Income will automatically receive a $1,200 stimulus payment with NO further action needed on their part. These payments are projected to go out no later than early May.",2020-04-15 20:40:09
Don't forget to tune in soon for the International Conservation Caucus's Virtual Hearing at 3 p.m. EDT TODAY! https://t.co/CPRtDcUBEb,2020-04-15 18:30:00
"Small businesses need help now. @housedemocrats are fighting for a comprehensive solution that provides #SmallBizRelief by:

-Providing more disaster relief loans
-Getting money to the most vulnerable small businesses
-Expanding relief eligibility to small farmers https://t.co/uYSl7X9sX9",2020-04-15 17:08:03
"If you or anyone you know is between the ages of 18 and 60, has been symptom-free of illness for the past 14 days, and is looking for ways to help the community, the Greater Chicago Food Depository is looking for volunteers! You can sign up here: https://t.co/WzsH5qIND4 https://t.co/BKhoBCjSCK",2020-04-14 22:49:00
"The stress of COVID-19 can be overwhelming and constant. If you or someone you know is feeling extreme stress or sadness, please don't hesitate to reach out to someone or call the Disaster Distress Helpline at 1-800-985-5990.",2020-04-14 21:47:00
"The International Conservation Caucus is holding a Virtual Hearing on Wednesday at 3 p.m. EDT on wildlife trade, the origins of COVID-19, and preventing future pandemics. You can watch it live through this link: https://t.co/Absir4cTpy",2020-04-14 20:46:53
This is such an amazing gesture from @GirlScoutsGCNW! Thank you for bringing us #SomeGoodNews. https://t.co/Gm969cWive,2020-04-14 14:02:09
The NICS Denial Notification Act will enable stronger communication between federal and local governments to ensure anyone not allowed to buy a gun can't just turn to unlicensed markets after being denied by legal gun shops.,2020-04-13 22:01:00
"If you have direct deposit set up with the IRS, you will receive your stimulus payment via deposit. If you do not, you can expect to receive a check in the mail. For more information from the IRS you can visit https://t.co/XglGHngNNo https://t.co/9qBWqi4WuH",2020-04-13 20:53:00
"During my recent interview with @WGNTV, I answered some commonly asked questions from viewers about coronavirus. If you are still wondering about stimulus payments and more, take a watch below! https://t.co/hZzgcME5eX",2020-04-13 19:52:19
"The time to address the disparities between black and white Americans was weeks, months, years ago. It's not too late for us to address this alarming health trend. The first step is for the federal government to acknowledge the issue. Read @RepBobbyRush's op-ed on what's next: https://t.co/VtRonfWsmo",2020-04-13 15:09:17
Thank you to @Diane_Keaton and other prominent figures who have recently come out in favor of the #BigCatPublicSafetAct. We appreciate your support! https://t.co/rlekmhHwLY,2020-04-13 13:56:00
"Happy Birthday to my colleague, a tireless champion for our city, and adedicated public servant, @RepChuyGarcia!",2020-04-13 02:07:31
"For those of you getting meals from CPS, you should know that beginning on April 13th, more than 270 schools will be open to keep providing meals for CPS students. https://t.co/ucgFXIEWIx",2020-04-12 21:42:00
"Postal workers are more crucial now than ever. People are relying on getting their bills and even groceries and toiletries through the mail. As a nation, we are incredibly grateful for the work of postal workers and wish them good health. https://t.co/6JeH132Fri",2020-04-12 18:43:00
"If you are a veteran experiencing COVID-19 symptoms, please reach out to your VA medical facility or call MyVA311 (844-698-2311, press #3 to be connected). You can click here for the latest VA information: https://t.co/KBnP7MVZKM https://t.co/YM4hWrGmQM",2020-04-12 15:49:00
Happy Easter! I wish all those celebrating a safe and healthy holiday! https://t.co/AFRdClzWJf,2020-04-12 13:49:00
"This week, the US Fish and Wildlife Service signed a historic agreement to help save the populations of declining monarch butterflies and other pollinators. Now, 45 companies will provide habitats to monarch butterflies on public and private land across the country #SomeGoodNews",2020-04-12 00:48:30
"With both Easter and Passover on the calendar, this week has been a particularly difficult time for many families to be apart. Please, remember that by staying home you are saving lives. Find a virtual way to celebrate with loved ones and remember we'll be together again soon.",2020-04-11 21:48:00
"This week, during the 10th anniversary of the tragedy at Smolensk, I stand in solidarity with the Polish people and all of Polonia as they commemorate and remember the 96 lives senselessly lost. #WeRemember",2020-04-11 21:07:48
The U.S. Postal Service is an essential service and is dedicated to following CDC guidelines while they stay open and keeping their employees and customers safe. Here's a link to their statement on COVID-19: https://t.co/AkV7W4WEmy https://t.co/Uznw11ZoQR,2020-04-11 18:36:00
Essential workers with children are relying on child care workers now more than ever. Those same carers are also having to ensure clean environments for the children they are nurturing. They're so vital during these times and I'm incredibly thankful for their service. https://t.co/9qjomDLaEg,2020-04-11 15:35:00
The President wants anyone responsible for holding him accountable to be someone he can count on to be loyal. He's left the door wide open for ongoing corruption in his own administration. We need an independent Inspector General to allocate the $2 trillion stimulus efficiently. https://t.co/Eu9FQRubkk,2020-04-10 18:59:00
"April 10 is #NYHAAD. 1 in 5 new HIV diagnoses in the US occurs in youth 13-24 yrs old. Together, we can help keep young people healthy by talking about #HIV and connecting youth to health services for testing, prevention, &amp; treatment. #StopHIVTogether https://t.co/p5tCy8YrTO",2020-04-10 17:56:00
"The Department of Transportation is working to activate it's existing emergency relief programs, including at the Federal Transit Administration. Congress and the DOT will continue to ensure that financial assistance is given to agencies and authorities that need it most. https://t.co/JfvATrBHYW",2020-04-10 16:57:00
"Tune in to @TheJamTVShow now!

📺⬇️ https://t.co/a5oh9nX6Sx https://t.co/w2nrOm3oQd",2020-04-10 15:53:04
"Our military members are spread out across the globe, often very far from their families, still doing the work of keeping our nation safe during the fight against this pandemic. Join me thanking them for their service and wishing them and their families well. https://t.co/1633A4ZDyU",2020-04-10 15:16:14
"I'll be talking with @TheJamTVShow this morning about what Congress is doing to fight coronavirus, what you can expect from the stimulus package, and how I'm keeping busy while staying home. Tune in at 11 am CT! https://t.co/a5oh9oeHK5",2020-04-10 13:33:00
Firing Captain Crozier for protecting his crew was a mistake which was compounded when Acting Navy Secretary Modly disparaged the Captain in front of his former crew. I’m glad that Secretary of Defense Esper and others pressured Modly to apologize and his resignation was right. https://t.co/ucSFUq3aOG,2020-04-09 23:41:00
It's easy to get lost in the drama of #TigerKing but the harsh reality is that big cats are often put in harmful situations when owned privately. The #BigCatPublicSafetyAct would ban the private ownership of big cats and prohibit dangerous roadside zoos. https://t.co/y3LaMwzJQy,2020-04-09 22:39:00
"""Wet"" markets are breeding grounds for zoonotic diseases that jump between animals and humans. My colleagues from across the aisle and I agree that ""wet"" markets should be permanently banned and are urging international organizations to shut them down. https://t.co/HULMnFOum2",2020-04-09 21:43:00
"Celine, we're all so glad you and your husband made it safely back to Chicago and we're glad to have been able to have helped. Thank you so much for your hard work as a health care worker. Dedicated essential workers like you are our heroes 🦸 https://t.co/N15sKnWAhm",2020-04-09 20:52:03
"Want to help your community access resources for hospitals, schools, and small businesses Respond to the #Census2020 at https://t.co/L8H8JjoGxE or look out for paper forms that will be mailed this week. Census data is protected by law and CANNOT be shared with law enforcement. https://t.co/QVBneZDYYE",2020-04-09 18:02:00
"The IRS has announced that the tax filing deadline has been extended and payments can be deferred until July 15, 2020. However, if you are expecting a refund, you can still file your taxes and get that refund just like usual. https://t.co/3HuuyKHCI8",2020-04-09 15:03:00
The coronavirus spreads rapidly and cleaning crews are working day and night to ensure that areas where our essential workers are get cleaned thoroughly. I want to thank cleaning crews across the country for continuing their work and making areas safer for all of us. https://t.co/MyNQQRkNKy,2020-04-09 14:04:36
"Chag sameach to all who celebrate #Passover.

In times of crisis, we must remember the importance of family and community. https://t.co/mCSHlJs7i2",2020-04-09 00:32:00
"As the coronavirus pandemic continues, my colleagues and I fear that the EPA is hastily putting forward rules that the public cannot digest and comment on in a timely manner. I, along with @RepMcNerney and more are urging the EPA to prioritize the public's comment period. https://t.co/NOBgLxetkz",2020-04-08 23:58:00
"Here's your good news break for today: for the first time ever, every single animal was adopted from Chicago Animal Control This Week! CAC is still housing dogs and cats who aren’t ready for adoption yet so you can still apply to foster or adopt. https://t.co/cz3N8DdD6a",2020-04-08 22:56:00
"In her letter to the editor, Kate Dylewsky from the Animal Welfare Institute breaks down the importance of the #BigCatPublicSafetyAct and why it's necessary NOW. Thanks for your support, Kate!https://t.co/45YmkKwQFM",2020-04-08 21:54:00
The Social Security Inspector-General is warning Americans about fraudulent letters threatening the suspension of Social Security benefits due to COVID-19-related office closures. Please know that Social Security is NOT being suspended. More info below: https://t.co/P1OGkOCvhB,2020-04-08 20:50:00
Journalists have continued to work during this time to ensure information is continuously flowing to the public. Their work has kept many Americans safe and saved countless lives. Please join me in thanking our journalists. https://t.co/8iq1tXRkIJ,2020-04-08 19:48:00
"I spent most of my life watching John Prine in concert and being moved by his music.

Our country has lost one of the great American songwriters He touched many lives and will be sorely missed.
https://t.co/aHuNq1kV9x",2020-04-08 18:47:25
The EPA has a responsibility to hold companies accountable for their pollution. Suspending monitoring of pollution by companies will damage the progress we've made in protecting our environment. The EPA should reimplement monitoring immediately. https://t.co/wOs65M9Qwu,2020-04-07 23:45:00
"Food can help make us feel connected to our friends, family, and the world around us. This pandemic has made it more clear than ever that restaurant workers are essential to our economy and our way of life. Please join me in thanking restaurant workers and wishing them well. https://t.co/Re5da4SsOP",2020-04-07 22:43:00
"If you are a parent of or a college student, you should know that all federal student loan borrowers can suspend payments without penalty for up to 60 days during the coronavirus pandemic. Please contact your borrower for more information on payment suspension. https://t.co/hFEw7XNgh6",2020-04-07 21:40:22
Transit workers are essential in helping all those who rely on public transportation to get to work and essential stores. I want to thank transit workers for continually coming to work and I wish them good health. https://t.co/48BUufMJh1,2020-04-06 21:16:52
"Between all the twists and turns of #TigerKing are reminders of how dangerous big cats are. If even one had escaped, first responders could have faced a horrifying situation. Passing the #BigCactPublicSafetyAct isn't just about saving the animals, it's about saving people too. https://t.co/KPnqG1iKMz",2020-04-06 18:45:00
There are a lot of moments in #TigerKing that show how cruel this industry is but none more than this one. There are no words for how disturbing it is to watch these animals be torn from their mothers when they're only minutes old. We need the #BigCatPublicSafetyAct to end this. https://t.co/K7W0etrM7a,2020-04-06 18:30:00
If you were as horrified by the scenes of abuse in #TigerKing as I was there is something you can do about it. Join the fight to pass the #BigCatPublicSafetyAct and end the private ownership of big cats and the cruelty of cub petting. https://t.co/8eagEcjniW,2020-04-06 18:15:26
"If you haven't heard, #TigerKing is the latest craze keeping us glued to our couches. While the series is full of fascinating people, my focus is on the animals trapped in disgraceful conditions. I introduced the #BigCatPublicSafetyAct to put an end to this industry. https://t.co/RFssa7g7Tq",2020-04-06 18:01:20
"For K-12 students, Chicago Public Schools will remain until at least April 20, 2020. During this pandemic, the President has also announced that standardized testing requirements will not be enforced. If you need more information, you can click here: https://t.co/S8FKTQhBIN https://t.co/qWSsmYBWnO",2020-04-06 16:32:00
"Later today, I will be leading a tweetstorm to bring attention to the importance of passing my bill, the Big Cat Public Safety Act. I hope you'll join me at 2 pm ET/1 pm CT and tweet using #BigCatPublicSafetyAct. https://t.co/cDiQSIEBiY",2020-04-06 15:31:11
Health Care workers are putting their lives at risk to save others. They are the true heroes of this pandemic and not enough thanks can be given to the millions of health care workers in this country. Please join me in honoring our health workers and wishing them the best health. https://t.co/V25rPSHuc8,2020-04-05 15:34:00
"“We cannot walk alone… We cannot turn back.” - Dr. Martin Luther King Jr. 
 
Even in times of crisis, we must remember that the fight for a better nation and world starts when we work TOGETHER.
 
Let us honor #MLK’s legacy by continuing his fight #ForThePeople. https://t.co/nrJokRBjRh",2020-04-04 18:25:00
"Small businesses in all 102 counties in Illinois are eligible for low-interest, economic injury disaster loans up to $2 million per business. If you are a small business and need to apply for a loan you can click here: https://t.co/r2nDEvPtWh https://t.co/pm7idUfn9W",2020-04-04 16:36:00
Emergency workers are on the front lines every day battling this virus. They continue to risk their lives for the betterment of the country and don't ask for anything in return. Please join me in thanking our emergency workers for their bravery and wishing them to remain healthy. https://t.co/SfetrBLH00,2020-04-04 14:33:00
The President is using the dark of night and a global crisis to try to hide his latest act of retaliation. Firing Michael Atkinson makes our intelligence community less independent and our country less safe. https://t.co/Qq4pX8Ves5,2020-04-04 04:12:43
We could not fight the coronavirus pandemic without the hard work and dedication of our paramedics. Please join me in thanking our city's newest first responders. We need them now more than ever. We are more grateful now that ever before. https://t.co/3lYPAVB4jE,2020-04-03 21:38:00
Has your business suspended operation because of limited commerce due to COVID-19? An #IRS credit may help you keep your employees on your payroll.  See FAQs on the Employee Retention Credit at https://t.co/kqYwzTPPFQ #COVIDreliefIRS,2020-04-03 20:28:00
"The State Department is recommending that all U.S. citizens abroad should return home immediately. If you are a citizen abroad, my website lists resources available for Americans abroad. https://t.co/bH4WXWuxlu",2020-04-03 19:24:00
"I recently talked with @MeghanKluth (spoiler alert: she's my daughter!) on her podcast to discuss the coronavirus pandemic and what Congress is doing to combat it. If you want to listen to the interview, check it out at the link below! https://t.co/rwv0tumRJY",2020-04-03 18:28:00
"Today, I introduced a bill to track dangerous gun proceed sales during this pandemic. By having the FBI report these statistics, we can help prevent prohibited individuals from easily accessing guns and posing a danger to our communities. https://t.co/25Y2HWQAJh",2020-04-03 17:59:54
"With the abrupt transition from in-person classes to remote learning in schools, teachers and students are navigating new ways of education and learning together. I want to thank teachers for their continued dedication and ingenuity during these times. https://t.co/dMbtHn4BFf",2020-04-03 17:26:00
