tweet,dates
"The bipartisan #coronavirus funding bill will deliver necessary resources to combat the spread of #COVID19. I will continue working to ensure that Congress provides the resources our federal, state, and local governments need to keep families in Utah and across the country safe. https://t.co/EEAbYZmnoc",2020-03-05 19:38:52
"China uses its Belt and Road Initiative to invest in global mineral production, leaving developing countries beholden to the CCP. My Energy Bill amendment would rein in China's economic aggression by establishing a mechanism to monitor these investments. https://t.co/uUFEyLW57g",2020-03-05 17:29:36
"Threats to our cybersecurity are a direct threat to our national security. It's concerning that the budget for @CISAgov proposes significant cuts. Given the cyber-attacks coming from hostile actors, we should heavily invest in the reinforcement of our critical infrastructure. https://t.co/0Xl1UtmF5D",2020-03-05 15:13:31
"We must work to continue securing our southern border, while making E-Verify mandatory nationwide. E-Verify is essential to turn off the magnet that draws people into the country illegally in the first place. https://t.co/KjmRqKPhva",2020-03-04 23:16:02
"It’s been 20 days since we raised this exact concern to @FDATobacco Director Zeller. Flavored e-cigarettes are still on the market, addicting our kids to nicotine. The @US_FDA must put the health of our children ahead of tobacco companies’ profits and eliminate vaping flavors. https://t.co/ZyJIC0xQ4g",2020-03-04 21:41:57
"The UK’s decision to incorporate Huawei into its 5G network invites the CCP into the infrastructure of a critical ally. My colleagues and I urge the @HouseOfCommons to revisit this decision given the security, privacy, and economic threats posed by Huawei. https://t.co/voPDfgQzwl",2020-03-04 17:00:07
"The members of the Utah National Guard embody our state’s core values of patriotism and dedication to service. It was an honor to meet with Brig. Gen. Michael Turley, who took command of the @UTNationalGuard in November, and other leaders from Utah’s Army and Air National Guards. https://t.co/mvUk9mxgtV",2020-03-04 15:40:08
"Utahns—recommend you follow @UtahCoronavirus for updates from our state’s Coronavirus Task Force. The latest #coronavirus information from state leaders, as well as #COVID19 updates from the @UtahDepOfHealth, @UtahEmergency, @CDCgov, and more will be accumulated there.",2020-03-03 22:55:27
Our government must partner with pharmaceutical companies to produce a large number of #Coronavirus vaccines once a viable vaccine is found. We can’t rely on countries like China for the manufacturing of pharmaceutical products that are critical to our national security. https://t.co/a6cCVCrGJU,2020-03-03 21:05:32
Time-tested advice still holds true: The easiest way to protect yourself and those around you from catching and spreading viruses is to wash your hands and cover your mouth when sneezing and coughing. https://t.co/3g5K9CabRb,2020-03-03 19:42:38
"Appreciate the efforts of our public health community to slow the transmission of the #Coronavirus. But I’m concerned that only 10% of necessary equipment for medical professionals is stockpiled. Going forward, Congress must better prioritize and prepare for situations like this. https://t.co/3H7jz4ohae",2020-03-03 18:51:13
"State-sponsored, forced labor camps that support global brands like @Nike and @Apple. Absolutely horrifying. Protecting human rights is far more important than protecting profit. The world—including business leaders—cannot turn a blind eye toward China's treatment of Uyghurs. https://t.co/04CSKgbOmr",2020-03-02 18:45:18
An authoritarian China is perhaps the single greatest threat to freedom around the world. Tune in as I discuss the importance of linking arms with our allies to confront growing Chinese aggression with @AndersFoghR at the @UofDenver’s @JosefKorbel School. https://t.co/3YSLVdGz0c,2020-02-29 01:05:59
"Spent the afternoon at the Utah State Capitol to provide legislators with an update on top priorities in the Senate. We discussed ways to address our national budget and debt, lower health care costs for Americans, and confront the growing rise of China. https://t.co/FUYbOTDELc",2020-02-28 21:49:51
Utah's booming economy makes our state a great place to start a business. Enjoyed sitting down with @SiliconSlopes Executive Director Clint Betts and @DomoTalk's Josh James to discuss how we can best continue supporting Utah's growing startup and tech community. https://t.co/Fze8qim2oP,2020-02-28 18:37:46
"Silicon Slopes is home to Utah’s burgeoning tech industry. One of these success stories is @PodiumHQ—an interaction management platform for local business. Stopped by its Lehi headquarters this morning to discuss the threat China poses to American businesses, trade, and more. https://t.co/aqaChpV1yI",2020-02-28 17:37:26
"Utah’s economy is thriving—our state has 3 cities on the @MilkenInstitute ""Best-Performing"" list! Provo-Orem was ranked #2 for large cities, while Logan &amp; St. George were ranked #3 and #4, respectively, for small cities. Great news for the Beehive State! https://t.co/ybT2Ot4g9m",2020-02-27 17:22:43
.@US_FDA’s January Guidance on vaping falls short of protecting youth and the public health. @SenJeffMerkley and I met with the FDA to discuss solutions to close the glaring gaps with regard to types of flavored devices still allowed on the market. https://t.co/j3DYLkyRhZ,2020-02-26 19:21:50
"We’re about to vote on two pieces of legislation: A bill prohibiting abortions after the 20-week mark; the second, ensuring any child that survives an abortion would receive necessary medical care. These bills are crucial to protect the lives of our children, born and unborn. https://t.co/iYFHlkKtuU",2020-02-25 20:39:43
Go Cougs! https://t.co/vVTyVZOZO3,2020-02-23 15:56:40
I spoke about the need for the U.S. to partner with our allies to pressure China to play by the international rules of free trade at @MunSecConf. China's current course of confrontation and attack on the economies of free nations cannot be allowed to stand. https://t.co/Jt3JirDxqK,2020-02-21 20:16:46
"China engages in cowboy capitalism—attacking the economies of free nations through predatory pricing, cyber theft, forced technology transfer, and more. I spoke at @MunSecConf about the threat China poses to international free trade. https://t.co/iJ481aTKHe",2020-02-21 18:55:55
"An informed electorate and an elevation of our civil discourse can only strengthen our society. It was a pleasure to sit down with @ChrisEvans and @MarkKassen to discuss the need for U.S. global leadership, our nation’s debt, and climate change for their project, #AStartingPoint. https://t.co/AhHsrvOCDs",2020-02-19 16:38:15
"Many communities across Utah have been affected by devastating wildfires over the last several years. @BLMnational’s announcement for funding of 11,000 miles of fuel breaks across western states, including Utah, is good news for preventing the spread of these wildfires. https://t.co/JN92GJzC8g",2020-02-18 15:31:49
Live now→ I'm discussing the global trade environment at the @MunSecConf. Tune in: https://t.co/PqPv69bkY2,2020-02-14 16:42:14
"150 years ago today, Seraph Young became the first woman to vote in Utah. It would be another 50 years until the 19th Amendment extended voting rights to women throughout the country. Utah women led the way—and we invite you to join us in honoring these remarkable visionaries. https://t.co/FH4FBTz1cN",2020-02-14 13:46:04
"Tomorrow marks 150 years since Utahn Seraph Young became the first woman to vote in the U.S. under equal suffrage law. Women and their experiences are a vital part of Utah's history. To all the women who have led and who continue to lead by example, we thank you. https://t.co/GJ53Rp6lgm",2020-02-13 21:20:32
Applaud @NatResources for advancing our legislation to provide water to the Navajo Nation and the people of Utah in a way that is good for everyone. There's no reason to wait any longer—our bill should be brought up for a vote in the Senate without delay. https://t.co/A1sqWO47HS,2020-02-12 20:25:21
"Russia has learned from Iran—using proxy actors, unbeholden to any higher power, to carry out nefarious activities while claiming plausible deniability. Our US-Libya strategy must address Russia’s use of mercenaries to achieve their malicious foreign policy goals. https://t.co/DZkImLiX5p",2020-02-12 19:48:33
"The Administration must unequivocally communicate its posture toward Libya on the global stage, at a time when Libya's civil war poses a threat to US interests. Clarifying the US-Libya strategy, including defining who our friends are, will help protect our regional interests. https://t.co/ZvZSGK71Gh",2020-02-12 18:38:10
The Equifax hack is yet another example of China's commitment to data theft. A warning to our allies: remember the inherent threat that accompanies incorporating Chinese technology into your infrastructure. https://t.co/0JeBTnc1pn,2020-02-10 16:27:15
My thoughts on today’s impeachment vote → https://t.co/Tk1OJWnEdc,2020-02-05 18:55:21
"At approximately 2:00 p.m. ET, I will be speaking on the Senate floor regarding the impeachment vote. You will be able to watch live on my Twitter feed, and also on the Senate’s official website: https://t.co/mlS6RtPeXb",2020-02-05 15:43:47
My statement on tonight's State of the Union address: https://t.co/i4cBEfucLr,2020-02-05 03:43:42
I’ll be joined by my friend and Utah Governor @GovHerbert for tonight’s #SOTU. I have admired and appreciated his leadership in our state and his dedication to serving Utahns. Honored to have him as my guest this evening. https://t.co/0uLHR8LrO6,2020-02-04 23:50:17
"In the midst of the Coronavirus, Taiwan’s exclusion from the @WHO greatly inhibits the ability for a coordinated, global response. This is yet another ploy by the CCP to isolate Taiwan from the global community.",2020-01-31 15:49:43
Learn more about the Andersens’ story and ways to avoid falling victim to Social Security impersonation scams: https://t.co/PVXxJWTIv7,2020-01-30 16:37:42
Machel and Kyle Andersen from Weber County testified in front of the @SenateAging Committee about their experience with the Social Security impersonation scam. Grateful the Andersens are sharing their story to help others avoid falling victim to these ruthless scammers. https://t.co/FQPLoNxxr5,2020-01-30 16:36:48
The questions I have submitted for the Q&amp;A period of the Impeachment Trial: https://t.co/JTHlKJfcNN,2020-01-29 18:46:11
"Families should be able to choose the school that best meets their child’s needs, whether it be public, charter or otherwise. Pleased to cosponsor the Senate’s National School Choice Week resolution, affirming that parents know what's best for their child. https://t.co/Syi3IwFxBh",2020-01-29 16:18:49
