tweet,dates
"Today, we celebrate the 75th anniversary of the Nazi surrender to the Allied Forces. Throughout World War II, the Allied Forces fought to liberate a continent and protect the freedoms we hold most dear. May we always remember the sacrifices of the Greatest Generation. #VEDay75 https://t.co/ThPQmEHj9b",2020-05-08 18:55:34
.@GovHerbert—my team and I wish you a Happy Birthday! https://t.co/VfHdkhK0I4,2020-05-07 19:21:57
"If we want to get serious about opening up our economy while keeping Americans safe, we need clear, comprehensive, and real-time data about the spread and infection rates of #COVID19. This data is critical to guide re-opening plans, especially if a second wave is expected. https://t.co/hE8HA7or4q",2020-05-07 17:01:11
"Increased #COVID19 testing is required to help get our economy re-opened while keeping Americans safe. Live now at @GOPHELP, we’re hearing about our country’s efforts to create new technologies that are being designed to produce millions of COVID-19 tests. https://t.co/sLX989Q5hq",2020-05-07 14:21:32
"Thank you, @SecBernhardt, for working with local Garfield County officials to ensure Utahns can enjoy @BryceCanyonNPS again. To echo @GovHerbert, if you’re visiting Bryce Canyon, be sure to maintain social distancing and adhere to any guidance given by park officials. https://t.co/4PUNXNsizN",2020-05-06 21:35:42
China uses its influence in international organizations to pursue its predatory path on the world stage. My @SenateForeign colleagues and I are introducing legislation to bring more transparency and accountability to US investments in these organizations. https://t.co/g2nL5pKX1s,2020-05-06 20:50:11
"On #NationalNursesDay, I'd like to recognize Utah’s nurses for their efforts to help save lives not just in our state, but across the country. To all those who are working tirelessly to care for our sick—we couldn't get through this without you!
https://t.co/CfaWBAVfri",2020-05-06 17:28:02
"To the students graduating from colleges and universities across Utah—congratulations! While I know your final semester, and graduation, look a lot different than you imagined, you should be proud of this great accomplishment. To the class of 2020: Well done, and congratulations! https://t.co/DiC0cW7HqI",2020-05-05 16:53:50
"Every day, our essential workers risk their safety for the health and well-being of our country. I’m introducing #PatriotPay to help compensate the essential workers on the frontlines of #COVID19. These unsung patriots deserve our unwavering support. https://t.co/NCznX3VgVc",2020-05-04 22:26:06
"Live soon→ I’ll be on @KSLNewsRadio discussing my #PatriotPay proposal to help ensure America’s frontline workers are rewarded for keeping us safe, healthy, and fed during #COVID19. Tune in: https://t.co/MMS8trls0Q",2020-05-04 20:10:55
"Update on round 2 of @SBAgov’s #PaycheckProtectionProgram loans approved for Utahns:
 
✅21,751 employers
✅$1,676,852,890
 
This brings Utah’s total #PPP numbers to:
✅43,008 employers
✅$5,372,252,349
 
We must continue helping small businesses retain employees and stay afloat.",2020-05-04 18:48:02
"America’s frontline workers are keeping us safe, healthy, and fed during the #COVID19 crisis. #PatriotPay would make sure they’re rewarded for it. https://t.co/NCznX3VgVc",2020-05-01 19:27:54
I’m introducing #PatriotPay because our essential workers—those putting themselves in greater risk on the frontlines of #COVID19—deserve our unwavering support. For more information on my plan to help ensure essential workers receive greater compensation→ https://t.co/NCznX3VgVc,2020-05-01 17:26:50
An amazing sight by the @F35demoteam. There are not enough words to thank Utah’s health care workers—individuals taking great risks to care for our sick. We appreciate you and are keeping you in our prayers. https://t.co/LXiPwhyRvN,2020-04-30 19:32:11
"Men and women across Utah are stepping up in the midst of the #COVID19 crisis—health care workers, farmers, delivery drivers, mail carriers, grocery store employees. To all workers deemed essential—thank you! We will get through this because of you and your heroic efforts. https://t.co/WrP2yFha4R",2020-04-30 18:53:28
"China’s main objective: become the global superpower militarily, economically, and geopolitically. To stop the spread of China's authoritarian reach, free nations must link arms and offer a choice: Abide by the global order or lose access to our markets. https://t.co/YUB1XdrrpO",2020-04-29 15:04:49
"The #COVID19 pandemic originated in China, and through cover-up efforts, the virus became global. Attitudes toward China have changed by virtue of this pandemic. America must partner with likeminded nations to counter China’s objectives and aggression. https://t.co/YUB1XdrrpO",2020-04-28 16:15:13
Proud to see folks come together to help their fellow Utahns! We’re all in this together. https://t.co/nSgvdr2mxg,2020-04-27 20:51:04
"More than 21,000 Utah employers leveraged @SBAgov’s #PaycheckProtectionProgram to help keep Utahns employed before the funding ran out. This vital #COVID19 relief program restarts today and I encourage small businesses across Utah to apply for these forgivable loans. https://t.co/6n5SF5U8MQ",2020-04-27 16:51:46
"This morning, small businesses will see the restart of @SBAgov’s #PaycheckProtectionProgram. I encourage employers in Utah to take advantage of these forgivable loans to help keep their doors open and help Utahns stay employed. To learn more: https://t.co/6ToIdzEFKk",2020-04-27 14:30:42
".@WHO appears to have shown remarkable deference to the Chinese government throughout the #COVID19 global pandemic. The @UN must immediately convene an independent panel of experts to review and assess the WHO’s pandemic response, and recommend reforms. https://t.co/YntgdUjzUh",2020-04-24 19:58:18
"Local radio, tv broadcasters, and newspapers play an integral role in keeping communities informed—especially during this time. We're urging federal agencies to utilize these local news outlets to reach folks in all corners, while helping them stay afloat. https://t.co/1xfi3ADYOm",2020-04-24 17:56:35
"Utah consistently punches above its weight—and utilizing the #PaycheckProtectionProgram has been no different. Proud Utah employers have leveraged these loans to keep Utahns employed, allowing us to have one of the lowest unemployment rates in the country. https://t.co/VPqOmwiZgs",2020-04-24 16:47:50
Pleased to see the additional @SBAgov funding for the #PaycheckProtectionProgram loans pass in the House. This relief package is critical to ensuring workers keep receiving paychecks and expands #COVID19 testing efforts. https://t.co/cgRuKmJIjd,2020-04-23 22:21:23
".@CDCgov has put significant effort toward data collection and sharing in the midst of the COVID-19 pandemic. But, despite having a world-class public health system, the lack of comprehensive, real-time #COVID19 data has hindered our ability to monitor and mitigate its spread.",2020-04-23 21:16:03
#COVID19 has exposed China's dishonesty for the world to see. America must lead like-minded nations in developing a unified strategy to counter China’s predation and corruption. https://t.co/gJchtn4Ioa,2020-04-23 20:45:27
"The cancellation of in-person school years across the country has been hard on students, teachers &amp; parents. I participated in a Q&amp;A with Herriman HS AP Government students during a virtual class session. They asked some impressive questions—check it out: https://t.co/qhbZiNoAhk",2020-04-23 18:01:59
"The beauty of Utah’s public lands are unmatched. On #EarthDay, we celebrate these places and the love Utahns have for them—recognizing that no one has a more vested interest in ensuring their health than those who call them home. https://t.co/qUtR7bxb8x",2020-04-22 21:30:53
The Social Security and Medicare Trustees annual report released today outlines a disturbing reality—Medicare will become insolvent in the next 6 years and Social Security will be in the same boat by 2035. All of this before the impacts of #COVID19 are even assessed. https://t.co/aPNLOgPKmp,2020-04-22 20:00:36
"I applaud the Senate’s passage of additional funding for small businesses, their workers, and public health this afternoon. This package will restart the #PaycheckProtectionProgram and affirms that our farmers and ranchers will qualify for these loans. https://t.co/tUKGK3Ev4V",2020-04-21 23:12:18
The #PaycheckProtectionProgram was created to get @SBAgov loans out quickly—to help the millions of Americans that were about to be put out of work. Congress must work together to replenish this vital loan program. https://t.co/byM882Okta,2020-04-21 18:41:38
Congress needs to get more #PaycheckProtectionProgram loan funding to our small businesses. We must do our part to provide additional relief to these workers and employers. https://t.co/UsOkX8uvXZ,2020-04-21 17:18:57
Our small businesses need help and they need help now. Participated in tonight’s @SiliconSlopes Town Hall to discuss the status of negotiations on more #PaycheckProtectionProgram loan funding. Congress must come to an agreement &amp; replenish these funds now. https://t.co/rOtvbTeI6b,2020-04-21 00:28:46
"Update on Utah's approved #PaycheckProtectionProgram loans before funding ran out:

✅21,257 Utah employers

✅$3,695,399,459

Congress must immediately help replenish these @SBAgov funds. Our workers and our small businesses can't afford to wait out political games.",2020-04-17 19:56:12
Emergencies demand emergency action: the Paycheck Protection Program for employees of small business is NOW out of money. Dems should immediately agree to replenish these funds so we can get urgent help to workers.,2020-04-16 14:08:38
We must do all we can to help our agricultural industry survive the #COVID19 crisis. Live soon→ I’ll be on @KSLnewsradio discussing our call to @USDA that it assist dairy farmers in Utah &amp; across the country to prevent a collapse in milk prices. Tune in: https://t.co/MMS8trls0Q,2020-04-15 20:06:19
Heroes. Incredibly proud of these Utah health care workers for stepping up to help save lives across the country. New York is lucky to have you. Praying for your safety. https://t.co/fn04PktDVz,2020-04-15 13:22:15
"#COVID19 has left Utah's dairy farmers with excess product and few, if any, ways to get products into the hands of consumers. We're urging the @USDA to assist our dairy industry so a stable food supply is available at reasonable prices now &amp; in the future. https://t.co/RD0hNkYB5m",2020-04-14 20:36:59
"Update on Utah's approved #PaycheckProtectionProgram loans:
 
✅12,914 Utah employers
✅$2,617,066,864
 
This is great news for our small businesses. However, this money is quickly running out. I urge my colleagues to come together to get @SBAgov more money for these loans. https://t.co/hOvnjcz2tR",2020-04-14 19:59:56
Farmers and ranchers in Utah are facing devastating consequences from #COVID19. Wade is a rancher from Sanpete County and a @UtahFarmBureau board member. What he's discussing here is sadly a reality for many Utahns: https://t.co/3AE7ZgCK71,2020-04-14 14:38:19
"Attention media and pundits: CARES Act is a rescue/relief package, not a “stimulus.” It’s an emergency measure to help people in need, keep people in jobs, boost unemployment checks, save hospitals, shore up states. A shuttered economy can’t be “stimulated”—that will come later.",2020-04-13 16:14:09
"To the delivery drivers, grocery store employees, mail carriers, restaurant workers—all the heroes helping during this difficult time—thank you! Particular thanks to our health care workers who are taking big risks by caring for the sick. You and your families are in our prayers. https://t.co/OWLqTtZjYw",2020-04-11 14:25:39
#COVID19 has exposed gaps in our nation’s capacity to respond to a pandemic. Establishing a health security council and creating a new NSC position to develop and implement global health strategies will better prepare us to address future health threats. https://t.co/oT2fJqMMTI,2020-04-10 18:16:24
"If you are eligible for the $1,200 Economic Impact Payment, but do not normally file taxes, the IRS has created a portal to collect the necessary information to determine eligibility and payment amount to send you your check. The form is available here: https://t.co/UUADcidKSx",2020-04-10 17:02:57
It is well-documented that wet markets in China have been the source of a number of worldwide health problems. We are urging China to immediately cease the operation of these markets to protect the international community from additional health risks. https://t.co/qWJniOYHRw,2020-04-09 22:32:50
"As of last night, 3,489 Utah employers have received $718,878,690 through the #PaycheckProtectionProgram—forgivable loans to ease the burdens of #COVID19. As the Senate continues work on further relief measures, I will keep pushing for additional support for our small businesses.",2020-04-08 20:37:59
It's critical that we help small businesses weather the #COVID19 pandemic—they are the backbone of the American economy. Live soon→ I’ll be discussing the resources currently available to small businesses with @D2KSL on @KSLnewsradio. Tune in: https://t.co/MMS8trls0Q,2020-04-07 16:27:01
Live soon→ The @UUtah webinar to help Utah businesses navigate the #COVID19 health and economic crisis. I’ll be sharing some best practices for crisis management based on my experience running the 2002 Olympic Games and my years in the private sector: https://t.co/v79OcmZ7sA,2020-04-03 16:51:21
"Together, we can #CrushTheCurve! Visit https://t.co/4qr0gy01z7 to help our state assess, test, and stop the spread of #COVID19. I nominate @BYU President Kevin Worthen, @RuthVWatkins, @UVU_President, and @Krommenhoek for the #TestUtahChallenge. https://t.co/8uVvi0HKMy",2020-04-03 15:40:19
"Businesses in Utah are struggling due to #COVID19. I encourage Utah business owners to register for the free @UUtah webinar ""Navigating COVID-19: How to Save Your Business"" today at 11am MDT. I'll be sharing some best practices for crisis management:
https://t.co/ELhla0Froc",2020-04-03 14:29:38
"Utahns currently abroad—if you want to be repatriated to the United States during the #COVID19 crisis, it’s urgent that you register with the @StateDept's STEP program. This is your best opportunity to get on a government-organized flight back to the US: https://t.co/LnUzD7ncSQ",2020-04-02 22:28:42
"Our nation's doctors—and all health professionals—are heroes during normal times, but nothing compares to what we've witnessed during this pandemic. To every doctor in Utah and across the country—thank you for working tirelessly to treat and care for patients. #NationalDoctorsDay",2020-03-30 17:48:22
"I applaud the House for coming together to pass our #COVID19 relief package. Congress and the Administration must continue working together to support or medical personnel on the frontlines, stabilize our economy, and provide relief to workers, families, and businesses.",2020-03-27 19:13:06
"The Senate's #COVID19 relief package provides support for hardworking Americans, families, and businesses. A summary of the CARES Act, as well as coronavirus resources and guidance for Utahns, can be found on my website: https://t.co/42K1FbU7N4",2020-03-26 16:48:22
"While I wish I were there tonight to cast my vote for the #COVID19 relief package, I'm pleased my colleagues got it across the finish line. Workers, families, and businesses are a step closer to critically needed resources. I implore the House to pass this bill without delay. https://t.co/ofphVXIGiu",2020-03-26 03:49:51
"We can't afford to wait any longer to send relief to those who need it. The Senate’s #COVID19 relief package supports workers, families, and businesses across the country. The Senate and House should pass this bill now and get it to the President’s desk. https://t.co/hXc3Auv0Zp",2020-03-25 20:35:12
"Pleased the Senate has reached agreement on a #COVID19 relief package and that it includes several provisions I pushed for—including direct cash relief for Americans, grants and loans for small businesses to keep their employees, and an expansion of unemployment insurance.",2020-03-25 13:01:02
People need help and they need help now. Congress needs to get this #COVID19 relief package done. https://t.co/jxp5qdsMej,2020-03-24 16:37:22
"Congress needs to come together NOW to provide relief to the small businesses, families, and workers that are struggling as a result of the #COVID19 pandemic. Live soon→ I’ll be on @fox13 to urge my colleagues to get this relief package done. Tune in: https://t.co/mldPPe9NCv",2020-03-24 15:05:08
"Participated in tonight’s @SiliconSlopes town hall, discussing the status of the Senate’s #COVID19 relief package. It’s important that Congress comes together NOW to provide relief for the small businesses, workers, and families that are struggling as a result of this pandemic. https://t.co/Ic5648okn9",2020-03-24 01:27:07
The Chinese Communist Party is spreading dangerous &amp; dishonest claims that the US is responsible for the #COVID19 pandemic—a pandemic that originated due to its own incompetence. We're asking for the creation of a NSC task force to counter this propaganda. https://t.co/R6M9lQdruY,2020-03-23 22:49:09
"Our economy is in distress. This #COVID19 relief package is about keeping people employed—to help companies, large and small, maintain payroll. Spoke with @D2KSL this morning about the need to help businesses and families meet urgent financial obligations. https://t.co/8r6uGq5m64",2020-03-23 21:12:50
Live soon→ I’ll be discussing the latest federal #COVID19 response efforts with @D2KSL on @KSLnewsradio. Tune in: https://t.co/MMS8trls0Q,2020-03-23 15:53:36
Senator Romney’s office issued the following statement: https://t.co/tBSx03ZlTr,2020-03-22 21:14:31
"Proud to see Utah’s tech entrepreneurs stepping up to help our small businesses during the #COVID19 crisis. Utahns—if you’re able to, I hope you consider supporting our local economy by ordering takeout or delivery to continue supporting local restaurants. https://t.co/rNnSPrRRxP",2020-03-21 19:52:46
"Locally-owned hair salons &amp; barber shops, stores, dry-cleaners, you name it—small businesses across Utah are suffering due to #COVID19. I encourage everyone who is able to support the businesses that are so crucial to our economy during this difficult time.",2020-03-21 17:43:09
"Utah restaurants—if you’re offering curbside, takeout, or delivery services during this time, I encourage you to register at https://t.co/dEvEhDloD7. Utahns—check out the site to support restaurants in your community if you're able to. https://t.co/yo2LHQmCc1",2020-03-21 16:19:33
"Small businesses are the backbone of the American economy &amp; the bedrock of our communities. If able, please consider:
1. Buying gift cards from local stores/restaurants for future use
2. Ordering takeout/delivery from local restaurants
3. Purchasing goods from local stores online",2020-03-21 15:19:49
Students who are now graduating from college are suddenly facing significant hurdles entering the workforce due to #COVID19. My bill would allow students who graduate this year to defer their federal loans for up to 3 years. https://t.co/GUZWjG1OdK,2020-03-20 23:22:50
"I know there’s a lot of #COVID19 information out there. If you have any questions about the federal coronavirus response efforts, please comment below. I will take your questions and answer what I can in a subsequent video.",2020-03-20 21:05:49
"Americans urgently need cash to meet immediate needs, that’s been my goal from the start. The current bill has promise but it shouldn’t give lower earners smaller checks —that’s directly contrary to my proposal. We need to fix this to ensure lower earners get equal payments.",2020-03-20 00:51:42
This is good news. I echo the Administration’s request that Michael White and all Americans wrongfully detained by Iran are immediately released. Let’s bring them home. https://t.co/UOkbsn84S6,2020-03-19 17:48:47
"With the economy shutdown due to #COVID19, we must immediately strengthen our Unemployment Insurance system. That means extending how many weeks one can receive benefits and broadening the eligibility to include furloughed workers, the self-employed, and independent contractors.",2020-03-19 17:03:12
"Appreciative of the over 150 Utah mayors &amp; commissioners who spoke with me yesterday so I could get a better sense of the needs of Utahns &amp; local businesses in this time. We're urgently working to bring additional economic relief to American workers, families &amp; small businesses.",2020-03-19 16:22:02
Live soon→ I'm joining @HughHewitt to discuss the federal response efforts to combat #COVID19. Tune in: https://t.co/7jy0ym4m1o,2020-03-19 11:22:41
"Grocery stores—Good idea to have “seniors only” shopping for an hour or two first thing in the morning. Keeping seniors free of #COVID19 is in everyone's best interest! Appreciate your efforts @HarmonsGrocery, @MySmithsGrocery, @Target, @Walmart, @DollarGeneral, and others. https://t.co/82JxE99arV",2020-03-18 21:07:16
"Pleased the #COVID19 response package passed the Senate in a bipartisan manner. Now, we must urgently act on additional measures to provide economic relief for working Americans &amp; families, protect health workers &amp; patients, boost small businesses, and help secure our economy. https://t.co/TBzFAu0JsQ",2020-03-18 20:12:20
"This is good news! Utah company Co-Diagnostics just received @US_FDA approval for its #COVID19 test—allowing them to produce 50,000 tests per day out of Salt Lake City. Proud to see a Utah company doing its part to increase our country’s testing ability. https://t.co/I4nR9IojtO",2020-03-18 17:18:53
".@SBAgov has approved the entire state of Utah as a “disaster area,” allowing small businesses across our state that have been affected by #COVID19 to apply for disaster relief loans. Information can be found here: https://t.co/jMlL0RkZEg",2020-03-18 16:34:26
"Much of Utah felt the 5.7 magnitude earthquake this morning. In the midst of #COVID19, this only heightens anxiety but it’s important to stay calm, follow proper safety measures and listen to local officials. Crews are assessing damage so please avoid downtown SLC and airport.",2020-03-18 14:46:17
"Applaud @spidadmitchell for using his platform to urge folks to practice strict social distancing. If you feel fine, you could still be spreading #COVID19! The coronavirus is highly contagious, even before symptoms present. Look forward to seeing you back on the court, Donovan! https://t.co/xi3NVWIIEu",2020-03-18 00:33:48
Congress is going to get help to the people who need it. We’re going to get help to American families and workers. We’re going to get help to businesses that have been dramatically impacted. We’re not going to leave here until we get the job done. And we will get the job done. https://t.co/F842077gdr,2020-03-17 21:19:30
Encouraged to see leaders coming together around actions that will lift up Americans. This will help provide a little certainty to families and workers in this challenging time. https://t.co/SebQCKFMAZ,2020-03-17 17:51:26
"While the Senate should act swiftly on the House relief bill, we also need to work urgently on additional #COVID19 response measures to help families and small businesses. My proposals: https://t.co/62YevTMgCI",2020-03-16 16:40:36
".@DHSgov has issued additional guidance for Americans returning from Europe and other countries affected by the Administration’s travel restrictions. Americans must travel through 1 of 13 airports, and go through additional screening measures. More info: https://t.co/D8Tvcxuot0",2020-03-14 16:54:22
"The outbreak of #COVID19 highlights our reliance on foreign-manufactured pharmaceuticals and the risk it poses to our national security. We need a strategy to safeguard our medical supply chain, preventing a sole reliance on China for critical supplies. https://t.co/n4GnZOw4VD",2020-03-13 16:31:59
"We're facing a serious health crisis, and Utahns shouldn’t have to choose between a paycheck and protecting their health. I’m teaming up with a bipartisan group of colleagues on a bill to provide assistance to those unable to work due to the #Coronavirus. https://t.co/7gs0Vyrko6",2020-03-12 18:06:54
".@SenMikeLee and I are seeking additional information from the @StateDept and @DHSgov regarding specific guidance for Utahns and family members of Utahns who are currently abroad and wish to return to the U.S. In the interim, our offices recommend: https://t.co/YCT6aGT44q",2020-03-12 12:58:39
"It was an honor to hear Caesar’s story at @SenateForeign this morning. I am moved by his courage—risking his life to expose Assad’s atrocities toward the Syrian people. I encourage you to take a few minutes to read his story:
https://t.co/3tdMwe1fzG",2020-03-11 17:44:01
It’s encouraging to see employers take commonsense steps to ensure hourly workers don’t have to choose between paying their bills and staying home to keep themselves and others healthy. https://t.co/h7y0D3aAYq,2020-03-10 19:46:55
Great to catch up with @RepJohnCurtis this afternoon to discuss ways we can continue working together to tackle Utah priorities. https://t.co/hYEgZVqs6M,2020-03-09 22:31:20
"It’s unacceptable that adversaries like Russia and China have more assets than we do in the Arctic. I urged @DHSgov Acting Secretary Wolf to prioritize providing our @USCG with increased security equipment, such as polar icebreakers. https://t.co/ZXk5jWz83X",2020-03-06 18:26:44
