tweet,dates
"We already know President Trump's border wall is reckless and fueled by bigotry. Building it during a pandemic—and putting workers' health at risk in the process—makes it even more shameful. 
https://t.co/sb7S4JDPnV",2020-04-24 18:50:00
".@USTreasury giving non-filers 48 hours to fill out the form required to receive their direct payment for their children is unreasonable. The Department needs to find another way to ensure these families get the full federal assistance they're entitled to.
https://t.co/QW7eFZsUXX",2020-04-24 17:36:52
"As coronavirus continues to take a toll on so many in WA, I'm fighting in Congress to make sure the next relief package addresses the diverse needs of all of our communities.

Today I spoke with leaders in the Puget Sound region about their specific and unique needs. https://t.co/nLKu682yza",2020-04-23 23:59:45
"OSHA is tasked with ensuring workers' safety &amp; health while on the job—&amp; its refusal to issue an Emergency Temporary Standard due to coronavirus is concerning &amp; dangerous. I cosponsored a bill to require OSHA take action to protect workers in this crisis.
https://t.co/L9kGd2cQen",2020-04-23 21:30:00
"Making sure testing is fast, free, and everywhere is essential to re-opening our communities. The latest coronavirus package made needed steps to invest in testing and require a national plan to ramp it up, but we can’t stop there. 
https://t.co/H8nO2G7Dj0",2020-04-23 20:07:00
"Families in WA and across the country are being forced to make impossible financial decisions because of the coronavirus pandemic. I’ll keep pushing to make sure families &amp; workers are getting the support they need to get through this painful time.
https://t.co/zroleyyE9g",2020-04-23 18:05:00
"With the uncertainty of the coronavirus pandemic, we must take necessary precautions to protect our elections—and that means expanding #VoteByMail in every state.
https://t.co/6o0nVrB312",2020-04-23 16:45:00
"For too many students, families, and businesses in WA and nationwide, getting online isn’t easy.

The coronavirus has shined a light on the deep digital divide in our communities and highlights why we must push for #DigitalEquityNow.
https://t.co/F4WHsPrS57",2020-04-22 23:45:00
"The first coronavirus case was confirmed in WA state just over 3 months ago. Since then, local public health officials, doctors, nurses, &amp; so many more on the frontlines have been working around the clock to respond &amp; save lives.

Thank you to those who are sacrificing so much.",2020-04-22 22:25:00
"We need to be listening to experts and science, not pushing them aside. A global pandemic is not the time to shuffle personnel, or contradict and remove experts for wanting to do their job well. These reports are incredibly disturbing and I will be pushing for answers. https://t.co/KceFh09GCU",2020-04-22 21:39:24
"It's absolutely shameful that extreme politicians would take advantage of this crisis to push their anti-abortion agenda. Abortion is essential health care and these cruel, partisan attacks must stop.",2020-04-22 20:30:00
"For 50 years, #EarthDay has been an opportunity to reflect on the impact of our actions on the planet &amp; recommit to doing better. Even in the midst of a global pandemic, we must do our best to reduce harmful pollution, prevent climate change, &amp; protect our environment.",2020-04-22 19:45:00
"This is exactly why I fought to make sure the latest coronavirus relief package required a national testing strategy. My focus now is holding the Admin accountable for creating and implementing a plan that can actually monitor &amp; suppress the coronavirus. 
https://t.co/aYPxlfbEl5",2020-04-22 18:55:00
"Health and home care workers, grocery store workers, farmworkers, pharmacists and other essential workers are putting their lives on the line every single day. At the very least, they deserve necessary protections and premium pay.
https://t.co/GC0OIVXBY0",2020-04-22 17:10:00
"As we all work hard to slow the spread of the coronavirus, we have to be sure we aren’t leaving anyone or anywhere behind. Today I spoke with folks from Northwest WA about the support they need to get through this pandemic. https://t.co/TKBeDzE7Jq",2020-04-22 02:50:14
"The latest coronavirus package is an important step to help struggling small businesses &amp; hard-hit communities, but this is no time to lose focus or slow down. Families &amp; businesses still need help &amp; there is much more that Congress needs to do. https://t.co/91R80iGyVy",2020-04-22 00:36:00
"I’m glad we could reach a bipartisan agreement to provide $25B to expand testing, surveillance and contact tracing, and require the Trump Administration to develop a plan to increase testing capacity and address disparities. https://t.co/82k4O4sPGZ",2020-04-22 00:05:13
"The CARES Act includes much-needed resources that will bring relief to hospitals, workers, small businesses, and hard-hit families and communities nationwide. Visit my website to learn more. https://t.co/JxtioYF47j https://t.co/sK2eRxbTbB",2020-04-21 19:12:00
"I talked with @frontlinepbs about how families, communities, and leaders in Washington responded and adjusted to this uncertain time.
 
Tune in or stream tonight at 9pm EST / 6pm PST. #FrontlinePBS
https://t.co/D5s07SuXsR",2020-04-21 17:52:00
President Trump wants to demonize immigrants instead of addressing the crisis we're facing. This is a harmful distraction from his failed response. Get states more tests. https://t.co/fQ2oTgowfU,2020-04-21 16:35:15
"We need a national plan to ramp up our coronavirus testing capacity if we want to get back to something like normal. The Trump Administration has failed to take action, so I led @SenateDems to lay out a roadmap to get our country where we need to be.
https://t.co/7Qmg481I3b",2020-04-21 15:41:00
Last week I heard from folks across Washington state about the challenges they’re facing due to the coronavirus pandemic. These phone meetings have been critical to helping me fight every day as their voice in the other Washington. https://t.co/JwvGU2xKXh,2020-04-21 01:35:00
"I've been hearing from folks across Washington state about what they need during this pandemic, and how I can help. These conversations have been and will continue to be critical to me as Congress works on additional relief packages. https://t.co/dyhVzwT7sp",2020-04-21 00:27:00
"I spoke with @frontlinepbs about the coronavirus pandemic and how we've navigated this difficult time in Washington state. Watch the trailer here and tune in or stream tomorrow at 9pm EST / 6pm PST. #FrontlinePBS
https://t.co/D5s07SuXsR",2020-04-20 23:15:00
"We can't safely re-open our communities and businesses without dramatically ramping up coronavirus testing. With @SenateDems, I introduced a roadmap to get our country's testing capacity on track. https://t.co/xNLEfH9tV1 https://t.co/Otscelcllp",2020-04-20 21:25:00
"While there's so much more that needs to be done, federal student loan borrowers will have their payments paused from now through September due to the coronavirus pandemic.

Find out what help is available and more below. https://t.co/Ny75vIXDTx",2020-04-20 20:01:00
"My roadmap with @SenateDems will get our nation’s coronavirus testing capacity back on the right track and help us get safely back to some semblance of normal life.
https://t.co/YVLE72RN3d",2020-04-20 18:41:00
"If you or someone you know is struggling with navigating homelessness or housing insecurity during this crisis, there is assistance available. Learn more ⬇️
https://t.co/A4LBf8qe0g",2020-04-19 20:30:21
"Doctors, nurses, grocery store workers, farmworkers, postal workers, and more in WA and across the nation are the heroes of this pandemic.
 
As we continue our coronavirus response, ensuring these frontline workers get premium pay is the least we can do.
https://t.co/pzyIQ1aQzG",2020-04-19 18:19:35
"If your hours have been cut or you lost your job due to the coronavirus, you could be eligible for unemployment benefits—which have been expanded by the CARES Act.
https://t.co/6s7IeotCiZ",2020-04-18 23:15:00
"Before we can even consider safely re-opening our communities, we must dramatically ramp up coronavirus testing. I unveiled a roadmap to get testing back on track and make sure it’s fast, free, and available everywhere.
https://t.co/Zc5nffavQE",2020-04-18 20:05:00
"Every community in WA must have the resources to protect public health and address the coronavirus' economic toll on workers, families, &amp; small businesses.

Yesterday, I spoke with folks from across Southwest Washington about the health care and economic needs of the region. https://t.co/QoBWs6lZh4",2020-04-18 18:44:29
"I fought hard alongside @rosadelauro to make sure workers could stay home if they’re sick, without missing a paycheck. But the Trump Administration has twisted paid leave policies to narrow who is eligible. This is unacceptable and needs to be fixed.",2020-04-18 17:41:00
"On today's call, @SenateDems pushed VP Pence on testing &amp; got no answers. The Administration is still refusing to act with urgency to ramp up our nation's testing capacity—&amp; shifting blame onto governors is another attempt to point fingers rather than solve problems.",2020-04-18 00:02:57
"We have to make sure WA’s hard-hit smaller cities &amp; rural areas don't fall through the cracks as we work to stem the tide of the coronavirus pandemic. I’m pushing for legislation that will provide additional federal funding and support to do just that.
https://t.co/6Y1WhrTgXD",2020-04-17 22:05:00
"The Trump Admin’s continued issues ramping up coronavirus testing have put people’s lives at risk. I’m glad @OIGatHHS is heeding my call to investigate the Admin’s efforts to produce &amp; distribute test kits so we can get to the bottom of what went wrong.
https://t.co/Sh7QNN57S3",2020-04-17 20:45:00
"I’m demanding answers from the Trump Administration about its failures to manage the national stockpile and get states the supplies needed to slow the spread of the coronavirus and save lives.
https://t.co/I5beSbseqA",2020-04-17 19:25:00
No. You do. https://t.co/aFHm6GFICx,2020-04-17 18:32:26
"The Trump Administration’s early missteps and lack of urgency to ramp up coronavirus testing have put us way behind. If we want to get back to any semblance of normal life, we need to get back on track—and I laid out a plan to do just that. 
https://t.co/mOTJnCpUFN",2020-04-17 16:31:00
"Need assistance with child care?
Worried about being able to make your student loan payments?
Need help putting food on the table for you and your family?
 
Find answers to these questions and more on my coronavirus resources webpage ⬇️
https://t.co/4oc3zCY0Yt",2020-04-17 00:31:00
Let me be clear: ANY plan to safely re-open our country must include a national strategy to ramp up testing so states have the information they need. The Trump Administration needs to stop shirking its responsibility to address the issues at the heart of this crisis.,2020-04-16 23:25:53
"Right now, there are more unknowns than certainties with the coronavirus pandemic—and I’m working hard to make sure we’re taking the steps we need to be prepared for whatever comes our way. 
https://t.co/hktg6Z46Dj",2020-04-16 21:45:00
"It's a new low for the Trump Administration to use the cover of the coronavirus pandemic to quietly develop more cruel policies regarding children in its care.

I've got news for them—Congress is watching. https://t.co/5K0FJmrJPW",2020-04-16 21:05:00
"We all must continue doing our part to slow the spread of the coronavirus in our communities by staying home, washing our hands, social distancing, and more.
https://t.co/8ZOMVAt5vI",2020-04-16 19:35:00
"The coronavirus pandemic touches every part of our state, and I'm working to ensure that the specific needs of every region are understood and addressed as we work our way out of this crisis. That's why yesterday, I spoke with folks from across Central Washington. https://t.co/0MXUJWmUCW",2020-04-16 18:35:33
".@SecAzar must allocate CARES Act funds to those who desperately need it on the frontlines of this pandemic without delay. Congress didn't intend these funds to be used as a bandaid so President Trump can avoid taking steps to expand access to care.
https://t.co/QIXRG7mYdI",2020-04-16 17:45:00
"From the start of the coronavirus pandemic, the Trump Administration has failed to build up the testing infrastructure we need. Our country can’t wait—and now @SenateDems have a roadmap to ramp up testing nationwide.
https://t.co/AbmW2P4D1w",2020-04-16 16:33:00
"This new report highlights how President Trump’s early missteps regarding coronavirus testing put us behind, and his continued lack of urgency &amp; leadership mean we are still struggling to catch up. We need to act—and fast. 
https://t.co/K6P6txdqoy",2020-04-16 00:40:00
"Frontline workers are literally putting their lives on the line every single day to keep us fed, keep us healthy, and keep us safe.
 
Premium pay &amp; necessary protective equipment are the least that our country can do as this pandemic continues.
https://t.co/2Z75xH1jhc",2020-04-15 23:35:00
Spread the word: you can now track the status of your direct payment from the federal government—which might be delayed because President Trump wanted to put his name on it. https://t.co/i02ogXnaBB,2020-04-15 22:52:00
"Congress strengthened federal support for SNAP, food banks, and more due to the coronavirus pandemic. Learn more about how to apply for assistance and get the help you need to put food on the table during this tough time. https://t.co/WDJfKsyQpN",2020-04-15 21:30:00
"🚨REMINDER🚨
 
Due to the coronavirus pandemic, the deadline for filing taxes has been extended to July 15.",2020-04-15 20:45:00
This is a tragically wrong step—especially right now. It will hurt our ability to respond to this pandemic and future public health emergencies. President Trump needs to stop pointing fingers and focus on how to keep people safe and healthy.  https://t.co/2gdgJC96mB,2020-04-15 20:05:00
"I’m continuing to reach out and listen to people across WA about how Congress can better support workers and communities being directly impacted by the coronavirus pandemic and response—and yesterday, I spoke with folks across Eastern Washington. https://t.co/11wG1hmV0Z",2020-04-15 18:48:22
"Health experts have made clear if we want to end social distancing &amp; safely get people back to work, back to school, &amp; back to some semblance of normal life—we will need hundreds of millions of tests. We need to make sure testing is fast, free, &amp; everywhere.",2020-04-15 17:32:28
"The Trump Administration's delays and missteps have put us in this absolutely unacceptable situation.

Later today, I'll lay out a roadmap for how to dramatically expand coronavirus testing nationwide. Stay tuned for more. https://t.co/NEZNoZgLra",2020-04-15 15:58:00
"Attention: Washington state will receive over $58 million in federal funding from the CARES Act to support child care assistance for essential workers and payments to child care providers. 
https://t.co/XsmQVmdr4R",2020-04-14 23:10:00
"The Trump Administration needs to get its act together. States seeking help during this crisis shouldn't be left wondering who they need to talk with to get it. 
https://t.co/mgLVC9qWDS",2020-04-14 21:45:00
"Thank you to the workers on the frontlines of the coronavirus pandemic. You are true heroes—and I’m fighting for you, and thinking of you, your families, and the sacrifices you’re making every day. https://t.co/s5UvjfkpCw",2020-04-14 20:15:00
"For months, @SenatorCantwell &amp; I have heard from Washingtonians across the state and our Tribal Nations about the lack of supplies and testing kits. This is unacceptable. We need transparency &amp; a national, real-time, public-facing inventory of tests. 
https://t.co/qHrDEsYL5P",2020-04-14 19:12:00
"Congress passed a paid leave policy to make sure more workers can stay home if sick, and still get a paycheck—and now the Trump Administration is creating loopholes to undermine it.

I will keep fighting to ensure workers get the paid leave they need.",2020-04-14 18:15:00
"A) This is not a movie. B) People are dying. C) If you're a leader, step up and lead. https://t.co/2dBAaJ6FFT",2020-04-14 16:55:01
"No one should fear the color of their skin will affect whether they get the care they need &amp; deserve to have a healthy pregnancy—but in our country, that's too often a reality. 

This #BMHW20, let's recommit to ensuring every mother gets quality care. https://t.co/F8kbnqXhTZ",2020-04-13 23:15:00
"The racial disparities in infection &amp; death rates due to coronavirus are shedding light on the inequality in our communities and health care system. To get a handle on this pandemic, we must ensure ALL patients have equal access to treatment &amp; health care.
https://t.co/EpaiawKSzh",2020-04-13 21:15:00
"As more and more Americans lose their jobs because of the coronavirus pandemic, which often also means losing their health insurance, the Trump Administration must do more to ensure these families know their options to get covered. https://t.co/Qp2YGmRhkL",2020-04-13 20:21:11
"It's shameful that extreme, right-wing politicians would use the coronavirus pandemic to push through their harmful, anti-abortion agenda. Abortion is health care and it’s reckless to try to take that away, especially at a time like this. 
https://t.co/HEF1oYHV5i",2020-04-13 19:05:00
"It’s simple: workers at our hospitals, grocery stores, pharmacies and more should get premium pay for putting their lives on the line during the coronavirus pandemic.
https://t.co/bVqQGIsOi8",2020-04-13 17:40:00
"The Trump Administration is allowing employers to sidestep their responsibility to workers across the country. This is unacceptable.

During this uncertain time, workers need the paid leave this law guarantees.
https://t.co/2TAHCJX8El",2020-04-13 00:05:00
".@WAplanfinder is extending the special enrollment period for health insurance to May 8. If you’re a Washington state resident who doesn’t have health insurance, find out if you qualify and apply now. 
https://t.co/CGJOAWoUgq",2020-04-12 21:36:00
"Student loan borrowers shouldn't be worrying about the crushing burden of student debt right now. Learn more about how Congress is providing needed loan relief during this crisis:
https://t.co/Ny75vIXDTx",2020-04-12 17:52:25
"Extreme, right-wing politicians are using a global pandemic to try to ban abortion, which *is* essential health care. Shameful.
https://t.co/lUdqwI0qy9",2020-04-11 21:30:00
"RT if you agree that the essential workers who are putting their lives on the line every single day deserve premium pay and necessary protective equipment. 
https://t.co/DLxxwsHIxP",2020-04-11 19:45:00
"With more and more workers losing their jobs due to the coronavirus crisis, there are new resources available to help families put food on the table.  More information below. 
https://t.co/WDJfKsQrhl",2020-04-11 17:05:00
Slowing the spread of the virus in WA requires transparency from every part of our gov’t—including our military. I'm pressing @DeptofDefense to provide clarity about how its decision to withhold data on coronavirus cases in our military communities will impact public health. https://t.co/IP3mCbzMAc,2020-04-11 00:03:32
"We must do everything we can to help small businesses weather this crisis, and the CARES Act takes some good steps toward providing the loans, grants, and assistance small business owners need. Learn more about the aid available below. 
https://t.co/zpSRlXM4fk",2020-04-10 21:45:00
"Need to sign up for unemployment benefits? Trying to figure out if your small business is eligible for assistance? Want to sign up for food assistance? 
 
Find answers to these questions and more on my coronavirus resources website.
https://t.co/4oc3zDfBQ1",2020-04-10 19:05:00
