tweet,dates
"Mr. Willie Belton was a respected political leader, war veteran &amp; civil rights leader who marched with Dr. Martin Luther King,Jr. He was awarded the Bronze Star &amp; Purple Heart for heroism in the Korean War &amp; the Louisiana Medal of Honor for community service. May he rest in peace https://t.co/2jmw44xgu2",2020-01-16 19:52:04
"I spoke to @KALBtv5 last night about the President's new trade deal with China and the Democrats' ongoing impeachment charade. They've been trying to unseat him for three years, but he just keeps on WINNING! https://t.co/jaC7U6HsuI",2020-01-16 16:01:52
Congratulations to @realDonaldTrump on signing his phase one trade deal with China today! (and shame on do-nothing-Nancy for trying to upstage it with her impeachment nonsense),2020-01-15 18:28:38
Former @Saints star Steve Gleason will receive the Congressional Gold Medal today for helping others with ALS through @TeamGleason. I'm fortunate to have been part of this effort &amp; I invite you to watch on C-SPAN at 2pm CT. @drewbrees will speak for Steve. https://t.co/YzvK5OlILV,2020-01-15 16:07:05
"Congratulations to the LSU Tigers on their 4th national championship with an undefeated record of 15-0 led by Heisman Trophy winner &amp; record-setting quarterback, Joe Burrow. This year’s team set an 80-year record of 726 points &amp; Burrow threw a record 60 touchdowns. #GeauxTigers! https://t.co/AL25SioYwK",2020-01-14 17:38:30
On our way to the Superdome with @realDonaldTrump on Air Force One to watch @LSUfootball dominate @ClemsonFB in the #NationalChampionship! #GeauxTigers! https://t.co/xTHIemqSmB,2020-01-13 21:15:31
"To my Democratic colleagues: if you can look these Gold Star Families in the face and tell them this was not a justified strike, may God have mercy on you.   Full speech: https://t.co/S3ZQPAP9fO https://t.co/xVTB3wcgu2",2020-01-10 00:14:47
"On this National Law Enforcement Appreciation Day, we honor those whose dedication and selfless service keep our communities safe. Today, and every day, we say thank you. https://t.co/CJ56lHsiyb",2020-01-09 22:13:07
Enjoyed breakfast this morning with @toddstarnes talking about his new book on the progressive assault on American values. https://t.co/JCv0U6OVSk,2020-01-09 02:39:34
"President @realDonaldTrump has proven he can speak softly &amp; carry a big stick:”To the people &amp; leaders of Iran, we want you to have a great future, one of prosperity at home &amp; harmony with the nations of the world. The United States is ready to embrace peace with all who seek it” https://t.co/EQqfK8MeAj",2020-01-08 18:26:12
"As I told @KALBtv5 yesterday: I don't fear retaliation from Iran. If they're foolish enough to hit us in a meaningful way, I can assure you we're primed and ready to take them on. https://t.co/vZkbPhTJ6J",2020-01-08 16:35:59
"So, if @realDonaldTrump had notified Pelosi and Congress before taking decisive life-saving action, I truly believe the terrorist Soleimani would still be alive and killing Americans. Congress moves at a snail's pace - thankfully, President Trump moves at light speed.",2020-01-06 17:49:07
Tonight I joined @StevenMaxwellTV on @KALBtv5 to discuss my support for @realDonaldTrump's decisive response which shows Iran and other terrorist organizations that there will be consequences for harming Americans and our interests. https://t.co/KQ3lhhyo03,2020-01-04 03:02:45
