tweet,dates
The plan to re-open America hinges on massive testing—along with contact tracing &amp; effective treatment. The Trump Admin has failed on testing since day one. The message remains clear: Make the tests. https://t.co/rP4KWy5bst,2020-04-15 16:23:41
"Instead of Trump falsely blaming the WHO, or his faux review, America needs a Pandemic Review Commission—an independent, bipartisan investigation just like after 9/11. https://t.co/9E0u67xHga",2020-04-15 14:59:16
Republican roadblocks to relief payments—affecting millions—must be removed. No one should be denied vital help. Corrections must be made in the next emergency package. https://t.co/TZchVamPCv,2020-04-15 13:52:15
"Unacceptable. During a pandemic the last thing we should do is underfund &amp; undermine the WHO. They warned about an imminent, insidious threat, which Trump &amp; his Admin chose to ignore. 
https://t.co/unV0nyjVLr",2020-04-15 00:37:49
"Staying connected is vital during this pandemic. FCC's Lifeline program is ensuring millions of veterans, seniors &amp; low-income households can access essential broadband &amp; phone services. I'm leading 26 of my colleagues to urge support for Lifeline in future COVID relief packages. https://t.co/ce597vW4QT",2020-04-14 17:19:36
"If the US Supreme Court can work remotely, the Senate can vote remotely. https://t.co/tEu9X8K5og",2020-04-13 21:23:06
Deliciously brightening the day for health care heroes who spent Easter away from their families. Thanks to Food for The Front Lines for delivering food purchased from local restaurants. A win-win! https://t.co/4QIQSMhVHd,2020-04-13 19:10:15
"The USPS is a lifeline for many; transporting medicines, test kits, &amp; PPE—plus delivering our votes in November. The Trump Admin should stop blocking efforts to provide them pivotal funding. https://t.co/Z9CLSZsxt8",2020-04-13 17:47:38
Local journalism closures cost us all—undercutting information &amp; community. That’s why I’m fighting to provide additional resources to support independent reporting &amp; media outlets in the next emergency relief bill. https://t.co/aZhbDzeaAV,2020-04-13 16:32:20
"Having failed to provide critical medical equipment, the least the Trump Admin can do is cover states’ cost share. If not, Congress must act to waive states’ 25% funding share in the next relief package. Red state or blue it’s real money.",2020-04-13 14:16:23
"A happy, healthy Easter to all who celebrate. Hoping you are able to share this wonderful holiday with friends &amp; family—even if only remotely this year. Stay safe.",2020-04-12 14:21:03
If you are experiencing domestic violence you are not alone—help is still available during the COVID-19 crisis. Advocates @CTCADV can assist you 24/7 via call (888-774-2900) or chat &amp; email at https://t.co/b3UpzwYL5o. https://t.co/53hYphXrAX,2020-04-11 16:31:34
Manufacturers &amp; entrepreneurs at MakerspaceCT are donating face shields to health care workers—frontline heroes at Hartford Hospital. CT ingenuity &amp; can do spirit from the makers. https://t.co/fiBwqacGcB,2020-04-11 15:11:12
"Vaping inflames airways &amp; impairs lung function—an open invitation to COVID-19 perils. Be smart, listen to scientists, stop inhaling deadly vapors. https://t.co/FRanjzdTnj",2020-04-10 23:23:54
"If you normally do not file a tax return, the IRS just launched a new tool to help expedite your #CARESAct economic impact payment. Visit their website &amp; register: https://t.co/7oJwxeUTBq",2020-04-10 22:20:12
Stop the #COVID19 snake oil scammers—like Alex Jones—exploiting widespread anxiety &amp; anguish. Bottom feeders are hawking fake remedies that have serious side effects. Hardly harmless: Beware. https://t.co/8peCPEZ9pk,2020-04-10 21:06:10
"Once we overcome this heartbreaking crisis, the American people deserve to understand how &amp; why we were so unprepared. I’m announcing legislation with @RepAdamSchiff, @SenFeinstein, @SenKamalaHarris, &amp; @SenMarkey creating a nonpartisan, independent investigation to do just that.",2020-04-10 19:40:14
The danger to the independence of inspectors general is unprecedented. That’s why I’m working on reforms to prevent Trump &amp; his admin from undercutting government accountability. https://t.co/e5CPzqJ2Ca,2020-04-10 01:12:06
"I’m demanding that OSHA adopt immediate standards to protect all frontline workers risking their lives. Healthcare, public safety, construction, &amp; other essential employees need personal protective equipment &amp; additional safeguards. https://t.co/XsvcOkod9P",2020-04-09 23:26:31
"Hunger is everywhere, just like COVID-19. I visited mobile CT Food Banks in Hamden &amp; East Haven this week. 700+ families were served &amp; countless others turned away when food ran out. Heartfelt thanks to the volunteers—more federal support is necessary. https://t.co/mnJNPcGXo9",2020-04-09 21:30:48
Thousands of Americans are still stranded overseas &amp; lack the funds to pay the sky-high costs to get back. I’m leading 10 colleagues in demanding Sec. Pompeo take steps to secure their immediate return &amp; work to provide financial relief/waive fees for travel home. https://t.co/cB58y7quYK,2020-04-09 19:14:40
Yesterday afternoon I visited another @CTFoodBank Mobile Pantry where they served 400 families in an hour &amp; had to turn people away after running out of food. The demand for assistance is growing every day &amp; need for allocated federal dollars is mission critical. https://t.co/o8Pt6FN6BP,2020-04-09 15:35:08
"Trump wants to kill the messenger—the WHO. It warned about an imminent, insidious pandemic. Trump dismissed &amp; demeaned the message &amp; now seeks to decimate WHO. Unacceptable. https://t.co/keAb73wgSc",2020-04-08 23:57:50
"To all who are celebrating Passover as it begins tonight, Chag Pesach Sameach to you &amp; yours from the Blumenthals. We hope you are able to reach out to family &amp; friends through virtual or other means to mark the holiday. Connection matters. But please continue to stay safe!",2020-04-08 22:14:11
"Deeply horrific. An 8-month pregnant woman with flu symptoms was arrested by CBP, denied medical care, &amp; forced to give birth standing up. This inhumane treatment must end. I've led 12 colleagues in demanding a DHS investigation &amp; @ACLU filed a complaint. https://t.co/wuZrOAhnRq",2020-04-08 21:34:10
"Reliable local news is even more vital during COVID-19, but outlets are struggling to make ends meet. Future COVID relief funding must include support for local journalism &amp; media so they can continue providing communities answers to critical questions &amp; lifesaving info. https://t.co/lpYn4VaKLy",2020-04-08 20:19:18
.@CTFoodBank is doing vital work to feed our communities during this crisis. Speaking w/organizers of the mobile pantry made it crystal clear the demand is huge &amp; resources are limited. Just today at one location they served 350+ people in an hour. More fed support must be given. https://t.co/t7OBOHnYHk,2020-04-07 23:59:15
Thank you @GraceFarmsCT for your wonderful work to get critical protective equipment to those fighting COVID-19 on the frontlines. https://t.co/rR1LDji7T4,2020-04-07 22:55:01
"Each day nurses, doctors, &amp; health care providers are risking their lives to save others. On #WorldHealthDay, I would like to say #ThanksHealthHeroes!",2020-04-07 21:43:39
"Modly had to go, but his taking the fall still leaves the need for Pentagon leadership accountability. We need to know who else was involved in removing a Navy captain doing his duty to protect his sailors. A full IG investigation is no less necessary. https://t.co/SyVfmA5pgB",2020-04-07 20:32:40
This blatant cover-up scheme is outrageous. It has no purpose except to derail&amp;defang oversight. To my Republican colleagues who’ve built careers advocating spending oversight: you must take a stand as Trump sidelines scrutiny over the largest relief funding bill in our history. https://t.co/j3mf1n5xq0,2020-04-07 19:34:52
"Tragedy &amp; scandal—this report documents both, as well as Trump’s deadly abdication of national leadership. All the more reason for a bipartisan 9/11 style commission—to investigate mistakes made&amp;lessons learned—once we’re through this heartbreaking crisis.https://t.co/fAzT54sTPr",2020-04-07 15:31:17
I am calling on FTC to investigate @zoom_us. Zoom’s pattern of security failures &amp; privacy infringements should have drawn the FTC’s attention &amp; scrutiny long ago. Advertising privacy features that do not exist is clearly a deceptive act.,2020-04-07 13:05:52
"At today’s press briefing, Trump said CAPT Crozier made a “mistake,” &amp; he may “look into it.” Here’s who made a shameful mistake: Modly, Esper &amp; all the Navy brass who aided &amp; abetted them. An IG investigation &amp; Senate hearing should hold them accountable.",2020-04-07 01:00:19
Thanks Chase &amp; Sonny for helping kids across CT get ready for online school. https://t.co/K8aQszfBfH,2020-04-06 23:03:02
Complete bravery is being shown by our nurses &amp; health care workers. Each day they face the horrors of this virus &amp; fight to save lives. https://t.co/5V7pfoSbQg,2020-04-06 21:40:34
Modly should be removed unceremoniously for these shocking remarks—especially after failing to protect sailors’ safety &amp; health. He has betrayed their trust. DoD IG must immediately launch an investigation. https://t.co/RAZTWit0oU,2020-04-06 18:37:07
"Help is vital against the danger of domestic violence—viciously compounded by virus-related stay-at-home requirements. In the 4th relief package, Congress must finally renew VAWA &amp; bolster support for the protection of women &amp; kids at heightened risk. https://t.co/tdCV6SHnS5",2020-04-06 15:57:13
