tweet,dates
Students – join me Monday at 7pm ET / 4pm PT for an IG live with @RepDean to discuss what Congress is doing to support every future leader. https://t.co/YLS6mHmmAu,2020-05-10 17:43:00
"Happy Mother’s Day #CA17! To all the moms out there, thank you for all that you do. Hoping everyone is able to spend a bit more time talking with all their family members right now. https://t.co/foUJFoUPp7",2020-05-10 15:20:00
"This #MentalHealthAwarenessMonth we all need to take extra care to check in with ourselves and our communities. Remember to take care of yourself, and reach out if you need any help.",2020-05-09 17:35:00
"Millions are out of work.

We need monthly $2k checks sent out to every American making less than $130K during this period.",2020-05-09 15:23:00
Any company that takes federal dollars and doesn’t use them to keep employees on payroll needs to be held accountable. https://t.co/AZQEU7f1T0,2020-05-09 14:37:00
"No American should have to leave their hometown to get a good paying job in the digital economy. 

Let’s invest in broadband, let’s invest in small towns, and let’s bring the tech revolution to every community. 
https://t.co/5Hov21JUpV",2020-05-08 22:06:00
"Right now, California is testing 29,414 a day. 

That’s far short of the recommended minimum of 42,524 a day in order to think about reopening on May 15th. 

I understand people are frustrated, I hear you and I get it. But the best thing we can do is continue to stay home. https://t.co/N5I2hBV9l0",2020-05-08 18:45:55
"No, they’re not. 

The federal government needs to step in and create sustainable jobs in clean energy, digital, and other forward-looking industries. That’s how we’re going to get folks back to work. https://t.co/9JdTnK17ae",2020-05-08 18:19:33
"7 weeks ago, we had the same number of COVID deaths as South Korea. 

Our abysmal failure to manufacture and distribute tests will forever haunt this country. 
https://t.co/6Yzzumhc9g",2020-05-08 13:44:00
"I support extending the UN arms embargo on Iran.

But Trump must use existing arms sanctions laws that stop weapons from going to Iran AND work to negotiate new regional arms control agreements.
https://t.co/5ZsGPFmMqe",2020-05-07 21:44:30
"We are LIVE on Facebook for our town hall. Tune in now and post your questions in the comments. 
https://t.co/gk9mseAO2Z",2020-05-07 19:02:39
"Reminder - our town hall is *today* at 12pm PT / 3pm ET. Tune in on Facebook to hear what we’ve been working on to get you and your family the support to get through this crisis. 
https://t.co/DFJKhGCKhY",2020-05-07 16:21:00
"No one should have to risk their life in a meat processing plant for America to eat.
 
That's why I'm introducing @SenBooker’s Farm System Reform Act in the House, to fight back against corporate Ag consolidation and protect family farmers. https://t.co/Wm1Rn6bsGf",2020-05-07 13:58:47
"Questions about your stimulus check? Wondering how to apply for more relief funding?

Our next town hall is tomorrow on Facebook Live at 12pm PT. Ask your questions in the comments, I’ll try and answer as many as I can. 
https://t.co/DFJKhGUl9w",2020-05-07 01:21:00
"I’ll be live tonight on IG at 5:30pm PT with @RepDebHaaland talking essential workers, monthly stimulus checks, and more. https://t.co/0b1VOJpvII",2020-05-06 21:16:00
"A refreshing piece of good news – planning to watch this weekend, thank you (as always) for your continued leadership @MichelleObama. https://t.co/Gl9p2HWD4U",2020-05-06 20:59:24
"To all survivors reading this news today: we see you, we hear you, we stand by you. Your experience is valid. Your stories are important. We're still in this fight &amp; we're not giving up.
https://t.co/OJ7X3RTSs2",2020-05-06 20:22:00
"Yesterday, we tested ~258k people. 

We need to be testing *at least* 1 million people a day. 

Until Trump mobilizes every resource available to the federal government, we are continuing to fail our most vulnerable. 
https://t.co/8iwzBhXKIm",2020-05-06 19:36:06
"Please list a few ideas of better ways to spend $500 million.

I’ll start: Buy as many COVID-19 tests &amp; as much PPE as possible. https://t.co/TgSkJyVp9H",2020-05-06 18:02:31
"Ahmaud Arbery’s death is a gut-wrenching reminder of the failure of the American justice system.

His family &amp; community deserve accountability.
https://t.co/EVNTPR0JQF",2020-05-06 18:00:12
"This year, perhaps more than ever before, we are all witnesses the heroism of nurses. To every nurse at the front lines of this fight, thank you for saving lives and keeping this country going on #NationalNursesDay.",2020-05-06 16:34:00
"Congress cannot bail out fossil fuel companies. CARES was supposed to benefit small businesses, not Big Oil. Proud to cosponsor @RepBarragan’s bill. https://t.co/YdOLehKsHJ",2020-05-06 13:55:11
"Join @RepDebHaaland and I tomorrow at 5:30pm PT on Instagram Live for a talk about how we are going to support essential workers throughout this crisis. Bring your questions, let’s talk through it together. https://t.co/7QPK5jlMz1",2020-05-05 23:15:00
"Every unemployed American should be given the chance to enroll in SNAP. 

We already have the infrastructure to get folks the relief they need to keep putting food on the table. A great commonsense solution here.  
https://t.co/jKrOp56OIm",2020-05-05 21:03:00
"We have a $740 billion Pentagon budget. 

That’s $130 billion more than the Obama years. 

With that same $130 billion, we could triple the NIH budget. Let’s invest in science.",2020-05-05 19:22:00
"We are the wealthiest nation on earth. 

How, in 2020, we have folks sitting in their cars outside of public libraries just to get online is just beyond me. 

Universal broadband isn’t a luxury: it’s a basic requirement for the 21st century digital economy. https://t.co/2KAsHOUxrN",2020-05-05 17:08:19
"Silicon Valley isn’t just home to billionaires and VCs.

We have some of the highest rents in the country, + huge numbers of independent contractors &amp; freelancers, + essential workers keeping our cities running. 

They’re the ones that should have access to CARES funding. https://t.co/cHpXyqJSje",2020-05-04 23:10:00
"At this point, one $1,200 simply doesn’t cut it. If we’re going to tell people to stay home from work, we need to give them an income to survive. 

Congress needs to pass a bill to send out monthly $2k checks for *at least* the next 6 months. https://t.co/dBIfB87YeG",2020-05-04 18:44:30
"We are only as safe as the least insured among us. 

The Sanders/Jayapal Health Care Emergency Guarantee Act would cover the costs of all COVID treatment - it must be included in the next relief package.",2020-05-04 17:19:00
"Happy #TeacherAppreciationWeek to all the educators across #CA17. 

This year, we’ve seen countless districts and classrooms adapt to the new reality during COVID-19. Wanted to spotlight a few of our local heroes and #SendTeachersLove-&gt;",2020-05-04 16:19:43
"We should be testing 1 million Americans a day.

The Defense Production Act gives the federal government that power, but Trump continues to drag his feet.

So @SenSanders and I are introducing legislation to put another $75 billion toward producing masks, swabs, and gloves. https://t.co/Y5Pw8tLGun",2020-05-04 15:20:12
No one in the Trump family should be profiting off of COVID relief funding.,2020-05-04 14:09:00
"If you can’t afford to pay your workers, you can’t afford to pay for stock buybacks.",2020-05-03 21:22:00
"No one should have to risk their health to cast a ballot.

To keep our elections fair and secure, we have to offer comprehensive vote-by-mail systems by November 2020.",2020-05-03 17:09:00
"The media are the watchdogs of our democracy. 

#WorldPressFreedomDay is an excellent reminder to celebrate the privilege to speak freely, and to commemorate the brave, brilliant journalists around the world working to hold those in power accountable.",2020-05-03 15:14:00
"This #AAPIHeritageMonth, I’m more proud than ever to represent the phenomenal AAPI community in Silicon Valley. No amount of hatred or intolerance will overshadow the joy in this month.",2020-05-02 21:37:00
"Every relationship involving domestic violence and abuse is different, but no one deserves to be in a relationship that makes them unsafe. 

If it’s safe for you to do so, you can call the National Domestic Violence Hotline at 1-800-799-7233 for support.",2020-05-02 18:03:00
Everyone in this country should be able to get tested and treated for COVID-19 free of charge.,2020-05-02 15:08:00
"My next Facebook Live Town Hall will be on Thursday May 7 at 12pm PT / 3pm ET. Send over your questions beforehand (more info in the event), and I’ll try and get to as many as I can. 
https://t.co/DFJKhGUl9w",2020-05-01 19:20:00
"80% of the small businesses that applied for PPP didn’t get any money. 

But publicly traded companies got $1 billion? 

The injustice here is astounding and inexcusable. https://t.co/omexlBQtTq",2020-05-01 17:00:54
"Everyone is taking a hit during COVID-19.

But no one is taking one harder than the working class.

This #MayDay, we're witnessing the power and persistence of those Americans still at work on the front lines. They deserve fair pay and safe conditions, today and every day.",2020-05-01 14:42:00
"Over 30 million Americans have filed for unemployment during this crisis.

Congress needs to send monthly $2k checks for at least 6 months. Then, if we’re still not getting folks back on their feet, Congress can vote on whether to extend the period. 
https://t.co/pEHPG5n3GE",2020-05-01 00:46:00
"Today at 3:30pm PT - I’m joining @BetoORourke via Instagram Live to talk essential workers, creating jobs for the future, and more. https://t.co/kHXsXCIB4O",2020-04-30 20:36:00
"Every time I get an Amazon package, I’m participating in an economy made possible by the labor of essential workers on the front lines of this fight. 

We all have an obligation to protect these workers by fighting for fair pay, safe conditions, and basic safety protections. https://t.co/hSY8V8Ahwq",2020-04-30 19:31:35
"In the next relief package, Congress has to do more to help minority communities that have been hardest hit. A few things we should focus on here ⬇",2020-04-30 18:42:09
"The war on drugs disproportionately targeted communities of color, unfairly locking up certain groups of users over others. 

@SenBooker, @RepBarbaraLee and I introduced a bill to expunge these records at the federal level. Justice is long overdue here. https://t.co/8K3GQNFsGx",2020-04-30 17:21:29
"No American should be worried about the cost of seeking COVID testing or treatment. 

The Jayapal/Sanders Health Care Emergency Guarantee Act will cover any costs associated with coronavirus treatment, because health care is a human right.",2020-04-30 14:18:00
"Sex workers were already among the most vulnerable. COVID, on top of the major health risks, has decimated these workers incomes. 

All Americans should benefit from the economic relief Congress is passing, including sex workers.
https://t.co/FrESm60vIc",2020-04-29 22:10:00
"Our tax dollars should be spent keeping folks on payroll, not enriching Wall Street any more.

The corporate greed displayed over the last month is outrageous and unacceptable. 
https://t.co/WvbVHdTHU7",2020-04-29 20:33:00
"I’m LIVE with Silicon Valley Rising and Santa Clara Supervisor Chavez talking about how we can protect and support essential workers during COVID-19. Join in here -&gt;
https://t.co/lBdpVRQr5i",2020-04-29 19:10:31
"The American people deserve more than the deal Congress got them. 

In the next package, we need to close these loopholes and put people over corporations. https://t.co/v6gbDob1Dp",2020-04-29 17:47:43
"Missing a bill payment right now shouldn’t threaten your life. Utilities must stay open and connected.

The water to keep your hands clean, the internet to stay connected and working, and the electricity to stay safe inside: these are the definition of essential resources. https://t.co/gbpnL6Wun9",2020-04-29 15:57:29
"I’m joining @BetoORourke via Instagram Live tomorrow at 3:30pm PT to talk essential workers, creating jobs for the future, and more. https://t.co/tedr4Pih12",2020-04-29 14:34:00
"Tomorrow I’ll be hosting an Essential Workers Town Hall with Santa Clara Supervisor Cindy Chavez – 12pm PT via zoom. More information here:
https://t.co/fWeFPwURkh",2020-04-28 23:39:00
"The president must come to Congress before starting a war, period.

Proud to partner with @SenMarkey again to reintroduce our bill preventing an unconstitutional war in North Korea. We cannot let the Trump admin use COVID as an excuse to circumvent Congressional authority. https://t.co/1cM7HA7Q1D",2020-04-28 20:44:18
".@EdClendaniel is absolutely right. 

Instead of spending another trillion fighting endless wars overseas, let’s invest in smart technology here at home to combat not only COVID but also climate change and remote work. 

The future of US security is in innovation, not war. https://t.co/wMVh2BaeJb",2020-04-28 19:44:53
"We actually don’t need to study this issue - Americans need more stimulus checks, now.

There is bipartisan support for this issue. @RepTimRyan and I are ready and available to sit down with anyone to make it happen. https://t.co/c9DhW7ZjCE",2020-04-28 19:09:44
"Essential workers are not disposable. 

Their work is and always was utterly necessary to keep our country running. 

That’s why @SenWarren and I sent our Essential Workers Bill of Rights to Congressional leadership today, urging them to include it in the next recovery package. https://t.co/6xQTi9nGPj",2020-04-28 16:14:23
"Rent is due this week.
 
Utilities are coming up. 

Americans need to cash, this month, next month, and every month after that until this crisis ends. 

A single, $1200 check isn’t going to cut it.",2020-04-28 13:45:03
"Rent is due this week. 

There’s no excuse for the government’s inability to mobilize and get folks the relief they need right now. 

We need an organized, federal response. 
https://t.co/8JMDjPkPmY",2020-04-27 20:17:00
"No one should be fighting with their insurance company for coverage right now. 

We need complete, comprehensive health care coverage for every American. Pass the Sanders/Jayapal bill.",2020-04-27 19:03:00
The Post Office is essential. Cruise ships are not. https://t.co/2U89LUZA7U,2020-04-27 16:55:22
"Mass unemployment isn’t inevitable: it’s the result of failed policies. 

Every stock buyback was a choice between making investors happy and having the money to keep your employees on payroll.",2020-04-27 16:06:00
"Unions have never been more important. 

If any employee sees unsafe practices at an essential business, we all want them to speak up. @SenWarren’s and my Essential Workers Bill of Rights will protect whistleblowers so we can keep this country safe. https://t.co/hGJinSXV54",2020-04-27 14:39:00
"If you are going to profit off of your employee’s labor right now, you need to protect your employees. 


That means safety equipment, hazard pay, child care and paid leave. 

A safe workplace isn’t a luxury: it’s a requirement.",2020-04-26 20:48:00
"No health care worker should have to work without proper protective equipment. 

Masks, gowns, and gloves are not luxuries: they are absolutely necessary. 

Every day the Trump administration fails to produce enough PEE is another day we  needlessly risk these heroes' lives.",2020-04-26 17:02:00
"We’ve spent $2 trillion fighting the war in Afghanistan. 

We can afford to give every human being in this country health care during a global pandemic.",2020-04-26 15:20:00
"We are LIVE on Facebook right now for our weekly livestream. Tune in and ask me a question in the comments.
https://t.co/x7CMFMF2QW",2020-04-25 19:02:39
"Tune in today at 12pm PT for our final town hall this month on Facebook Live, @ RepRoKhanna. There’s a lot going on, I’ll try and cover as much as possible.
https://t.co/zf0tB4A3yH",2020-04-25 14:36:00
"Our most important economic mission is to prevent economic collapse. 

That means:

✅ Sending $2k checks to every American
✅ Supporting small businesses, hospitals and local governments 
✅ Creating new jobs that will be there when this crisis ends.",2020-04-24 18:05:00
"Our Facebook Live town hall is tomorrow at 12pm PT // 3pm ET - leave your question in the comments section and I’ll try and get to as many as I can. 
https://t.co/zf0tB4REXh",2020-04-24 15:37:00
"Community Health Centers serve 32,000+ patients right here in #CA17. They provide quality, affordable health care to our neighbors who might otherwise be unable to access care under the current system. 

Proud to support CHCs and their integral role in the fight against COVID-19.",2020-04-23 23:56:00
"#RamadanMubarak to the Muslim communities across the globe celebrating. While the holiday is beginning in an uncertain period of world history, there’s never been a greater need for the compassion and generosity surrounding this holy month. https://t.co/dpAmqTukVL",2020-04-23 21:27:00
"Viruses don’t have an ethnicity. 

There’s no place for this kind of blatant, senseless racism anywhere, and particularly not in CA-17. https://t.co/LEQ36XL1H6",2020-04-23 20:49:13
"The shelter-in-place rules are slowing the spread, but if we stop social distancing the number of cases and deaths will increase.

Until a vaccine is developed, mass testing is the key to reopening the economy. 

Here's the plan:",2020-04-23 19:30:42
"Our next CARES bill needs to put workers first and prioritize monthly checks for every American. 

A one-time $1,200 is certainly a lot for many folks, but it doesn’t come close to meeting the need in the Bay Area. https://t.co/YzqcUeRv5d",2020-04-23 18:54:00
"At the Capitol today to speak up for all the essential workers, from the doctors to the bus drivers to the small business owners, who deserve fair pay and adequate protection during this crisis. https://t.co/YJHtCPoq4M",2020-04-23 17:50:33
"McConnell is dead wrong.

Santa Clara County handled the US's 1st COVID case on Feb 6 with the aggressive, coordinated approach local governments have modeled across the nation. 

Federal support is the least we can give the public servants on the front lines for our communities. https://t.co/6l97bmqyX6",2020-04-23 16:46:31
"Many essential workers are risking their lives at the rate of $7.25 an hour. 

For $7.25/hr, they are keeping our grocery aisles stocked and our packages delivered, our buses running and our food cooked.

The least we can do is raise that minimum wage.",2020-04-23 16:03:00
"Last year, Congress passed a $738 billion defense budget, one of the most costly in the history of this country. 

There should be bipartisan outrage that the Pentagon is now coming and asking for more. https://t.co/eSLFhOraWs",2020-04-23 13:43:34
"Every American should get free COVID-19 testing and treatment. Full stop. 

Proud to support @SenSanders and @RepJayapal’s Health Care Emergency Act to cover all costs for the duration of this pandemic.",2020-04-22 19:17:00
".@RevDrBarber is absolutely right - COVID is showing the consequence of our country’s inability to give every human being the dignity of affordable health care + affordable housing. 

We would all be safer if we invested in everyone’s humanity. https://t.co/cfZnhf6XdT",2020-04-22 15:50:01
"If COVID has taught us anything, it’s that we need to listen to the scientists. 

This #EarthDay, the immediate urgency of the climate crisis is more evident than ever. Let’s be thankful for the world around us, and save our planet.",2020-04-22 15:16:00
"The Pentagon shouldn’t get any more COVID relief money. 

If the DoD needs more cash, some quick ideas I have for saving money: 

✖️End endless wars
✖️Stop nuclear arms races
✖️No more giveaways to defense contractors. https://t.co/nua3EbnV2j",2020-04-21 23:46:49
"When Congress votes on CARES 2, we need to include: 

✔@SenWarren and my Essential Workers Bill of Rights
 
✔@RepTimRyan and my plan to send monthly $2000 cash payments to every American. 

Progressives should insist that the relief goes to workers, not big corporations.",2020-04-21 16:46:00
"The right to vote in a safe and secure environment is sacred. 

We must allow every voter to mail in their ballot this November. https://t.co/mBaWe2g1W4",2020-04-21 16:27:46
"How far can a single $1200 check get you in the Bay Area? 

Congress must include my and @RepTimRyan’s proposal to send monthly $2k checks to everyone making under $130k in the next relief package. https://t.co/xqqfWAec4p",2020-04-21 14:43:00
"Thank you, from the bottom of my heart, to everyone keeping our community safe and fed.

Yet another reminder of the acute need so many of our neighbors are facing right now. 

We need monthly checks for the duration of this crisis.
https://t.co/OGN0IPgFrQ",2020-04-20 22:56:00
"Another thread on the national debt -&gt;
 
The Fed owns 40% of all US public debt than any other entity—more than the 30% China or any other foreign governments own. 

That's how, in just weeks, Treasury issued millions of $1,200 checks. 1/x",2020-04-20 20:58:48
"This entire process has exemplified the inequalities in private industry. 

If you had a great relationship with a bank, you got the money. 

If you didn’t have those connections, you’re out of luck. https://t.co/GgvZylTUG0",2020-04-20 20:33:30
"So many Americans are fighting this battle on the front lines, putting their lives in danger so we can continue to get the food, mail, and transportation we need to survive. 

To everyone working through this crisis: thank you.",2020-04-20 17:02:00
"The next relief package needs to prioritize workers, not corporations.

There’s no excuse for bailing out the CEO’s who are now conducting mass layoffs. https://t.co/ZXbRDqneHQ",2020-04-20 04:00:00
"Next steps to fund mass testing?

⬆️ Defense Production funding to make the swabs vials for testing
⬆️ FEMA funding for mobile testing
⬆️ HHS expert guidance to Walmart and CVS https://t.co/EpSOAxDLEB",2020-04-20 01:43:37
"For all the automation in Silicon Valley, many workers are still doing the physical labor to keep remote work going. 

The janitors, bus drivers, and security guards deserve our heartfelt gratitude. 

More, they deserve full benefits, quality health care, and fair compensation.",2020-04-19 17:02:00
"American workers, not corporations, need our support the most right now. 

Congress should be putting all our efforts toward making sure folks can still put food on the table and stay in their homes.",2020-04-18 17:01:00
"A grocery clerk in my district contacted me because his manager wouldn’t let him wear a mask or gloves for his shift.

That’s outrageous. We need an Essential Worker Bill of Rights to protect the 60 million Americans still at work.

Safe work conditions are never a luxury.",2020-04-18 15:48:00
"A safe workplace is never a luxury.

@SenWarren and I are calling for an Essential Workers Bill of Rights to be included in the next relief package, because no one should have to be striking for fair pay and protective equipment right now. https://t.co/xsjeeU4brP",2020-04-17 21:47:00
"Screenshot from this week’s call with all of #CA17’s phenomenal mayors. Our collective belief in science + support for health care professionals put us far ahead of the curve. Proud to represent such an innovative, caring community. https://t.co/K8l8vw90Dv",2020-04-17 20:20:00
"1 in 10 Americans have already filed for unemployment. 

We need to bailout workers, not more corporations. This is shameful. https://t.co/hIkUCTzQpd",2020-04-17 18:45:47
"Grocery clerks should have free child care.

Public transportation operators should be getting overtime (at least) and hazard pay.

Public safety officials should get no-cost testing and treatment.

That’s why @SenWarren and I wrote an Essential Worker Bill of Rights. https://t.co/ipJT7knu3K",2020-04-17 16:32:00
"Nurses are wearing garbage bags, hospitals are rationing ventilators, and today’s unemployment rate is akin to the Great Depression. 

We can’t afford *not* to invest in a massive COVID-19 response. 1/x
https://t.co/EHOONPwkEQ",2020-04-17 16:01:40
"We spend $740 billion on National Defense.
 
We spend $10 million on the CDC.

Our national defense strategy should include plans for a pandemic. We need to fund the science, innovation, and research to get mass testing out. That’s the immediate security concern in this country. https://t.co/dxHCVos1aM",2020-04-17 00:13:00
"We are paying the price for our underinvestment in science, our reliance on foreign medical suppliers, and our insufficient preparation for any kind of global pandemic. 


Silicon Valley has the tools to reshape the American economy. It’s time we put them to use. https://t.co/zoZ6j4WfEN",2020-04-16 22:06:18
"We are LIVE on Facebook right now for our weekly livestream. Tune in and ask me a question in the comments.
https://t.co/Qxzdlw0ZMD",2020-04-16 19:01:36
"Tune in today at 12pm PT for our second ‘lunch break’ town hall on Facebook Live, @ RepRoKhanna. We’re going to be talking about how we can get this economy working for every American, board games, and more. 
https://t.co/TRq3QPqg83",2020-04-16 15:31:00
"The 60 million Americans at work right now need our full support.

Hazard pay, paid sick leave, and no-cost health care. 

That should be our baseline right now.",2020-04-16 14:31:00
"Reminder - you can fill out the questionnaire you received in the mail from the Census Bureau, either on paper, over the phone, or online, and get counted. https://t.co/T1AvCXU0zF",2020-04-16 14:19:46
