tweet,dates
Students across Maine look up to you and Captain Cassidy!  Thank you for taking the time to answer their questions.  We are all looking forward to hearing about your time aboard the International Space Station on NASA TV at 1:20 PM. https://t.co/Va08GzDzsy https://t.co/uyluv2nnoS,2020-04-13 17:10:37
"Thank you to all the truck drivers in Maine and throughout the country who are going above and beyond, missing time at home with their own families, in order to keep stores stocked with essential products during the COVID-19 pandemic.
 
https://t.co/VizOgb7rJg",2020-04-13 16:14:54
"Nearly $13 million has been awarded to 18 health centers across Maine to support care for COVID-19 patients in their communities. This funding builds on the more than $1 million @SenAngusKing and I announced for health centers last month.

https://t.co/rjJ6kCSCLg",2020-04-13 13:50:41
"He is risen! While our celebrations might look different this year, Tom and I send our best wishes to everyone observing Easter today.",2020-04-12 11:41:12
"The Paycheck Protection Program I co-authored went live 8 days ago. In those 8 days, 8,400 Maine small businesses have been approved for $1.5 billion in forgivable loans. This relief will help keep workers’ paychecks coming &amp; small businesses afloat.",2020-04-11 16:40:24
"A new COVID-19 scam involves con artists attempting to steal seniors’ personal information and hard-earned savings by telling them that they need to provide or confirm their bank account information before they can receive their coronavirus rebate checks.

https://t.co/CP2fnkAYxB",2020-04-10 21:23:21
"#BREAKING: Maine hospitals and other health care providers will receive $145,763,812 through the CARES Act to help protect the health of Mainers and support doctors, nurses, and other medical professionals on the front lines in the fight against the COVID-19 pandemic.",2020-04-10 16:18:38
"I join our entire state in welcoming Larry Lord back to Maine today.  Larry is a true hero who risked his own life to save the lives of a dozen of his coworkers.  Welcome home, Larry!  https://t.co/SuAk5TE0hB",2020-04-10 11:44:46
"At a time when our health care system is overburdened by the COVID-19 pandemic, the last thing doctors, nurses, and patients should have to worry about is whether there will be an adequate supply of the lifesaving medications they need.",2020-04-09 16:37:07
"Safe travels to York native Capt. Chris Cassidy! When he joins Caribou native @Astro_Jessica, two Mainers will be in space for the first time. At a difficult moment for our nation, Capt. Cassidy and Dr. Meir are shining examples of what we can achieve by working together. https://t.co/4kd0LFEgzL",2020-04-09 10:43:05
"Tom and I extend our best wishes to all those observing Passover this week in Maine and throughout the country. Although the circumstances may be different this year, I hope everyone is able to connect with their family and faith.",2020-04-08 23:12:05
"It is unconscionable that criminals are seeking to exploit the current public health and economic crisis, yet scams related to COVID-19 are proliferating. I spoke with @newscentermaine about ways Mainers can protect themselves. https://t.co/WGJ6MiiEaw",2020-04-08 11:45:26
Great news that the Administration agreed to my request for an additional $250 billion for the Paycheck Protection Program I co-authored.  It provides forgivable loans so small businesses can survive &amp; give paychecks to their employees.,2020-04-07 22:09:40
"Our health care professionals—doctors, nurses, &amp; first responders—must have the equipment they need to safely help COVID-19 patients. I joined a bipartisan group to help ensure all emergency personnel on the frontlines have an adequate supply of PPE.

https://t.co/U6M5r5kM32",2020-04-07 18:51:55
"Demand for the Payroll Protection Program I co-authored, which provides forgivable loans so small businesses can survive and send paychecks to their employees, is so strong that I have urged the White House and my colleagues to prepare to increase the funding.",2020-04-07 14:38:31
"Social Security beneficiaries have received letters claiming their payments will be suspended while SSA offices are closed amid COVID-19 unless they call a number given by con artists. Beneficiaries are then misled into providing personal info or payment.

https://t.co/wudFPv4ByU",2020-04-07 14:10:20
"UPDATE–As of 4PM today, 1,816 Maine employers will receive $510,891,620 in Paycheck Protection Plan loans.  These forgivable loans will help keep paychecks coming for tens of thousands of Mainers who work at small businesses. Together, we will weather the storm caused by COVID-19",2020-04-06 20:53:28
"Rural areas face unique health care challenges. Supporting these communities is more important than ever amid COVID-19. I joined 42 Senators, including @SenAngusKing, in urging HHS to provide immediate financial assistance to rural hospitals &amp; clinics.

https://t.co/iJtbwHjbSb",2020-04-06 20:03:02
"During this public health crisis &amp; time of economic hardship, criminals are seeking to steal from hardworking Americans. Small businesses are being told that they must pay a fee to apply for a Paycheck Protection Program loan, a program I co-authored.

https://t.co/HmE4i4I80u",2020-04-06 16:24:43
"#BREAKING: Relief is on the way for the employees of Maine’s small businesses! In just two days, 1,026 Maine employers have received $291.9 million in Paycheck Protection Plan loans.",2020-04-05 17:35:19
"Maine’s fishermen are experiencing severe financial harm due to COVID-19. I joined a group of Senators to secure $300 million in the Phase 3 relief package for those working in the fishing industry. The Commerce Department must distribute this aid quickly

https://t.co/UXJ3V2OTmS",2020-04-04 15:26:20
"I strongly supported the IRS’s policy change to allow Social Security beneficiaries to receive rebate checks automatically. Now IRS needs to work with other federal partners so that veterans, individuals with disabilities, &amp; seniors who receive SSI get these checks automatically.",2020-04-03 18:52:06
"Social Security beneficiaries will automatically receive a rebate check under the CARES Act. This new policy removes an unnecessary, bureaucratic hurdle some seniors were facing. As Chairman of the @SenateAging Committee, I strongly supported this change.

https://t.co/iYeApsfYxf",2020-04-02 18:43:28
"COVID-19 is overburdening our health care system &amp; taking a tremendous toll on Maine jobs &amp; small businesses. @SenAngusKing, @chelliepingree, @RepGolden, &amp; I wrote to the President today to express our full support of @GovJanetMills’ request for a Major Disaster declaration. https://t.co/3QY0g5W3wN",2020-04-02 16:59:43
"More than $16.5 million has been awarded to ensure that the State of Maine will continue to be able to provide safe, affordable housing for Mainers amid COVID-19. I worked to secure this funding for Maine in the coronavirus emergency response package.

https://t.co/wgCSAwxGLm",2020-04-02 14:37:56
"To combat the rise of COVID-19 scams, I joined a bipartisan group of 32 Senators in urging the Federal Trade Commission to increase efforts to inform seniors about this fraud &amp; ensure they have the tools they need to keep their personal information safe.

https://t.co/t41KQQxJS4",2020-04-01 21:27:54
"Five Maine tribal communities have been awarded more than $1.3 million through the COVID-19 emergency response package. I worked hard to secure these resources for Maine’s tribes to assist their efforts to prevent, prepare for, &amp; respond to this pandemic

https://t.co/ruOE7fgxyj",2020-04-01 18:23:26
"Across the state, Maine businesses are retooling their product lines to make sanitizer, personal protective equipment, &amp; other items needed to fight COVID-19 &amp; help keep health care workers &amp; first responders safe. Mainers’ ingenuity &amp; resiliency will get us through this crisis. https://t.co/9XNpaWF0Kh",2020-04-01 13:49:02
"As the co-author of the law providing $377 billion for small businesses &amp; workers affected by COVID-19, I'm pushing for its swift implementation. Resources from Treasury &amp; SBA will help answer questions about how to access this desperately needed funding.

https://t.co/rgytEZChVo",2020-03-31 22:57:44
"18 health centers throughout Maine have been awarded more than $1 million to immediately address screening and testing needs, acquire medical supplies, and boost telehealth capacity to respond to COVID-19.

https://t.co/pUj7AfOUpL",2020-03-31 19:14:23
"These students are an inspiration. Rather than spending the money they saved for a class trip, they are using it to prepare hundreds of free meals for seniors, first responders, and disabled veterans. Thank you for giving back to your community!

https://t.co/nNcBuci9qs",2020-03-31 16:38:35
"Keeping our health care workers protected is critical to caring for COVID-19 patients. @SenAngusKing, @chelliepingree, @RepGolden, &amp; I called on DHS to immediately release PPE from the National Stockpile. We're working closely with @GovJanetMills to help meet Maine’s needs. https://t.co/1Mo3aBdTGB",2020-03-31 14:30:40
"On #NationalDoctorsDay, thank you to all our doctors &amp; other medical professionals for your tireless efforts on the frontlines of COVID-19. Your expertise &amp; healing hands are needed more than ever. I’m committed to increasing PPE supplies to help keep you and your patients safe.",2020-03-30 21:42:16
".@newbalance and its hardworking employees in Skowhegan, Norway, and Norridgewock represent the best of our nation’s manufacturing heritage.  Once again, they have proven that there is no challenge that American workers cannot meet.  

https://t.co/VbaUQzHy1J",2020-03-30 19:00:13
"During this pandemic, local agencies in Maine and throughout the country are being stretched thin to help address the needs of millions of low-income individuals and families, including challenges related to employment, nutrition, health, and transportation.",2020-03-30 15:40:13
"A bipartisan group of my colleagues &amp; I successfully included $300 million to assist fishermen in the COVID-19 relief package. This funding will help ensure that families &amp; businesses that depend on the industry’s success can emerge from this crisis.

https://t.co/CsDKpH44GC",2020-03-30 13:08:58
Ingenuity &amp; caring describe the reactions of Maine people &amp; businesses to COVID-19. The leaders of @LLBean &amp; @NewBalance are revamping factories to manufacture masks to protect health care workers. LL Bean has also partnered with Good Shepherd Food Bank to deliver food packages.,2020-03-29 16:34:11
"Across the country, Americans are stepping up in response to COVID-19. Congress is doing its part too, passing a $2 trillion package that will help provide relief.  Read my column in today’s Maine Sunday Telegram for more information about this new law: https://t.co/Ekh6W34IAI",2020-03-29 13:14:42
"To help protect &amp; support Maine employers like @LLBean, @husseyseating, and Rogers Collection, I wrote to Treasury Secretary Steven Mnuchin today, calling on him to temporarily defer tariffs for U.S. companies that are experiencing economic hardship during the COVID-19 pandemic. https://t.co/ECKppOruaM",2020-03-28 17:10:24
"I am saddened by the passing of my friend and former colleague, Tom Coburn of Oklahoma. Tom was a man of deep faith and strong convictions who cared deeply for his family and our country. May God bless his wife Carolyn and daughters during this difficult time and always.",2020-03-28 16:07:20
"Our shipyard workers are essential to our national security. The Navy should be taking aggressive actions to help protect their health during the COVID-19 pandemic.  

https://t.co/ws0Goi0vy2",2020-03-28 13:55:06
"Great work, Abbott! This is a significant breakthrough in the fight against COVID-19. When I toured your Scarborough facility in 2018, I was so impressed by your dedicated employees who were making the next generation of diagnostics. https://t.co/T6zlhd0So1",2020-03-28 01:31:44
"The $2 trillion COVID-19 emergency relief package was just signed into law. It passed the Senate 96-0 Wednesday &amp; the House passed it by voice vote today. Bipartisan relief is on the way to support Americans in need, strengthen our health care, &amp; assist workers &amp; small businesses https://t.co/MZi92WLtV6",2020-03-27 20:42:37
"I extend my deepest condolences to the family and friends of the Mainer who passed away from COVID-19.  A difficult road lies ahead for our state.  We are resilient, and we will get through this crisis together.",2020-03-27 19:19:39
"Maine’s Area Agencies on Aging have been doing incredible work meeting the nutritional needs of seniors. As older adults self-isolate due to COVID-19, home-delivered meals are more important than ever. This $1.2 million grant will support their efforts.

https://t.co/m0EqJ6v58i",2020-03-27 14:17:45
"SCAM ALERT: Con artists are targeting seniors through marketing schemes that claim to provide test kits for COVID-19. These criminals are using phone calls, social media, email, &amp; door-to-door visits to try to obtain personal information from victims.
 
https://t.co/QTPRe3XNVT",2020-03-26 20:49:52
"From Fort Kent to Kittery, Mainers are stepping up to help  neighbors in need. Thank you to Carroll Ann and Gaetan Oakes, owners of Whistle Stop restaurant, for making and delivering free meals to seniors and those with disabilities in your community.  
https://t.co/xq0yfEkRcM",2020-03-26 16:25:06
"Tonight, the Senate came together to pass a $2 trillion emergency relief package that will reinforce our health care system, shore up our economy and businesses, support those who are unemployed, and help prevent millions of Americans from losing their jobs.",2020-03-26 03:46:41
"Following unanimous passage, a bill I authored to renew &amp; improve the Older Americans Act has become law. As we work to mitigate the spread of COVID-19, this law will support community-based &amp; nutrition services for older Americans &amp; their caregivers.

https://t.co/WosoXi1Sww",2020-03-26 00:28:23
"For more information about the $377 billion small business relief package I authored with @marcorubio, @SenatorCardin, and @SenatorShaheen, click here: 

https://t.co/JRBb7jC0Uw https://t.co/aeutYTZD9Y",2020-03-25 22:15:26
"Relief is on the horizon for American workers &amp; small businesses. @marcorubio, @SenatorCardin, @SenatorShaheen, &amp; I worked on the bipartisan $377 billion small business economic relief plan, which was included in the Phase 3 emergency relief package.

https://t.co/9aXZ1jQFMN",2020-03-25 18:48:44
"The @RedCross is facing a critical shortage of blood donations. To keep donors and staff safe, strict safety and social distancing measures are in place. If you are healthy and able to help, please consider scheduling an appointment at: 

https://t.co/v8qKtusSn3",2020-03-25 17:36:39
"To save Maine jobs, we must prevent Maine’s employers from going out of business due to COVID-19. The @MaineChamber, @PortlandChamber, &amp; @BangorChamber have compiled a list of resources available to help small business owners during this crisis.

https://t.co/daKcAFLpui",2020-03-25 14:13:01
"I spoke with Dr. Edison Liu, president &amp; CEO of @jacksonlab, about JAX's work to breed a specialized strain of mice to help researchers find a vaccine for COVID-19.

https://t.co/yU3jCpwkqV",2020-03-25 11:45:52
"Maine’s small businesses employ the majority of workers in our state. We must come together to pass legislation to prevent them from going under, keep workers employed &amp; paychecks coming, &amp; assist those who have lost their jobs during this pandemic.

https://t.co/FyI1TeoX4E",2020-03-24 18:23:31
"We are in the midst of a crisis in our country caused by the coronavirus.  When it comes to Americans’ health and saving Americans’ jobs and our small businesses, we don't have another day. We don't have another hour. We don't have another minute to delay acting. https://t.co/xbeagCoLvQ",2020-03-23 18:06:48
"UPDATE: This important legislation has been signed into law, ensuring that student veterans will continue to receive the education benefits that they earned through their service to our country. https://t.co/Edyx9XwhUt",2020-03-23 15:18:55
"It is essential that Congress stop its partisan bickering &amp; work together to protect workers’ paychecks. On the Senate Floor this evening, I implored my colleagues to deliver urgently needed aid for the employees of small businesses throughout our nation.

https://t.co/QmVugExGi1",2020-03-23 01:08:14
"At a time of heightened demand for nutrition services due to seniors self-isolating because of COVID-19, we need expanded access to programs like @_MealsOnWheels that provide relief for seniors staying home.
 
https://t.co/qzD0HtxZNz",2020-03-22 19:21:43
"More than 80,000 Maine students qualify for free or low-cost meals, but with schools closed due to COVID-19, many no longer have access. @SenAngusKing, @chelliepingree, @RepGolden &amp; I urged @USDA to expand nutrition services by allowing more schools to operate as open meal sites. https://t.co/7FIL6YMfcd",2020-03-22 16:37:01
"Closing the U.S.-Canada border to nonessential travel will help slow the spread of COVID-19, but we must ensure that it does not disrupt medical equipment supply chains or hinder health care and essential personnel responding to the outbreak.

https://t.co/qCveB1gWgO",2020-03-22 14:21:55
