tweet,dates
"Nearly $200,000 has been awarded to @unetweets to increase telehealth capabilities in response to COVID-19. This funding will help UNE reach seniors in rural communities by providing medical professionals with the telemedicine tools they need to safely care for their patients.",2020-05-20 16:26:01
COVID-19 has made it challenging for seniors &amp; low-income families to travel to purchase food. @SenAngusKing &amp; I joined a bipartisan group of our colleagues in calling on the USDA to further expand delivery &amp; curbside pickup options for SNAP participants during this pandemic. https://t.co/CkgmkKRaRn,2020-05-20 13:54:46
"The Senate passed a bill to ensure families of first responders who have lost their lives to COVID-19 can access survivor benefits without facing unnecessary hurdles. First responders are working selflessly to keep our communities safe, &amp; we must protect &amp; care for their families https://t.co/VfgPBy2ytF",2020-05-19 20:07:55
"May is Lyme Disease Awareness Month. With more people spending time outdoors due to COVID-19, I urge everyone to take precautions to protect against tick-borne diseases. The Tick Act, a new law I wrote, will help by providing $150 million to fight ticks.

https://t.co/TKmzv1nEdR",2020-05-19 17:14:41
"The Postal Service is the linchpin of the mailing industry &amp; the focal point of many rural communities. @SenFeinstein &amp; I led a bipartisan group calling for relief for USPS &amp; additional safety protections for employees in the next COVID-19 package.

https://t.co/ftq6xGJ7M6",2020-05-19 13:45:51
"Helping people with diabetes manage the disease &amp; avoid hospitalization is always a top priority, &amp; it is even more important during this pandemic. I joined a bipartisan group calling on CMS to expand access to tools that help Medicare beneficiaries with diabetes stay healthy. https://t.co/NeThG8oIbg",2020-05-19 11:40:55
"During the COVID-19 pandemic, there may be increased risk for elder abuse. To help protect seniors, @SenatorMenendez, @ChuckGrassley, &amp; I introduced a bill to help provide professionals with training for cases where the victim or a witness has Alzheimer’s. https://t.co/n8eYvSHKPd",2020-05-18 22:15:37
"On a Zoom conference call this morning, @GovJanetMills &amp; the Maine delegation discussed our ongoing joint efforts to combat COVID-19 &amp; the threat it poses to the health of our citizens &amp; communities. We will continue to work closely together to advocate on behalf of all Mainers.",2020-05-18 19:22:52
"Today, I'm joining a bipartisan group in introducing the SMART Act - a $500 billion rescue package for state &amp; local governments hurt by COVID-19. 

Under our bill, Maine would receive at least $2 billion, which builds on the $1.25 billion we received from the CARES Act.",2020-05-18 16:17:38
I have long been a strong advocate for the Inspectors General.  They are vital partners in Congress’s effort to identify inefficient or ineffective government programs and to root out fraud and other wrongdoing.,2020-05-17 02:13:38
"According to the @AP, a Census Bureau survey showed that nearly 2/3 of small businesses in Maine have received forgivable PPP loans, among the highest in the nation.",2020-05-16 15:28:44
The proliferation of scams exploiting older Americans’ anxiety about COVID-19 underscores the ruthlessness of con artists. @SenatorSinema &amp; I introduced a resolution for National Senior Fraud Awareness Day to emphasize the need to raise awareness about scams &amp; stop criminals. https://t.co/FNsQDaZCiq,2020-05-15 22:18:35
"#NationalPoliceWeek is a time to thank law enforcement officers &amp; reflect upon the sacrifices they make every day to keep our communities safe. 
 
https://t.co/AK0FIkysBB",2020-05-15 15:12:14
"As USDA implements the Coronavirus Food Assistance Program, @SenSherrodBrown, @SenStabenow, &amp; I led a bipartisan group urging them to adopt a plan that reaches all local producers, including new farmers, to help minimize the burden COVID-19 has placed on our agriculture sector. https://t.co/e9xFGCVEr0",2020-05-14 16:04:25
"#BREAKING: Maine is receiving $52,673,451 to purchase, administer, and expand capacity for COVID-19 testing.

https://t.co/RrpyUeQtuT",2020-05-13 17:35:04
"Tragically, COVID-19 has claimed the lives of a disproportionate number of nursing home residents. We must do more to protect vulnerable seniors. @SenatorSinema &amp; I outlined our recommendations for a new Commission that will help protect older adults in nursing homes. https://t.co/FrRjXceTdu",2020-05-13 13:24:00
"My experienced staff at my six constituent service centers are continuing to assist thousands of Mainers during this difficult time. If you need help with a federal agency or if you’re looking for information on the COVID-19 response, please visit https://t.co/GC3gCHb2fx. https://t.co/w5Bp0cuI1s",2020-05-12 23:26:50
"HHS must use an evidence-based approach to distribute medicines to treat COVID-19, such as the emergency drug Remdesivir. At a hearing today, I raised this issue with the FDA Commissioner to help ensure that patients at Maine hospitals are able to access these treatments. https://t.co/um8aUPWf99",2020-05-12 19:59:48
Bipartisan cooperation is needed now more than ever to confront the unprecedented crisis facing our nation. I am honored that my work to bring together people on both sides of the aisle was reflected in the Lugar Center and Georgetown University’s Bipartisan Index. https://t.co/mNCI1mKlyI,2020-05-12 13:22:41
"Maine has been awarded more than $4.3 million in the second installment of funding to support affordable housing, reduce homelessness, &amp; bolster COVID-19 prevention &amp; response efforts.

https://t.co/X2eQCPdCKx",2020-05-11 15:40:45
We owe it to our veterans to ensure they have the health care they have earned through their service. The Maine Delegation wrote to the VA to urge them to prioritize providing additional testing kits &amp; PPE to help protect veterans &amp; medical professionals in Maine &amp; across the US. https://t.co/23Pvcevqr7,2020-05-11 12:34:54
Happy Mother’s Day to all of the wonderful Maine moms who keep their families and communities strong! https://t.co/mT6YLQwrvD,2020-05-10 12:05:18
"Maine has been awarded an additional $3 million to help prevent low-income families &amp; seniors from making the impossible choice between paying for heat &amp; paying for food or medicine. @SenJackReed &amp; I secured additional funding for LIHEAP in the CARES Act.

https://t.co/Azr2Y1gVt8",2020-05-09 15:11:20
No Labels’ bipartisan and bicameral members of Congress held a Zoom meeting today to discuss further aid to state and local governments whose revenues have plummeted due to COVID-19. @Sen_JoeManchin and I are the Senate chairs of @NoLabelsOrg. https://t.co/oLNsp3KOAN,2020-05-08 21:58:41
"Maine has received $1.25 billion in direct assistance so far through the CARES Act, but our state &amp; local governments will need additional help to offset the sharp revenue decrease caused by COVID-19.",2020-05-08 19:20:32
"America’s bus &amp; motorcoach industry provides 600 million passenger trips annually. To help ensure that this industry is there for our communities following COVID-19, @SenJackReed &amp; I urged Treasury to offer businesses assistance &amp; guidance to overcome their unique challenges. https://t.co/d0HapupGYG",2020-05-08 17:35:34
"Despite school closures due to COVID-19, teachers in Maine &amp; throughout the country have gone above &amp; beyond to develop innovative ways to continue to support students &amp; provide a high-quality education. 
 
https://t.co/Z4fcAeXTIx",2020-05-08 14:47:39
"Nearly $2.5 million has been awarded to 19 Maine housing authorities to help their dedicated staff prevent, prepare, and respond to COVID-19 and help protect vulnerable public housing residents.

https://t.co/8QhoZxqMuj",2020-05-08 12:28:14
"USPS workers are stepping up in response to COVID-19, continuing to deliver mail &amp; packages, &amp; they need our support. 

@SenFeinstein &amp; I led a bipartisan group of 10 Senators in calling for the inclusion of emergency funding for the USPS in any future coronavirus legislation. https://t.co/XhY5scpDG7",2020-05-08 00:17:11
"This morning, I pressed top U.S. health officials on the need to rapidly scale up the domestic production of new COVID-19 tests and supplies in order to help ensure that Mainers and all Americans will have adequate testing capacity to safely reopen our society. https://t.co/cbiGuQJDPS",2020-05-07 21:31:48
NEW FUNDING FOR MAINE TESTING: Nearly $5 million in federal assistance has been awarded to 18 health centers throughout Maine to expand COVID-19 testing.,2020-05-07 17:21:27
NEW FUNDING: More than $20 million in relief for the hardworking men and women in Maine’s lobster and fishing industries is on the way.  I helped secure this COVID-19 related funding to assist families and communities that depend on our fisheries.,2020-05-07 13:41:21
The CARES Act became law over a month ago and included $300 million I helped secure to support lobstermen and fishermen. It is long past time for this aid to be released. I have spoken with the Administration and am continuing to press them to distribute this critical funding.,2020-05-06 18:38:34
"Nursing is not just a profession; it’s a calling. On #NationalNursesDay, we thank nurses in Maine &amp; throughout the country for answering this call. Their spirit of caring &amp; determination is helping us conquer COVID-19. Be well, stay safe, &amp; thank you for all that you do. https://t.co/ZDZoJ4hdg4",2020-05-06 16:29:16
"A proposal by USDA would put food benefits at risk for 3.1 million Americans, including more than 44,000 Mainers. In light of increasing food insecurity caused by COVID-19, @Sen_JoeManchin &amp; I renewed our opposition to this proposal &amp; called on USDA to halt the proposed rule. https://t.co/dSB5Fiesjs",2020-05-06 13:33:03
"NEW NFIB SURVEY: The PPP is delivering much-needed assistance for small businesses and their employees. 77% of small businesses have applied, and 61% of them have received funds already. PPP is helping 26,025 Maine small employers send paychecks to an estimated 200,000 Mainers. https://t.co/CnS9OAX00O",2020-05-05 22:14:21
"I met with @AARPMaine members to discuss ways we can continue to support seniors, especially amid COVID-19. From securing funding for food assistance programs to providing resources for hospitals &amp; our state &amp; local governments, I will continue to work to help keep seniors safe. https://t.co/Kagwazdm0d",2020-05-05 15:31:25
"Nearly $3 million in additional funding through the CARES Act has been awarded to Maine colleges &amp; universities to help students pay for food, housing, course materials, technology, health care &amp; child care. This builds on the more than $41 million they received last month. https://t.co/I3MJOiMBLi",2020-05-05 12:08:32
"REMINDER: SSI &amp; VA benefit recipients need to visit the non-filer portal on https://t.co/B26T86xks2 by May 5th to receive the additional $500 per qualified dependent this year, on top of their $1,200 economic impact payment.
 
https://t.co/6ikA7P7eFJ",2020-05-04 22:13:35
"The @alzfdn has set up a helpline to answer COVID-19 questions for families affected by Alzheimer’s. Staffed entirely by licensed social workers, this resource can be accessed at https://t.co/JuUdzN2ph1.
 
https://t.co/mw1WiHoTBJ",2020-05-04 16:17:25
"The employees of Puritan are so dedicated, so hardworking, and so caring. They know just how important the work they are doing is to helping protect the health and safety of our country. They are proving once again that Maine-made is best-made. 

https://t.co/Rii4StkGIy",2020-05-04 13:11:01
"PPP UPDATE: Since Monday, another 9,026 Maine small employers received $317,222,402 through the Paycheck Protection Program I co-authored, with an average forgivable loan of $35,145. The PPP is helping a total of 25,695 Maine small employers to send paychecks to their employees.",2020-05-03 17:32:12
"#BREAKING: 121 Maine rural health care providers, including hospitals, clinics, and community health centers, will receive $131,501,672 through the CARES Act.  This financial relief is vital to helping support medical professionals on the front lines and helping protect patients.",2020-05-01 22:15:33
"I am so proud of this collaborative effort involving three Maine companies—Puritan Medical Products, Cianbro, and Bath Iron Works—and their hardworking employees, which will double the production of testing swabs.

https://t.co/8PYjoMsWDN",2020-05-01 19:05:01
"Maine’s seafood industry has experienced severe financial harm due to COVID-19. To support Maine fishermen, I helped secure $300 million in the CARES Act. I wrote to President Trump to urge him to swiftly release this assistance for the hardworking men &amp; women in the industry. https://t.co/QDibu7no9S",2020-05-01 16:16:27
"Amid COVID-19, Maine’s ports have been vital to transporting food &amp; medical supplies. As the Chairman of the Transportation Appropriations Subcommittee, I requested MARAD to host a webinar to provide Maine ports with the information they need to apply for federal grant programs. https://t.co/fThYzC5xWY",2020-05-01 14:29:15
"ATTN FIRE DEPTS: FEMA has made $100 million in emergency funding available for firefighters to purchase or be reimbursed for personal protective equipment (PPE). Fire departments have until May 15 to apply for this funding.

https://t.co/LHZmlrsgct",2020-04-30 13:53:15
"Today I visited the Androscoggin Mill in Jay to tour the site of the April 15 explosion &amp; receive an update on the investigation &amp; current operations.

https://t.co/iCSHY1TWe3",2020-04-29 22:20:57
"PPP UPDATE: More than 18,000 Maine small employers have been awarded a total of $2.3 billion. Since applications reopened on Monday, 1,548 Maine small employers—with an average estimated size of fewer than four employees—have been approved for an average loan of $39,000.",2020-04-29 15:49:14
"Online learning, teleworking, &amp; telehealth have become increasingly important amid COVID-19. @Sen_JoeManchin &amp; I called on the FCC to work with broadband service providers &amp; Congress to increase the number of mobile broadband hotspots across rural America

https://t.co/DIUe5QfTlq",2020-04-28 21:43:54
"NEW FUNDING: Maine hospitals &amp; other medical providers have received a total of more than $187 million through the CARES Act so far to help protect the health of Mainers &amp; support doctors, nurses, &amp; others on the front lines in the fight against COVID-19
 
https://t.co/MKTuZvr8LX",2020-04-28 16:44:04
"ACTION NEEDED by May 5:
 
The IRS issued an alert for SSI &amp; VA beneficiaries to visit the IRS non-filer portal by May 5 if they have dependents &amp; did not file a tax return in 2018 or 2019 so they can receive $500 per qualified dependent, on top of their $1,200 stimulus payment.",2020-04-28 12:02:34
"REMINDER: There is NO fee required to apply for a loan through the Paycheck Protection Program. Anyone who believes they have been targeted by this type of scheme should report it to my Committee’s Fraud Hotline at 1-855-303-9470.
 
https://t.co/jRpZEorz8h",2020-04-27 19:09:48
"NEWS FOR MAINE SEASONAL BUSINESSES RE: PAYCHECK PROTECTION PROGRAM:
 
The Treasury Department just announced that seasonal employers now have the option to use ANY consecutive 12-week period between May 1, 2019 &amp; Sept. 15, 2019 for calculating their maximum PPP loan amount.",2020-04-27 17:22:37
"Maine has the most wonderful teachers!

https://t.co/2Vcs5TQVT8",2020-04-27 16:12:03
"Attention small employers and self-employed Mainers such as fishermen: SBA will resume accepting Paycheck Protection Program applications at 10:30 this morning.

https://t.co/oTfcBRo2zp",2020-04-27 13:57:37
"Great news for small businesses, employees, &amp; health care workers! A bipartisan bill signed into law today will provide an additional $320 billion for the #PPP I co-authored, $75 billion for hospitals &amp; providers, &amp; $25 billion for COVID-19 testing.

https://t.co/nj5POZgGJ3",2020-04-24 20:37:04
"The COVID-19 pandemic has caused significant disruptions to our education system. This additional federal funding will help our wonderful, hardworking Maine teachers continue to provide quality instruction and help students achieve their goals.

https://t.co/noB7UmN8zV",2020-04-24 19:16:22
"Maine nursing homes, senior living facilities, &amp; homes for those with disabilities need additional support to protect residents &amp; employees from COVID-19. I joined a bipartisan group of nearly 30 Senators calling on HHS to provide these communities with the resources they need. https://t.co/YmkVimKYlP",2020-04-24 16:26:58
"The reopening of two paper machines eight days after the massive explosion at the Androscoggin Mill in Jay is a testament to the resiliency of Mainers and the bravery of the employees whose quick actions prevented further damage.

https://t.co/1VvqD9v0OX",2020-04-24 11:48:01
"Blessed Ramadan to all those who are observing this holy month of reflection, fasting, and prayer!",2020-04-24 01:32:51
"Latest Maine data on the Paycheck Protection Program I co-authored: 

To date, Maine has received $2.24 billion in forgivable loans for close to 17,000 small employers, providing paychecks for approx. 180,000 employees. 

The avg. loan amount: $134,000 

Avg. # of employees: 12",2020-04-23 21:32:38
"Maine farmers support our rural communities and our local food supply, and they need our support now. @chelliepingree and I called on USDA to work quickly to provide small farms with the financial assistance provided in the COVID-19 relief packages.
 
https://t.co/fWmLpj0yuW",2020-04-23 16:02:26
"The Senate has done its part by passing another bipartisan COVID-19 relief package I helped negotiate that will support small employers, employees, our health care system, and testing efforts. The House should pass it without delay.

https://t.co/Yyi6Dz8Cte",2020-04-23 13:15:16
"Nurses are among the many heroes who are working on the front lines in Maine and throughout the country to combat the COVID-19 pandemic.
 
I spoke with several groups of Maine nurses about what we can do on the federal level to assist their tireless efforts.",2020-04-22 14:59:38
"BREAKING: Maine will receive at least $16,295,844 for COVID-19 testing needs from this new emergency aid package the Senate passed this afternoon.",2020-04-21 21:38:20
Congress has once again reached a bipartisan agreement to respond to COVID-19. The Senate passed a $480 billion emergency aid package that includes $320 billion for the Paycheck Protection Program I co-authored to help small employers survive &amp; continue to pay their employees.,2020-04-21 21:32:26
"ACTION NEEDED: SS &amp; Railroad Retirement beneficiaries with dependents need to visit the IRS portal by noon TOMORROW if they did not file a tax return in 2018 or 2019 so they can quickly receive the additional $500 per qualified dependent, on top of their $1,200 rebate check. https://t.co/r9XCdhGiEm",2020-04-21 16:18:28
"COVID-19 has greatly affected Maine’s potato farmers, who have lost nearly half of their business with the shutdown of restaurants &amp; could see orders reduced next year. To help mitigate losses, the Delegation is urging USDA to directly purchase Maine potatoes from farmers. https://t.co/hcTEkmPfse",2020-04-21 12:32:27
"Today I spoke with students from Northern Penobscot Tech Region III via Zoom who are studying to earn their IT certifications. With many Mainers learning remotely &amp; working from home, IT professionals are in high demand. I wish them the best of luck as they continue their studies",2020-04-20 22:18:41
The Department of Commerce needs to immediately release the $300 million in assistance to fishermen &amp; related businesses that was included in the Phase 3 coronavirus emergency package.,2020-04-20 19:47:37
"Now is the time when partisan bickering should be put aside for the good of our fishermen and numerous other small employers and employees in Maine and across our country. 

https://t.co/qHvplMobUQ",2020-04-20 14:34:38
"Maine and NH’s Congressional Delegations stand with our hardworking dairy farmers who are struggling with plummeting dairy prices and increased costs due to COVID-19. We called on USDA to help stabilize prices and support these family-owned farms.

https://t.co/EsjKe3Nozl https://t.co/uHAKYtFCt3",2020-04-20 00:42:09
"While negotiations remain ongoing, I am optimistic that we will soon secure an agreement to replenish funding for the Paycheck Protection Program — a program I co-authored that provides forgivable loans to help small employers survive &amp; give paychecks to their employees.",2020-04-19 22:56:29
"Maine will receive nearly $11 million to provide child care assistance to those who are working on the front lines to fight this pandemic &amp; to help our child care providers facing decreased enrollment &amp; even closure due to COVID-19. 

https://t.co/QPdKUFKsUG",2020-04-19 18:36:06
"I am so grateful to all Mainers who are serving on the front lines during the COVID-19 pandemic. These heroes are working tirelessly, giving compassionate care, and protecting vulnerable members of our society. Together, we will get through this crisis. 

https://t.co/eEsRL4wixK",2020-04-19 15:19:01
"UPDATE: Maine veterans who receive disability compensation and other VA benefits will now automatically receive their coronavirus rebate check without having to file a tax return or fill out unnecessary paperwork.

https://t.co/zh7i49AQBz",2020-04-18 21:16:59
"The Paycheck Protection Program has been incredibly successful, providing $2.24 billion to 16,699 small Maine employers in less than two weeks.  We must replenish funding for this program that is already supporting an estimated 180,000 Maine jobs.

https://t.co/kqQoCGBFj7",2020-04-18 18:57:56
Rural &amp; low-income areas face additional challenges from COVID-19 due to limited availability of high-speed Internet.,2020-04-17 20:27:18
"Maine’s agriculture sector is an integral part of our economy &amp; continues to be the lifeblood of many rural communities. To help our farmers, the USDA must provide financial relief &amp; direct payments to farmers who have suffered from losses due to COVID-19

https://t.co/DFZFDcgzCK",2020-04-17 17:51:10
"Maine will receive $9,273,552 to support K-12 &amp; postsecondary education through the CARES Act. This funding will help schools adapt &amp; transition to online learning &amp; help students continue to receive quality instruction during the COVID-19 pandemic.

https://t.co/nTmzNyQnUu",2020-04-17 14:29:56
"For the past 7 months, @Astro_Jessica has been shattering records aboard the @Space_Station. In between these trailblazing achievements, she worked on hundreds of experiments and spoke directly with Maine students.  https://t.co/bKiLV4ziDH",2020-04-17 10:19:21
"Members of the Maine and NH Delegations are united in calling on the DOD to reinstate its paid administrative leave policy at public shipyards like PNSY in order to protect the health of employees and their families. 

https://t.co/zBxGhRudd9",2020-04-16 22:15:46
"Nearly $500,000 has been awarded to the Maine Hospital Association to help ensure that medical professionals in our state have the training and resources they need to care for COVID-19 patients. 

https://t.co/a5NtVGQXtb",2020-04-16 20:06:49
The Paycheck Protection Program has run out of funding.  We urgently need an additional $250 billion for this program I co-authored that provides forgivable loans so small employers can survive &amp; give paychecks to their employees.,2020-04-16 16:59:47
I am praying for the safety of the workers at the Androscoggin Mill in Jay as well as all of those who were in the vicinity of the explosion. I thank all of the brave first responders who have rushed to the scene to assist.,2020-04-15 18:18:03
"UPDATE: $2.1 billion from the Paycheck Protection Program will support 14,154 Maine small employers &amp; an estimated 180,000 Maine jobs. Nationally, more than one million small employers are approved. Congress must pass additional funding for the PPP I co-authored to meet demand.",2020-04-15 16:23:07
It is imperative that the brave Maine men &amp; women who are working on the front lines to combat COVID-19 have ready access to PPE. The Maine Delegation is urging HHS &amp; FEMA to provide assistance in helping our state more easily access this potentially lifesaving equipment. https://t.co/KYHW392Xjp,2020-04-14 18:54:35
"UPDATE: Nearly $2 billion in forgivable Paycheck Protection Program loans have been approved for 12,364 Maine small employers. The PPP I co-authored is helping Maine small businesses continue to pay more than 100,000 employees &amp; avoid closing their doors due to COVID-19.",2020-04-14 16:57:39
"Maine has been awarded more than $83 million to help ensure that public transportation remains strong and reliable so that people can access medical care, grocery stores, pharmacies, and other necessities during the COVID-19 pandemic. 

https://t.co/LxDNGhzovf",2020-04-14 13:56:02
"Maine colleges and universities will receive more than $41 million in CARES Act funding. $20.5 million of this funding must be used for emergency financial aid grants to our students who have suffered economic harm as a result of COVID-19.

https://t.co/UrdjZwHrvk",2020-04-13 19:40:02
"As of this morning, $1.87 billion in forgivable Paycheck Protection Program loans have been approved for 11,088 Maine small businesses. This critical relief will help more than 100,000 Maine employees receive paychecks even if they have been temporarily laid off due to COVID-19.",2020-04-13 17:40:40
