tweet,dates
"Wishing a Happy Mother’s Day to all the outstanding moms across Minnesota and this nation! A special thank you to my mother, Patsy, and my wife Jacquie, whose patience and love inspire me every single day. https://t.co/r3cqzDV2bn",2020-05-10 15:30:01
Congrats to my friend @RepFrenchHill for being named to the CARES Act Congressional Oversight Commission. I was proud to vote for the CARES Act to provide much-needed resources for Americans. Glad to see he will be a part of the effort to properly disseminate and implement this.,2020-05-08 15:11:14
"On #NationalDayOfPrayer, let us remember that the power of prayer is given to all by God, and the freedom of religion is a core American value. Together we can seek peace and prosperity, regardless of our differences.",2020-05-07 18:29:45
"I am beyond grateful to the outstanding nurses around the nation who offer extraordinary care and services to Americans, especially during this difficult time in our country. Today, on #NurseAppreciationDay, and every other day - thank you for serving your patients!",2020-05-06 22:38:16
I'm hosting a telephone town hall at 4PM. Visit my website to learn more about how to join. I look forward to hearing from constituents all across #MN06 today! https://t.co/moj1VJw8pc,2020-05-06 19:24:13
"Classrooms across Minnesota might look different right now, but one thing hasn’t changed; teachers are going beyond the classroom to educate and support their students. This #TeacherAppreciationDay, thank you to all of the teachers that do so much for our children and community. https://t.co/M5ypqqfYiN",2020-05-05 21:46:17
ICYMI – Farms &amp; other agricultural businesses can apply for relief via @SBAgov! https://t.co/DDRBXTYymK,2020-05-05 14:07:15
"Today is #InternationalFirefightersDay! Thank you to the brave men and women who answer the call to protect their fellow Americans. It was an honor to thank these heroes in person when some Minnesota firefighters visited Washington, D.C. in March! @IAFFNewsDesk https://t.co/YyqOube8WL",2020-05-04 22:46:03
"REMINDER: Many individuals who don’t traditionally file taxes, like seniors and veterans, are eligible for federal economic impact payments under the #CARESAct, but must submit their payment info to the @IRS by May 5 https://t.co/EY0B19JDOP",2020-05-04 22:08:25
"I introduced the Senior abuse Training and Offense Prevention (STOP) Act to support our local communities who are proactively preventing and combatting elder abuse. Our seniors deserve to age with dignity and I am committed to ensuring they can. Read more:
https://t.co/JRhDjsG88I",2020-05-04 21:18:37
A huge thank you to our community health centers who remain a vital service to our communities during this difficult time. We are so grateful for the care you give and the sacrifices you make to care for your fellow Minnesotans. https://t.co/6zBXxCXy7J,2020-05-04 18:38:11
"I’m proud to co-sponsor @RepFrenchHill’s legislation to promote safer transactions during the #COVID19 outbreak. This modern, touchless approach will save lives and help revolutionize the future of our current payment infrastructure! https://t.co/x7ctOgzt6m",2020-05-01 18:45:26
Proud to co-sponsor this common-sense legislation! https://t.co/eLC28HwlcM,2020-05-01 17:24:20
Still waiting on your economic impact payment? @IRS has developed the Get My Payment tool to help you check your eligibility and find out the status of your payment! https://t.co/4NsgvgjNjJ,2020-04-30 21:55:48
"For SSI recipients: If you have a beneficiary under the age of 17 and would like to receive your economic impact payments, make sure to submit your non-filer information to the @IRS by May 5! https://t.co/EY0B19JDOP",2020-04-30 21:51:36
"Last week, my colleagues &amp; I sent a letter to @SteveMnuchin1 urging @USTreasury to use emerging technologies such as #blockchain to help distribute #CARESAct Economic Impact Payments. Read more below https://t.co/x0ktbouqrG",2020-04-30 18:14:55
It was an honor to have @VP Mike Pence visit Minnesota yesterday to see firsthand the outstanding work @MayoClinic is doing to fight #COVID19. Listen to their roundtable discussion here: https://t.co/2PNFr8drFn,2020-04-29 19:32:31
"It has been incredible to see the outpouring of support for our frontline health care workers from individuals, communities, and companies across the nation. This initiative by @UnitedHealthGrp’s Foundation will help in the fight against #COVID19. https://t.co/gr3SJm0k4K",2020-04-29 14:22:09
Thank you @realDonaldTrump for hearing my concerns and those of our livestock producers in Minnesota and responding with swift action. Our agriculture community deserves our support during this unprecedented time. https://t.co/2q6WypPdVq,2020-04-28 19:29:02
"Thank you to our doctors, nurses, support staff, emergency response workers, and all of the people who love them for their service in our fight against #COVID19. We will defeat this together! https://t.co/NGgpixlN0Z",2020-04-27 22:16:12
We will get through this crisis by working as one community &amp; nation. Thanks to the great work of @ccstcloud and their volunteers for getting food to housebound Minnesotans! https://t.co/7JdU92kcfk,2020-04-27 20:48:15
"Starting TODAY, @SBAgov and the #PaycheckProtectionProgram will resume accepting applications to provide forgivable loans to keep employees paid. Find out more here: https://t.co/ILXHftvyzd",2020-04-27 17:48:38
"Every year @DEAHQ hosts National Prescription Drug Take-Back Day. It is postponed, but please remember to #SecureYourMeds. Prescription drug abuse affects many Americans. Stow these prescription drugs until you can dispose of them safely. Read more here: https://t.co/iX7BHqhgnQ",2020-04-25 19:41:54
Proud to co-sponsor @RepHuizenga's HEROES Act - which gives medical professionals and first responders on the front lines of this war against #COVID19 a federal income tax holiday while fighting this virus! We are grateful to them. #ThankYouHealthWorkers,2020-04-24 19:17:09
"Today, I voted in favor of the Paycheck Protection Program and Health Care Enhancement Act. Read my full statement here: https://t.co/WTi5WTsvIs",2020-04-23 23:25:22
In search of open businesses in #MN06? Visit @hometownsource’s list here: https://t.co/63tgESRKF2,2020-04-23 17:59:40
As we celebrate 112 years of the @USArmyReserve today - Let us acknowledge the incredible service of these men and women who are making our nation stronger right now by aiding our frontline health care workers! #USARBirthday112 #TwiceTheCitizen https://t.co/CFIbC00kiL,2020-04-23 16:37:59
Thank you to @MedicalAlley for hosting a virtual town hall yesterday &amp; allowing me to participate. Our medical device community is doing outstanding work to increase production &amp; assist our frontline health care workers with the tools to fight #COVID19. https://t.co/9SGlNfT1BK,2020-04-22 19:46:25
It was great to catch up with members of @mnbar on the phone today! I have been proud to support funding for the Legal Services Corporation since my early days in Congress and will continue to do so. #LSCMatters https://t.co/jvat6VdqG3,2020-04-22 18:25:49
"TODAY: Action required for @SocialSecurity beneficiaries &amp; SSI recipients who did not file taxes in 2018 or 2019, but have children under the age of 17 and qualify for additional direct assistance, visit here to learn how to apply: https://t.co/EY0B19JDOP",2020-04-22 17:36:26
"Incredible to see Tina Peterson, a FedEx truck driver from @BlaineMN speaking at the @WhiteHouse. Truck drivers have been some of the silent heroes throughout this pandemic. I am grateful to them for keeping the nation supplied and the American economy moving. https://t.co/uny0Ftot1p",2020-04-22 13:17:38
"ATTENTION: Action required by April 22nd! For @SocialSecurity beneficiaries &amp; SSI recipients who did not file taxes in 2018 or 2019, but have children under age 17 and qualify for additional direct assistance, visit here to learn how to apply: https://t.co/9DkrlDIeIZ",2020-04-21 21:22:02
"Today, on #YomHaShoah, #WeRemember the millions of innocent lives murdered in the Holocaust and commit to #NeverAgain allowing evil to flourish in our world. #HolocaustRemembranceDay @HolocaustMuseum https://t.co/wlSuWCPtyQ",2020-04-21 20:08:02
"Simply expanding the list of ""essential"" businesses one at a time is the wrong approach to keeping Minnesota's economy afloat. Read my op-ed with @paulgazelka calling on Gov. Walz to give every Minnesotan a plan to reopen our economy. https://t.co/2eWN37Wd5W",2020-04-18 18:29:47
"Proud to see MN’s researchers &amp; workers at the front lines of our fight against #COVID19. @FDA just approved a device to help patients breathe which was designed at @UMNews, and will begin production in MN. https://t.co/AQWBEtfxQq",2020-04-17 22:37:52
"Each year, @MinnPost hosts a night of comedy, music, and bipartisanship. Sad to see it canceled due to #COVID19 – was looking forward to getting back on the MinnRoast stage. Can't wait to join next year! Watch highlights from last year, here: https://t.co/R43AWNPciH",2020-04-17 17:28:02
"Due to the #CARESAct, self-employed and contract workers are now eligible for unemployment benefits in MN. Read more via @MinnPost: https://t.co/2JrvlMRYOi",2020-04-16 18:39:28
"Tina Peterson from Blaine, MN, a professional driver and service provider to @FedEx, will be part of today’s @WhiteHouse Celebrating America’s Truckers event! Thank you Tina for your dedication during this crisis. Watch LIVE here: https://t.co/LL1aMP0aoj https://t.co/VXWpZTRKee",2020-04-16 18:22:09
"Happy 112th birthday, Erna! https://t.co/dM27PnCvOI",2020-04-15 19:37:28
"We will only be able to defeat #COVID19 through widespread &amp; accessible testing. Thank you to @CMSGov, @USDOL and @USTreasury for your guidance to ensure every American can be tested w. no out-of-pocket costs. https://t.co/cAvsoj3zSN",2020-04-15 13:36:56
"ICYMI- I appeared on @WJON_News to talk about the response to #COVID19, including the CARES Act and programs available to small businesses like the Paycheck Protection Program. Listen here: https://t.co/Yw86l9U2AD",2020-04-14 18:40:30
"The CARES Act, which I supported, is allowing MN cities to support some of our most vulnerable residents with shelter &amp; hygiene stations for the homeless during the #COVID19 crisis. https://t.co/uLm51bBCYU",2020-04-14 15:22:49
"As we continue to #StayAtHome to combat the spread of #COVID19, access to digital resources remains extremely important. For students practicing distance learning to parents continuing their work remotely, stay connected by visiting my resource kit here: https://t.co/Q0wsXQrNyz",2020-04-13 17:41:20
Jacquie and I are wishing you all a happy and blessed Easter! #HeIsRisen,2020-04-12 16:20:02
"He himself bore our sins in his body on the tree, that we might die to sin and live to righteousness. By his wounds, you have been healed. (1 Peter 2:24) May you have a peaceful &amp; reflective Good Friday.",2020-04-10 20:15:54
"Wishing Mike Lynch a happy retirement from @wccoradio—thank you for 40 years of informing Minnesotans about the snow, ice, hail and all of the wonderful weather MN has to offer! 
https://t.co/ZvK0vTBWAJ",2020-04-09 19:43:56
"On this day last year, the MN delegation came together for our annual #HotDish competition. While we might be far from our friends &amp; colleagues, our great state will stand united in our fight against #COVID19. https://t.co/jlzhawVaIo",2020-04-09 18:03:14
"For members of our agriculture community, who continue to keep the shelves stocked and our plates full, my office assembled a list of resources as we continue to fight #COVID19 together. Read more here: https://t.co/MDWa5DWC9b",2020-04-08 22:03:54
"BREAKING --&gt; The @CDC has announced that they will award an additional $2.6M to MN’s state and local health departments, resulting in a total of $13M to support the fight against #COVID19 https://t.co/x1IXIdFPEO",2020-04-08 16:49:17
Glad to see @POTUS grant @GovTimWalz request for a disaster declaration for Minnesota. Proud to support this request with the rest of the Minnesota delegation. Read more here: https://t.co/13MjYZ18nG,2020-04-08 14:50:07
"Proud to see my colleagues from @FinancialCmte holding our leaders accountable—the American people deserve decisive action to fight #COVID19, not partisan politics disguised as relief. https://t.co/wBeAQPfkFF https://t.co/00F3ly0vih",2020-04-07 20:33:29
"Today is #WorldHealthDay! To our health care professionals, their loved ones, and all others on the front lines around the world—we thank you. https://t.co/HsWQHFU3Ev",2020-04-07 17:23:23
"With my support, the House passed a bill guaranteeing that our servicemen and women who had their education interrupted by #COVID19 will have access to their earned education benefits. Learn more about resources available to veterans on my website: https://t.co/2J8x9wbt1D",2020-04-06 23:41:30
Do you have questions about how the new #PaycheckProtectionProgram can help you and your business? Read more here and please contact our office if we can help: https://t.co/l9vBVIFo7d https://t.co/RNdl07NVSF,2020-04-06 21:03:43
“Blessed is he who comes in the name of the Lord! Hosanna in the highest heaven!” - Matthew 21:9 Wishing a blessed Palm Sunday to all who observe.,2020-04-05 17:51:22
"This week, thousands of Minnesota schools started online learning. For parents &amp; kids, this can mean adapting to new routines. Read more about my tips for families navigating #COVID19 here: https://t.co/BR7yxKdp9i",2020-04-02 23:47:00
"The CARES Act, which I supported, includes a new program to help small businesses bridge the gap in revenue so they can continue to pay their employees despite #COVID19 related closures and lost revenue.",2020-04-02 21:41:26
"#COVID19 has impacted household incomes across the country, and paying monthly bills might be difficult. If you or a loved one is in need of mortgage relief, @CFPB has guidance! https://t.co/79fTYsCCqP",2020-04-02 15:43:19
"Last week, I voted in favor of the CARES Act. This bipartisan legislation will provide support for millions of Americans as we fight the spread of #COVID19, for doctors and nurses, small business owners, the recently unemployed, and Americans across the nation. https://t.co/2fW0kc2UQ6",2020-03-31 02:16:05
"Today is #NationalDoctorsDay! Sometime today, join me to #ThankADoctor for keeping our families and communities safe. https://t.co/QJ7lE9DzMW",2020-03-31 01:37:43
Our efforts to fight #COVID19 have real impacts on our physical and mental well-being. My office assembled mental health resources for those struggling during this time. Read more here: https://t.co/UkSq61bvla https://t.co/GMVTUtYPY7,2020-03-30 16:03:32
"ICYMI: Due to #COVID19 safety concerns, the MN October 1, 2020 deadline for enforcement on #REALID will be pushed back a year to October 1, 2021. https://t.co/BmKJjC7aqn",2020-03-30 01:26:33
"Thanks to @NASA for giving kids a new way to explore during this #shelterinplace, even if it’s just from the living room! https://t.co/i3dXBdSaq4",2020-03-29 18:15:43
"Read my full statement regarding my support for the CARES Act below, or by visiting my website here: https://t.co/eJX0R9PfnE https://t.co/dYjwxfjszB",2020-03-27 18:24:35
"Jacquie and I are praying for comfort for the family and loved ones of my friend, former Senator Steve Dille. It was an honor to serve alongside him in the Minnesota Legislature and represent the shared values of our neighboring communities. He will be missed by so many.",2020-03-26 21:49:18
Minnesota’s greatest asset has always been the ingenuity of its people. Proud to see Minnesotans doing their part to support our doctors and nurses at the front lines in our fight against #COVID19! https://t.co/aX3nlzVorW,2020-03-26 20:58:43
"BREAKING --&gt; Based on recommendations from @UMNews and @MNHealth, @GovTimWalz announced a “stay at home” order, requiring Minnesotans to stay at home unless absolutely necessary. https://t.co/4L4Ag2A3aM",2020-03-26 19:38:01
"Today, I spoke with the CEO of @Coborns, the @StCldAreaChamb, @MN_Chamber, @mncreditunions and the @MinnBankers - These folks are a huge part of the fight to combat coronavirus and keep our economy and small businesses alive. We can fight this together. https://t.co/zfRI8uQw5w",2020-03-25 23:53:01
Proud to see @3M ramp up their continued production of N95 respirators – with nearly 100 million manufactured per month! You are protecting our front line health care workers around the country – We are grateful. Thank you!  https://t.co/0JCgUGnuMH,2020-03-25 13:29:57
"Wishing a happy birthday to the love of my life, my wife Jacquie. https://t.co/zrYTy2rFWf",2020-03-24 23:51:10
"Small businesses are the economic engines of our community, but they are also among the hardest hit by the #COVID19 outbreak. See my toolkit below to learn more about resources for small business owners and employees! Read more here: https://t.co/akWkDJlujl https://t.co/oaor6QhyPE",2020-03-24 21:09:10
"Thank you to the nearly 10,000 constituents who participated in my #COVID19 tele-town hall yesterday! If I didn’t have time to answer your question, you can always email me at https://t.co/8LVIr3NfRr. https://t.co/6pve9R27yI",2020-03-24 20:35:06
"Today is #NationalAgDay! Thank you to our nation’s ag workforce, who are working hard to keep our shelves stocked and our plates full. https://t.co/t3Mg2N0LSW",2020-03-24 18:24:34
Incredible! Minnesota’s backlog of #COVID19 tests has been eliminated with the help of @MayoClinic. https://t.co/Lkl6xCXKJj,2020-03-24 14:45:34
"Proper mental health care is essential, especially as we embrace social distancing and other precautions to slow the spread of #COVID19. Read more about how mental health professionals are embracing telehealth here: https://t.co/F56SF9rmWz",2020-03-23 19:39:28
"ICYMI: In light of the #COVID19 outbreak, @MNSure will open up a special enrollment period for those currently w/o insurance. The enrollment period will run from today to April 21. Read more here: https://t.co/7i6dKYFjel",2020-03-23 18:11:13
Thanks to @US_FDA for your quick approval of this potentially life-saving test! https://t.co/ZmmAe85yXg,2020-03-23 16:22:10
"My office has put together a resource kit for seniors who are at a higher risk from COVID-19. Learn more by visiting here, or by reading below: https://t.co/gfBjn58e0W 
 
For additional information, visit my website at https://t.co/go9x27Rcvs. https://t.co/yQfTxN11g7",2020-03-23 16:01:51
"I caught up with @mnmilk to check in on our dairy farmers. We often take for granted a gallon of milk or a loaf of bread, but during a time of crisis, we are reminded how important stocked grocery stores are. Now, more than ever, I am grateful for our ag community. https://t.co/dw3cz65QIn",2020-03-22 15:03:03
"Jacquie and I are praying for the family and loved ones of the Minnesotan who lost their life to COVID-19. As we combat this virus, I urge you: follow the precautions, wash your hands, practice social distancing, reduce the risk of exposure. Together, we can stop the spread.",2020-03-21 17:24:23
Hospitals in Minnesota are on the front lines of combatting the spread of COVID-19. I received a briefing from @MNhospitals on the status of our facilities. Inspired by our dedicated health care workers who are serving their fellow Minnesotans. https://t.co/geles6KwB7,2020-03-21 17:19:02
"As a father of seven, I know that school closures can cause stress for families. My office put together a resource kit for parents. Learn more by visiting here, or reading below: https://t.co/6PsZPnslzs   
 
For additional information, visit my website at https://t.co/go9x27Rcvs. https://t.co/3IEX7hKcim",2020-03-20 21:35:42
Great to see @Medtronic commit to 24/7 production of ventilators. Minnesota is proud to be the home of medtech companies who are determined to serve the needs of the American people during this time of crisis. We are in this together.  https://t.co/UUAfKbtpRP,2020-03-20 20:18:09
"ICYMI: With my support, the House passed legislation that will ensure G.I. Bill benefits will cover our Veterans’ tuition and housing allowances, no matter what measures their school has to take to prevent the spread of #COVID19. 
https://t.co/YlwnAqTMbM",2020-03-20 18:57:16
"In times of need, the American spirit always presents itself in the form of generosity and care for our neighbors. During this national emergency, it’s vital that we continue to give blood. Find a @RedCross blood drive and make an appointment here: https://t.co/iQlKc0B4kx https://t.co/yx4Wu4LYuH",2020-03-20 18:31:30
I had an important call with Lt. Col. Jason Hull of the @MNNationalGuard to discuss their role in Minnesota’s overall emergency operations plan. They are an integral part of our state’s response to combat COVID-19. https://t.co/87h34i1hms,2020-03-20 14:07:46
"My office has compiled a resource kit for veterans. Learn more by visiting here, or by reading below: https://t.co/Om5oNPHgsY 

For additional information, visit my website at https://t.co/go9x27Rcvs. https://t.co/LyOVDsE8Sv",2020-03-20 00:06:14
Minnesotans are at the front lines in the fight against #COVID19! Thanks to @3M and @Medtronic for stepping up their production masks for health care workers and N95 ventilators to help care for those with the virus.,2020-03-19 19:54:52
"There are steps all of us can take to protect the health of our friends, family and neighbors. Read the @WhiteHouse  
guidelines on how to stay healthy below. https://t.co/61cN3cIs2G",2020-03-19 13:33:12
"This morning I spoke with Dr. Thelen from the St. Cloud VA Hospital, who briefed me on the steps they’re taking to ensure service and care. They’re open for business, but please call them at 320-252-1670 before visiting! https://t.co/87QFa50llD",2020-03-18 19:57:54
"In difficult times, it is our duty to stand by our fellow Minnesotans for the good of our community. All of us Minnesotans in Congress came together to share our recommendations on how to fight #COVID19. We will overcome this virus, together. https://t.co/rQcI9q6Ryc",2020-03-18 18:18:16
"While many of us are practicing social distancing to slow the spread of #COVID19, let’s take a moment to thank our brave law enforcement, first responders, and all those who are still providing essential services. Thank you for keeping us safe and prepared.",2020-03-16 20:59:36
"Yesterday, @GovTimWalz announced that MN K-12 schools would be closed through March 27 to combat the spread of #COVID19. Read more here: https://t.co/C2tjuP0vvO",2020-03-16 20:23:46
Happy birthday to the legend @SidHartman! https://t.co/hCnKyakN8L,2020-03-15 22:55:18
Read my full statement regarding my vote on the Families First Coronavirus Response Act here: https://t.co/XJS1PdPgkf,2020-03-15 14:52:42
Thank you to @MayoClinic for your incredible efforts. A testing site is available seven days a week in Rochester. More information at https://t.co/D9VRItVbD4 #COVID19 https://t.co/CxJUoo5nji,2020-03-13 21:20:17
"To stay in compliance with public health recommendations, all Capitol and White House tours will be canceled through the end of March. We have reached out to those with a tour scheduled through our office, but please contact the DC office at (202) 225-2331 with any questions.",2020-03-13 18:06:55
Breaking --&gt; Minnesota will receive more than $10.5 million in CDC funds from the #COVID19 supplemental. These funds will help state and local governments fight #coronavirus and keep Minnesotans healthy.,2020-03-13 17:28:51
"During #WomensHistoryMonth, we often recognize women from our history books. However, we can’t forget about the everyday heroes that keep our communities safe and healthy. Read about some of them in @abcnewspapers here: https://t.co/6N3lJtCAZN",2020-03-12 18:25:26
"Join me in celebrating Girl Scout Day! #BecauseofGirlScouts, millions of women and girls are taking action to make the world a better place. Whether she’s building a robotic arm, coding an app, or lobbying her city council, a Girl Scout can do anything!",2020-03-12 17:42:51
"Today is the 4th Annual #MNBroadband Day! Access to broadband means access to the world, through things like remote work or telemedicine. Let’s work together to ensure everyone can access these vital services! #RuralMatters",2020-03-12 16:47:16
Happy to meet with Red River Valley Sugarbeet Growers Assn and discuss how we can support ag in MN! https://t.co/wIefmKAxqi,2020-03-11 20:32:52
"In response to #coronavirus, Congress passed an $8.3 billion supplemental last week. This funding is going towards:
  
•Expediting vaccine development
•Purchasing essential supplies
•Assisting state &amp; local health officials",2020-03-11 17:28:20
"Yesterday, my staff had the chance to meet with @ocrahope about how Congress can support the fight against #ovariancancer. https://t.co/qOkFxX0WfV",2020-03-11 15:58:07
"APPLY NOW: The application for the Young Women Leadership Program for high school girls in #MN06 is OPEN! For more information on this program, visit my website here: https://t.co/FDULsMQmYK",2020-03-11 14:46:43
Today I had the opportunity to meet with @AmericanLegion. Thank you for your time &amp; service to our great nation! https://t.co/dMiXyQhExX,2020-03-10 21:58:59
"ICYMI: Today, @FinancialCmte continued our accountability efforts and demand for responsible business practices. Thank you to @PatrickMcHenry and @RepAndyBarr for another report on the structural deficiencies at Wells Fargo. https://t.co/ioiF9qaAGE https://t.co/GOKZ85iUyE",2020-03-10 21:07:38
