tweet,dates
"BREAKING → Today, we launched a resource page on our website to keep Minnesotans informed with updates on COVID-19 (coronavirus). Visit this page to learn more about how to stay healthy and to keep up with efforts to prevent the spread of this virus. https://t.co/go9x27Rcvs",2020-03-10 21:03:50
"Some people are at higher risk of getting very sick from #coronavirus:
  
•Older adults
•People who have serious chronic medical conditions - heart disease, diabetes, &amp; lung disease

Please visit https://t.co/24jntsxMNb to see specific steps you should take to protect yourself",2020-03-10 19:17:52
Happy to meet with some of MN’s bravest today - thanks to @Chris_Parsons74 and everyone at @MNProFFs for keeping our communities safe! #MNProfessionalFireFighters https://t.co/6FKxGM0Myq,2020-03-10 18:35:36
Are you having trouble navigating a government agency? Let my dedicated casework staff help during our mobile office hours TODAY from 10AM-1PM at Waconia City Hall. Learn more about these recurring office hours here: https://t.co/NkoqhYs7LO,2020-03-10 14:56:28
"Our health care professionals are working hard to contain #coronavirus. Make sure you know the signs &amp; symptoms of COVID-19. They could appear 2-14 days after exposure:
•Fever
•Shortness of breath
•Cough 
Stay home &amp; contact your doctor if you start experiencing symptoms!",2020-03-09 21:18:46
"Last week I introduced legislation to provide further flexibility and support for dairy farmers. As a Congressman that Represents Minnesota’s largest dairy producing county, I have seen firsthand the hard work these people do. Read more about my bill here: https://t.co/VJ5fcVGqfC",2020-03-09 19:17:06
Thanks @DanielManick for sharing a local perspective on mining in MN! #MiningMonday https://t.co/4ENEURTojb,2020-03-09 17:29:11
"As cases of #coronavirus #COVID19 are confirmed in Minnesota, remember to protect yourself by following the steps below. For more information follow @mnhealth and read their latest news update here: https://t.co/aFgwCgj0I0 https://t.co/zUkrIEaD8h",2020-03-09 04:06:02
"Today is #InternationalWomenDay! While we celebrate women’s achievements, we also need to recognize the barriers women face, like sexual assault and workplace inequality. Equality can't be achieved until we address these issues, together. #InternationalWomenDay2020",2020-03-08 14:26:04
REMINDER: Daylight savings time is tomorrow! Remember to #SpringForward on Sunday.,2020-03-07 15:27:39
"Happy birthday to my mom, Patsy. She is 80 years young today! https://t.co/dW1oGoieWK",2020-03-07 00:02:11
Happy to see the quick &amp; nonpartisan response to #coronavirus. Thank you to @realDonaldTrump for signing this legislation to help keep Americans healthy! https://t.co/wAOzAA1bUS,2020-03-06 19:22:11
It was an honor to have @VP @Mike_Pence visit Minnesota. @3M is at the forefront of the medical technology that will stop the spread of #coronavirus (COVID-19). I’m glad the Administration has taken the necessary actions to contain the virus. https://t.co/JTHHoQhfDp,2020-03-06 17:20:02
I’m in studio with @KerriMPR on @MPRnews now. Listen live here: https://t.co/6AbDs5WsLm https://t.co/6UUwkXXvgI,2020-03-06 15:13:05
"Last night, my colleagues and I passed an emergency funding package to support a swift and strong response to #coronavirus. The health of the American people is not a partisan issue. https://t.co/QQMgj07xqX",2020-03-05 22:10:12
It was my pleasure to meet with @VFWHQ yesterday! Thank you for your work for our service members and their families #VFWDC2020 https://t.co/peLj3uNUUj,2020-03-05 21:08:57
Today is the @FTC’s #SlamtheScam Day as part of National Consumer Protection Week! Click here to learn more about common scams and how to stay safe here: https://t.co/reExP5gkCM  #NCPW2020,2020-03-05 16:46:54
Thanks so much to @MNFarmBureau President @KevinPaap for sharing this important info! https://t.co/Yg5pQdFSia,2020-03-04 22:17:14
"Thanks to @MNCounties for letting me join you this morning, and thank you for all that you do for our great state! #mncounties https://t.co/8BTZT2wpKB",2020-03-04 16:50:22
"APPLY NOW: My office has launched our annual Young Women Leadership Program for high school girls in #MN06! For more information on this program, visit my website here: https://t.co/SBo42eHUlm",2020-03-03 22:02:49
Happy birthday to the world’s best boss! You continue to show us what a true leader looks like. --staff https://t.co/xVFlloFRjB,2020-03-03 19:52:53
"Yes, in my backyard of #MN06! I was happy to support this legislation, which will promote affordable housing to communities across America. Thanks for your leadership @RepTrey! https://t.co/8zAMsTYr0A",2020-03-03 18:43:08
"Great to spend time with MN’s law enforcement at this weekend’s @MNPoliceAssn Conference in St. Cloud, learning about how we can support those who keep us safe. https://t.co/2fGdI6kQ3F",2020-03-03 13:59:28
"There’s a lot of information being spread about #coronavirus (COVID-19). While the risk remains minimal for Americans, the US government is taking every step to keep Americans safe against the virus. https://t.co/amxk1sdWlb",2020-03-02 22:48:19
#DidYouKnow some of the key components in Prince’s iconic guitars were made from copper like the type in the Duluth Complex? #MiningMonday https://t.co/455oUeU1tR,2020-03-02 22:24:44
Great to meet with @MNVeteran. I will continue to partner with Commissioner Herke to end veteran suicide. My SAVE Act would ensure same-day mental health treatment at VA health facilities for those in crisis. Read more here: https://t.co/TUeCUlOJ4j https://t.co/xlw2ffK4Ib,2020-02-28 20:22:06
"Thanks to @MAKMinnesota, Commissioner of the @MNDOT, for taking the time to meet with me yesterday! Looking forward to continuing work with you to keep MN moving in 2020. https://t.co/EapbgTHFT0",2020-02-28 16:07:32
Thanks to @MNHS for your work documenting MN’s rich history for #blackhistorymonth. You can read more of their work here: https://t.co/XZp2UIqLAm https://t.co/IPhdQ678c0,2020-02-28 15:12:10
"February is #AmericanHeartMonth. Coronary heart disease affects 239,000 people in Minnesota. Join me and @TheHeartTruth &amp; let others know there is a lot we can do to keep #OurHearts healthy.  https://t.co/7Y9ZoBuxN7 https://t.co/NnrwO6VWJW",2020-02-27 22:50:15
Thanks to the MN @CF_Foundation for meeting with me this afternoon! My new Personalized Medicine Caucus will work to make emerging treatments for diseases like #cysticfibrosis accessible and individualized. https://t.co/twYrcBqW1T,2020-02-27 22:36:28
Honored to speak to MN’s bravest heroes at yesterday’s @DAVofMN breakfast. Thank you for your service! I introduced the SAVE Act to ensure same-day treatment at VA facilities. These brave men and women deserve timely and efficient care. Learn more here: https://t.co/Gf3lEZ5022 https://t.co/Oz0hGELgbw,2020-02-27 21:57:23
